,Unnamed: 0,neg_prob,pos_prob,neg_vader,neu_vader,pos_vader,sentence,dict,identifier,sentiment
3033,3033,0.9999025219408462,9.747805917259444e-05,0.0,1.0,0.0,Now I'm back on the medication rollercoaster and nothing feels right anymore.,compound,0,neu_vader
3037,3037,0.9999830819588936,1.691804110194078e-05,0.0,1.0,0.0,I have zero medication fog too.,compound,0,neu_vader
3040,3040,0.9998024733016452,0.00019752669834955652,0.414,0.586,0.0,"I mean if a psychiatrist can't help me, if there are no meds that can help me, and I'm too trapped in my own personal hell to help myself, than who can?",attr,0,neu_vader
3042,3042,0.9999449401602084,5.505983979358204e-05,0.0,1.0,0.0,"Meditation, medication, therapy.",appos,0,neu_vader
3053,3053,0.9965528649155404,0.003447135084457637,0.0,1.0,0.0,"When I left work the second day they were really understanding (I just said it was a medication problem), and today when I texted my boss.",compound,0,neu_vader
3055,3055,0.9936830196000208,0.006316980399967082,0.094,0.9059999999999999,0.0,Because it has been so long since I was experiencing the severe swings I didn't have a real baseline to go by to compare my post-medication mood swings to.,compound,0,neu_vader
3080,3080,0.9995426344298024,0.0004573655701819168,0.095,0.905,0.0,"She is very compliant with her medication regimen, and able to use cognitive exercises to bring herself down from less severe manic episodes.",compound,0,neu_vader
3094,3094,0.9997574635983068,0.0002425364017078249,0.0,0.7909999999999999,0.209,"So, I'm surprising myself by keeping to my meds schedule.",amod,0,neu_vader
3097,3097,0.9997406320259036,0.000259367974100283,0.14400000000000002,0.769,0.087,"I have since been medication free for the past 6 months, but still have problems remembering things from the year I was on Abilify.",npadvmod,0,neu_vader
3100,3100,0.9999582076216996,4.1792378312028055e-05,0.191,0.809,0.0,"Ongoing issues I've been having include memory issues - I've always been forgetful, but I don't know if there is something more wrong with me, or if it's the medication.",attr,0,neu_vader
3102,3102,0.9989413686715644,0.001058631328450257,0.0,1.0,0.0,"At the age of 22, and 34 medication later- I decided to quit.",compound,0,neu_vader
3103,3103,0.9997899485414512,0.00021005145856585746,0.29600000000000004,0.7040000000000001,0.0,"I quit smoking, I quit being abusive to myself, I quite medication, I quit everything.",conj,0,neu_vader
3107,3107,0.9973183008754728,0.002681699124528981,0.226,0.675,0.099,"It seems like his depressive episodes keep getting worse, even though he's been doing the medication trial-and-error dance for a while.",compound,0,neu_vader
3117,3117,0.9989386249932128,0.0010613750067976064,0.063,0.649,0.28800000000000003,"Well, after an incredibly difficult year of finally seeking treatment, mood episodes, ups and downs, new medications and all out just feeling mental, I am so proud to have been accepted into my chosen Honours Program.",conj,0,neu_vader
3127,3127,0.9999886727873384,1.1327212649276355e-05,0.0,1.0,0.0,My insurance policy *would* completely cover her therapy and meds ($1000+/month) except she totally blows off filing claims.,conj,0,neu_vader
3138,3138,0.9995272771285204,0.00047272287147000165,0.0,1.0,0.0,Or at least a medication that has less dramatic side effects.,ROOT,0,neu_vader
3140,3140,0.9999239869096088,7.601309037872873e-05,0.0,1.0,0.0,"Some brief hypomanic periods I can identify which, in my opinion, were likely medication induced.",attr,0,neu_vader
3141,3141,0.9995639271524498,0.0004360728475468852,0.0,1.0,0.0,"Extended periods which I now recognize as mixed states which also, in my opinion, were likely medication induced.",npadvmod,0,neu_vader
3143,3143,0.999880901193854,0.00011909880613835124,0.0,1.0,0.0,"I mean I am not totally on my real medicine dose I need, I'm on seroquel 100 mg (all in one pill) seroquel xr 300 mg, and 100 mg of lamictal.",compound,0,neu_vader
3150,3150,0.9999665136591168,3.348634087139691e-05,0.10800000000000001,0.701,0.191,The medication side of it here is awful but hopefully I see my ward doctor today.,compound,0,neu_vader
3153,3153,0.999996353143644,3.6468563589760285e-06,0.0,0.848,0.152,Has anyone else experienced something like this with an antidepressant or other medicine besides anti-anxiety?,conj,0,neu_vader
3170,3170,0.9999772884904554,2.271150956257567e-05,0.0,0.618,0.382,Are there any super safe medication that is used specifically for mood instability?,attr,0,neu_vader
3172,3172,0.9999948624853312,5.1375146693273114e-06,0.0,0.5660000000000001,0.434,Some medicine advice/experience please?,ROOT,0,neu_vader
3173,3173,0.9996810905610816,0.00031890943892510734,0.23800000000000002,0.762,0.0,"My shrink wanted me on depakote for bipolar 2 instead of an ssri or lamictal and I suspected he was wrong, my brother in laws psychiatrist said it's the wrong medication.",attr,0,neu_vader
3175,3175,0.9999044664420886,9.553355789622165e-05,0.0,1.0,0.0,So we all know our moods and medications can have a big impact on eating habits.,conj,0,neu_vader
3178,3178,0.99998780319078,1.2196809227937025e-05,0.11900000000000001,0.746,0.134,I have tried therapy and meds for years and I don't know what can help my messed up brain.,conj,0,neu_vader
3191,3191,0.997423861393157,0.0025761386068467035,0.20800000000000002,0.792,0.0,"I know that my depression is largely the result of current circumstances, but I can't help but feel that it may be slightly medication-related.",npadvmod,0,neu_vader
3201,3201,0.99977007820792,0.0002299217920833379,0.081,0.809,0.11,"When I brought it up with my doctor she gently reminded me that ""not all meds work at first"" and refused to change them around.",amod,0,neu_vader
3214,3214,0.9996595192248464,0.00034048077514494107,0.0,0.723,0.27699999999999997,i think most of the positive feeling about my diagnosis and medication is most likely the prozac.,conj,0,neu_vader
3225,3225,0.999758414088202,0.00024158591181540362,0.0,1.0,0.0,I have to go in there tomorrow and explain to them all of this and probably end up with another medication switch.,compound,0,neu_vader
3227,3227,0.9999606970797671,3.930292024516308e-05,0.0,1.0,0.0,I think it's time for me to start some therapy and medication again.,conj,0,neu_vader
3229,3229,0.9999664986937152,3.350130629456809e-05,0.0,1.0,0.0,I've not been prescribed any other meds.,npadvmod,0,neu_vader
3231,3231,0.938580479153186,0.06141952084682061,0.11,0.89,0.0,"So 2 years ago I was diagnosed as bipolar II after a breakdown that was the high point of 7 years of depression treatment, many medications, many counselors, many and various kinds of doctors etc.",conj,0,neu_vader
3236,3236,0.99988830593389,0.00011169406609623735,0.0,1.0,0.0,"""Was it the medication?""",attr,0,neu_vader
3244,3244,0.9998437137922404,0.00015628620776897387,0.0,1.0,0.0,We talked things over and basically she's just told me to find coping strategies and kept my meds the same.,ccomp,0,neu_vader
3247,3247,0.9996028568701459,0.00039714312983511394,0.11800000000000001,0.838,0.044000000000000004,"and what really scares me is the other symptoms for depakote withdrawal include seizures even if you never had them (coupled with the scary zyprexa muscle spasms this sounds even more fucked)

also of course listed for both meds withdrawal symptom is what it was treating.",compound,0,neu_vader
3253,3253,0.9986759160842706,0.0013240839157247352,0.0,1.0,0.0,Does a mood stabilizer strictly have to be be part of your meds regime if you're bipolar?,compound,0,neu_vader
3272,3272,0.9999520275627666,4.797243723386152e-05,0.359,0.6409999999999999,0.0,"Recently, I was perscribed stress reducing medication.",attr,0,neu_vader
3277,3277,0.999679446230196,0.0003205537698051781,0.426,0.574,0.0,I fucking hate BIG PHARMA and western medicine's view of mental illness.,poss,0,neu_vader
3303,3303,0.999831370516342,0.00016862948366600192,0.091,0.7090000000000001,0.201,"The meds seem to be helping, and my memory loss is going away, so the meds side effects are getting better.",nmod,0,neu_vader
3305,3305,0.9999669964206068,3.300357940562821e-05,0.778,0.222,0.0,Fuck meds.,ROOT,0,neg_vader
3306,3306,0.9999763394696086,2.3660530400409635e-05,0.0,1.0,0.0,"I take meds morning and evening, when do I take them?",compound,0,neu_vader
3323,3323,0.9997832508130138,0.0002167491869860248,0.0,0.887,0.113,"Either way, she declares that she doesnt need ""fat girl"" meds like that, and will only take her Adderall and Xanax (of which she needs to take an entire bar to go to sleep) that she convinced some GP to prescribe to her.",conj,0,neu_vader
3329,3329,0.9999675601751712,3.24398248269545e-05,0.0,0.8959999999999999,0.10400000000000001,That they admitted me into ICU for observation and medication and what not.,conj,0,neu_vader
3330,3330,0.9987328818245936,0.0012671181754139002,0.0,0.87,0.13,I took a four day break from my Vyvanse then added Vistaril to my sleep meds to help with getting sleep.,conj,0,neu_vader
3332,3332,0.9999001686127345,9.983138727850313e-05,0.0,1.0,0.0,The appointments she'll have to face and all the meds.,conj,0,neu_vader
3336,3336,0.9986481709804941,0.0013518290195157663,0.22699999999999998,0.584,0.188,"I also suffer from PTSD, would it be a good medication for that?",attr,0,neu_vader
3338,3338,0.9999775548271724,2.2445172843673262e-05,0.0,0.775,0.225,"Still pretty early in my medication career, so I know there are options.",compound,0,neu_vader
3340,3340,0.9996763048766056,0.0003236951233979913,0.08,0.563,0.35700000000000004,"All in all, an insane experience, but I'm very glad and relieved that I'm meds'd up.",acomp,0,neu_vader
3344,3344,0.9998969000997128,0.00010309990028237976,0.225,0.775,0.0,"Given this fact they've sent my counselor numerous emails saying things such as ""Lithium is the wrong medication for my son"" and ""There's no way that I'm actually suffering with this disorder"".",attr,0,neu_vader
3347,3347,0.999998047558468,1.9524415459290693e-06,0.0,0.737,0.263,So...is Lithium (or other medicine) anything like this?,conj,0,neu_vader
3351,3351,0.9999893707200084,1.0629279990210956e-05,0.0,1.0,0.0,So I am basically asking is the medicine doing what it should do?,attr,0,neu_vader
3355,3355,0.999598543542614,0.0004014564573783541,0.048,0.9520000000000001,0.0,"Only one pdoc in my entire city takes my insurance and the earliest he could see me is July, but my meds need serious adjusting and I can't wait that long.",amod,0,neu_vader
3358,3358,0.9993630047394017,0.0006369952605908152,0.0,0.7240000000000001,0.276,"May consider going to 1mg)

&amp; I should be taking Ambien for insomnia, but I'm a little afraid considering my recent luck regarding medications haha.",compound,0,neu_vader
3375,3375,0.9997553908021964,0.0002446091978075417,0.0,0.812,0.188,"I have a wonderful psychiatrist that I see when needed, and I've been off all psychiatric medications for **almost a year.",attr,0,neu_vader
3385,3385,0.9998798458519684,0.00012015414804953879,0.0,1.0,0.0,I was diagnosed bipolar 5 years ago and am now 20 off meds for 2 years because I couldn't stand the side effects.,attr,0,neu_vader
3395,3395,0.9997960281259359,0.0002039718740759408,0.12300000000000001,0.877,0.0,I'll never be sure if it was the medication or the bipolar that led to..,attr,0,neu_vader
3402,3402,0.9998346734514888,0.00016532654850240434,0.42200000000000004,0.578,0.0,"the suicide attempts, the mixed episodes, the medication changes, the sleep deprivation.",compound,0,neu_vader
3410,3410,0.9999937856644072,6.214335580373976e-06,0.212,0.64,0.14800000000000002,"Okay so backstory: 
Parents and doctor took me off all meds an it's been like 2.5 weeks and ugh fuck all of this.",punct,0,neu_vader
3419,3419,0.9999656277436432,3.437225636237111e-05,0.0,1.0,0.0,"I have been off meds for about 6 months, and have been diag.",advmod,0,neu_vader
3426,3426,0.9996321507805096,0.0003678492194973597,0.0,0.948,0.052000000000000005,"I had myself voluntarily committed got out AMA, was prescribed lithium, smoked marijuana and fudged the doses of my meds which led me to ANOTHER psychotic episode and an involuntary hospitalization where they assigned me the meds i'm currently on.",appos,0,neu_vader
3434,3434,0.9999780275462076,2.197245379566427e-05,0.0,1.0,0.0,I've only recently started therapy and medication.,conj,0,neu_vader
3435,3435,0.99990231823088,9.768176911167318e-05,0.0,1.0,0.0,Before I was diagnosed and started therapy and meds I had many episodes and didn't realize it.,conj,0,neu_vader
3437,3437,0.999903160465646,9.683953434261002e-05,0.115,0.769,0.115,Our goal is to raise awareness about mental illness and explore the research and medicine available to treat mood disorders.,conj,0,neu_vader
3441,3441,0.9976106618161412,0.00238933818387598,0.0,0.746,0.254,"i should feel happy because this was the last powerfull medication to get off of, the previous being clozaril, the most powerful antipsychotic.",attr,0,neu_vader
3463,3463,0.9931735137463801,0.0068264862536282405,0.0,0.9490000000000001,0.051,"However, I did text to apologize to both of them that I BBQ'd too long and had one too many beers in the sun (left out the medication part)....",compound,0,neu_vader
3475,3475,0.999993276300495,6.723699491680367e-06,0.0,1.0,0.0,Any medicine changes?,compound,0,neu_vader
3478,3478,0.9989169215149248,0.0010830784850904011,0.105,0.895,0.0,"(The last 20 months medication free)

I know the risks of combining psychoactive substances and mental illness are nothing new, but is it common at all to be misdiagnosed as bipolar II?",npadvmod,0,neu_vader
3480,3480,0.9999321173112674,6.78826887302976e-05,0.0,0.865,0.135,That I'm ready to go to regular therapy and be put on whatever meds the docotrs say.,pcomp,0,neu_vader
3486,3486,0.9998145404227068,0.00018545957729239955,0.10099999999999999,0.698,0.20199999999999999,kind of serious question...i know too many meds blunts your creativity.,npadvmod,0,neu_vader
3487,3487,0.9999175157868052,8.2484213176512e-05,0.0,1.0,0.0,She's been on her meds the whole time.,advmod,0,neu_vader
3494,3494,0.9946706998991356,0.0053293001008468295,0.115,0.654,0.23199999999999998,"I'm finally feeling fed up of feeling just okay, and I want to see if I can get on less or no medication with a doctors approval, don't worry ;) I'm not just going to stop taking them suddenly as I know what that can do.",conj,0,neu_vader
3504,3504,0.9999394274379618,6.057256202612479e-05,0.0,1.0,0.0,"School starts soon, meds.",npadvmod,0,neu_vader
3505,3505,0.999966501141648,3.3498858368279345e-05,0.259,0.741,0.0,"Class is too hard, meds.",npadvmod,0,neu_vader
3506,3506,0.9999449401602084,5.505983979358204e-05,0.0,1.0,0.0,"Unemployed, meds.",ROOT,0,neu_vader
3510,3510,0.9999803413176184,1.9658682380838606e-05,0.0,1.0,0.0,So basically my medication M.D.,compound,0,neu_vader
3511,3511,0.9992364254553756,0.0007635745446402589,0.0,0.8270000000000001,0.17300000000000001,"As a meds solution, we tripled my Pristiq (to 150mg, a very unusual dosage).",amod,0,neu_vader
3512,3512,0.9993076789188982,0.00069232108110978,0.231,0.769,0.0,"So long story short:

* We **dumped Abilify**- always a troublesome medication for me.",appos,0,neu_vader
3515,3515,0.9991290927877008,0.0008709072122848228,0.10300000000000001,0.682,0.215,I am in treatment and taking an awesome cocktail of meds- it just doesn't feel fair.,punct,0,neu_vader
3517,3517,0.9996007947662214,0.0003992052337645184,0.0,0.8909999999999999,0.109,"During a full assessment for ADHD (which, I guess, I do definitely have) the doctor who was seeing me asked if I could provide a full medication record.",compound,0,neu_vader
3518,3518,0.9999713102195558,2.868978044696822e-05,0.239,0.7609999999999999,0.0,"When I gave her my full medication history, she immediately started suspecting bipolar disorder (probably type 2?)",compound,0,neu_vader
3519,3519,0.9998382484626991,0.00016175153728960437,0.079,0.7440000000000001,0.177,"Things like, ""medication x gave me intense anxiety and heart palpitations"" or ""medication y caused me to become more depressedthan usual"".",compound,0,neu_vader
3521,3521,0.9998342174714656,0.00016578252853315646,0.0,1.0,0.0,"I was also prescribed lamotrigine for treatment-resistant depression...and it's the only medication that HAS consistently ""worked"".",attr,0,neu_vader
3525,3525,0.9959682501707472,0.0040317498292420095,0.0,0.852,0.14800000000000002,There's so much advice out there suggesting that a combination of therapy and medication helps the most.,conj,0,neu_vader
3526,3526,0.9999842228630534,1.5777136948972956e-05,0.0,1.0,0.0,The medication part is obvious but what are you supposed to get out of therapy?,compound,0,neu_vader
3542,3542,0.9999669964206068,3.300357940562821e-05,0.0,1.0,0.0,medication.,ROOT,0,neu_vader
3548,3548,0.9999669964206068,3.300357940562821e-05,0.688,0.312,0.0,No meds.,ROOT,0,neg_vader
3549,3549,0.999939610117608,6.038988238300346e-05,0.0,0.41700000000000004,0.583,it's the best medicine.,attr,0,pos_vader
3558,3558,0.9999907240348708,9.275965127237283e-06,0.265,0.735,0.0,I don't know if it's just meds or if it's me trying to fuck myself over so I'll lose my job.,attr,0,neu_vader
3566,3566,0.9997772114697172,0.00022278853027121918,0.0,1.0,0.0,"I realized it might be the meds, so I googled it.",attr,0,neu_vader
3568,3568,0.9999712180924828,2.8781907509120045e-05,0.162,0.838,0.0,I was wondering if anyone has any thoughts or experience with ADD medication and bipolar disorder.,amod,0,neu_vader
3571,3571,0.9989223553957032,0.0010776446042840963,0.0,0.8270000000000001,0.17300000000000001,After working with medication doses I have noticed a huge change in my life.,compound,0,neu_vader
3573,3573,0.9945340124021472,0.005465987597867809,0.07200000000000001,0.9279999999999999,0.0,"It was brought on by the mixture of bipolar meds (Do not take Tegretol if you are not healthy, just my experience) and painrelief meds I started just over a month before.",npadvmod,0,neu_vader
3623,3623,0.9999565772288436,4.3422771165036734e-05,0.0,0.789,0.21100000000000002,Alcohol becomes my new medication but it only calms me so much.,attr,0,neu_vader
3625,3625,0.9965508315339741,0.0034491684660381263,0.0,1.0,0.0,We've been experiencing a long/cold Spring and at first I thought that was it since I'm fed up with it but now I'm thinking it' the meds.,ccomp,0,neu_vader
3629,3629,0.9995151624408309,0.0004848375591622372,0.165,0.835,0.0,"I'm a 22 year old student, I've suffered with depression for years, have been on Prozac for about a year or a year and a half, I was off meds for a while before that and had been on Lexapro for a while previously.",attr,0,neu_vader
3634,3634,0.9996360772765192,0.0003639227234834962,0.046,0.9540000000000001,0.0,"I am on my parent's insurance, they pay my bills for the most part since I can't work anymore, and they very much control everything to do with my psychiatrist and medications.",conj,0,neu_vader
3640,3640,0.9998310139484468,0.00016898605155732255,0.0,0.828,0.172,"Interestingly, my doc has given me 3 choices of starting medications - lithium, lamotrigine, and abilify.",compound,0,neu_vader
3643,3643,0.9246813498447524,0.07531865015525799,0.081,0.843,0.077,"Somewhat against my original wishes, and without meaningfully informed consent, I began taking Latuda, a newer atypical antipsychotic, acquiescing to the treatment only after a voice in my head (belonging to, I shit you not, the immortal extraterrestrial vampire Virgin Mary, and by the way, also the occult basis behind V in Alan Moore's *V for Vendetta*) told me that the pills were ""power medicine"" and would level up my defenses against Aleister Crowley's malign army of sorcerers, who counted my ex-girlfriend among their number.",attr,0,neu_vader
3657,3657,0.9986785507192356,0.0013214492807639721,0.271,0.7290000000000001,0.0,"She told me that due to my frequent and debilitating panic attacks, my suicidality, my bipolar disorder, and my unmanaged psych meds, I should be in the hospital.",conj,0,neu_vader
3665,3665,0.990106176007872,0.009893823992118436,0.247,0.753,0.0,"I resent medication/drugs as a whole, because of seeing my mother abuse them for so long, so I am generally not a medication-happy person.",dep_npadvmod,0,neu_vader
3668,3668,0.9992992532524044,0.0007007467475856013,0.0,0.69,0.31,"The best medication in my opinion, and this is such a grey area, medical marijuana.",ROOT,0,neu_vader
3669,3669,0.9997686794976758,0.0002313205023416743,0.0,1.0,0.0,Anyways with all that being said I've been off all pharmaceutical medications for the passed 9 months.,attr,0,neu_vader
3670,3670,0.9999669964206068,3.300357940562561e-05,0.0,1.0,0.0,https://realmedication.wordpress.com/2015/08/13/my-take-on-bi-polar-1-and-bi-polar-2/,npadvmod,0,neu_vader
3676,3676,0.9993696176598096,0.0006303823402014497,0.045,0.841,0.114,"Edit: In short, just express yourself as honest as possible, you could give me anything to what your last episode was like, how it made you feel, what went through your thought process, the meds you take or lack there of, anything to give me perspective.",dep,0,neu_vader
3680,3680,0.9997135860086036,0.0002864139913791372,0.11800000000000001,0.75,0.133,"I hate my mood swings, meds every day...I'm not as sharp as I used to be, but, oh well.",npadvmod,0,neu_vader
3684,3684,0.9999079150985136,9.208490150201519e-05,0.047,0.675,0.27899999999999997,"There are probably some great medications to help people with depression, you can ask your doctor about that... but if you can hold out things do get better and it's up to you to decide what's best for you.",attr,0,neu_vader
3690,3690,0.9996849590907896,0.00031504090921277884,0.0,0.83,0.17,I ended up calling 911 from a payphone in my boxers and a Great Excape hoody because I came off my meds early and abruptly.,npadvmod,0,neu_vader
3700,3700,0.9999372529834331,6.274701658132511e-05,0.0,0.87,0.13,I shoved every emotion or retort down and brought him my medicine box with it's cute little AM/PM boxes for the week.,compound,0,neu_vader
3708,3708,0.9952146416820276,0.004785358317980004,0.0,0.8859999999999999,0.114,""", medication adjustments--my entire human experience takes place against the context of my brain's ""special"" responses to its ""special spice"" brain chemistry.",compound,0,neu_vader
3709,3709,0.9999861555445392,1.3844455455051434e-05,0.467,0.5329999999999999,0.0,"Actually, fuck western medicine guys.",compound,0,neu_vader
3712,3712,0.9999834195150654,1.6580484925109122e-05,0.159,0.841,0.0,I've also taken hydroxzine which is my daily anxiety medicine.,attr,0,neu_vader
3724,3724,0.9991161907575528,0.0008838092424638,0.106,0.836,0.057999999999999996,"I'm normally a very rational person, but right now I want to quit the meds cold turkey because it doesn't feel like they're doing anything.",nmod,0,neu_vader
3725,3725,0.9998138986033308,0.00018610139665609806,0.0,1.0,0.0,"I have gone two my meds Dr maybe five times,.and my tharapist for a year now.",compound,0,neu_vader
3742,3742,0.997312993145536,0.002687006854482496,0.0,1.0,0.0,"I went to go see a new therapist today, and while he really wants to put me on medication, he offered electroshock therapy as a non-medication option.",compound,0,neu_vader
3746,3746,0.9993600990574923,0.0006399009425262224,0.0,1.0,0.0,"After being off my meds for over a month, I finally saw my pdoc today.",attr,0,neu_vader
3766,3766,0.999992512397684,7.487602309096651e-06,0.0,0.885,0.115,"I just want to know if this is common, medicine related, whatever.",npadvmod,0,neu_vader
3767,3767,0.9999382875350818,6.171246490653091e-05,0.0,0.644,0.35600000000000004,"Now that that rambling is done, share your positive meds stories with me!",compound,0,neu_vader
3772,3772,0.9814091739605866,0.01859082603940145,0.066,0.882,0.051,"Just wondering, because I have often heard of people with Bipolar disorder going well into their 20s and sometimes 30s without ever getting a definitive diagnosis, or getting a diagnosis and spending years working out a medication combination that works for them.",compound,0,neu_vader
3777,3777,0.99772237752471,0.0022776224752758607,0.237,0.763,0.0,I told my family about my depression and the medication I was taking both of which I had been hiding from them for years.,conj,0,neu_vader
3787,3787,0.9999636066473684,3.6393352632924396e-05,0.0,1.0,0.0,"My meds I think have finally started to really work, and I was just put on Adderall.",ROOT,0,neu_vader
3789,3789,0.9960834892746924,0.003916510725320551,0.0,0.897,0.10300000000000001,"I don't remember what exactly happened, it was all a blue of emotional brain and new meds.",conj,0,neu_vader
3800,3800,0.9996462832586012,0.00035371674140288837,0.22,0.687,0.09300000000000001,"The thing I hate the most about Bipolar is not the immense pain, or all the meds I have to take, or the social isolation.",dep,0,neu_vader
3812,3812,0.999947128844797,5.2871155216060574e-05,0.0,1.0,0.0,"Beyond that, after starting the medicine things were just off.",compound,0,neu_vader
3817,3817,0.9996026744936104,0.0003973255064063303,0.32,0.68,0.0,"I started to think I was wrong about it being the medicine, I started to think I was a bad person.",attr,0,neu_vader
3819,3819,0.9998974958310148,0.00010250416900374696,0.23800000000000002,0.6559999999999999,0.106,I've been trying so hard to concentrate and have added an anti-psychotic which has helped my panic attacks but no matter how much better I've gotten with therapy and meds it doesn't seem to help my work performance.,conj,0,neu_vader
3832,3832,0.9999393977111084,6.060228887904976e-05,0.157,0.843,0.0,And an unrelated question: Is ones medication an indicator of how severe ones bi-polar is?,ccomp,0,neu_vader
3851,3851,0.9997686182660128,0.00023138173397704067,0.0,1.0,0.0,the other meds for years.,ROOT,0,neu_vader
3855,3855,0.9999580878581584,4.191214185260279e-05,0.0,0.861,0.139,"Including diet, fitness, health, meditating, massage, meds to talk to my doc about, whatever.",ROOT,0,neu_vader
