,Unnamed: 0,neg_prob,pos_prob,neg_vader,neu_vader,pos_vader,sentence,dict,identifier,sentiment
4000,4000,0.9990383786847628,0.0009616213152463364,0.062,0.8290000000000001,0.109,"So apparently they are now able to do a genetic test that will show your psychiatrist what medications would work best, what medications might be metabolized different than normal, and which medications should be avoided.",nsubjpass,1,neu_vader
4004,4004,0.9999563456392404,4.365436075936983e-05,0.0,0.61,0.39,Lastly what medications have caused you the most significant weight gain?,nsubj,1,neu_vader
4022,4022,0.9996112266949896,0.000388773305013585,0.0,0.7909999999999999,0.209,The doctor did want to admit her to a psyche ward for a week so her medication could be corrected but the family decided that home care would be more suitable.,nsubjpass,1,neu_vader
4023,4023,0.9999323223751164,6.767762486408781e-05,0.19399999999999998,0.8059999999999999,0.0,Should she be under house arrest until the meds start working.,nsubj,1,neu_vader
4038,4038,0.9979564578291872,0.0020435421708065904,0.0,0.88,0.12,"I noticed a word I did not expect to see and looked closer ""these medications may cause excessive salivating: blabladinol, raspberrinol, lithium, sodiu-... ""

*lithium*

Shit.. Haha",nsubj,1,neu_vader
4056,4056,0.9996392463695116,0.00036075363048304913,0.13,0.87,0.0,"I also went through 2 year period where I was clinically depressed, and medications really helped me put a floor on my thinking and stand back up.",nsubj,1,neu_vader
4062,4062,0.9998417282622496,0.00015827173773914078,0.0,0.9329999999999999,0.067,"I know one thing for sure, that this happened very less when I was on escitalopram, but the meds are changed since my doctor has changed.",nsubjpass,1,neu_vader
4063,4063,0.9998500354329196,0.00014996456709849898,0.0,1.0,0.0,Maybe waiting for the new meds to kick-in?,nsubj,1,neu_vader
4067,4067,0.99992911973255,7.08802674363261e-05,0.091,0.909,0.0,"I don't think my meds are working, either that, or I'm taking things waaaay to hard.",nsubj,1,neu_vader
4068,4068,0.9301477269821822,0.06985227301782553,0.07400000000000001,0.688,0.239,"My biggest worry is that any medication that effectively levels out my mood will also eliminate the times where I feel especially lively, motivated and able to make a decent amount of artwork.",nsubj,1,neu_vader
4070,4070,0.9986061465081726,0.0013938534918391775,0.111,0.6559999999999999,0.233,I'm generalizing here but what I've read was that some medications treat the mania aspect of bipolar while others treat the depressive side.,nsubj,1,neu_vader
4071,4071,0.9992533147250064,0.0007466852749846137,0.182,0.629,0.18899999999999997,What medications are prescribed to treat the depressive side of bipolar?,nsubjpass,1,neu_vader
4075,4075,0.9998969772886709,0.00010302271131261445,0.20600000000000002,0.59,0.204,My meds just got changed so I'm behaving like a jackass.,nsubj,1,neu_vader
4084,4084,0.9999787383138836,2.1261686120314388e-05,0.14300000000000002,0.68,0.177,My therapist warned me that medication can lessen or even diminish  creativity.,nsubj,1,neu_vader
4087,4087,0.9999882537528844,1.1746247095944162e-05,0.0,1.0,0.0,He tells me meds might have been triggered something else.,nsubj,1,neu_vader
4104,4104,0.9996217813820136,0.0003782186179955828,0.0,0.833,0.16699999999999998,"But, if medication isn't possible, what's the next best thing a person can do that doesn't have insurance and getting insurance isn't a possibility?",nsubj,1,neu_vader
4113,4113,0.9970042371276242,0.002995762872368647,0.0,0.723,0.27699999999999997,"Just wanted to post a positive and hope it might help someone else as well.. Long story short, my meds crapped out, and I needed to see a doc stat.",nsubj,1,neu_vader
4125,4125,0.9999762997635092,2.3700236500788808e-05,0.13,0.721,0.15,"I still feel like hell, and could start crying again at any moment, but I have hope today, and I'm going to make contact with my new pDoc to get my meds adjusted.",nsubj,1,neu_vader
4135,4135,0.9999789510549721,2.104894504646436e-05,0.0,0.812,0.188,Some people out there knowing which medications might offer some benefit for physical performance?,nsubj,1,neu_vader
4183,4183,0.997457627224288,0.002542372775692421,0.076,0.765,0.159,"To appease my parents, and give them peace of mind, I continued my regimen of medication, though I despised taking an anti-phycotic(Zyprexa) and began declining the medications intake as quickly as possible.",pobj_nsubj,1,neu_vader
4185,4185,0.9987239002900388,0.0012760997099614485,0.0,1.0,0.0,"I expected both medications to be reduced to nothing, but slowly it became evident that my psychiatrist wasn't intending on decreasing my lithium, as such, it was to be a life long medication.",nsubjpass_attr,1,neu_vader
4217,4217,0.999938075215658,6.192478432360995e-05,0.341,0.659,0.0,"TL;DR: My meds keep changing, I'm losing my mind and am getting worse.",nsubj,1,neu_vader
4240,4240,0.9998240423853948,0.00017595761460127352,0.136,0.746,0.11800000000000001,"I just, I can't and won't believe her because if meds won't actually help, that it'll make things worse, that its all a pharmaceutical conspiracy, then I legit don't have any reason to go on because I cannot continue to live like this, I would rather burn myself alive than keep living like this if it were my only 2 options.",nsubj,1,neu_vader
4241,4241,0.9999810691820159,1.8930817991175226e-05,0.122,0.8170000000000001,0.061,"I don't know why I'm posting this, I guess I just want to be told that meds ARE the right thing, that they have helped you guys and that I'm not just going to be handing out money to the pharmacy for no reason only to continue on with this shit that we call life with no improvement, cuz I'd rather just end it now then.",nsubj,1,neu_vader
4244,4244,0.9992634317667816,0.0007365682332362236,0.0,0.861,0.139,"And yet, psychiatrists think the meds they give us are working and they're making good citizens out of us.",nsubj,1,neu_vader
4245,4245,0.9998625676111208,0.00013743238888783778,0.129,0.647,0.223,"As much as I respect psychiatrists' work and admire their service, I don't think they realize how debilitating, humiliating, and costly these meds are.",nsubj,1,neu_vader
4255,4255,0.9999554765961812,4.4523403816573523e-05,0.0,1.0,0.0,"This is just a goofy post, but jesus CHRIST does anyone else's medicine make them grind their teeth!?",nsubj,1,neu_vader
4270,4270,0.9999419772251772,5.80227748130323e-05,0.0,1.0,0.0,Maybe the meds are working?,nsubj,1,neu_vader
4289,4289,0.9993131798410378,0.00068682015894488,0.34,0.604,0.055999999999999994,"For me, it is the only way I can relieve my neck/back pain (I am allergic to Percocet and the medication I am currently on hurts my stomach so badly I lost 15 lbs in 2 months).",nsubj,1,neu_vader
4298,4298,0.9996048922809676,0.0003951077190367,0.0,0.902,0.098,"I know that just straight up telling her ""You need to get back to your therapist and take your meds"" is a HUGE no-no that could trigger an episode, but she's really wearing on me emotionally.",nsubj,1,neu_vader
4309,4309,0.9995874897025729,0.0004125102974330286,0.239,0.7609999999999999,0.0,His medication is being changes from epilim to some new drug that he is not to fond of because he is having suicidal thoughts.,nsubj,1,neu_vader
4322,4322,0.9999115665683654,8.843343161456783e-05,0.252,0.748,0.0,i need my meds and the hoops to get them again are retarded.,nsubj,1,neu_vader
4338,4338,0.9999650584844456,3.494151555063442e-05,0.155,0.845,0.0,or if the new medications I am on will stop this from happening again?,nsubj,1,neu_vader
4342,4342,0.990672198448634,0.009327801551367509,0.048,0.68,0.272,"The meds have been great at controlling my symptoms but I'm having a really hard time with my self confidence due to weight gain, especially with the summer and shorts and bikinis coming up.",nsubj,1,neu_vader
4350,4350,0.9999284636179148,7.153638209873388e-05,0.0,1.0,0.0,I just think that the medication is just messing with my head.,nsubj,1,neu_vader
4351,4351,0.9999480556247942,5.194437519818113e-05,0.0,1.0,0.0,Could the medication affect me or is it just me??,nsubj,1,neu_vader
4361,4361,0.9999669964206068,3.300357940562821e-05,0.38799999999999996,0.612,0.0,My meds stopped working.,nsubj,1,neu_vader
4363,4363,0.9919777666940512,0.008022233305938153,0.209,0.757,0.034,"My problem is that because I have anxiety stemming from a doctor who refused to take me off of a mood stabilizer that made me suicidal (I voluntarily committed myself to a psych ward in order for me to get my meds changed) and because the Dr office kept double charging me, I stopped going to my Dr.",nsubj,1,neu_vader
4372,4372,0.9999443440358078,5.565596417761503e-05,0.0,0.614,0.386,"I really thought my meds were working, I felt great!",nsubj,1,neu_vader
4386,4386,0.9999225936047691,7.74063952131348e-05,0.218,0.423,0.359,"for better or worse, until the medicine starts helping.",nsubj,1,neu_vader
4388,4388,0.9999478072026488,5.219279734192188e-05,0.223,0.777,0.0,"As you all know, medication is critical to stability.",nsubj,1,neu_vader
4393,4393,0.9999842241624732,1.5775837507417035e-05,0.096,0.8079999999999999,0.096,I'm in some really challenging courses right now in college and my meds just flat out stopped working.,nsubj,1,neu_vader
4417,4417,0.999691953166848,0.0003080468331374488,0.33299999999999996,0.667,0.0,My medicine kept the suicidal thoughts coming on a daily basis.,nsubj,1,neu_vader
4419,4419,0.9987616832363244,0.001238316763672934,0.182,0.782,0.036000000000000004,My Pdoc reccomended the NAC and it has some solid if emerging studies for its effectiveness on bipolar depression- if you aren't having any luck in the downswing and other meds aren't desirable perhaps ask your Pdoc about it.,nsubj,1,neu_vader
4427,4427,0.9993580659202912,0.0006419340797186894,0.0,1.0,0.0,I don't have bipolar but the medication is the same as a bipolar person would take.,nsubj,1,neu_vader
4432,4432,0.9998959422382541,0.00010405776175644294,0.0,0.889,0.111,"So not being able to convince him that this medicine worked for me, he gave me Buspar.",nsubj,1,neu_vader
4433,4433,0.9999501900615608,4.980993845332348e-05,0.0,0.873,0.127,"After 3-4 weeks, what I thought was the medicine started making me feel really emotional.",nsubj,1,neu_vader
4438,4438,0.9999792753375704,2.0724662434698326e-05,0.0,1.0,0.0,I know I am already somewhat down because my medication doesn't totally level me out.,nsubj,1,neu_vader
4439,4439,0.9997527269363204,0.0002472730636934121,0.0,0.826,0.174,Can certain medications do something to the redness in your eyes?,nsubj,1,neu_vader
4445,4445,0.9997819353067576,0.00021806469322369917,0.23600000000000002,0.764,0.0,"?mg Risperidone, 12 mg of Abilify, 72 mg of Concerta, 80 mg of Propranolol, but in the end the medication caused more problems than my diagnosed bipolar disorder, and I cut everything except 200 mg of lamictal.",nsubj,1,neu_vader
4447,4447,0.9760626371716812,0.02393736282830294,0.0,0.917,0.083,I'm looking for a new psychiatrist and therapist at the moment because they seem to think my medications are doing me well right now and that these are just small scale symptoms that will never go away even though I have two bipolar I family members one of which has been very stable for some time.,nsubj,1,neu_vader
4455,4455,0.9991158955235708,0.0008841044764195621,0.161,0.8390000000000001,0.0,We also feel the other medications were masking the adverse effects of the Trileptal.,nsubj,1,neu_vader
4459,4459,0.9999889556764456,1.1044323558130839e-05,0.0,1.0,0.0,How do you know you need your meds adjusted?,nsubj,1,neu_vader
4463,4463,0.999975288314565,2.471168545128504e-05,0.0,0.408,0.5920000000000001,My meds worked better and better.,nsubj,1,pos_vader
4466,4466,0.9997883701189944,0.00021162988101694708,0.0,1.0,0.0,Do any of you have advice on getting to sleep when your body is used to the sedative effects of meds without being able to take said meds?,nsubj,1,neu_vader
4467,4467,0.999482648402158,0.000517351597847922,0.0,0.7909999999999999,0.209,So I had my meds upped and overall I see myself doing a lot better.,nsubj,1,neu_vader
4470,4470,0.998335796020438,0.001664203979543552,0.21600000000000003,0.784,0.0,"After the meds arrived two days late I never went back on them, because the possibility of experiencing that again was to painful and terrifying to imagine.",nsubj,1,neu_vader
4498,4498,0.9999082927555204,9.17072444716997e-05,0.141,0.722,0.13699999999999998,"I'd hate to start from the beginning, titrating back up from nothing, when this medication has been so helpful to me.",nsubj,1,neu_vader
4502,4502,0.999971409746576,2.8590253417408442e-05,0.0,1.0,0.0,The medication must be working.,nsubj,1,neu_vader
4513,4513,0.9999695535479096,3.0446452097011235e-05,0.0,1.0,0.0,*(This medication is fucking up my life.,nsubj,1,neu_vader
4522,4522,0.999966524092114,3.347590789363393e-05,0.0,1.0,0.0,"Being off meds seems to be everyone's preference, and I feel why.",nsubj,1,neu_vader
4526,4526,0.9917806629970196,0.008219337002980635,0.0,0.9209999999999999,0.079,"One other important note:  a new medication was added to my cocktail very recently (right when I started feeling all this), but I have looked and it doesn't have any side effects of a decreased sex drive.",nsubjpass,1,neu_vader
4527,4527,0.999976449401468,2.355059851894397e-05,0.0,1.0,0.0,The medication is Geoden.,nsubj,1,neu_vader
4547,4547,0.9981399074713796,0.001860092528610289,0.20199999999999999,0.7979999999999999,0.0,"The problem, however, is that the medications are making me very tired all the time - so much so that I can't stay awake the whole day and am lethargic for much of the time I am awake.",nsubj,1,neu_vader
4556,4556,0.9998298696477306,0.00017013035225660897,0.0,0.825,0.175,"I've been trying to get my meds right for a while so things have been touch and go, but I'm so glad I got out there and tried.",nsubj,1,neu_vader
4580,4580,0.9999786133851816,2.1386614809961986e-05,0.187,0.747,0.066,"Although, my mother saw me researching BP and had an awful response (told me to pray more, it's all in my head, meds are bad, it'll go away, etc.).",nsubj,1,neu_vader
4581,4581,0.9999420551459371,5.794485404589858e-05,0.33299999999999996,0.667,0.0,"My current meds are
Seroquel XR
Wellbutrin SR
Lexapro
Rozerem
Concerta 
Intuitiv

So blah blah blah, irritability issues sleeping.",nsubj,1,neu_vader
4590,4590,0.9995323019195004,0.00046769808049404514,0.0,0.737,0.263,Finding the right medication is like baking a cake.,nsubj,1,neu_vader
4591,4591,0.9999598001106224,4.019988939028911e-05,0.0,1.0,0.0,I may not have insurance next month and my meds are very expensive.,nsubj,1,neu_vader
4610,4610,0.9999753359665168,2.4664033491906564e-05,0.0,1.0,0.0,I think my meds have gluten in them.,nsubj,1,neu_vader
4614,4614,0.9999544804302346,4.5519569778633314e-05,0.0,0.488,0.512,"Atm, my medication works perfectly.",nsubj,1,pos_vader
4627,4627,0.9974544399797618,0.002545560020244913,0.07,0.782,0.147,"high risk behaviors like my drug addictions, sex, physical serious injuries have been a result of impulse, another symptom, and sometimes the self medication can hit that sweet spot of evening you out, but be careful.",nsubj,1,neu_vader
4632,4632,0.9998929662594778,0.00010703374052310866,0.191,0.809,0.0,i fight to get my meds working so that i can start the day.,nsubj,1,neu_vader
4636,4636,0.9899647052892088,0.010035294710801636,0.033,0.75,0.217,"As I had felt perfectly fine and I had eaten NOTHING remotely questionable (other than the bupropion), it seemed probable it was a side effect, and I wanted to make sure things were ok.

Ok, now, here is the important part: He told me that the medication would **not** have caused the symptoms, and I had what was a simple case of gastroenteritis.",nsubj,1,neu_vader
4645,4645,0.9994857345749588,0.0005142654250376201,0.0,1.0,0.0,I take lithium and my other meds give me dry mouth so I'm up several times a night to pee.,nsubj,1,neu_vader
4646,4646,0.9980716769371074,0.0019283230629109469,0.0,0.9440000000000001,0.055999999999999994,"I really want to do mushrooms again (such a soaring, spiritual experience for me) but I don't know if my medications with interact with the psilocybin.",nsubj,1,neu_vader
4654,4654,0.99995629548887,4.370451113723211e-05,0.0,1.0,0.0,"BUT

Without health insurance, my medications cost me approximately another $200/month.",nsubj,1,neu_vader
4656,4656,0.9999728608777092,2.713912230647573e-05,0.0,0.488,0.512,What meds helped you best?,nsubj,1,pos_vader
4659,4659,0.993949410788366,0.006050589211647426,0.0,0.879,0.121,"I have a strong Chemistry background, and I've tried to explain that your body chemistry constantly changes, so my medication doesn't always have exactly the same effect.",nsubj,1,neu_vader
4665,4665,0.9999160464608828,8.395353910362238e-05,0.0,1.0,0.0,Now I know all meds can cause reactions in sun and I've know that for awhile.,nsubj,1,neu_vader
4674,4674,0.9966425993319828,0.0033574006680307266,0.0,0.9309999999999999,0.069,"I've been told I'm either bipolar or have borderline personality traits but I have to wait for a consultant to give a definite verdict, apparently my meds will either be switched to an SSRI or an anti-psychotic - I'm just wondering how the anti-psychotics work in regards to my situation because I don't actually have and have never experienced psychosis so how do they work as a mood stabiliser?",nsubjpass,1,neu_vader
4677,4677,0.9902916695026412,0.00970833049734635,0.0,0.915,0.085,"I felt that the meds would change who I was dramatically, that I'd be giving up what I am, because bipolar is and was a very big part of who I am.",nsubj,1,neu_vader
4679,4679,0.998916938414462,0.0010830615855452308,0.0,1.0,0.0,Both of them have told him on more than one occasion that the meds he takes are anti-psychotic (no shit) and he doesn't need to be on them.,nsubj,1,neu_vader
4695,4695,0.9993913222220456,0.000608677777960872,0.0,0.866,0.134,"I ended up in a hospital, new medicine makes me want to be more creative, which keeps me going, but still feel off my feet.",nsubj,1,neu_vader
4729,4729,0.999946427133484,5.35728665161861e-05,0.102,0.898,0.0,"The meds were making me sick so i tried to taper to just Lithium, but it's not suppressing my manic states.",nsubj,1,neu_vader
4730,4730,0.999901004679751,9.899532025536876e-05,0.221,0.7140000000000001,0.065,"Looking back on when I was on olanzapine, valproic acid and venlafaxine, I realize that these thoughts kinda went away, but the medication is unacceptable to me since they cloud my mind and kill my motivation to do anything.",nsubj,1,neu_vader
4737,4737,0.9993572466365214,0.0006427533634909508,0.131,0.8690000000000001,0.0,But now I'm starting to think I'm one of those people that meds do not help.,nsubj,1,neu_vader
4739,4739,0.9999408526079879,5.9147392031164646e-05,0.297,0.703,0.0,But these medications are making everything so much worse.,nsubj,1,neu_vader
4746,4746,0.9997291263134992,0.0002708736864917971,0.0,1.0,0.0,MAYBE the meds will kick in and I can live my fucking life.,nsubj,1,neu_vader
4757,4757,0.9986472442850022,0.0013527557150061285,0.132,0.868,0.0,"I've never been a morning person, maybe it's because the medicine I take has ran it's course, my stomach is empty, and overall my body is just in a state of shock or something.",nsubj,1,neu_vader
4768,4768,0.99979003397289,0.0002099660271259327,0.0,0.6940000000000001,0.306,Is it a possibility that my meds quit being effective or i have built up a tolerance?,nsubj,1,neu_vader
4769,4769,0.999805637140966,0.00019436285904816743,0.233,0.767,0.0,I'm not sure what a diagnosis would even do since meds really screw with me.,nsubj,1,neu_vader
4779,4779,0.9997280800865256,0.0002719199134566108,0.0,1.0,0.0,"The weight came back, as did the zombie medications.",nsubj,1,neu_vader
4792,4792,0.9979059206937198,0.0020940793062962024,0.0,1.0,0.0,The meds decrease the amplitude of my cycle but I still cycle and I'm white-knuckling it as I wax and wane.,nsubj,1,neu_vader
4796,4796,0.9997853939314226,0.00021460606855901992,0.0,0.866,0.134,"I can't really tell if this is just how it feels to be happy because my meds are taking effect, or if it's more than normal.",nsubj,1,neu_vader
4800,4800,0.9999337127261944,6.628727381464958e-05,0.27399999999999997,0.726,0.0,"Another night... meds are taken... but fuck this... so hard to keep going... slits on my wrists, such is life...",nsubjpass,1,neu_vader
4801,4801,0.9999584161834428,4.158381657514256e-05,0.341,0.659,0.0,Counseling didn't work - meds made things worse.,nsubj,1,neu_vader
4802,4802,0.9995052805479002,0.000494719452091803,0.462,0.5379999999999999,0.0,"I posted here a while back, as my meds gave me crazy panic attacks (Quetiapine).",nsubj,1,neu_vader
4835,4835,0.9997851683757271,0.00021483162428155293,0.0,1.0,0.0,"I spent just over a week there, getting my meds figured out, getting my coping skills rebooted, and generally decompressing.",nsubj,1,neu_vader
4841,4841,0.9996800164837908,0.0003199835162124228,0.0,1.0,0.0,"They can get burned for doing this, so just go with it- especially if the meds are working.",nsubj,1,neu_vader
4844,4844,0.9988723785714388,0.001127621428572639,0.0,0.657,0.34299999999999997,"I was manic for like a month, and I thought the meds were helping.",nsubj,1,neu_vader
4846,4846,0.9996492944618462,0.00035070553816818567,0.0,0.8540000000000001,0.146,"My medications are the only thing that really makes me feel happy, it's almost impossible for me to form emotional connections with other people because I think I have PTSD my last therapist said I did.",nsubj,1,neu_vader
4873,4873,0.9991578667355532,0.0008421332644647029,0.0,0.828,0.172,The one medication that did help with some of the physical things was clamipromine.,nsubj,1,neu_vader
4874,4874,0.99991307865787,8.69213421262094e-05,0.239,0.7609999999999999,0.0,No other medication has helped with these symptoms.,nsubj,1,neu_vader
4877,4877,0.9999069015436984,9.30984562934136e-05,0.0,1.0,0.0,The medicine has been fucking my world up to the point where I can't tell anymore.,nsubj,1,neu_vader
4882,4882,0.9999847912953932,1.520870462357688e-05,0.0,0.741,0.259,I feel like meds are being shoved down my throat!,nsubjpass,1,neu_vader
4889,4889,0.9999716638269898,2.8336173018721266e-05,0.0,0.812,0.188,If so who has had success keeping mania at bay who had previously had medication induced mania?,nsubj,1,neu_vader
4908,4908,0.9876872804746774,0.012312719525339702,0.0,0.757,0.243,"I thought the meds were working perfectly for me, even though I bought for hundreds of dollars worth of books in just a month.",nsubj,1,neu_vader
4910,4910,0.9992182289675016,0.0007817710324818954,0.273,0.65,0.078,"In the mean time I have no access to a psychiatrist, I'm still cycling like mad, I'm irritable, angry, and overwhelmed constantly, my meds still haven't kicked in and my wife doesn't want me to go back to the hospital....",nsubj,1,neu_vader
4918,4918,0.9988652494871624,0.001134750512826029,0.155,0.688,0.158,"So, anyways, as much as this medication is helping, it's (somewhat ironically) reaffirming my lack of belief in free will, which is, in turn, making me feel worse.",nsubj,1,neu_vader
4935,4935,0.9986278105669693,0.0013721894330195046,0.27899999999999997,0.513,0.207,"The meds are definitely cushioning the drop, but I'm unsure if this is just a slow drop to feeling very low, like I did before my regimen.",nsubj,1,neu_vader
4946,4946,0.9999555904827176,4.440951727404424e-05,0.114,0.536,0.35,"A dear friend, trying to help, told me ""The medicine didn't make you gain weight, your eating did.""...Right.",nsubj,1,neu_vader
4947,4947,0.999996706116638,3.293883367183093e-06,0.272,0.629,0.099,The damn medicine made me constantly hungry where no food could satisfy it and if I didn't eat when I was hungry I'd be sick.,nsubj,1,neu_vader
4949,4949,0.9999885040088046,1.1495991197372012e-05,0.0,0.755,0.245,He didn't understand how shitty that medicine made me feel.,nsubj,1,neu_vader
4950,4950,0.9998480486813072,0.00015195131868116698,0.0,0.861,0.139,"Just the other day I realized that the week before last, I had my meds increased.",nsubj,1,neu_vader
4953,4953,0.9932177742415632,0.006782225758435846,0.055,0.8690000000000001,0.076,"I haven't seen a psychiatrist in years and had just been having my gp perscribe me the same meds i've been on with some slight adjustments, but I no longer even live in the same city as him anymore and didn't feel it was safe to continue doing that.",nsubj,1,neu_vader
4961,4961,0.9988447786094854,0.0011552213905214508,0.281,0.63,0.08900000000000001,"i know the fact that i'm even thinking about it means i should go, but the financial fallout is so great that i'm afraid i'll never recover which will only add to my stress and make my life even shittier than it already is...  i do feel safe there, the meds make the never ending mix tape of suicidal thoughts stop, and i don't have to face the fucked up reality that is my life...  but once my stay is over it all goes back to hell...  but the pull of the hospital blanket draped around me, the little cups of happy pills and being with people that understand what it's like to have a brain that is at constant war with itself is cathartic...  no sharp objects to mutilate myself with (it seems to let some of the poisonous thoughts escape), no bottles of pills saying 'eat me - i can make the pain stop for good', no bridges to jump off, someone concerned enough to check my arms for new cuts every day, no vodka to drown my sorrows in, no illegal drugs to escape into... something about waving the white flag of defeat against this awful thing called bi-polar that makes it stop for a little bit...  like a holy day ceasefire... but just like a ceasefire - the war always starts back up with a vengence...   or am i just being overly dramatic?",nsubj,1,neu_vader
4962,4962,0.999867586009744,0.00013241399027051824,0.0,1.0,0.0,Has medication made a big difference?,nsubj,1,neu_vader
