,Unnamed: 0,neg_prob,pos_prob,neg_vader,neu_vader,pos_vader,sentence,dict,identifier,sentiment
993,993,0.9993030809366864,0.0006969190633088338,0.16399999999999998,0.836,0.0,"I am a 18 year old female, I recently went to a psychiatrist and though I was not diagnosed I was given a mood chart and medication that are mood stabilizers and anti depressants.",conj,0,neu_vader
1010,1010,0.99969265121175,0.00030734878824941,0.168,0.8320000000000001,0.0,"I know that they can exclude you based on existing psychological conditions and medication, but is it a blanket exclusion or based on case-by-case assessment?",conj,0,neu_vader
1020,1020,0.9991455709561932,0.0008544290437930762,0.0,1.0,0.0,So I have been off psyche meds for a couple of months.,npadvmod,0,neu_vader
1021,1021,0.9994791254046149,0.0005208745953694395,0.095,0.8009999999999999,0.10400000000000001,"Today was the second day that I couldn't take my blood pressure medication(the only pill I still take) because I ran out right before a holiday abroad, and I haven't been eating, I have been very irritable, I have been talking a LOT(very passionately as well), my pulse is really high, and I've had a cold sweat here and there.",aux,0,neu_vader
1024,1024,0.997900152344838,0.002099847655151657,0.105,0.7959999999999999,0.098,"Within the past few months, I have attempted suicide, been sent to a mental hospital, diagnosed with PTSD and Bipolar 2, sought therapy and proper medication, and am progressively doing my best to look up and move forward.",conj,0,neu_vader
1026,1026,0.9998474084297668,0.00015259157024757918,0.252,0.748,0.0,"Mom told me that my mental disorder and medication is bullshit and I should just get over it, and I called her out on the fact that she battles her own demons.",conj,0,neu_vader
1040,1040,0.9998615235817891,0.00013847641820545988,0.38299999999999995,0.617,0.0,"This, panic attacks, episodes, consequences for social and professional life, medication side-effects.",compound,0,neu_vader
1046,1046,0.9999684712081128,3.152879187007695e-05,0.14400000000000002,0.856,0.0,I then shifted doctors and got diagnosed with borderline personality disorder through new tests and new medicines ensued.,conj,0,neu_vader
1051,1051,0.9849103549845584,0.01508964501543198,0.07400000000000001,0.9259999999999999,0.0,"Hi All,

Being recently diagnosed Bipolar II, and going through the process of trying different medication cocktails, I'm in a tricky spot.",compound,0,neu_vader
1080,1080,0.9997200393182968,0.0002799606817072697,0.0,1.0,0.0,She suggested that I might need a medication change to maybe lamictal and to talk to my psychiatrist about it.,compound,0,neu_vader
1120,1120,0.9999695220765684,3.0477923434490187e-05,0.0,1.0,0.0,How do I learn to understand how my medicine affects me and if it's indeed the right medicine before me?,attr,0,neu_vader
1124,1124,0.9998743878998888,0.0001256121001196372,0.079,0.748,0.17300000000000001,"**I was wondering what medications, if any, people have had success with for anxiety that is NOT a benzodiazepine?",dep,0,neu_vader
1148,1148,0.9997602441114104,0.0002397558885782583,0.264,0.736,0.0,"She doesn't like therapy and meds and refuses to think anything is wrong, kind of just blames other people instead of her approach to them.",conj,0,neu_vader
1149,1149,0.9987697143219312,0.0012302856780766402,0.0,1.0,0.0,"Therapy and medications are part of the current program, but don't seem to be enough.",conj,0,neu_vader
1155,1155,0.9994770115620762,0.0005229884379393514,0.0,0.943,0.057,"Currently, I take 1050 mg Lithium, 200 mg Lamictal, 12.5 mg Ambien CR + occassional 3 mg Melatonin as well as some other minor gastro meds and supplements, just to give an idea of what I'll need to manage.",conj,0,neu_vader
1168,1168,0.999902053568994,9.794643101001093e-05,0.23,0.77,0.0,"I have noticed that when I'm off medication people act differently towards me, more hostile or perhaps more aggressive.",compound,0,neu_vader
1181,1181,0.9996445722445768,0.00035542775543882717,0.0,1.0,0.0,"About 3 months ago, she got started on lithium (she's also on lamictal and adderall and a few antipsychotics and antianxiety meds)...",conj,0,neu_vader
1187,1187,0.9999504950895309,4.95049104798811e-05,0.11699999999999999,0.635,0.248,"Listener 2 provided basic reminders about important things like therapy and medication, without giving advice.",conj,0,neu_vader
1197,1197,0.9990395649336999,0.0009604350662878547,0.052000000000000005,0.679,0.26899999999999996,"My journey through life has been crazy, but through therapy and medication, I am the most stable and the most consistently happy that I have ever been.",conj,0,neu_vader
1209,1209,0.9984017391620259,0.0015982608379568745,0.102,0.7909999999999999,0.107,So I decided to try clonazepam with my night time meds (Seroquel)... and now I'm missing a huge chunk of memory.,appos,0,neu_vader
1212,1212,0.9894322829102872,0.010567717089696409,0.10800000000000001,0.892,0.0,I see my therapist almost every week (she's great) and FINALLY found a decent medication combo that works even though some of the side effects still suck.,compound,0,neu_vader
1229,1229,0.9946558971294862,0.005344102870504915,0.153,0.847,0.0,"After a long journey of self discovery, including missing for days, hospitalization, compulsion, scratching, miscarrying, stripping, sex, drugs, meditation, and medication, I still struggle with Ambiso on a daily basis.",conj,0,neu_vader
1232,1232,0.999840289479165,0.00015971052085230286,0.07,0.62,0.31,"Before now I've been pretty damn stable for at least a year, maybe two, thanks to finally figuring out my perfect medication combo (Lamictal and Wellbutrin SR if that matters).",compound,0,neu_vader
1235,1235,0.9997930130342629,0.00020698696575362726,0.115,0.7829999999999999,0.10099999999999999,"And she sits on a high horse, so the idea that someone else (especially western medicine) helping her is ludicrous.",appos,0,neu_vader
1240,1240,0.9981467314726246,0.0018532685273717781,0.07200000000000001,0.9279999999999999,0.0,Is this one of the reasons that some (including myself at times) have a hard time with treatment and medication?,conj,0,neu_vader
1249,1249,0.9997929023102919,0.00020709768969872988,0.0,1.0,0.0,"They gave me names of therapists and meds and stuff, it just seemed way out of line.",conj,0,neu_vader
1252,1252,0.9966867339690092,0.0033132660309981576,0.14300000000000002,0.857,0.0,"He was diagnosed ~8 years ago, we've been though a lot- hospitalizations, more meds/pdocs than I can list, ECT, financial crises after hypomanic spending sprees, suicide watches, you name it.",conj,0,neu_vader
1254,1254,0.9999770863889684,2.2913611030356218e-05,0.0,1.0,0.0,Came off meds (Lexapro and Effexor).,ROOT,0,neu_vader
1258,1258,0.999508311147816,0.0004916888521897708,0.376,0.624,0.0,"So I am suicidal, no meds for a month at least and homeless in three days.",appos,0,neu_vader
1265,1265,0.9957147604276828,0.004285239572299708,0.0,1.0,0.0,I had a tooth pulled two days ago so I'm on 325mg of Hydros (pain meds) for several days.,appos,0,neu_vader
1279,1279,0.9996793067877344,0.00032069321227643215,0.057999999999999996,0.807,0.135,"It took me over 10 years to get the correct diagnosis and medication, I don't want to fuck that up.",conj,0,neu_vader
1281,1281,0.9999687555170628,3.124448295011509e-05,0.0,0.8390000000000001,0.161,Medical marijuana seems to be the only medicine that can undoubtedly relieve my symptoms.,attr,0,neu_vader
1285,1285,0.9746378205799784,0.025362179420029763,0.0,1.0,0.0,"She had a lifetime of dealing with her mother and her condition/medication and the ups and downs it brought (I don't remember what it actually was), and as little as she thought she knew me at times, she knew more than anyone else ever did.",conj,0,neu_vader
1295,1295,0.9999449401602084,5.505983979358204e-05,0.0,0.444,0.556,"Like, pre-medication deep.",npadvmod,0,pos_vader
1297,1297,0.9900608043233552,0.009939195676626704,0.042,0.885,0.073,"I've noticed over the last few years most bipolars I meet know who michiu Kiaku is, they understand quantum mechanics a million times better than laymen, I meet the parents of bipolar kids that have NO IDEA what meds their kid is even on, and if I ask them about bipolar and topics they should have researched seeing as how their kid has it, and they don't know crap.",ccomp,0,neu_vader
1312,1312,0.9999779560421236,2.2043957865606388e-05,0.0,0.7879999999999999,0.212,The timing and the medication roulette could not be more awful.,compound,0,neu_vader
1313,1313,0.9846226626392164,0.015377337360792652,0.304,0.608,0.08800000000000001,"I struggle with suicidal thoughts ALOT, I feel worthless, a burden to other people, waste of space shit like that the meds help and I'm back in therapy but the thoughts never seem to go away.",compound,0,neu_vader
1316,1316,0.9942949407538232,0.005705059246180812,0.10099999999999999,0.7909999999999999,0.10800000000000001,"Sadly I couldn't fill them for about a week, but now that I'm a few weeks in I think I finally may have found my combo, which is amazing cause I lost count after a dozen different meds and this is try 3 for both, though first time together.",npadvmod,0,neu_vader
1334,1334,0.9999710597640844,2.894023592138544e-05,0.239,0.7609999999999999,0.0,"I have been on anti depressants but not bipolar medication, what is the difference?",attr,0,neu_vader
1337,1337,0.9990856157618132,0.0009143842381744144,0.0,0.758,0.242,After I got out of the hospital I felt really awesome glad to be home and the medications they gave me seamed to be working (zyprexa=mood stabilizer; zoloft=antidepressants).,conj,0,neu_vader
1353,1353,0.9993199073177652,0.0006800926822336866,0.077,0.687,0.235,"I'm on the best medication regime I've ever had - just one med, but it's very effective and has almost no side effects for me.",compound,0,neu_vader
1360,1360,0.9997090488877284,0.00029095111228793867,0.0,0.856,0.14400000000000002,I got a call from the county today who is supposed to help me get on meds long term.,amod,0,neu_vader
1367,1367,0.98307610963009,0.016923890369914266,0.045,0.871,0.084,"I've never been an alcoholic but have always enjoyed alcohol and have always had a few beers in the fridge to unwind with after work most days but have stopped drinking completely since becoming medicated (Quetiapine), mainly because of how it interacts with and potentiates the meds effects a lot.",compound,0,neu_vader
1373,1373,0.9995376334437392,0.0004623665562799259,0.077,0.9229999999999999,0.0,"Over the years I have combated this issue with all that I could, using cognitive therapy and medication in tandem  to fight against the invisible force that would hold me hostage in my home.",conj,0,neu_vader
1384,1384,0.9994513456644808,0.0005486543355167279,0.0,1.0,0.0,"I've been trying to find the right medication combo for... seven years, this August.",compound,0,neu_vader
1397,1397,0.9999714303942012,2.856960580473927e-05,0.0,1.0,0.0,"What is this medication  
Why does it hold me back?",attr,0,neu_vader
1404,1404,0.999871308323327,0.00012869167667544894,0.0,1.0,0.0,"But anyway, here are my meds, can you guys tell me if you think I should see a difference in my mood if I am actually bipolar?",attr,0,neu_vader
1405,1405,0.9999695473002668,3.0452699739275592e-05,0.0,1.0,0.0,"One question:
-IF someone was set off with Mania when they were prescribed anti-anxiety (SNRI) medication is that indicative of Bipolar?",npadvmod,0,neu_vader
1406,1406,0.9999710514653616,2.8948534654731988e-05,0.0,1.0,0.0,I know it's not my other meds because I've been on them before.,attr,0,neu_vader
1416,1416,0.9929542433011436,0.007045756698859444,0.076,0.86,0.064,"This year, the clinic I was going to dropped my care (maybe because I demanded they mail me medication because I tried picking it up on a day they were closed, then tried demanding gas money, then I proceeded to tell this secretary of a christian non-profit ever fallacy in their operations.)",ccomp,0,neu_vader
1442,1442,0.9999714206494659,2.8579350525364467e-05,0.071,0.929,0.0,I know that no one can give medical advice here but just wondering about what a manic phase is opposed to medicine side effects?,compound,0,neu_vader
1450,1450,0.9999801279158494,1.9872084149966724e-05,0.11800000000000001,0.745,0.13699999999999998,"vitamin d and iron replacements and testosterone shots


he stopped all my meds 2 days ago.",npadvmod,0,neu_vader
1452,1452,0.9967600415294166,0.003239958470581145,0.0,0.919,0.081,I've been going through a bunch of medication changes so I was writing these episodes off to that but it's becoming more obvious that it's a reoccurring thing during certain times of the month.,compound,0,neu_vader
1469,1469,0.9916908639817348,0.008309136018274996,0.159,0.778,0.063,"We've been doing well lately with a couple small exceptions, despite the fact that I've been miserably rapid cycling for close to a month now (uninsured, waiting on treatment, no meds).",npadvmod,0,neu_vader
1470,1470,0.9995571720253068,0.0004428279746904922,0.179,0.821,0.0,The moral of my story...is I thought it was the medicine to blame.,attr,0,neu_vader
1472,1472,0.9986842848830312,0.001315715116968833,0.0,1.0,0.0,"The reality is that nobody can diagnose someone through a post on the internet, regardless of a background in psychology or medicine.",conj,0,neu_vader
1485,1485,0.9965210973910376,0.0034789026089627746,0.0,1.0,0.0,The lithium is the first medication that has really helped me get out of my slump a bit.,attr,0,neu_vader
1486,1486,0.9996958547880214,0.00030414521199777385,0.0,1.0,0.0,One medication at a time.,ROOT,0,neu_vader
1487,1487,0.9999930843686922,6.9156313248522736e-06,0.452,0.5479999999999999,0.0,Therapy and medicine failed me.,conj,0,neu_vader
1490,1490,0.9999289712565488,7.102874345082137e-05,0.441,0.5589999999999999,0.0,All of my medication combos have left me severely depressed.,compound,0,neu_vader
1521,1521,0.9842778076174922,0.015722192382513187,0.0,0.9129999999999999,0.087,"I have been off meds for 4 months, dealing well with the end of a long term relationship and way more social than in the past.",npadvmod,0,neu_vader
1525,1525,0.9999594232791968,4.0576720799093175e-05,0.299,0.701,0.0,I need to lose all of this medicine weight!,compound,0,neu_vader
1526,1526,0.9998416040776136,0.00015839592237295948,0.0,0.73,0.27,5+ years of medicine weight gain and I need it to go!,compound,0,neu_vader
1548,1548,0.9997352295209574,0.00026477047905057156,0.113,0.69,0.19699999999999998,"However, since I'm stable and doing fine, I'm wondering if it's the meds causing the memory loss.",attr,0,neu_vader
1550,1550,0.9999503089205424,4.969107945610288e-05,0.0,1.0,0.0,"Not exercise, not meditation, not diet, not staying up all night, not even psychiatric meds.",appos,0,neu_vader
1560,1560,0.9998960704702892,0.0001039295296967828,0.0,0.687,0.313,I feel like this is a really intense medication to start out on.,attr,0,neu_vader
1561,1561,0.9999583876747212,4.161232527839998e-05,0.0,1.0,0.0,I am just now beginning medication treatment for bipolar.,compound,0,neu_vader
1568,1568,0.99988772934878,0.00011227065121395974,0.231,0.5479999999999999,0.222,"I miss hallucinating and going crazy 

I miss being insane...what the fuck is wrong with me...I shouldn't be upset that that I'm normal and happy and everyone is so much happier with me medicated I just don't feel like its me they love and its the meds.",conj,0,neu_vader
1578,1578,0.9998716055691386,0.00012839443087096124,0.0,0.818,0.182,I'm aware that this depends on the person and medication but I'm interested in hearing about this.,conj,0,neu_vader
1579,1579,0.986549993680268,0.01345000631973355,0.0,0.9540000000000001,0.046,"* Spotify :  Katie Lee –  [*The Get Well March*] (https://open.spotify.com/track/1K9cACwj3OXIlgSnb1lwXh) (1'54"")
 
&amp;nbsp;

In the days when therapy rather than medication was the vogue the  folk singer [Katie Lee] (https://en.wikipedia.org/wiki/Katie_Lee_(singer))  released two albums; [*Songs of Couch and Consultation*] (https://open.spotify.com/album/1LIJ0eGi7SKHJXaTTkZ1Fk) (1957), and [*Life is Just a Bed of Neuroses*](https://open.spotify.com/album/6NlFKMWoYRYHnUsVs4Z2Y5) (1960).",conj,0,neu_vader
1584,1584,0.9998801032292656,0.00011989677072409685,0.0,0.892,0.10800000000000001,"I should mention that is was not exclusively sleep aids that would trigger her psychotic episodes, but on several occasions other medicines as well.",conj,0,neu_vader
1585,1585,0.9997739164157908,0.00022608358419479882,0.063,0.937,0.0,"She was kept at the center for a little over a week, and began taking a low dosage anti-psychotic medicine (maybe anti-manic medicine I can't remember what the doctor said) along with other counselling and treatment.",appos,0,neu_vader
1589,1589,0.9999697835498104,3.021645019106496e-05,0.095,0.828,0.077,Do they really teach psychiatrists to diagnose disorders like that in meds schools or are psychiatrists just incompetent because nobody evaluate and verify their competence once they finish school?,amod,0,neu_vader
1609,1609,0.9996618885945252,0.0003381114054568444,0.068,0.932,0.0,"Over the past few years she has been virtually UN medicated because either meds she tried before stopped working, or she could not tolerate the side effects.",advcl,0,neu_vader
1630,1630,0.99830370988919,0.0016962901108101495,0.0,0.877,0.12300000000000001,"I'm on abilify, klonopin, &amp; stallera, as well as prednisone &amp; a few other meds/chemo for RA.",attr,0,neu_vader
1632,1632,0.9999902065934124,9.793406588034473e-06,0.138,0.862,0.0,Can anyone describe some medications stories about how they were affected?,compound,0,neu_vader
1633,1633,0.9998623752413911,0.00013762475860709387,0.14300000000000002,0.857,0.0,His paranoid tendencies greatly subsided after two hospitalizations and the right anti-psychotic medication.,conj,0,neu_vader
1650,1650,0.9947291833967224,0.005270816603282294,0.067,0.905,0.027999999999999997,"I know I probably repeated myself a few times and that this is probably more of a relationship advice type thread, and I apologize for that - but since this is such a drastic change in his personality from before, I can't help but wonder if it's his medicine?",attr,0,neu_vader
1654,1654,0.9994369593521208,0.0005630406478781693,0.0,0.6940000000000001,0.306,"I am pretty well medicined, except when it comes to my rare cases of hypomania.",acomp,0,neu_vader
1661,1661,0.999988997878946,1.1002121057606116e-05,0.0,0.7829999999999999,0.217,"Are there any therapies, workbooks, or medicines you would recommend?",conj,0,neu_vader
1686,1686,0.9974038615000976,0.002596138499889481,0.064,0.9359999999999999,0.0,I later learned that I had been prescribed far too much Lithium - tell that to the closet of clothes that don't fit right now :P. I still owe my university for my diagnosis and medication.,conj,0,neu_vader
1697,1697,0.9999669964206068,3.300357940562821e-05,0.688,0.312,0.0,No meds.,ROOT,0,neg_vader
1700,1700,0.9992975166314824,0.0007024833685285392,0.106,0.784,0.11,Following this meeting I devoured literature on bipolar disorder and the medications I was taking and the wikipedia explanations of manic phases rang true.,conj,0,neu_vader
1704,1704,0.9999282960557928,7.170394421153513e-05,0.0,0.8220000000000001,0.17800000000000002,And since then I’ve been incredibly careful to stick to my medication regimen and make it my top priority.,compound,0,neu_vader
1718,1718,0.9727679379768194,0.027232062023179186,0.166,0.8340000000000001,0.0,"The previous visit she made a comment that she wasn't completely convinced I wasn't bipolar but she'd have to look into it further... so as soon as I told her I related to the symptoms of atypical depression almost as much as I did ADD she jumped on that and prescribed me Lamotrigine, which I know is a medication for bipolar disorder.",attr,0,neu_vader
1747,1747,0.9998722112300572,0.00012778876994505695,0.226,0.774,0.0,"And scared of the ECT scheduled for Friday, of course, which I can no longer medicate-away the fears of (my money, bank card, car keys, meds etc have all been confiscated.)",conj,0,neu_vader
1752,1752,0.9997525701620279,0.00024742983795437735,0.0,0.726,0.27399999999999997,Therapy and medication only go so far in helping you; Sometimes you have to give yourself a hand.,conj,0,neu_vader
1756,1756,0.9999835091238162,1.6490876176612586e-05,0.109,0.835,0.055999999999999994,I have been thinking strongly about going onto some new medication and some anti anxiety medication... but there are so many factors that are overwhelming to me.,conj,0,neu_vader
1768,1768,0.9999726685754484,2.7331424558956306e-05,0.128,0.847,0.025,"For any of you that know anything about blood sugar it was bad, I was having consistent high morning blood sugars no matter what I did to control it (like 400 high) I had no choice but to quit the medication cold turkey.",nmod,0,neu_vader
1778,1778,0.9992484402134868,0.0007515597865019268,0.0,1.0,0.0,"Within the past year or so, I began to eat at least one to two meals a day again, and then more recently have been working on my medication balance.",compound,0,neu_vader
1781,1781,0.9999844251398164,1.5574860168656467e-05,0.0,1.0,0.0,"I was wondering;     
1) how many people have any proper education in psychology, medicine, biochem, neuroscience, statistical analysis etc?",conj,0,neu_vader
1787,1787,0.99971209085217,0.00028790914782555685,0.21600000000000003,0.784,0.0,I'm sick of this meds dance that I've been in since I was 13.,amod,0,neu_vader
1788,1788,0.9999843660743246,1.5633925666789843e-05,0.5760000000000001,0.424,0.0,I have had several anxiety attacks and no meds.,conj,0,neg_vader
1820,1820,0.9994326842191692,0.0005673157808198423,0.0,1.0,0.0,"My therapist said I should ask other people inflicted with BPI and see what they have to say about it, I know for a fact that it is my medication, but is it too much?",attr,0,neu_vader
1831,1831,0.9999587287830262,4.1271216958131296e-05,0.0,0.932,0.068,"She opened and maxed out several cards, bottomed out and over drafted bank accounts on things that aren't returnable and now I am left scrambling for some money for very basic things like house hold bills and her medicine / therapy.",nmod,0,neu_vader
1842,1842,0.9897189036044688,0.0102810963955218,0.0,1.0,0.0,"That brings my medication cost to an estimated $250 (estimated by the pharmacist), which could change (read: increase) based on how the insurance company would view a new prescription order from a new doctor or something.",compound,0,neu_vader
1856,1856,0.9999694089392056,3.059106080668454e-05,0.0,1.0,0.0,I'm calling my doctor tomorrow to ask for an appointment and some heavier meds.,conj,0,neu_vader
1858,1858,0.9999224665308191,7.753346917753408e-05,0.0,0.912,0.08800000000000001,What did you do when you found out and did the treatment for that physical ailment help your physical and mental state without needing the BP meds any more?,conj,0,neu_vader
1870,1870,0.9999626476952592,3.735230474084801e-05,0.0,1.0,0.0,It's Friday so I take my meds two hours late because I go to group.,amod,0,neu_vader
1873,1873,0.9997165420416227,0.0002834579583664756,0.162,0.838,0.0,She even went as far as refusing completely to comply with the doctors medication suggestions.,compound,0,neu_vader
1912,1912,0.9999205041245524,7.949587545421335e-05,0.055,0.8690000000000001,0.077,"Hi guys,lately I have been pretty stable in my life after being diagnosed with bp1 (getting help,regular psychiatrist meetings and medication) but I feel completely empty and I think to myself that before atleast I could feel things,connect with people and I'm starting to become more and more withdrawn.",conj,0,neu_vader
1934,1934,0.9999665739053434,3.342609464663429e-05,0.0,1.0,0.0,Pdoc wants to see if tweaking my meds levels things out.,compound,0,neu_vader
1936,1936,0.9999602929971682,3.9707002846435074e-05,0.0,1.0,0.0,The permanent one is Lamictal which ironically is an anti-seizure medication.,attr,0,neu_vader
1951,1951,0.9972622606779812,0.0027377393220353306,0.0,1.0,0.0,"I came into this understanding that there will always be some side effects, and that there isn't really a ""perfect"" bipolar medication available yet.",attr,0,neu_vader
1958,1958,0.9999823049093391,1.7695090648059353e-05,0.0,1.0,0.0,20+ medications later and I'm just done.,npadvmod,0,neu_vader
1978,1978,0.9997397398609283,0.00026026013905908977,0.10300000000000001,0.897,0.0,At 630 my alarm went off and I took two more 20mg of geodon and all my other meds I usually take at 730.....,conj,0,neu_vader
2001,2001,0.9910281354704359,0.008971864529561445,0.391,0.609,0.0,"I've been diagnosed with a lot of different things, with severe depression and anxiety, diff therapists, meds, not a lot of help.",conj,0,neu_vader
2010,2010,0.9999459299909884,5.407000901619902e-05,0.0,1.0,0.0,"I don't know how that is for scale, but it's both too many pills, and not enough medicine.",conj,0,neu_vader
2014,2014,0.9998717708646572,0.00012822913533417702,0.08900000000000001,0.728,0.182,"Forgetting about my illness and resuming ""normality"" has been the greatest medication I have at the moment and I want it to stay the way it is.",attr,0,neu_vader
2022,2022,0.9771760397030028,0.022823960296991217,0.0,0.866,0.134,"This, along with the amount that I was drinking, resulted in about 10 stone of weight gain and enough medication to knock out a Horse.",conj,0,neu_vader
2039,2039,0.9998342601757798,0.00016573982421727893,0.0,1.0,0.0,I haven't been off these meds in &gt;8 years.,npadvmod,0,neu_vader
2047,2047,0.9983145581803664,0.0016854418196406821,0.0,0.86,0.14,"I have tried a number of things, meds, life-style changes, etc.",conj,0,neu_vader
2056,2056,0.9999943549594618,5.645040546597413e-06,0.0,0.8759999999999999,0.124,I guess I dont have any real questions besides what can I do to help cope with all this that is not medicine.,attr,0,neu_vader
