,Unnamed: 0,neg_prob,pos_prob,neg_vader,neu_vader,pos_vader,sentence,dict,identifier,sentiment
949,949,0.9997587666440768,0.0002412333559349547,0.0,0.866,0.134,I had a talk with my psychiatrist and she made it seem that every single medication I could or should take will make me gain weight.,nsubj,1,neu_vader
955,955,0.999478661605612,0.0005213383943869072,0.0,0.769,0.231,My meds help even me out most of the time.,nsubj,1,neu_vader
963,963,0.9999884246112442,1.1575388773782915e-05,0.114,0.8859999999999999,0.0,so i recently stopped seeing my pdoc and so i went to my family doctor to have my meds refilled.,nsubj,1,neu_vader
974,974,0.9995895392139578,0.0004104607860507042,0.0,1.0,0.0,She said it was just what the medication does to everyone.,nsubj,1,neu_vader
983,983,0.9999494612686298,5.053873137788826e-05,0.341,0.659,0.0,Filed FMLA due to ongoing pdoc and psych appointments and lingering fear the meds would mess me up too badly.,nsubj,1,neu_vader
986,986,0.9999702764807948,2.972351920131258e-05,0.11199999999999999,0.888,0.0,My medications aren't helping much now and I have been updating my psych every time I see him.,nsubj,1,neu_vader
994,994,0.999975384630654,2.4615369326538235e-05,0.0,0.6829999999999999,0.317,My medication has been helping and I do have 2 people really close to me who I trust and encourage me to continue bettering myself.,nsubj,1,neu_vader
999,999,0.9999611587938902,3.884120611501982e-05,0.23800000000000002,0.544,0.218,I was in pretty bad shape before the meds kicked in.,nsubj,1,neu_vader
1030,1030,0.9999360753352482,6.392466476885083e-05,0.0,0.625,0.375,Honestly meds helped with almost everything.,nsubj,1,neu_vader
1034,1034,0.9997774816858936,0.00022251831411384263,0.21,0.61,0.18,"I told my doctor about my worries, he said he wishes he could tell me I will be OK, but the truth is he doesn't know, this illness of mine will forever have to be under surveillance to make sure medication is working, but there are no guarantees, that killed a little part of my hope.",nsubj,1,neu_vader
1052,1052,0.999936034550918,6.396544909332183e-05,0.0,1.0,0.0,"I can't tell if my meds are starting to work, or if I'm hypomanic.",nsubj,1,neu_vader
1055,1055,0.991229113892644,0.00877088610735019,0.0,0.769,0.231,"She put me on Seroquel, but she's keeping me on 50 mg per day until I can see my psychiatrist to make sure my meds won't cocktail in a weird way and if Seroquel is the best course of action.",nsubj,1,neu_vader
1061,1061,0.9998765662348422,0.0001234337651476029,0.0,1.0,0.0,The only meds that ever seemed to work were mood stabilizers.,nsubj,1,neu_vader
1062,1062,0.9999885798099416,1.1420190059981607e-05,0.0,1.0,0.0,The meds have really leveled me out.,nsubj,1,neu_vader
1071,1071,0.9999920575948325,7.942405172262894e-06,0.11599999999999999,0.696,0.18899999999999997,"But then other bipolar people who should know better jump in and start saying things like ""xyz medicine is horrible, don't ever take it!""",nsubj,1,neu_vader
1077,1077,0.9994519373086068,0.0005480626914056599,0.065,0.935,0.0,I wouldn't have figured out that my meds weren't working well enough if I hadn't had my journal to keep record of the patterns in my moods and behaviors.,nsubj,1,neu_vader
1079,1079,0.9992654631491776,0.0007345368508266853,0.0,0.7170000000000001,0.28300000000000003,I already feel a little better knowing that my new meds might finally let me be free of symptoms.,nsubj,1,neu_vader
1087,1087,0.9997193518274772,0.0002806481725190209,0.135,0.865,0.0,And I know medication just lessens the symptoms it doesn't make them go away entirely which also scares me.,nsubj,1,neu_vader
1099,1099,0.9999880050079921,1.1994992012953478e-05,0.0,1.0,0.0,"The medication you stabilised on, do you just take them indefinitely from here on out?",nsubj,1,neu_vader
1106,1106,0.999994921136042,5.078863942609073e-06,0.32799999999999996,0.672,0.0,The medicine and just PTSD/bipolar/bpd got me all fucked up.,nsubj,1,neu_vader
1108,1108,0.9996778278673212,0.00032217213265917967,0.126,0.8740000000000001,0.0,The medication she takes restricts her episodes to occurring every few years and they change each time.,nsubj,1,neu_vader
1109,1109,0.9999100596208812,8.994037910148837e-05,0.33,0.67,0.0,My medications are finally leveling me out... yet tonight I'm having a painfully lonely night.,nsubj,1,neu_vader
1110,1110,0.9999904077078502,9.59229214980891e-06,0.078,0.922,0.0,I just don't what to do and my anxiety is crippling but meds have never really helped me,nsubj,1,neu_vader
1114,1114,0.9997622832312808,0.00023771676870771856,0.055999999999999994,0.6759999999999999,0.267,"I know meds can seem ridiculous, especially if you are just coming to terms with a diagnosis, but trust me, meds are better than the alternative.",nsubj,1,neu_vader
1119,1119,0.9999144256229344,8.557437705023811e-05,0.087,0.794,0.11900000000000001,People always ask how my meds affect me and I honestly have no idea outside of they seem to keep my mood flat.,nsubj,1,neu_vader
1121,1121,0.9999594682209056,4.053177909045407e-05,0.19899999999999998,0.6679999999999999,0.133,"""It's all in your head man, you don't need that shit""
""Your meds are just big pharma trying to poison your mind: get off that shit, it's gonna kill your brain""
""Just smoke some pot, dude- it's nature's medicine""
""Stop taking that stuff, it makes you lose who you truly are.",nsubj_attr,1,neu_vader
1125,1125,0.9999861524975948,1.3847502390939193e-05,0.159,0.7290000000000001,0.11199999999999999,"But I still feel like I'm lost and loose and not sure really what I can do, since I know that my current medication is not doing what it should and either needs to be increased or changed.",nsubj,1,neu_vader
1129,1129,0.9999371038948008,6.28961052029152e-05,0.185,0.815,0.0,His medication is not as well managed as mine.,nsubj,1,neu_vader
1130,1130,0.9999501589377756,4.98410622212347e-05,0.0,1.0,0.0,My meds (lamotrigine/citalopram/lorazepam) are not doing nearly enough yet.,nsubj,1,neu_vader
1133,1133,0.9998164114417526,0.00018358855822772041,0.0,0.899,0.10099999999999999,I'm going to do another questionnaire to see if meds are recommended for my level of symptoms.,nsubjpass,1,neu_vader
1150,1150,0.9999766129747726,2.338702522323723e-05,0.0,1.0,0.0,How have your meds changed your life?,nsubj,1,neu_vader
1170,1170,0.9981686886768416,0.0018313113231496969,0.0,0.868,0.132,All in all I rate the experience a 4/10 because I did learn some good coping skills and finally got my meds adjusted.,nsubj,1,neu_vader
1189,1189,0.9994690427007492,0.0005309572992392624,0.201,0.562,0.237,"I hope the new meds help, but haven't had luck in the past.",nsubj,1,neu_vader
1193,1193,0.9999908734590734,9.126540944474876e-06,0.0,0.6779999999999999,0.322,Bonus if your meds don't nix your sex drive!,nsubj,1,neu_vader
1196,1196,0.9995235241389064,0.0004764758610965405,0.077,0.6970000000000001,0.226,"For some people, the mania is so amazing, that medication and therapy may not be worth it.",nsubj,1,neu_vader
1201,1201,0.9999505869309044,4.9413069077963736e-05,0.28600000000000003,0.47600000000000003,0.23800000000000002,"Like, my medication doesn't make me happy.",nsubj,1,neu_vader
1226,1226,0.9999233653615504,7.663463843775351e-05,0.0,0.843,0.157,"Update: My medication has been updated, but I'd still appreciate any and all other coping strategies you've got to offer.",nsubjpass,1,neu_vader
1251,1251,0.997509281886064,0.002490718113930636,0.23,0.6890000000000001,0.08199999999999999,I feel like an outsider in my own mind and life all the time and while medication stops my depression and mania I feel it numbs me.,nsubj,1,neu_vader
1255,1255,0.9997349847331012,0.0002650152669091024,0.139,0.8109999999999999,0.05,For starters he can barely hold a full conversation; his meds make his memory shit and he forgets what he's saying halfway through a sentence.,nsubj,1,neu_vader
1268,1268,0.9966213617777432,0.003378638222250455,0.0,1.0,0.0,"I've read in a few forum posts that zinc can be used to counter the effects that meds have on libido, but not from anybody that actually used it.",nsubj,1,neu_vader
1270,1270,0.9999669238573852,3.3076142627703816e-05,0.0,1.0,0.0,We have talked at length about this and I understand the effects that the meds have had.,nsubj,1,neu_vader
1276,1276,0.9980722419584112,0.0019277580415724173,0.265,0.48200000000000004,0.253,"I'm finally feeling better psych meds wise, but I have a history of self destructive behavior.",nsubj,1,neu_vader
1278,1278,0.9997596345815004,0.00024036541851374214,0.068,0.8,0.132,"Yes I  was smoking crazy amounts of pot, and now that I'm out I really, really want to grab some more... but my medication works.",nsubj,1,neu_vader
1288,1288,0.9994784493731488,0.0005215506268421748,0.136,0.8640000000000001,0.0,"I'm getting out of control, the medications are not helping (lamictal &amp; seroquel).",nsubj,1,neu_vader
1299,1299,0.9993743633266392,0.0006256366733419861,0.0,1.0,0.0,I took medication from age 14 to 22. the medication robbed my life.,nsubj,1,neu_vader
1310,1310,0.9997701642463428,0.00022983575364207158,0.402,0.598,0.0,"My self perception is very distorted and I said some nasty angry things.,The medication is not working at all, and I will stop it.",nsubj,1,neu_vader
1317,1317,0.9999392349348156,6.076506517649701e-05,0.0,0.8290000000000001,0.171,As the weeks passed the meds really started helping and leveling me out.,nsubj,1,neu_vader
1318,1318,0.9994476411144178,0.0005523588855816328,0.0,0.828,0.172,"tl;dr got hit by a train, meds started to work, so I’m following my dreams",nsubj,1,neu_vader
1323,1323,0.9988895703356506,0.001110429664340609,0.151,0.7979999999999999,0.051,And yes some of the side effects just fucking suck but you need to gauge how uncomfortable you are now vs. what that medication will do for you in the long run.,nsubj,1,neu_vader
1326,1326,0.9931982726567338,0.006801727343281987,0.0,0.809,0.191,The point is you have to really put forth a lot of effort sometimes to get the benefit - That medication could significantly improve the quality of your life.,nsubj,1,neu_vader
1341,1341,0.9996021393655372,0.00039786063448117706,0.29600000000000004,0.7040000000000001,0.0,"But, I'll be damned if these meds are doing a fucking thing except excacerbating the problem or worse doing things unknown until the future.",nsubj,1,neu_vader
1357,1357,0.99998164311554,1.8356884458146657e-05,0.514,0.486,0.0,My worst fear is that my medicine is going to stop working.,nsubj,1,neg_vader
1372,1372,0.9999343527838058,6.564721621210943e-05,0.057,0.894,0.049,"It can take years to find the right med combo, and if you use pot and your doctor doesn't know, you very well could wind up thinking your medicines don't work when they do, or do work when they don't, potentially prolonging your agony for years.",nsubj,1,neu_vader
1388,1388,0.9987516199675466,0.0012483800324566555,0.272,0.728,0.0,"Worst I've felt in a long time, probably since my meds started working.",nsubj,1,neu_vader
1418,1418,0.9999953713707818,4.628629207832738e-06,0.0,0.8,0.2,"I guess what I'm wondering is what does ""working medication"" look like?",nsubj,1,neu_vader
1427,1427,0.9997757094944996,0.00022429050551403242,0.08800000000000001,0.7490000000000001,0.163,"Any time I start talking about how the meds have helped me she looks at me like I'm a drug addict, not like I'm someone with an illness.",nsubj,1,neu_vader
1436,1436,0.9999680911173582,3.1908882657270746e-05,0.0,1.0,0.0,Turns out that my meds are messing with my eyesight and that I need FUCKING BIFOCALS.,nsubj,1,neu_vader
1440,1440,0.9998375174709668,0.00016248252902746418,0.192,0.667,0.142,I'm relieved as my meds have been adjusted and I feel stable but I'm dreading the day I have another episode.,nsubjpass,1,neu_vader
1449,1449,0.9985396240521318,0.0014603759478507205,0.059000000000000004,0.941,0.0,was in hospital for it as i dont handle bloods well (its a trigger and i have to be drugged out for it) im not coping and hes claiming i need to wait 3 months for my long acting meds to leave the blood stream before we can even start to know if its working.,nsubj,1,neu_vader
1466,1466,0.9479923599320358,0.05200764006797305,0.0,0.73,0.27,"Even though it hasn't been a week, the medication is working since now I can fall asleep before 12 but I seem to alternate between feeling normal, calm, somewhat cheerful and an intense feeling that I don't know how to describe it.",nsubj,1,neu_vader
1473,1473,0.9994934867130356,0.0005065132869797018,0.079,0.7390000000000001,0.182,"For instance, his best friend won't have anything to do with me any more because at christmas my meds stopped working and I had a serious rapid cycling moment, so now he just thinks I'm 'crazy'.",nsubj,1,neu_vader
1475,1475,0.9998592344507083,0.00014076554930813104,0.18,0.634,0.185,"Have any meds been successful at getting you out of the ""dreamlike"" state of depression?",nsubj,1,neu_vader
1479,1479,0.9996837520382869,0.00031624796173072205,0.0,1.0,0.0,The drugs I'm on aren't enough and I don't have a place to go right now to try to get meds adjusted.,nsubj,1,neu_vader
1483,1483,0.9990988993802428,0.0009011006197584805,0.0,0.7829999999999999,0.217,"it feels like medication does this all the time, is my body building some immune system after a while or wtf?!",nsubj,1,neu_vader
1509,1509,0.999985235526565,1.476447343737219e-05,0.0,0.8909999999999999,0.109,I currently have neither and am getting my meds refilled by my primary and don't know when i'll be able to get professional help.,nsubj,1,neu_vader
1512,1512,0.9999803422689726,1.9657731036630832e-05,0.0,1.0,0.0,"or ""My meds are finally working!""",nsubj,1,neu_vader
1513,1513,0.9989536945518124,0.0010463054481988402,0.23,0.731,0.039,"Yeah, it absolutely sucks that someone's meds are working after the 2nd combo when you've been working on combos for years, but that doesn't mean you should downvote them out of spite or jealousy.",nsubj,1,neu_vader
1517,1517,0.9604436745071909,0.039556325492802635,0.11699999999999999,0.826,0.057999999999999996,Anyway after it took me a long time to titrate up to 150mg I started feeling really good in May and the start of June...my pdoc and I thought it was because the meds were working but in mid June I started heading back down into a depressive episode and I still am in the same depressive episode.,nsubj,1,neu_vader
1518,1518,0.9955109315680551,0.004489068431964607,0.0,0.8640000000000001,0.136,So I think I may have actually been in a hypomanic episode instead of the meds actually helping.,nsubj,1,neu_vader
1520,1520,0.9997226561000456,0.0002773438999603593,0.179,0.794,0.027000000000000003,I'm meeting with her again in about a week and a half and I feel really bad about telling her that im still feeling depressed and that the meds aren't working cause she just got me so much of the lamictal that would go to waste if we try something else.,nsubj,1,neu_vader
1535,1535,0.9999949464104202,5.053589566887961e-06,0.0,1.0,0.0,All I can think is what if this medication makes me psychotic?,nsubj,1,neu_vader
1554,1554,0.918950151524732,0.08104984847526442,0.23199999999999998,0.69,0.078,I was so sick at 3.0 I'm   having heart pain twitching all over my body loss of hair I had throat pain along with unreal anxiety well sleeping waking up every hour he said I couldn't have any side effects at such a low blood level but I was reading other people feeling sick at this lower 3.0 I'm worried I don't know what to think if anyone know anything it would be helpful what do I ask my doctor to do help me please I'm in a in forced drug treatment program to get my charges reduced but part of the program is I must take meds but I've had so many side effects it's such a nightmare... started off at 900 mg lithium carbonate eskalith this is my third Med and I dont feel I have bipolar my family pushed me into it to get my charges reduced OMG I'm in he'll these meds make me sleep all the time loss of hair feeling numb depression so many weird problems blurred vision I'm only 34 and never had side effects / reactions to anything other than bug bites poison ivy  sun burn normal things.,nsubj,1,neu_vader
1581,1581,0.9984555849079008,0.0015444150920996733,0.0,1.0,0.0,"One medication that I'm on called gabapentin, a mood stabilizer, only comes in 100mg capsules.",nsubj,1,neu_vader
1582,1582,0.9979219741906772,0.002078025809312061,0.223,0.708,0.068,"I am in a demanding academic field so given that my experience with Risperdol was a disaster with focus and confusion, I'd like to hear a reason to believe that these medications are different.",nsubj,1,neu_vader
1606,1606,0.99931493912419,0.0006850608758149986,0.256,0.6990000000000001,0.045,"I also have PTSD, which was misdiagnosed as bipolar for years and the resulting medication made me so sick, tired and miserable that there is little I will not do to avoid bringing on bipolar.",nsubj,1,neu_vader
1616,1616,0.9998933814965464,0.00010661850343704326,0.092,0.722,0.18600000000000003,"Help...


**Further explanation**

I don't know why, but meds often work great in the beginning and then abruptly and/or rapidly stop working or go south.",nsubj,1,neu_vader
1617,1617,0.9999911685269488,8.831473057199874e-06,0.152,0.693,0.156,"So the meds must have had some positive effect if not being on it made life horrid, right?",nsubj,1,neu_vader
1625,1625,0.9999644516181222,3.5548381864461824e-05,0.0,0.748,0.252,It's...new...I know the medicine is there to help me.,nsubj,1,neu_vader
1635,1635,0.9985194378103248,0.0014805621896870232,0.196,0.687,0.11699999999999999,"I don't think the meds are working, but they make me feel weird to the point an increase my harm my limited abilities at school, though that is basically a moot point since I am not doing my work now.",nsubj,1,neu_vader
1664,1664,0.9999549041094772,4.5095890522142045e-05,0.0,1.0,0.0,"And it is why I have the notion that my medications are ""holding me hostage"".",nsubj,1,neu_vader
1672,1672,0.9999641514735929,3.584852642667073e-05,0.0,1.0,0.0,At first I thought medication was working.,nsubj,1,neu_vader
1674,1674,0.9999827866330876,1.7213366897184966e-05,0.0,1.0,0.0,"I've been on meds since I started seeing them, so I'm thinking that is probably why they aren't diagnosing me with bipolar--  bc my meds are working.",nsubj,1,neu_vader
1683,1683,0.9997459347114162,0.00025406528856674286,0.161,0.772,0.067,"We went outside to smoke a cigarette and started talking about life and how I wanted to be a writer, but I'm struggling because I feel that my medicine inhibits my abilities and all that stuff.",nsubj,1,neu_vader
1687,1687,0.9998324153937834,0.00016758460622025547,0.0,0.755,0.245,Some medication im on actually helps produce new growth of dopamine receptors causing depression... i fill them with dope.,nsubj,1,neu_vader
1688,1688,0.9996560982059792,0.0003439017940128352,0.0,1.0,0.0,So that medication is out of the question.,nsubj,1,neu_vader
1693,1693,0.9998931139280168,0.0001068860719832052,0.0,0.645,0.355,Luckily the medication will start working soon.,nsubj,1,neu_vader
1702,1702,0.9996524446189028,0.00034755538111247723,0.09300000000000001,0.907,0.0,I'm trying to push the argument that medication has changed my political views but nobody will believe it.,nsubj,1,neu_vader
1706,1706,0.9999641926637021,3.580733629874083e-05,0.34,0.66,0.0,Antihistamine based sleeping meds make me aggressive and paranoid.,nsubj,1,neu_vader
1707,1707,0.999973764202256,2.623579774003822e-05,0.64,0.36,0.0,Anti nausea meds make me agitated and distraught.,nsubj,1,neg_vader
1714,1714,0.9991201299152924,0.0008798700847176776,0.065,0.935,0.0,"So in all, my meds are going to cost me about $150 a month which is wayyy beyond what I can pay for.",nsubj,1,neu_vader
1733,1733,0.9999791159303052,2.088406969312789e-05,0.0,1.0,0.0,"My meds have to be switched up every few months, because my body gets used to them or something.",nsubj,1,neu_vader
1738,1738,0.9999508267825452,4.917321744673775e-05,0.0,1.0,0.0,"My old meds didn't work for me, even though I stayed on each cocktail for at least three months.",nsubj,1,neu_vader
1743,1743,0.99983615483118,0.00016384516883847082,0.0,1.0,0.0,Took 3 years to get the meds set.,nsubj,1,neu_vader
1751,1751,0.9999679824778968,3.2017522095609925e-05,0.163,0.8370000000000001,0.0,"They switched me to ablify because my old meds where doing bad things to my body, and my mind.",nsubj,1,neu_vader
1754,1754,0.9999705022065372,2.949779345044536e-05,0.0,1.0,0.0,"I did start part time work, my meds are on track and stuff.",nsubj,1,neu_vader
1763,1763,0.9998303682824884,0.00016963171750302033,0.0,0.772,0.228,edit: she had also been telling me towards the end that she has been feeling like the meds haven't been working like they're supposed to.,nsubj,1,neu_vader
1767,1767,0.999393708128936,0.0006062918710634387,0.0,0.664,0.336,He believes that his work will soon bring him great fame and prosperity and that meds will dilute his thoughts and creativity.,nsubj,1,neu_vader
1776,1776,0.9998795976317336,0.00012040236826264121,0.086,0.914,0.0,The medication really makes me feel so normal and I don't want to go un-medicated.,nsubj,1,neu_vader
1810,1810,0.9979506998543872,0.0020493001456076466,0.055999999999999994,0.816,0.128,"TL;DR
I'm in a scenerio where natural events are running their natural course and it's taking its toll on me, or these events are signifying my meds are no longer working how they are intended to.",nsubj,1,neu_vader
1819,1819,0.9999303477929836,6.965220701681617e-05,0.0,1.0,0.0,I guess basically I am wondering does anyone know how long it will be before the meds really start working and I can feel normal?,nsubj,1,neu_vader
1823,1823,0.9997215097238136,0.0002784902761884622,0.10300000000000001,0.897,0.0,I know that medications aren't perfect though so I should get to know when I'm having hypomania so I can prepare for it in the future if/or when it happens.,nsubj,1,neu_vader
1826,1826,0.9999597953264082,4.020467358666951e-05,0.0,1.0,0.0,I know medication is necessary to feel 'sane.',nsubj,1,neu_vader
1830,1830,0.999942608205639,5.739179436707392e-05,0.318,0.607,0.075,"The meds help, but all I've had as far as ""mania"" goes is suffering from someone else's trauma.",nsubj,1,neu_vader
1843,1843,0.9997656838945248,0.0002343161054841979,0.083,0.875,0.042,"She hasn't been on her meds for about 4 months now, mainly because we don't have insurance and we can't afford any of her meds (we've tried medicaid, disability, and those free med programs with no luck), but also because she doesn't like how the meds make her feel.",nsubj,1,neu_vader
1845,1845,0.999878872860944,0.00012112713905569031,0.0,0.909,0.091,it makes things 10x worse....ive just gotten out of my 5 hospitalization (2014) so i know all my meds are fine.,nsubj,1,neu_vader
1859,1859,0.9999741720549136,2.5827945077919767e-05,0.0,1.0,0.0,"As if I took the ""easy"" way out and let medicine do the work.",nsubj,1,neu_vader
1874,1874,0.9999691468307818,3.085316923367597e-05,0.102,0.843,0.055,"Well on the 12th, 11 days ago, I noted my swings starting to disappear (I chart my moods now) and I'm not sure if the medicine is finally actually working or if I'm just hypomanic again.",nsubj,1,neu_vader
1875,1875,0.9999946581303976,5.341869598763372e-06,0.16699999999999998,0.833,0.0,"So I guess the question I have is, if the meds are working and I am ""better"", what the hell am I supposed to do with myself now?",nsubj,1,neu_vader
1877,1877,0.9997776149451608,0.00022238505483801344,0.14400000000000002,0.8009999999999999,0.054000000000000006,I'm scared a shelter will be a fucking terrible place while my meds are changing and I barley have the energy to call them all but I guess I have to.,nsubj,1,neu_vader
1890,1890,0.9999223011271644,7.769887282234184e-05,0.11199999999999999,0.888,0.0,My meds that had been working on me for 10 years suddenly stopped doing their magic.,nsubj,1,neu_vader
1897,1897,0.9999669964206068,3.300357940562821e-05,0.0,1.0,0.0,The meds aren't working.,nsubj,1,neu_vader
1901,1901,0.9993727684480084,0.0006272315519914603,0.068,0.879,0.054000000000000006,"I'm just getting medicaid after being uninsured (and thus untreated) for a few years and looking to start treatment again (medication has been helpful for me, but I've had little to no real therapy.)",nsubj,1,neu_vader
1902,1902,0.999795524131463,0.00020447586853460556,0.10300000000000001,0.8340000000000001,0.063,Been feeling all over the place and meds aren't helping fast enough (ie lamictal takes forever to get on the proper dose!!),nsubj,1,neu_vader
1904,1904,0.9971923997802354,0.002807600219747664,0.12,0.708,0.172,"My fucking medicine has helped me gain a LOT of weight, and it really, really bothers me.",nsubj,1,neu_vader
1913,1913,0.9996041701535494,0.00039582984644301165,0.23399999999999999,0.7659999999999999,0.0,I'm starting to think that medication may not be the best option.,nsubj,1,neu_vader
1914,1914,0.9995604418757704,0.00043955812423725687,0.126,0.696,0.17800000000000002,"Everything was going great even though in the beginning, the meds were making me tired all the time.",nsubj,1,neu_vader
1915,1915,0.9999815910175344,1.8408982479075e-05,0.0,1.0,0.0,My meds are gone and I feel nothing.,nsubjpass,1,neu_vader
1920,1920,0.9928430277465145,0.007156972253478006,0.11,0.89,0.0,Seroquel (200mg) was one of the first meds I was put on about 8 months ago and it really helped a lot with my depression (I think - maybe the other meds helped the depression?).,nsubj,1,neu_vader
1921,1921,0.9999882466763768,1.1753323619978164e-05,0.196,0.804,0.0,I'm just wondering... do medicines just stop working after awhile?,nsubj,1,neu_vader
1930,1930,0.99972414360372,0.0002758563962605744,0.0,0.868,0.132,"END EDIT

It seems pretty obvious to me after doing some thought, research, and discussion that medication is a temporary fix for bipolar.",nsubj,1,neu_vader
1931,1931,0.9998223581271084,0.00017764187290000258,0.307,0.693,0.0,That the meds might be making it worse.,nsubj,1,neu_vader
