,Unnamed: 0,neg_prob,pos_prob,neg_vader,neu_vader,pos_vader,sentence,dict,identifier,sentiment
3,3,0.9999806787289758,1.9321271015784145e-05,0.0,1.0,0.0,These episodes could be very extreme so she (thankfully) began therapy and medication.,conj,0,neu_vader
4,4,0.9960564448904136,0.00394355510957723,0.0,1.0,0.0,I keep getting asked what my goal for treatment is from both  my pdoc in my bipolar medication group which also has a small therapy element .,compound,0,neu_vader
6,6,0.9997350835274542,0.00026491647255180316,0.0,0.8740000000000001,0.126,"I have *not* found an acceptable medication regimen yet, and since the diagnosis, I have progressed into ultra-rapid cycling.",compound,0,neu_vader
14,14,0.9979407960078348,0.002059203992153095,0.047,0.866,0.087,"I think giving blood reduced my medications levels in my bloodstream, and thus, exposed me to the 'original' state of myself that was prone to these cycles.",compound,0,neu_vader
22,22,0.99758557197957,0.002414428020417281,0.0,1.0,0.0,"I know I need to talk to a psychiatrist about all of this, but the psychiatrist I'm currently seeing only sees me for medication management, and I only see her once every 3 months for a follow up, and each follow up is 15-20 minutes long to determine if she should renew my prescription.",compound,0,neu_vader
30,30,0.9991717156140788,0.0008282843859037887,0.0,0.639,0.361,Hopefully a good pdoc and proper meds will help but I can't wait for that.,conj,0,neu_vader
32,32,0.9999913683421512,8.631657832519209e-06,0.0,1.0,0.0,Could this actually be medicine-related?,npadvmod,0,neu_vader
37,37,0.9977619550429608,0.0022380449570531934,0.042,0.958,0.0,"I've had ADHD most of my life, and I've managed it semi-effectively (at times) alternatively through self-imposed organizational tools and habits (which work for short periods, usually), medication (which I can seldom afford now that I'm on my own), and extensions and incompletes from my professors (which I hate, but is usually what I end up needing).",conj,0,neu_vader
38,38,0.999977128910738,2.2871089266124005e-05,0.0,1.0,0.0,"So I am hypomanic, been seeing my psychiatrist and meds being adjusted etc....",conj,0,neu_vader
56,56,0.9993931454621608,0.0006068545378449191,0.18899999999999997,0.6579999999999999,0.153,And what do I even say when I get to the hospital I feel like they're going to treat me like a goddamn basket case and I'm scared and embarrassed that I let things get to this point and I don't know if I should tell my dad because that's just time and money out of his day and I don't want him to get mad at me because I'm notorious for not taking my medication shit i don't know what to fucking do at all and I don't want to fuck myself over today PLEASE HELP!,compound,0,neu_vader
60,60,0.9993295262223484,0.0006704737776422742,0.0,1.0,0.0,"I took headache meds, sinus meds, did a NeilMed sinus rinse, and took an Epsom salt bath.",conj,0,neu_vader
62,62,0.9996626769403392,0.00033732305967167715,0.0,1.0,0.0,"I see a psychiatrist for medication management, and I don't see a therapist.",compound,0,neu_vader
71,71,0.9453545647063034,0.05464543529369968,0.077,0.7490000000000001,0.17300000000000001,"Just a quick post before I go to sleep, so apologies for late replies/not being 100% clear:

Over the last three/four days, I've gone from about 75% (of what was normal, pre meds) depressed, to a pretty solid hypomanic.",appos,0,neu_vader
78,78,0.9787522593125024,0.02124774068748216,0.0,0.8009999999999999,0.19899999999999998,"I went through some rough patches as I tried to find a medication combination that worked for me, but (with the help of my psychiatrist) I found a combination that worked well.",compound,0,neu_vader
79,79,0.9973311488414288,0.002668851158589528,0.21100000000000002,0.684,0.105,**The problem now:** I just entered a manic episode about a week ago that has been one of the worst episodes since I started taking this better medication combination.,compound,0,neu_vader
96,96,0.9987858269130936,0.001214173086900362,0.321,0.679,0.0,"The disease makes it worse, but I think the problem is that, underneath all the symptoms and the medication, I'm just a worthless little pussy.",conj,0,neu_vader
117,117,0.9993241426042389,0.0006758573957575397,0.0,1.0,0.0,"""The DSM IV-TR has a clause that states “medication-induced mania” is not to be considered bipolar.""",npadvmod,0,neu_vader
118,118,0.9906782222655184,0.009321777734471405,0.065,0.87,0.065,"On page 368 heading ""Criteria for hypomanic episode"" there's a note, it reads


Note: Hypomanic-like episodes that are clearly caused by somatic antidepressant treatment (e.g., medication, electroconvulsive therapy, light therapy) should not count toward a diagnosis of Bipolar II Disorder.",conj,0,neu_vader
121,121,0.9999710833132548,2.8916686734338147e-05,0.187,0.813,0.0,** She wants me on lamitral which are anti seizure meds.,attr,0,neu_vader
126,126,0.9931720738993004,0.006827926100705962,0.256,0.7440000000000001,0.0,"Anyways, now that I'm 25, having started medication two days ago, I'm starting to feel a lot of resentment and disappointment.",nummod,0,neu_vader
134,134,0.9999708509324556,2.9149067545197224e-05,0.0,0.639,0.361,"So friends, what is your medication(s) nightmare?",attr,0,neu_vader
139,139,0.9998304748974628,0.000169525102521702,0.16699999999999998,0.833,0.0,"I'm not sure if it's my medications or I'm just losing my mind with racing thoughts, but I will go into another room and forget why I got up in the first place.",attr,0,neu_vader
151,151,0.9991238897754374,0.0008761102245544157,0.124,0.765,0.11199999999999999,have mood stabilizers and other medications for bipolar 2 been worth the risk of side effects?,conj,0,neu_vader
165,165,0.9998032322326832,0.0001967677673312661,0.028999999999999998,0.895,0.075,"I try to handle it myself with anxiety meds only when needed and marijuana (which calms me down and helps me think straight) and to just work through everything, but I'd say we all know that doesn't always work as expected and can even backfire.",conj,0,neu_vader
177,177,0.9999592244797076,4.07755202955296e-05,0.0,0.8740000000000001,0.126,I know the mental health team and medication is what i want.,conj,0,neu_vader
184,184,0.9999221204540186,7.787954599033609e-05,0.0,1.0,0.0,From both the transition and the medicine itself.,conj,0,neu_vader
188,188,0.9999669964206068,3.300357940562821e-05,0.688,0.312,0.0,No meds.,ROOT,0,neg_vader
190,190,0.9996105446949396,0.0003894553050779872,0.0,0.855,0.145,I've agreed not to move anytime soon - added extra therapy and another medication and my doctor has approved a week off work for me to get to a place where I can focus again.,conj,0,neu_vader
191,191,0.9999538240365612,4.617596345746858e-05,0.22699999999999998,0.773,0.0,I was wondering if anyone takes medication for both anxiety and bipolar disorder and what medication it is?,attr,0,neu_vader
195,195,0.9992061750408624,0.0007938249591437419,0.0,1.0,0.0,"I've been hypomanic for the past few weeks and despite medication increases (going from lamictal 100mg to 200mg and seroquel 25mg to 100mg), exercise, and eating right, I keep going up and up and up and up.",compound,0,neu_vader
199,199,0.9999625028201896,3.749717981624415e-05,0.124,0.6940000000000001,0.183,"... not to sound dire, but even when you think you have EVERYTHING going - insight, doctor access, medication, general health and employment, supportive partner and friends - this shit comes back and hits you and WILL topple things.",conj,0,neu_vader
202,202,0.995010907100258,0.0049890928997549395,0.0,0.941,0.059000000000000004,"One or two of you may understand what it is to have your affect blunted for most of TEN YEARS, your sexual desire coming out for MAYBE one week every three months, and wondering every day if it's the medication, the situation or YOU.",attr,0,neu_vader
227,227,0.9999260654180392,7.393458197744464e-05,0.0,1.0,0.0,It is now totally out of my medication regime....,compound,0,neu_vader
230,230,0.9999836285319388,1.637146806389099e-05,0.0,0.667,0.33299999999999996,:) Have you ever come off medication?,npadvmod,0,neu_vader
232,232,0.999951847368581,4.815263139994333e-05,0.146,0.8540000000000001,0.0,In part this is because my medication regimen is not yet stable.,compound,0,neu_vader
237,237,0.999888103065334,0.00011189693465939502,0.0,1.0,0.0,I hit the medication lottery and got on Lamictal and it worked.,compound,0,neu_vader
238,238,0.9997861318083844,0.0002138681916253576,0.0,0.851,0.149,"With constant visits, medication and therapy I have been able to manage it well.",conj,0,neu_vader
242,242,0.9930292214768672,0.0069707785231296155,0.0,1.0,0.0,"However, with very little discussion(understandably) she temporarily popped me on a new medication(in place of the pristiq) until this can either be sorted out, or she can at least be back to set me up on samples.",amod,0,neu_vader
250,250,0.9680517163077432,0.0319482836922701,0.24600000000000002,0.754,0.0,Over the years I've managed to find a meds combo (Trileptal and Gabapentin) that keeps my moods more level but I struggle with depression and anxiety (PTSD as well) and it frequently keeps me in the house.,amod,0,neu_vader
254,254,0.9999008676787796,9.913232122794088e-05,0.0,0.769,0.231,Did the thyroid meds help with your moods at all?,ROOT,0,neu_vader
268,268,0.9999669964206068,3.300357940562561e-05,0.0,0.4,0.6,Self medication ftw,compound,0,pos_vader
279,279,0.9999734008201296,2.659917988606854e-05,0.0,1.0,0.0,I won't delve too deeply into my medication history.,compound,0,neu_vader
281,281,0.9999577167033832,4.228329662965045e-05,0.0,0.752,0.248,So I'm on Lamictal again after being medication free since August/September.,attr,0,neu_vader
293,293,0.9966517728009846,0.0033482271990220923,0.083,0.818,0.099,"Part of me thinks I need to just be patient, save up some money, and get some counseling and meds, but I worry that a medicated version of me might be willing to sacrifice that dream of international travel for some short term stability.",conj,0,neu_vader
295,295,0.9999795002441682,2.0499755815195245e-05,0.0,0.386,0.614,Hail medication!,ROOT,0,pos_vader
296,296,0.9992143128174928,0.0007856871824890728,0.0,1.0,0.0,"With therapy and proper medication, I’ve been able to begin to put my life back on track, but it will take time.",conj,0,neu_vader
297,297,0.9971284138193826,0.0028715861806119713,0.0,0.679,0.321,"Today, as a student in a PhD program, I am feeling wonderful with therapy and medication.",conj,0,neu_vader
315,315,0.9998354090226677,0.00016459097733263132,0.0,0.8,0.2,"3 years later (2008) and now I'm married to a doctor (family medicine), I've got a good job (government contractor), and things are going well.",appos,0,neu_vader
320,320,0.9996034439678868,0.00039655603211866255,0.0,0.6829999999999999,0.317,"I have been off meds for a while, while trying to get pregnant, but have been doing pretty well.",advmod,0,neu_vader
358,358,0.9985687229099796,0.0014312770900300226,0.174,0.7709999999999999,0.055,My SO suffers from bipolarism (not sure if that is the correct terminology) and epilipsy We have been together for 2 years currently she is going through a meds adjustment and is suffering through many side affects.,compound,0,neu_vader
380,380,0.999874999319538,0.00012500068045859973,0.125,0.875,0.0,"So I had a surgery, couldn't fix my heart, but at least I wasn't passing out anymore, and with some(experimental) medication(with awful side-effects) I was able to at least get through each day.",punct,0,neu_vader
381,381,0.9792652771306602,0.02073472286933753,0.0,1.0,0.0,"I know a lot of people tend to think that the right diet, exercise and possibly medication will ""cure"" me.",conj,0,neu_vader
388,388,0.9999725284177982,2.747158219640707e-05,0.0,1.0,0.0,I did treatment and therapy and meds and all that stuff.,conj,0,neu_vader
395,395,0.9999673776607828,3.262233921317823e-05,0.16699999999999998,0.833,0.0,I suspect it's my meds but won't know until Monday.,attr,0,neu_vader
398,398,0.9915129694441058,0.008487030555885197,0.146,0.8540000000000001,0.0,"I reacted badly to Abilify, but let's not make this a meds thread*

So I've been going through a depressive episode around December and in the end of December my gf went abroad for some study exchange.",amod,0,neu_vader
403,403,0.9999848319267112,1.5168073270480682e-05,0.0,1.0,0.0,UP DATE: Got me meds!,ccomp,0,neu_vader
405,405,0.9999322397728768,6.776022711502972e-05,0.046,0.9540000000000001,0.0,"I keep telling the psychiatrist on campus that I don't feel well, but she's afraid to make major changes to my medicine because I usually end up breaking down during big medicine changes.",compound,0,neu_vader
423,423,0.9999752440939116,2.4755906076083506e-05,0.40399999999999997,0.596,0.0,"I am very, very bad at medication management.",compound,0,neu_vader
465,465,0.9999883986678544,1.1601332127007762e-05,0.0,1.0,0.0,What happens when and if I'm prescribed medication?,conj,0,neu_vader
486,486,0.9999387035876476,6.129641235300186e-05,0.231,0.769,0.0,I've been doing the medication trial and error since 2008.,compound,0,neu_vader
490,490,0.9968944343586952,0.003105565641319166,0.111,0.818,0.071,"It's also helps keep me away from drinking and so does the klonopin, that was my self medication for the anxiety, which really is only a short term fix, I really don't like drinking now.",attr,0,neu_vader
500,500,0.9992319390989176,0.0007680609010886955,0.129,0.871,0.0,"Rent, internet, cell phn, meds, they all get paid each month, but with regard to discretionary funds, including saving, I have a difficult time budgeting.",conj,0,neu_vader
503,503,0.9995667382482796,0.00043326175170591057,0.242,0.758,0.0,"Usually he gets depressed this time of year, he has changed doctors and medications and he went into an irritable manic state.",conj,0,neu_vader
504,504,0.999919623322608,8.037667737560547e-05,0.0,0.741,0.259,Therapy is THE best thing I could ever do for myself (and the meds).,conj,0,neu_vader
516,516,0.9999046633891135,9.533661089244351e-05,0.0,0.847,0.153,Hes taking Seroquel and some other medicine on top of that.,conj,0,neu_vader
519,519,0.9993878569052022,0.0006121430947906197,0.0,1.0,0.0,"So I ask, what do you do when you're having an episode that isn't a drug or medication to cope.",conj,0,neu_vader
536,536,0.9998245249628755,0.00017547503713053072,0.0,0.8320000000000001,0.168,"BUT, with my recent diagnosis and thus recent medication... it's much better than the last time I was here (also depressed).",conj,0,neu_vader
539,539,0.9995426924372935,0.00045730756269844747,0.326,0.674,0.0,"However, upon research I found many people find medication m much worse than the illness itself.",compound,0,neu_vader
542,542,0.9997103013324818,0.0002896986675250108,0.057999999999999996,0.89,0.052000000000000005,"I just needed to get this out there, that someone will understand how hard it is to keep yourself together, I work so hard every hour of every day to manage my condition with out medication, and at times like this I realize just how frail my system is.",conj,0,neu_vader
545,545,0.9970855925380172,0.0029144074620001373,0.15,0.85,0.0,I don't like the idea of taking a medication long-term that we don't completely understand.,amod,0,neu_vader
553,553,0.9999669964206068,3.300357940562821e-05,0.0,0.408,0.5920000000000001,Non-bipolar stimulating medicines.,ROOT,0,pos_vader
581,581,0.9982633676397156,0.0017366323602974365,0.0,1.0,0.0,"If that isn't the case, is it normal for not taking meds/less sleep to cause mania?",amod,0,neu_vader
586,586,0.9991942420088148,0.0008057579911667122,0.0,0.898,0.102,After a misdiagnosis by an asshole psychiatrist I was prescribed every SSRI in the book and some other mood meds like Risperidone and finally lithium.,conj,0,neu_vader
589,589,0.9991211697088109,0.0008788302911838195,0.0,0.8809999999999999,0.11900000000000001,"I don’t have all the bills in from of me right now but the hospital bills, medication, ambulances, everything else is easily close to $40,000.",conj,0,neu_vader
612,612,0.9976936806112428,0.002306319388774292,0.0,1.0,0.0,This is a question that's been going through my mind a lot as I've been working my way towards a diagnosis and the right meds.,conj,0,neu_vader
615,615,0.99994561860995,5.438139004652149e-05,0.314,0.541,0.146,He is definitely severely and persistently mentally ill and needs treatment and medication.,conj,0,neu_vader
643,643,0.9997333022619792,0.0002666977380356559,0.079,0.9209999999999999,0.0,"Have any of you self-observant bipolar cycling people been cycling regularly while unmedicated, then began meds and actually stopped cycling and became normal?",advmod,0,neu_vader
646,646,0.9963045097134416,0.003695490286542708,0.0,1.0,0.0,"However, my doc is also considering a bipolar diagnosis, since genetic testing shows that I'm susceptible to it (I have my own theory that there's something underlying several disorders that makes them seem so connected, but until mental health becomes a real medicine, I don't think we'll get answers on that any time soon).",attr,0,neu_vader
673,673,0.9984463693859824,0.0015536306140111556,0.127,0.682,0.191,I want a medication combination that works and makes me feel better instead of me freaking out multiple times a week.,compound,0,neu_vader
674,674,0.9999251381909277,7.486180906679488e-05,0.12,0.8109999999999999,0.069,"Last time this happened it was worse and I got it checked out, they said everything was fine and it was probably the medication.",attr,0,neu_vader
680,680,0.9998840733355736,0.00011592666441961096,0.413,0.551,0.036000000000000004,"Constant mood swings, suicidal thoughts, devastating depressing — plus the fact that I see and hear shit when I'm off meds

I just want my old psychiatrist back",advmod,0,neu_vader
683,683,0.9999516310633988,4.83689366173269e-05,0.0,1.0,0.0,It's been this way as long as I remember and it's probably medication related.,attr,0,neu_vader
694,694,0.9998791843969044,0.0001208156031025517,0.0,0.8370000000000001,0.163,"The few rehab programs I had as an option, that were free, required me to be off all medications.",attr,0,neu_vader
705,705,0.9993948843856706,0.000605115614308999,0.14,0.7759999999999999,0.084,"My psych recommended it to me in addition to my current medication regime (lamotrigine, with olanzapine as emergency mania suppressant) and since starting it I have been disgustingly well (6 months), so my anecdotal experience there may be something to it.",compound,0,neu_vader
706,706,0.9976069597632748,0.002393040236718428,0.0,0.74,0.26,"The lamotrigine has been my current medication for the past 5+ years, so it is interesting to see that I am feeling even better now that I am taking the N-acetylcysteine as well.",attr,0,neu_vader
709,709,0.9998800236584594,0.00011997634153282607,0.0,1.0,0.0,Is this a medication issue?,compound,0,neu_vader
725,725,0.9986649408304644,0.001335059169533068,0.064,0.71,0.226,I got the medication but from everything I read online it looks like this is a medication for BP1 and focuses on helping with mania which I have never had and I am skeptical of having had hypomania if I am being honest.,attr,0,neu_vader
727,727,0.9960588217323224,0.003941178267664508,0.0,0.821,0.179,I feel like every time I go to the doctor it is like picking a medication name out of a hat with regards to what I am going to get.,compound,0,neu_vader
732,732,0.9975315958396808,0.0024684041603380037,0.13,0.87,0.0,"Whether it's a medication, herbal supplement, or even something as simple as low amounts of caffeine.",attr,0,neu_vader
755,755,0.9968427274920402,0.0031572725079561576,0.0,0.743,0.257,"*posted this on psychforums but realized i liked reddit better

i went on a mental bender(ie year long mania, yay), left school for the hospital, and after a whole bunch of therapy and meds am ok now.",conj,0,neu_vader
759,759,0.9972998096163462,0.002700190383673536,0.095,0.7190000000000001,0.18600000000000003,"My dad says the therapy, medications, and hospital doesn't help so I should quit all of it and pray to god.",conj,0,neu_vader
763,763,0.9964688999261841,0.0035311000738002768,0.369,0.631,0.0,"In a nutshell
I have a long history of depression, self mutilation, binging, purging, alcoholism, drug use, medication use &amp; abuse for several mental illnesses.",compound,0,neu_vader
774,774,0.9991957759901984,0.0008042240098187725,0.11599999999999999,0.884,0.0,"Between insurance, medication, and therapy, (not to mention my student loan payments) my paycheck takes a BIG cut.",conj,0,neu_vader
779,779,0.9999607646894134,3.923531057970521e-05,0.34700000000000003,0.653,0.0,"I lost my insurance last summer, so I stopped treatment and my medications.",conj,0,neu_vader
781,781,0.9988291374516473,0.0011708625483369053,0.242,0.6729999999999999,0.084,"I probably should be, although every medication I have tried and the subsequent ""loading period"" has felt like a disaster and seemed to make things worse.",npadvmod,0,neu_vader
788,788,0.9972887451116568,0.00271125488833859,0.0,0.847,0.153,"I can try to understand it through the help of my doctors, my therapist, and my medication.",conj,0,neu_vader
795,795,0.998007520366508,0.0019924796335024433,0.0,1.0,0.0,"I don't think it's the meds, but I don't think I'm going into a mood swing or anything.",attr,0,neu_vader
803,803,0.9996820042142088,0.00031799578577703893,0.0,1.0,0.0,New meds: Lithium (450mg) and Lamictal (25mg 3x a week to build up slowly).,ROOT,0,neu_vader
804,804,0.9999680412906574,3.195870932266208e-05,0.0,1.0,0.0,"I had some medication changes, (took me off Lexapro, introduced Lamictal and Serequel).",compound,0,neu_vader
810,810,0.9998269522857004,0.00017304771428997595,0.127,0.768,0.105,"I have since gone back on meds (had an insurance problem, plus I'm sure you guys know how it is with the going on and off meds) and am starting to feel more stable, besides being heartbroken/depressed and crying A LOT.",conj,0,neu_vader
816,816,0.999713185788313,0.00028681421168746994,0.0,0.8859999999999999,0.114,Also I had to come clean to my parents for the first time about my diagnosis (Bipolar 1) and the medication I'm taking.,conj,0,neu_vader
840,840,0.9997347259394559,0.0002652740605611581,0.06,0.87,0.071,"This is impossible for me without paying out of pocket, because my medication expenses are only $180, and no doctor anywhere will charge $413 for a visit even if they accept SOC (which is rare).",compound,0,neu_vader
844,844,0.9999494589612749,5.0541038734012846e-05,0.0,0.8,0.2,I feel like I have had an endless list of diagnoses and medication.,conj,0,neu_vader
852,852,0.9993983342612696,0.0006016657387256043,0.077,0.877,0.045,"No money means I cant drive to town (I live on a rural property) to see my pdoc, who I can't pay, and be prescribed medication, which I really really need.",conj,0,neu_vader
858,858,0.9955896808232844,0.004410319176696735,0.215,0.6809999999999999,0.10400000000000001,He is a hell of a lot luckier than many people on here in that my folks will pay for his docs and meds.,conj,0,neu_vader
863,863,0.9997663284617944,0.00023367153820128185,0.0,1.0,0.0,"So I think I have found the right medicine combo of 200mg lamotrigine, 12.5 of sertraline, and 5mg focalin.",compound,0,neu_vader
865,865,0.994760283662904,0.0052397163370918615,0.066,0.934,0.0,"Then I start to wonder how valid the entire basis of mental illness is when I've tried every traditional medical treatment and various medication combinations and had only few month long periods of ""normal"" ever in the last nine years.",compound,0,neu_vader
879,879,0.9757140120737959,0.024285987926195258,0.115,0.73,0.154,I'll keep taking them every night before bed until I am clearly out of the woods - it's a lot easier being able to sleep through the worst of the medication's effects.,poss,0,neu_vader
886,886,0.9984968967485466,0.0015031032514509727,0.0,1.0,0.0,"I have another P-doc appointment next week AND am starting weekly therapy, plus the drug copays incurred with a medication change (dropped depakote, titrating up onto lamictal, upped abilify, unchanged cymbalta.)",compound,0,neu_vader
887,887,0.9990871756063072,0.0009128243936945511,0.271,0.7290000000000001,0.0,I am just out of a meds-induced mild depressive state.,npadvmod,0,neu_vader
891,891,0.9995919632787578,0.00040803672123346533,0.055,0.945,0.0,"I pay rent, cable/internet, most of our food costs, every time we go out for drinks.... plus my meds, food/treats/vet visits for my dog, gas for my car and motorcycle (luckily that one's cheap), my doctor's bills and bills for all the blood work I have to do all the damn time... but we get by.",conj,0,neu_vader
897,897,0.9996865407152604,0.00031345928475187766,0.22,0.745,0.035,"Well, since I had no money left because my job sent me on an 'illegal' unpaid medical leave and I needed the money to pay to see my pdocs and my meds, I had NO choice but to file for partial unemployment.",conj,0,neu_vader
902,902,0.9991742939953808,0.0008257060046038535,0.0,0.7290000000000001,0.271,"Not sure where else to post this, but I think here would be my best bet as I believe it to be a medication thing.",compound,0,neu_vader
904,904,0.9988340702999804,0.001165929700003028,0.293,0.7070000000000001,0.0,In the meantime I missed a few days due to medication issues and they fired me over attendance.,compound,0,neu_vader
912,912,0.9991251932072076,0.0008748067928107451,0.0,0.8220000000000001,0.17800000000000002,Someone once told me there was a bipolar medication that also helps with focus.,attr,0,neu_vader
913,913,0.9937467653272132,0.006253234672769821,0.0,1.0,0.0,My wife is currently in the middle of a 14 day hold in an inpatient behavioral medicine center.,compound,0,neu_vader
971,971,0.9999885618645936,1.1438135398669949e-05,0.0,1.0,0.0,Anybody else mix alcohol and medication on occasion?,conj,0,neu_vader
