,Unnamed: 0,neg_prob,pos_prob,neg_vader,neu_vader,pos_vader,sentence,dict,identifier,sentiment
10,10,0.9999376760147584,6.232398522613637e-05,0.073,0.809,0.11800000000000001,"Only meds that have worked for me so far have been Zoloft (really good except kills my motivation and interest), and remeron (great but I sleep all the time).",nsubj,1,neu_vader
13,13,0.9993245611800304,0.0006754388199621847,0.099,0.755,0.145,"My medications are affordable, I can see a doctor when I need to, I can be admitted to a public hospital and not be burdened with debt.",nsubj,1,neu_vader
16,16,0.9956781289419292,0.004321871058057993,0.079,0.9209999999999999,0.0,"After a year of therapy, my therapist has advised me to see this doctor to explore potential for medication to assist with suspected BPII.",nsubj,1,neu_vader
18,18,0.9998293125229424,0.00017068747704224605,0.0,1.0,0.0,"She said I will only see him once, I will not see him for CBT therapy or anything, simply for medication and to check in on how medication is progressing.",nsubj,1,neu_vader
19,19,0.9999669964206068,3.300357940562821e-05,0.0,1.0,0.0,My meds aren't working.,nsubj,1,neu_vader
20,20,0.9998434455307732,0.0001565544692354612,0.292,0.708,0.0,I'm depressed again and the meds aren't working yet.,nsubj,1,neu_vader
24,24,0.9842437573088209,0.015756242691197655,0.0,1.0,0.0,"I have seen a variety of doctors, all the medication I have tried has turned me into a zombie and I am unable to function.",nsubj,1,neu_vader
53,53,0.9999825815303242,1.7418469668928022e-05,0.0,1.0,0.0,I'm thinking if my meds don't kick in by late June I am done.,nsubj,1,neu_vader
58,58,0.999939184206028,6.0815793988666955e-05,0.17,0.83,0.0,"So, this is why I don't understand why the medication didn't help this.",nsubj,1,neu_vader
59,59,0.9992245635621512,0.0007754364378667817,0.0,0.67,0.33,"If I'm productive and happy and finally stable, the medication has to be working...",nsubj,1,neu_vader
67,67,0.9996800454744474,0.000319954525558164,0.06,0.94,0.0,-Don't want to ask Pyschiatrist... only meds are the answer for many mental health things --- acc to the industry.,nsubj,1,neu_vader
77,77,0.9999627160270708,3.72839729463155e-05,0.0,0.721,0.27899999999999997,"I mean, feel free to give me the usual Psychedelics/Don't go off meds lecture, but I'm not stupid.",nsubj,1,neu_vader
87,87,0.9997832859180278,0.00021671408199168922,0.336,0.664,0.0,Ugh I was out on the patio at a theater and these idiots were complaining about how horrible psych meds are.,nsubj,1,neu_vader
88,88,0.9998817809326209,0.00011821906739364065,0.105,0.895,0.0,Atarax makes me twice as anxious and the sleep meds just made me groggy and not fall asleep.,nsubj,1,neu_vader
99,99,0.99864426463822,0.0013557353617628413,0.075,0.7170000000000001,0.20800000000000002,I am nervous about getting a new dr and getting in before my meds run out and finding a house I will feel safe and good in.,nsubj,1,neu_vader
106,106,0.9989031874389458,0.001096812561048075,0.043,0.8390000000000001,0.11900000000000001,"I also have an issue with weight, and saw that most bipolar medications make you gain it, which makes me not want to take it even more...",nsubj,1,neu_vader
120,120,0.9999310639868396,6.893601314171102e-05,0.36200000000000004,0.502,0.136,"I mean, I know that this medication is making me forgetful and stupid, but I still felt like a dumbass.",nsubj,1,neu_vader
125,125,0.999891890914434,0.00010810908558561937,0.195,0.805,0.0,"The medication didn't work as intended, so we stopped that.",nsubj,1,neu_vader
129,129,0.9999827670924516,1.7232907555247435e-05,0.0,0.877,0.12300000000000001,I have to explain at least 3-4 times how meds are effecting me or certain situations etc...,nsubj,1,neu_vader
130,130,0.999990660306432,9.33969355380459e-06,0.0,0.772,0.228,My medication is cymbalta and seroquel but even on them I feel like I'm beginning mania again!!!!!,nsubj,1,neu_vader
141,141,0.9997539318917656,0.0002460681082229181,0.08800000000000001,0.723,0.18899999999999997,15 hours into withdrawal and just as strongly as the medicine felt the first dose I am feeling it missing my first dose.,nsubj,1,neu_vader
145,145,0.9999633241137228,3.667588626108987e-05,0.0,0.787,0.213,UPDATE: Upped my meds and things seem to be calming down.,nsubj,1,neu_vader
157,157,0.9999270062300398,7.299376996123615e-05,0.0,1.0,0.0,I was wondering how these meds are affecting others.,nsubj,1,neu_vader
158,158,0.9981804708462751,0.0018195291537381794,0.253,0.747,0.0,I am questioning the use of these meds and am looking for advice on what meds are working for others with bipolar I disorder and or including depression.,nsubj,1,neu_vader
159,159,0.9999669563812826,3.30436187222468e-05,0.0,1.0,0.0,So here is the question - what happened to people with bipolar before medicine existed?,nsubj,1,neu_vader
160,160,0.9995039912793808,0.0004960087206023368,0.098,0.691,0.21100000000000002,"What I'm really curious about is the possibility that people, before psychiatric medicine was commonplace, found ways of successfully managing bipolar disorder.",nsubj,1,neu_vader
161,161,0.9965189817186356,0.003481018281359853,0.079,0.8109999999999999,0.11,"In the U.S, psychatric medicine plays a very big role in dealing with mood disorders like bipolar and depression, but some studies often call into question the effectiveness.",nsubj,1,neu_vader
173,173,0.999989014546625,1.0985453395961496e-05,0.0,0.58,0.42,Are medications my only hope?,nsubj,1,neu_vader
203,203,0.9999760223910934,2.3977608893425197e-05,0.0,1.0,0.0,So adhd meds were late.,nsubj,1,neu_vader
211,211,0.996006095353644,0.003993904646343492,0.096,0.904,0.0,The last medication I was on a couple of years ago was Lamictal and Klonopin for anxiety as needed.,nsubj,1,neu_vader
214,214,0.9999631816472768,3.681835271943288e-05,0.28,0.72,0.0,"The problem is that although I think my medication is working, I'm not *completely* sure.",nsubj,1,neu_vader
216,216,0.9995180964239776,0.00048190357603680576,0.193,0.807,0.0,"* I *want* the medicine to work, badly, so I'm afraid of that clouding my judgement.",nsubj,1,neu_vader
240,240,0.9995961091864041,0.0004038908135805763,0.077,0.767,0.157,"Around 8 months ago, or so, I told my pdoc that while the meds were evening me up, I still had no energy or motivation to do anything.",nsubj,1,neu_vader
252,252,0.9999521727467036,4.7827253295874185e-05,0.0,0.755,0.245,I want my medication to work.,nsubj,1,neu_vader
270,270,0.9999369807339836,6.301926599823963e-05,0.0,1.0,0.0,Are the fucking meds not working??,nsubj,1,neu_vader
272,272,0.9999914954323434,8.504567667523807e-06,0.0,0.667,0.33299999999999996,"(no meds or food or sleep so I'm pretty unstable)  

Neighbor disrespectful like before.",nsubj,1,neu_vader
289,289,0.9999927613326232,7.238667365190636e-06,0.258,0.742,0.0,"The medication really fucked me up, my psychiatrist would not listen to my concerns, I finally stopped cold turkey back in January.",nsubj,1,neu_vader
290,290,0.9999241513557012,7.584864431195916e-05,0.158,0.8420000000000001,0.0,"The new medication has helped SO MUCH, but I feel more lost than ever on what my next step is.",nsubj,1,neu_vader
291,291,0.9999039481188418,9.605188116466072e-05,0.127,0.789,0.085,"Could it be possible the medication is making me feel this ""stuck in the middle"" feeling?",nsubj,1,neu_vader
303,303,0.9995180218938344,0.00048197810615228253,0.0,0.938,0.062,"I'm planning on seeing a doctor when I get some money after the new year, so I was just wondering what the first visit will be like, how long it'll take to determine my diagnosis, and when is medication an absolute necessity.",nsubj,1,neu_vader
307,307,0.9993445044168658,0.0006554955831496461,0.0,1.0,0.0,I know that self-medication with alcohol is harmful and may decrease the effectiveness of my medications.,nsubj_pobj,1,neu_vader
319,319,0.9968885814849568,0.0031114185150541147,0.10099999999999999,0.635,0.265,All of a sudden it feels like I'm slipping fast; almost like my meds stopped working.,nsubj,1,neu_vader
325,325,0.9998475008627584,0.00015249913723326667,0.0,1.0,0.0,I just feel that the meds and therapy now isn't working and I've tried so many.,nsubj,1,neu_vader
327,327,0.9999216557401698,7.834425983754854e-05,0.0,1.0,0.0,Can medications for treating bipolar II /cause/ the symptoms?,nsubj,1,neu_vader
333,333,0.9998595321935664,0.00014046780642660477,0.077,0.7340000000000001,0.188,"When I told my mom and my therapists that I didn’t feel like the meds were working, I was kind of brushed off, so I have some trust issues and feelings that medication won’t work for me or will do more harm than good.",nsubj_nsubj,1,neu_vader
343,343,0.9991899860270372,0.0008100139729568461,0.0,0.625,0.375,Were the medications prescribed based on your DNA analysis a good fit?,nsubj,1,neu_vader
345,345,0.9999759744224912,2.402557751870235e-05,0.0,1.0,0.0,Are there other that only dopamine based meds work?,nsubj,1,neu_vader
346,346,0.9999546476599612,4.5352340047126534e-05,0.0,1.0,0.0,So I notice that antipsychotic meds target dopamine receptors.,nsubj,1,neu_vader
368,368,0.9996169662126788,0.000383033787308805,0.0,0.8759999999999999,0.124,Its been a long road but I feel I'm ready to move on with my life and not have to have my medication dictate my life.,nsubj,1,neu_vader
378,378,0.9999587726836974,4.122731631635071e-05,0.0,0.40399999999999997,0.596,I really hope these meds help me.,nsubj,1,pos_vader
382,382,0.9951869254286251,0.004813074571371932,0.0,0.943,0.057,"As you can guess, I put on a ton of weight ever since then despite the low dosage of 100 mg twice a day (medication is more conservative in Japan compared to north america).",nsubj,1,neu_vader
384,384,0.9991471183869242,0.0008528816130758943,0.10099999999999999,0.899,0.0,28 meds and the only one to ever work normally was abilify and I stopped because of the Parkinson's.,nsubj,1,neu_vader
385,385,0.9999579576991532,4.204230083385329e-05,0.355,0.645,0.0,Let me know how meds fucked your life too.,nsubj,1,neu_vader
390,390,0.9999768531694468,2.3146830535618576e-05,0.128,0.7959999999999999,0.076,"I was aware that lamotrigine and oral contraceptives can have negative interactions, so I asked my pdoc and my gyno whether my current medications would be ok.",nsubj,1,neu_vader
392,392,0.999847758445762,0.00015224155422257558,0.25,0.75,0.0,"4) My meds are probably still working, but can't contend with the crazy baby hormones.",nsubj,1,neu_vader
414,414,0.9998597272784662,0.00014027272151355088,0.0,1.0,0.0,I realize that medication only does half the work - the rest being up to me.,nsubj,1,neu_vader
419,419,0.9999017244977566,9.8275502238053e-05,0.0,1.0,0.0,i told him i don't expect him to get therapy but he needs to get medication to stabilize.,nsubj,1,neu_vader
426,426,0.9940768937122412,0.005923106287777465,0.0,0.752,0.248,"As a side note, I'm pretty sure these meds (citalopram and lamictal) work just fine for me, because I was on them for about a year solid following my initial diagnoses of BPD II.",nsubj,1,neu_vader
437,437,0.9998770516870696,0.000122948312929695,0.0,1.0,0.0,"My meds aren't ""working"", I would be the same person without, they aren't for me, I'm not really BP.",nsubj,1,neu_vader
439,439,0.9804059145745688,0.01959408542541633,0.07200000000000001,0.792,0.136,"About a year ago, she stopped taking all of her medication, since she felt fine, although the medication is what was making her feel fine.",nsubj,1,neu_vader
449,449,0.9985517356937784,0.001448264306224928,0.047,0.846,0.107,"Throughout all of this happening, the medicine I am on which is Seroquel XR, I have had to up the dose to help keep myself 'sane', well I was doing it a lot, my doctor had me at such a low dose it wasn't doing anything....",nsubj,1,neu_vader
451,451,0.999822866043572,0.00017713395644371985,0.068,0.856,0.076,"I have to see the doc, and the soonest that would be is on the 20th... so I'm looking to be going 14 days w/o medicine..I got angry but not with the secretary on the phone and simply said please cancel all future appointments as I will just be going to the hospital even though I don't want to I feel it is my only option to ensure I stay 'level'... Just for a FYI, she had me on 25mg Seroquel XR once a day (that meant breaking a 50mg XR tablet in half) and I was taking 200mg to stay sane, I don't get why she put me on such a low dose as she had me on this med before but it was at 150mg.",nsubj,1,neu_vader
459,459,0.9984298284299968,0.0015701715700120855,0.0,0.7859999999999999,0.214,I am trying to think of things to tell her to convince her that the meds will be good for her.,nsubj,1,neu_vader
461,461,0.9617062914398729,0.03829370856014454,0.094,0.615,0.29100000000000004,But I'm at a loss at how to get Sandra to appreciate the seriousness of her own situation and to accept that the meds will help her lead a better life.,nsubj,1,neu_vader
466,466,0.9999294322216036,7.056777839196286e-05,0.0,1.0,0.0,What happens before the meds take effect?,nsubj,1,neu_vader
467,467,0.9999264591402725,7.354085972848231e-05,0.158,0.8420000000000001,0.0,"I 'm afraid I can't cope, and my meds are already proving to be insufficient from keeping me away from suicidal ideation, self-medication, and psychotic intrusive urges.",nsubj_conj,1,neu_vader
472,472,0.9999148328411619,8.516715884815072e-05,0.0,0.743,0.257,":D

My new meds work fantastically, and the therapy I got from my university wellness center really helped out on my coping mechanisms.",nsubj,1,neu_vader
474,474,0.9999836744996532,1.6325500360286912e-05,0.0,1.0,0.0,Thing is this medication was working for me.,nsubj,1,neu_vader
476,476,0.9998540884821346,0.0001459115178462564,0.0,0.8270000000000001,0.17300000000000001,"You shouldn't fall between the cracks so much now:) your meds won't cost you your rent, and hopefully there will be state funded free clinics for your shrinks and co soon too!",nsubj,1,neu_vader
480,480,0.9994253136035192,0.0005746863964937616,0.0,0.6940000000000001,0.306,I know the medication is helping a lot.,nsubj,1,neu_vader
481,481,0.9999893272646372,1.0672735378783194e-05,0.16699999999999998,0.833,0.0,"But, she also said that the medication I'm on is dangerous (referring to the rash, which I have not had) and she asked me if I even researched it (the answer being yes).",nsubj,1,neu_vader
484,484,0.9944210042596572,0.005578995740360309,0.0,0.8540000000000001,0.146,"I want her to know that the medication I'm taking is helpful, and somehow prove to her that it is not a ""last resort option,"" whatever that means.",nsubj,1,neu_vader
495,495,0.9999587331509824,4.1266849000453966e-05,0.0,1.0,0.0,The medication seems to be working.,nsubj,1,neu_vader
511,511,0.9984786171090148,0.0015213828909720448,0.155,0.845,0.0,my cousin has said multiple times to me that he believes mental illness is something that can be cured through sheer will power and that medication is a waste of time and money.,nsubj,1,neu_vader
514,514,0.9984310968902378,0.0015689031097775687,0.354,0.6459999999999999,0.0,"Mine's gotten to the point when I have an episode they are screaming at me ""Kill yourself"" ""You are a piece of shit and need to die"" And the meds aren't really helping...",nsubj,1,neu_vader
515,515,0.9999670462976477,3.295370235693277e-05,0.38,0.62,0.0,I am so bad that pain meds (Oxycodone) and Valium are doing NOTHING to me.,nsubj,1,neu_vader
522,522,0.9809556279765234,0.019044372023460543,0.078,0.87,0.053,I am doing better one my medicine but even with insurance my total meds reach 200+ a month and that doesn't include the costs of office visits which I am behind in paying or my other bills i struggle to pay each month or the fact most days I eat one meal and snack because it is all I can afford.,dobj_nsubj,1,neu_vader
528,528,0.9999903670839888,9.632916008288674e-06,0.0,1.0,0.0,I got my meds reduced because I brought up slight twitching to my psychiatrist.,nsubj,1,neu_vader
533,533,0.9997875882412968,0.00021241175868935716,0.0,0.68,0.32,For the most part the medication has been wonderful and I've felt better than I ever had.,nsubj,1,neu_vader
537,537,0.9977631993365136,0.0022368006634660687,0.08199999999999999,0.7829999999999999,0.135,It helps to know that even though I'm not in the best place right now... the things I've done and the meds I take have allowed me to be in a better place than I might have been.,nsubj,1,neu_vader
546,546,0.999980799012782,1.9200987230800658e-05,0.115,0.76,0.125,"I suppose, at what point is medication not worth any risks or side effects?",nsubj,1,neu_vader
548,548,0.9996253327848424,0.0003746672151621115,0.21899999999999997,0.581,0.2,But the effective medications trigger Bipolar states that are extremely dangerous.,nsubj,1,neu_vader
558,558,0.9999572128184104,4.278718159794264e-05,0.536,0.46399999999999997,0.0,Any tips for chilling the fuck out when meds fail?,nsubj,1,neg_vader
579,579,0.9999675588828651,3.2441117149732904e-05,0.0,0.878,0.122,"But if I didn't have ADHD, I feel like the ADHD meds wouldn't work on me how they're suppose to Y'know?",nsubj,1,neu_vader
580,580,0.9999835223858072,1.6477614177597315e-05,0.059000000000000004,0.792,0.149,"I guess what Im wondering in all this (and I'm sure at this point this post may not make lots of sense, my mind is literally going all over the place, I'm wanting to run around like mad, and I'm pretty sure my meds or at least Adderall has worn off) is if maybe my man friend is right and/or if I should be at all concerned and maybe talk to my psychiatrist Monday about this and reevaluating me and such....",nsubj,1,neu_vader
592,592,0.9985633334596892,0.001436666540300681,0.0,0.782,0.218,The medication made me pass out in a matter of 10 minutes and probably saved my life.,nsubj,1,neu_vader
635,635,0.9999679279168284,3.207208318470567e-05,0.15,0.68,0.17,I feel like my current medication isn't doing enough to stop these thoughts.,nsubj,1,neu_vader
644,644,0.9988881116375354,0.001111888362477603,0.071,0.878,0.051,"I'm currently not on meds, I never found ones that worked for me, the meds I did take would go down into my belly but they would not stop the bipolar swinging of my mind so I stopped taking them and just cycle regularly still.",nsubj,1,neu_vader
653,653,0.9990050982118168,0.0009949017881638953,0.0,1.0,0.0,"Around 11PM, the meds wore off and I could think a little bit clearer.",nsubj,1,neu_vader
667,667,0.8844956514719313,0.11550434852807402,0.0,0.951,0.049,"I am determined to make the CBT work, as it does seem that you get out of it what you put in and I really didn't try last time, but medication is a new one for me.",nsubj,1,neu_vader
678,678,0.9993729716096276,0.0006270283903842382,0.0,0.8640000000000001,0.136,My meds have kept me fairly stable for about a year and I would rather not switch.,nsubj,1,neu_vader
688,688,0.9998999780862432,0.00010002191376124489,0.0,0.735,0.265,All the other meds do fine.,nsubj,1,neu_vader
689,689,0.9996364740888604,0.00036352591114990814,0.0,1.0,0.0,"Beyond just a general ""my medication makes me stable.""",nsubj,1,neu_vader
695,695,0.999958205957674,4.179404230818245e-05,0.0,0.7390000000000001,0.261,I just got my meds right to where my head is clear enough for me to receive help.,nsubj,1,neu_vader
696,696,0.9999963868781006,3.6131219019697565e-06,0.349,0.557,0.094,Yes I have attempted suicide twice on meds but me off meds is even worse.,nsubj,1,neu_vader
703,703,0.9999869133762996,1.308662368742503e-05,0.0,1.0,0.0,Would medication be absolutely necessary for this situation?,nsubj,1,neu_vader
708,708,0.9999488612101602,5.113878984528234e-05,0.34,0.602,0.057,"Thankfully my meds control my impulsive behaviors, but I wonder if they should also be controlling these negative thoughts especially hen they involve suicide.",nsubj,1,neu_vader
721,721,0.9999727177276978,2.7282272282109197e-05,0.0,1.0,0.0,"If they can get her sleep meds worked out, she might be out as early as Monday.",nsubj,1,neu_vader
741,741,0.9999887784895009,1.1221510514642914e-05,0.0,1.0,0.0,"What medications, if any, were you on?",nsubj,1,neu_vader
746,746,0.9989633984837027,0.0010366015163137583,0.272,0.728,0.0,"Earlier in the summer, I felt as if the medication was making me worse, so I stopped taking it.",nsubj,1,neu_vader
748,748,0.9997798215278492,0.00022017847214706303,0.131,0.7759999999999999,0.092,"I've been off my medication for almost 3 months now and I still have many issues, but the problems my meds created have all vanished.",pobj_nsubj,1,neu_vader
750,750,0.9996524651186208,0.00034753488138076664,0.0,0.742,0.258,"My BD is not as severe as others, and I still believe medication can help, but in my case I feel that I'm better off without.",nsubj,1,neu_vader
764,764,0.9999657329085608,3.426709142130417e-05,0.0,0.647,0.353,Latest medication is helping so much I'm starting to feel freed.,nsubj,1,neu_vader
769,769,0.99997857226268,2.1427737311228493e-05,0.0,0.816,0.184,"I don't think it was just him giving up on me by saying ""well your meds aren't working so maybe you're just bipolar"".",nsubj,1,neu_vader
780,780,0.9994699305499424,0.0005300694500430617,0.0,0.667,0.33299999999999996,I also understand that certain medications are better than others for different types.,nsubj,1,neu_vader
785,785,0.9997297621692164,0.00027023783080102807,0.11599999999999999,0.884,0.0,"Other than that,  the medicine seems to work along with Vistaril for anxiety spikes.",nsubj,1,neu_vader
789,789,0.9997992242517632,0.00020077574825145495,0.0,1.0,0.0,My meds have really helped me get to a ground state.,nsubj,1,neu_vader
801,801,0.9997955251574878,0.0002044748425277269,0.0,1.0,0.0,Now that I am leveling out and the medicines are kicking in I finally went back through my journal.,nsubj,1,neu_vader
802,802,0.988485561152988,0.011514438847028574,0.0,0.9209999999999999,0.079,"You can take medicines that will make it easier to deal with life, but those medications take away pieces of your life too.",dobj_nsubj,1,neu_vader
815,815,0.9999512271543516,4.877284564943507e-05,0.0,0.775,0.225,*The good news is that my medication is starting to work.,nsubj,1,neu_vader
818,818,0.9988690491212048,0.0011309508788107272,0.135,0.865,0.0,My meds aren't the best but I'm a lot healthier on them then when I'm not.,nsubj,1,neu_vader
826,826,0.9998091788032526,0.0001908211967552883,0.221,0.779,0.0,"My pdoc adjusted my meds some (Lamictal 200 mg, Trileptal 1200 mg daily) because I haven't been able to shake the depression.",nsubj,1,neu_vader
832,832,0.9997560162806876,0.00024398371932965053,0.0,1.0,0.0,The medication started to dwindle in its magic.,nsubj,1,neu_vader
836,836,0.9999544982194236,4.550178056849457e-05,0.21899999999999997,0.7809999999999999,0.0,"He calls me from the counter, apparently my meds were cut from the program... with no warning.... three fucking weeks after I was told how reliable the program was.... one motherfucking week before Christmas!",nsubjpass,1,neu_vader
841,841,0.9998294960538698,0.00017050394612550082,0.321,0.513,0.165,Apparently having someone with a mental illness and NO medication is a good thing.,nsubj,1,neu_vader
845,845,0.998559160695076,0.0014408393049171971,0.0,1.0,0.0,"As far as meds go, I currently take 100 mg Zoloft a day.",nsubj,1,neu_vader
848,848,0.9999547900445808,4.52099554372575e-05,0.11199999999999999,0.8420000000000001,0.046,"I want to think that my meds are working and this is just how it is to feel normal, but I just have no idea.",nsubj,1,neu_vader
849,849,0.9998518042869772,0.00014819571301315226,0.0,1.0,0.0,"I know the meds are there to change your brain chemistry, but do you actually feel different?",nsubj,1,neu_vader
850,850,0.999988814050266,1.1185949730701198e-05,0.0,1.0,0.0,Is that really what meds are supposed to do?,nsubjpass,1,neu_vader
855,855,0.9998382798520258,0.000161720147970549,0.0,1.0,0.0,What other medication has helped you with the manic side ?,nsubj,1,neu_vader
857,857,0.9998778648400614,0.00012213515992704944,0.0,0.59,0.41,Bonus points if the medication does not aggravate hair loss... (I can dream can't I?),nsubj,1,neu_vader
867,867,0.9998202813329474,0.00017971866704329274,0.0,1.0,0.0,"I don't think Lamictal is necessarily causing this, maybe I'm just noticing it more because I'm waiting for the medication to start working.",nsubj,1,neu_vader
868,868,0.9999498718454998,5.012815451653688e-05,0.182,0.818,0.0,"I thought my meds were working, but I haven't had moods like this in years.",nsubj,1,neu_vader
874,874,0.9999730326490508,2.6967350940984987e-05,0.161,0.769,0.07,I need someone/something to distract me from this boredom - my meds have just been increased and I'm just waiting the few weeks for them to kick in.,nsubj,1,neu_vader
894,894,0.9999055606448578,9.443935512939438e-05,0.0,0.823,0.177,My meds have kept me in check but things just got out of hand last night and I went into an episode.,nsubj,1,neu_vader
907,907,0.9999618322163653,3.8167783635437094e-05,0.10800000000000001,0.892,0.0,"My medication's never been ""right"" and we just keep trying things, and now it's even harder since I lost my insurance.",nsubj,1,neu_vader
920,920,0.796315573672499,0.2036844263275017,0.0,0.968,0.032,"I'm almost certain his decision to unmedicate himself was related to his religious conversion a few years ago...I am a Christian myself, but he seems to belong to the type that believes all medication is from Satan(as far as I'm concerned, one of his delusions).",nsubj,1,neu_vader
928,928,0.999421463926168,0.0005785360738174301,0.19,0.706,0.10400000000000001,I used to suffer from an eating disorder and there are lingering thoughts I'm afraid that medicine that causes weight gain will push it over the edge.,nsubj,1,neu_vader
939,939,0.9997389278949208,0.0002610721050599577,0.0,0.87,0.13,"I thought I had a good hold on everything, I thought my meds were working, but apparently not.",nsubj,1,neu_vader
947,947,0.9999901654654694,9.834534525022204e-06,0.0,1.0,0.0,Does bipolar medication have long term effects?,nsubj,1,neu_vader
