,Unnamed: 0,neg_prob,pos_prob,neg_vader,neu_vader,pos_vader,sentence,dict,identifier,sentiment
1932,1932,0.9990835905965156,0.0009164094034647127,0.0,0.813,0.187,"I wonder what the medication is really doing to my brain, whether I really have the strength to endure a relapse after finally seeing what it's like to live without symptoms.",nsubj,1,neu_vader
1939,1939,0.9999669964206068,3.300357940562821e-05,0.0,1.0,0.0,The medications aren't working.,nsubj,1,neu_vader
1940,1940,0.9997894216786444,0.00021057832135998856,0.26,0.74,0.0,I don't know what else to do and I am so scared I am too petrified of what might happen if I call the health center and tell them the meds aren't helping.,nsubj,1,neu_vader
1959,1959,0.9999965294272509,3.470572746079778e-06,0.0,1.0,0.0,"When I see my psychiatrist on Monday, and she asks how my meds have been working out, all I can think about telling her is ""Fine.""",nsubj,1,neu_vader
1994,1994,0.9731103050287956,0.026889694971220457,0.0,0.9570000000000001,0.043,"Myself and some of my extended family (aunts, cousins) have been trying to convince my parents that they need to set some sort of ultimatum for him with the drinking - if his meds worked properly and without interference, it would be a whole different ball game.",nsubj,1,neu_vader
2015,2015,0.9946597989910874,0.005340201008919192,0.0,1.0,0.0,Then I took an antihistamine for a sinus issue that's going around and out of curiosity looked up how the medication works.,nsubj,1,neu_vader
2020,2020,0.9998014530701126,0.00019854692989243927,0.106,0.894,0.0,"My medication was all changed around by my Psychiatrist, and he told me so often to cut down on the drinking.",nsubjpass,1,neu_vader
2021,2021,0.9993595232881866,0.0006404767118255554,0.0,1.0,0.0,This led to my medication being hiked up in dosage on a regular basis.,nsubjpass,1,neu_vader
2024,2024,0.9998231598825776,0.00017684011743455638,0.235,0.765,0.0,"Along with that, since I stopped drinking and my medication was sorted out properly, I managed to lose 8 stone.",nsubjpass,1,neu_vader
2026,2026,0.9991120262407606,0.0008879737592541435,0.18,0.662,0.159,He has a reputation at multiple hospitals for being the best psychiatrist but what he's best at is lying and that's what I've concluded is necessary for patient compliance which is a big thing in psychiatry because the meds are shit.,nsubj,1,neu_vader
2034,2034,0.9996022819534062,0.0003977180465978014,0.0,0.84,0.16,"The meds I'm on have been a godsend and we probably need to up the dose, my next appt is May 5.",nsubj,1,neu_vader
2041,2041,0.999672504731637,0.0003274952683530757,0.0,0.878,0.122,"On top of all that, my meds keep me from really releasing any emotion.",nsubj,1,neu_vader
2059,2059,0.999304668205468,0.0006953317945297878,0.0,0.769,0.231,i believe the medication is playing a key role.,nsubj,1,neu_vader
2077,2077,0.999985053699716,1.4946300302574988e-05,0.0,1.0,0.0,What medications are you currently on?,nsubj,1,neu_vader
2079,2079,0.9999782868581406,2.1713141849497087e-05,0.14800000000000002,0.667,0.185,"...So since meds won't work for me, am I stuck like this?",nsubj,1,neu_vader
2084,2084,0.9998230243927854,0.00017697560722637097,0.0,0.8170000000000001,0.183,And the medication I wanted to try and would be most comfortable starting off with would be Lamictal.,nsubj,1,neu_vader
2092,2092,0.9999626678010014,3.733219898610013e-05,0.0,1.0,0.0,and all my other meds are working.,nsubj,1,neu_vader
2095,2095,0.9998689952752134,0.0001310047247716932,0.239,0.7609999999999999,0.0,For people who used to feel apathetic what medication made the apathy go away for you?,nsubj,1,neu_vader
2101,2101,0.9971971152496792,0.0028028847503016787,0.0,1.0,0.0,I can't wait for the meds to kick in and for me to find a proper therapist.,nsubj,1,neu_vader
2110,2110,0.9914134083188708,0.008586591681127655,0.0,0.789,0.21100000000000002,"He's been on medication now for three months, and his pdoc recently (a few days ago) said the meds seemed to be working pretty well and that he appeared fairly stable.",pobj_nsubj,1,neu_vader
2124,2124,0.999952433758696,4.756624130461828e-05,0.0,1.0,0.0,Will the medication 'fix' this?,nsubj,1,neu_vader
2125,2125,0.9983364533202984,0.0016635466797120244,0.0,0.946,0.054000000000000006,"Well I've been having hypermanic episodes the past couple of months and I'm in the middle of one right now, or so I'm told, and my meds aren't leveling out my moods and my mind is racing constantly.",nsubj,1,neu_vader
2139,2139,0.9998110399106525,0.00018896008935284647,0.154,0.6990000000000001,0.147,They said that after a while a certain medicine has no effect on them.,nsubj,1,neu_vader
2142,2142,0.9999481123333532,5.188766666416479e-05,0.127,0.613,0.259,My friend said the meds would dull her emotions and take away the ability to feel.,nsubj,1,neu_vader
2147,2147,0.999869998997274,0.00013000100274679563,0.0,0.733,0.267,"I get my meds free from the county MHMR program, which is good because I couldn't afford treatment at all otherwise.",nsubj,1,neu_vader
2148,2148,0.9999286270925968,7.13729074060613e-05,0.22699999999999998,0.5670000000000001,0.20600000000000002,I know that meds alone don't cut it.,nsubj,1,neu_vader
2151,2151,0.9999889655349432,1.103446506080092e-05,0.0,0.8390000000000001,0.161,"I feel like before meds my sex drive was overactive (I'm female, just for reference).",nsubj,1,neu_vader
2152,2152,0.9989156234852316,0.001084376514776968,0.061,0.8370000000000001,0.10300000000000001,"So the point is, while these meds haven't eliminated my sex drive in any way, they help to take off that aggressive edge sometimes.",nsubj,1,neu_vader
2169,2169,0.9988153998973356,0.0011846001026507515,0.0,0.8029999999999999,0.19699999999999998,I am pretty convinced i have some other co-existing illness^foot so my pdoc said keep a mood chart and talk to her after i let the meds kick in a bit.,nsubj,1,neu_vader
2174,2174,0.9998436846438676,0.0001563153561484272,0.128,0.872,0.0,"Her meds were stepped back up (Lamictal), but she had weekly issues with missing doses before and after the episode.",nsubjpass,1,neu_vader
2175,2175,0.99757161181853,0.002428388181483254,0.212,0.706,0.08199999999999999,"The messiness reaches unbearable levels at times (I have a bad habit of enabling and picking up after her), when her ADD meds wear off it’s literally like a kid in a candy store, hyper and uncontrolled with some violence.",nsubj,1,neu_vader
2181,2181,0.9997704310806792,0.00022956891930528262,0.0,0.7979999999999999,0.20199999999999999,But he has back up plans if the medicines are too strong for me.,nsubj,1,neu_vader
2190,2190,0.9999745127748408,2.548722514427302e-05,0.0,1.0,0.0,Tl;dr: current meds aren't working.,nsubj,1,neu_vader
2233,2233,0.999924269844754,7.573015523650236e-05,0.0,0.884,0.11599999999999999,My therapist says if I lived in place like this I could just get the meds shipped to me every few months.,nsubj,1,neu_vader
2236,2236,0.9998784027540962,0.00012159724589718042,0.0,1.0,0.0,Is it possible that my medication isn't doing the job?,nsubj,1,neu_vader
2258,2258,0.9955197700437703,0.004480229956211957,0.0,1.0,0.0,My meds are going from 60 total to over 100 for a bare minimum of the three I absolutely have to have.,nsubj,1,neu_vader
2263,2263,0.9991015613536028,0.0008984386463989402,0.071,0.71,0.21899999999999997,"I guess what I'm trying to say is, my life is awesome now, my medication works, I live somewhere (far, far away) in a place I love, I feel put together, and while bad days exist, they exist like they do for normal people.",nsubj,1,neu_vader
2264,2264,0.9998861766510728,0.00011382334891171728,0.159,0.841,0.0,But the medication is not helping me to not cycle anymore.,nsubj,1,neu_vader
2276,2276,0.9999555672378364,4.4432762172952176e-05,0.0,1.0,0.0,I know the difference from reality and what isn't real and medication works for me (I am medicated at this point).,nsubj,1,neu_vader
2289,2289,0.9998850267377384,0.00011497326227884485,0.0,1.0,0.0,"Bipolar medications have sleep side effects, sleep medications have mood side effects...",nsubj,1,neu_vader
2296,2296,0.999598293231786,0.00040170676820127114,0.0,0.725,0.275,"So the affection, the medication, the poly, everything has been created and taken away by this disease.",nsubjpass,1,neu_vader
2312,2312,0.9997769444368868,0.00022305556312363252,0.087,0.9129999999999999,0.0,I was recently re diagnosed with ADHD and am worried that the meds that I am prescribed (Ritalin and Ritalin La) may be destabilizing my mood.,nsubj,1,neu_vader
2320,2320,0.9997986509849957,0.00020134901500338932,0.0,1.0,0.0,This started about a week after my medication was changed.,nsubjpass,1,neu_vader
2322,2322,0.9997653847207452,0.00023461527925535083,0.0,0.8170000000000001,0.183,"And frankly the more I think about it, the more I'm sure I might be bipolar, and I'm not sure the medications I'm on now are working.",nsubj,1,neu_vader
2333,2333,0.9996839263276964,0.0003160736722858743,0.436,0.564,0.0,"But the medicines side effects are SO bad, and it’s very frustrating.",nsubj,1,neu_vader
2334,2334,0.9998675551721391,0.00013244482787959006,0.361,0.435,0.204,"Aside from my increased appetite, anxiety, fatigue, memory problems, forgetfulness, feeling like a “zombie”, the medicine is killing my sexual function.",nsubj,1,neu_vader
2360,2360,0.9995904745755289,0.0004095254244642802,0.057999999999999996,0.7929999999999999,0.149,"I've gotten used to them so they don't really bother me, but I do remember them all and it weirds me out that a medication could bring out something like this.",nsubj,1,neu_vader
2362,2362,0.9999302765836976,6.972341631412927e-05,0.313,0.607,0.08,My meds barely make me feel like there is a point in existing without them well it's bad suicidal thoughts all day every day.,nsubj,1,neu_vader
2370,2370,0.9999560469070418,4.395309294618725e-05,0.153,0.721,0.126,I went to my school's disability services so I could get help because my medication has shot my concentration to shit.,nsubj,1,neu_vader
2376,2376,0.997587774446542,0.0024122255534683354,0.0,0.85,0.15,"My meds are still very much under adjustment, but I feel totally fine most of the time.",nsubj,1,neu_vader
2402,2402,0.9989601560994956,0.0010398439004993217,0.0,0.805,0.195,"I need the meds to have a life, any pointers to restart the creative urge?",nsubj,1,neu_vader
2405,2405,0.9998883245364626,0.00011167546352160049,0.165,0.835,0.0,"I know that it's probably the meds doing their job but it still makes me wonder:

* Was there actually anything wrong with me?",nsubj,1,neu_vader
2411,2411,0.9995315697086744,0.000468430291313244,0.046,0.9540000000000001,0.0,"I dont want to diagnose myself before my official examination, but the bottom line is, the medicines havent been working, maybe a placebo effect, who knows.",nsubj,1,neu_vader
2412,2412,0.9999763105775664,2.368942241735518e-05,0.0,1.0,0.0,how different can things get once my meds will be changed if this is the case?,nsubjpass,1,neu_vader
2417,2417,0.99992693974016,7.306025985911976e-05,0.11199999999999999,0.888,0.0,"So the cold medication messed up my routine and I didn't remember my doset, just my birthcontrol and the cold stuff.",nsubj,1,neu_vader
2429,2429,0.9996192919591828,0.00038070804083387047,0.251,0.675,0.07400000000000001,"I barely leave the house, meds get forgotten, mania begins and things aren't well.",nsubjpass,1,neu_vader
2451,2451,0.9999866190738492,1.3380926148345947e-05,0.0,0.8320000000000001,0.168,"I'm going to speak to my doctor about this, but what are some other good medications to manage anxious/obsessive-compulsive/paranoid bipolar?",nsubj,1,neu_vader
2455,2455,0.999953902059224,4.609794078238321e-05,0.0,1.0,0.0,Could my bipolar meds be interfering with the painkillers?,nsubj,1,neu_vader
2460,2460,0.99998838124161,1.1618758401257249e-05,0.0,0.8640000000000001,0.136,"The only medicine she is currently on is adderall xr 30mg, and I honestly thing the doctor misdiagnosed her with A.d.d.",nsubj,1,neu_vader
2467,2467,0.9999486460128492,5.1353987144679103e-05,0.0,0.588,0.41200000000000003,The meds work well.,nsubj,1,neu_vader
2481,2481,0.9999965264276744,3.4735723444846482e-06,0.0,0.826,0.174,I have been to my psychiatrist meds were increased and added etc.,nsubjpass,1,neu_vader
2498,2498,0.9998665122188902,0.0001334877810922993,0.0,0.816,0.184,"In the meantime, my medication and therapy weren't doing much to help me.",nsubj,1,neu_vader
2508,2508,0.9999631536621952,3.684633781666172e-05,0.0,0.905,0.095,"tl;dr - My mom put ideas into my head that I can't get rid of, that meds don't work and mess you up.",nsubj,1,neu_vader
2516,2516,0.9999746959389352,2.530406108165474e-05,0.0,1.0,0.0,How does medication feel?,nsubj,1,neu_vader
2533,2533,0.9986558378209592,0.0013441621790322242,0.09699999999999999,0.665,0.23800000000000002,"Doesn't have to be all sunshine and rainbow stories, just want to (1) not feel so alone in being more scared about this than hopeful and positive and (2) reinforce to myself that medication can do a lot of good and I'm not going through this for nothing.",nsubj,1,neu_vader
2545,2545,0.996260473449212,0.0037395265507693906,0.0,0.8,0.2,"This is excellent, in my opinion, since she knows a lot of the ins and outs of what goes on in my head and what medications would be helpful.",nsubj,1,neu_vader
2559,2559,0.9999690423371111,3.095766289692365e-05,0.266,0.7340000000000001,0.0,"The point is, these medications did not really help me because I was mostly having depressive episodes.",nsubj,1,neu_vader
2564,2564,0.9999633053554272,3.669464458273873e-05,0.0,1.0,0.0,Currently her meds are set at 12.5mg Lamictal and 75mg Zoloft.,nsubj,1,neu_vader
2567,2567,0.9999431801352988,5.681986469772313e-05,0.0,1.0,0.0,Crazymeds.us is down so I can't readily find the answer.,nsubj,1,neu_vader
2579,2579,0.9995833746899212,0.00041662531008947607,0.0,0.78,0.22,"That ""did you take your meds today"" comment is thrown around a lot, as well as ""seems like your meds are finally working"" whenever there hasn't been a fight.",nsubj,1,neu_vader
2598,2598,0.9999360355371766,6.396446283553288e-05,0.0,1.0,0.0,"The meds he listed for me to check out were: Depakote ER, Tegretol, Lithium, Zyprexa, Seroquel, Risperdal, Abilify, Geodon, and Saphris.",nsubj,1,neu_vader
2618,2618,0.9999457918080464,5.420819194528811e-05,0.0,1.0,0.0,My meds recently decreased in level.,nsubj,1,neu_vader
2625,2625,0.9996319202412892,0.000368079758707709,0.0,0.745,0.255,"We discussed it, and agreed that some extra medication would likely help the issues I'm having.",nsubj,1,neu_vader
2634,2634,0.9995960191039874,0.00040398089602885383,0.0,0.8320000000000001,0.168,"Basically, I'm together to the point that I don't need constant watch, my meds are in transition but under control yadda yadda, but I get overwhelmed incredibly easily.",nsubj,1,neu_vader
2661,2661,0.9997898445515864,0.00021015544841258453,0.0,0.8540000000000001,0.146,Along with a proper diet and a good exercise regimen (this last part is where holistic medicine gets it right).,nsubj,1,neu_vader
2662,2662,0.999982913438232,1.70865617866781e-05,0.187,0.6509999999999999,0.162,"If you ""think"" you have ""bipolar"" because you have occasional mood swings and sometimes feel depressed or excited, but not ridiculously, overpoweringly excited for 5 days straight followed by horribly depressed for weeks or months, then maybe homeopathic medicine along with diet and exercise is for you.",nsubj,1,neu_vader
2673,2673,0.9998914572119014,0.00010854278811114007,0.192,0.8079999999999999,0.0,With the meds those obsessive thoughts would nearly evaporate.,nsubj,1,neu_vader
2674,2674,0.9998324891553088,0.00016751084468226768,0.0,0.899,0.10099999999999999,I know the right meds can take time to find but when I go to her and tell her whatever I am on isnt really working I always feel like she doesnt believe me.,nsubj,1,neu_vader
2681,2681,0.994131578478694,0.005868421521292943,0.147,0.853,0.0,"About two weeks ago, I got sick with a viral form of meningitis, and was hospitalized for a week, during which time I had difficulty keeping any food, and thus, any medication that was not delivered via IV, down.",nsubj,1,neu_vader
2682,2682,0.9997828788458268,0.00021712115416104642,0.0,1.0,0.0,"If the meds are exacerbating the D/O, I shouldn't take them.",nsubj,1,neu_vader
2688,2688,0.9996375483599024,0.0003624516401021248,0.0,1.0,0.0,"However, I could feel that the medicine makes me sort of... hazy.",nsubj,1,neu_vader
2689,2689,0.9997228704261416,0.0002771295738433981,0.0,1.0,0.0,At first I thought the medication didn't work sometimes.,nsubj,1,neu_vader
2690,2690,0.9999665975584232,3.3402441567181125e-05,0.157,0.672,0.172,And the truth is that I think the medicine makes me forgetful.,nsubj,1,neu_vader
2693,2693,0.9987223358540992,0.001277664145899859,0.094,0.9059999999999999,0.0,"http://www.reddit.com/r/bipolar/comments/2g73ik/its_all_falling_apart_again_a_rant/

TL;DR version is that I have an extremely erratic and unpredictable type of bipolar that makes medication difficult, and so far impossible, to get right.",nsubj,1,neu_vader
2712,2712,0.9983510932215768,0.0016489067784303936,0.057999999999999996,0.759,0.183,"Seems the meds were doing something, they no longer work, and ive gained a lot of weight, but my brain feels like it's ""awakening"" again.",nsubj,1,neu_vader
2713,2713,0.9996022913779266,0.0003977086220551712,0.0,1.0,0.0,"The meds really made my mind blank, but maybe too much, to a point where I couldn't tell.",nsubj,1,neu_vader
2714,2714,0.9991452863511712,0.0008547136488194168,0.111,0.889,0.0,"Very weird, but things are returning to ""normal"" as the meds wear off.",nsubj,1,neu_vader
2717,2717,0.9999275694273492,7.243057266266299e-05,0.0,0.8270000000000001,0.17300000000000001,"https://www.studyingbipolar.com/index.aspx

Not sure what proof to post as the medicine is injected...",nsubjpass,1,neu_vader
2720,2720,0.9999305679542232,6.943204579274717e-05,0.0,1.0,0.0,I see my pdoc next week to discuss how the new medicine is working out in my regime.,nsubj,1,neu_vader
2721,2721,0.9999498692288624,5.01307711175321e-05,0.0,0.915,0.085,I just would like to know if perhaps this recent upswing might have something to do with my new medication finally kicking in and the side effects wearing off?,nsubj,1,neu_vader
2727,2727,0.9999789059023066,2.1094097675322286e-05,0.094,0.9059999999999999,0.0,So what happens if I become unstable again and need the have my meds adjusted and have the changes monitored sooner than two months from then?,nsubj,1,neu_vader
2728,2728,0.9997367603549482,0.0002632396450604192,0.0,0.8190000000000001,0.18100000000000002,"I feel like the only choice I'd have would be to hospitalize myself if I needed help, rather than having a pdoc I can call and actually depend on to make sure my meds are always working the way they should...",nsubj,1,neu_vader
2734,2734,0.9997467560157196,0.00025324398428442567,0.08800000000000001,0.8440000000000001,0.068,Problem is I need to be at bed at a certain time for my meds to kick in and also wake me up at 6am (barely getting up in time).,nsubj,1,neu_vader
2753,2753,0.9999556444936528,4.4355506353583315e-05,0.0,0.8809999999999999,0.11900000000000001,All I can do now is try to calmly sit here and wait for the medicine to kick in.,nsubj,1,neu_vader
2759,2759,0.9997896035958598,0.00021039640415759008,0.185,0.73,0.086,My family knows because he has warned me that his meds will invariably will stop working or there is a chance.,nsubj,1,neu_vader
2765,2765,0.9999612897747489,3.8710225267236905e-05,0.545,0.397,0.057999999999999996,"My meds are working, no more excessive or inappropriate emotional responses, no rumination, no hypomania, no severe depression.",nsubj,1,neg_vader
2771,2771,0.9998430426620318,0.00015695733795791732,0.0,0.675,0.325,Can anyone assure me that this is a good thing to do and that meds and/or therapy will improve my life?,nsubj,1,neu_vader
2791,2791,0.9841122353112866,0.015887764688702125,0.059000000000000004,0.941,0.0,"I am Bipolar ii and my meds are currently:

Daily...
lithium (900mg)
valproate (600mg)
thyroxine (one tablet unsure of mg)
lamotrigine (1/2 tablet unsure of mg)

I think the valproate has pushed my weight up rather than the others, in 6 months i have gone from what was once a steady 77kgs to now 83kgs which for me is too heavy as i am only 5""9 and not a big build at all.",nsubj,1,neu_vader
2793,2793,0.9999672517679352,3.2748232084697786e-05,0.0,0.7829999999999999,0.217,"The only medication I take now is lithium, because it's natural.",nsubj,1,neu_vader
2799,2799,0.996415974399648,0.003584025600341791,0.0,0.8320000000000001,0.168,She always says that the best thing that ever happened for them was that her husband was hospitalized and they found the right medication for him to be on so their life could settle down and they could be happy together.,nsubj,1,neu_vader
2812,2812,0.9998284958425367,0.00017150415745886474,0.0,0.75,0.25,"My meds aren't working so well anymore, and I know I need to just accept the disease and go on.",nsubj,1,neu_vader
2818,2818,0.9998603936384598,0.00013960636152937384,0.141,0.657,0.20199999999999999,I'm feeling like my meds need adjusting as my moods are really unstable at the moment.,nsubj,1,neu_vader
2825,2825,0.9998751794834866,0.0001248205165114951,0.109,0.8909999999999999,0.0,I'm guessing my medication will be changed by my pdoc this Monday considering any higher dosage of Seroquel makes me completely numb emotionally.,nsubjpass,1,neu_vader
2831,2831,0.9998850810814648,0.00011491891854464493,0.203,0.687,0.11,"Would I be prone to being easily pushed into the DEPRESSION ZONE, while this medication is being taken?",nsubjpass,1,neu_vader
2851,2851,0.999956142651566,4.3857348452690825e-05,0.0,1.0,0.0,My meds aren't working as perhaps they should.,nsubj,1,neu_vader
2854,2854,0.9999191098151576,8.089018482899036e-05,0.0,0.738,0.262,"I know self medication is frowned upon, but I just find it interesting.",nsubjpass,1,neu_vader
2856,2856,0.9999365561391922,6.344386079877958e-05,0.05,0.69,0.26,"Since posting, less than two months ago, asking for reasons not to commit suicide, my medicine has kicked in, my friends have held me up, and I've made new friends.",nsubj,1,neu_vader
2858,2858,0.9999768101462854,2.318985369950149e-05,0.43200000000000005,0.568,0.0,Goddammit these meds are making me numb and foggy but I still know that deep sadness and guilt and suicidal thinking is still there.,nsubj,1,neu_vader
2861,2861,0.99882161045595,0.001178389544052687,0.0,0.787,0.213,What has medication has been successful for you with the less amount of side effects?,nsubj,1,neu_vader
2862,2862,0.9999283396210716,7.166037892980225e-05,0.10400000000000001,0.8959999999999999,0.0,"Long story short, I was diagnosed with BPDII (w/mixed episodes and rapid cycling) about 4 mos ago and meds still aren't right (lots of bad reactions or just didn't do anything for me).",nsubj,1,neu_vader
2863,2863,0.99998198237938,1.8017620625035603e-05,0.0,0.887,0.113,What I'd really like to hear from you guys out there is how long did it take you to get your meds right?,nsubj,1,neu_vader
2864,2864,0.9995873833429244,0.00041261665706206587,0.0,1.0,0.0,I've recently been diagnosed and came to a place where I feel that my meds are working correctly.,nsubj,1,neu_vader
2867,2867,0.9999160358180292,8.396418196998816e-05,0.0,0.862,0.138,Nothing is helping but the medication itself has helped my bipolar.,nsubj,1,neu_vader
2884,2884,0.9999492115068104,5.0788493206103476e-05,0.196,0.804,0.0,When the meds stabilize me and I'm no longer suicidal).,nsubj,1,neu_vader
2885,2885,0.9999068817251012,9.311827489910588e-05,0.0,1.0,0.0,Over the last few months my meds have been regulated but something still didn't seem right.,nsubjpass,1,neu_vader
2886,2886,0.9999686366315792,3.1363368409865695e-05,0.0,1.0,0.0,"Additionally, my meds (seroquel, lithium, depacoat) apparently make my period irregular, so far that I recently went 5 months between cycles.",nsubj,1,neu_vader
2891,2891,0.9997638125769266,0.00023618742309259086,0.0,0.718,0.282,"More often these days, I think I'm fine, and that the medication is just working; I'm happy.",nsubj,1,neu_vader
2896,2896,0.9994646692028551,0.0005353307971645943,0.0,0.45,0.55,"I feel like this medication is helping a great deal, its just not helping enough.",nsubj,1,pos_vader
2905,2905,0.9999457886405864,5.421135941470682e-05,0.0,1.0,0.0,My complicated health makes almost all medication impossible.,nsubj,1,neu_vader
2908,2908,0.99991551736094,8.448263904236023e-05,0.063,0.8540000000000001,0.083,"If I see my psych he'll just say to take them, I'm thinking more why shouldn't I manage my own meds and take something I can take when I need to and not when I don't, why doesn't that exist?, if it's because they're worried about addictive behaviour how is that different from taking something long-term anyway, surely that could be a good thing when meds are SO hard to stick to taking?",nsubj,1,neu_vader
2911,2911,0.9960959008517386,0.0039040991482721006,0.068,0.85,0.08199999999999999,"yes, I get it that that would be because the meds had built up to a therapeutic level but I'm still 'on' something that day that I don't want to be, it's still affecting how I am and how I act and think, I'm saying I don't want that, I'm not ill every day so I don't want to med every day.",nsubj,1,neu_vader
2913,2913,0.999800471342884,0.00019952865712884825,0.0,1.0,0.0,"I thought my meds were working, but they weren't (fuck all of you who tried to tell me that because you were right, anyway).",nsubj,1,neu_vader
2914,2914,0.9999652670656234,3.4732934369053394e-05,0.545,0.455,0.0,My meds are shit.,nsubj,1,neg_vader
2921,2921,0.9998273971244896,0.00017260287552266207,0.0,1.0,0.0,All the other meds I've taken make everything fuzzy.,nsubj,1,neu_vader
