,Unnamed: 0,neg_prob,pos_prob,neg_vader,neu_vader,pos_vader,sentence,dict,identifier,sentiment
2063,2063,0.9996896056931841,0.00031039430680862,0.243,0.667,0.09,I suffer from bipolar disorder (diagnosed) and have been curious to see what type of medication treatments others have been on.,compound,0,neu_vader
2070,2070,0.9977322445224558,0.002267755477540178,0.0,0.8740000000000001,0.126,I know there are meds that will help me get out of  this funk and back to a more stable state but I'm afraid of going back on antidepressants.,attr,0,neu_vader
2078,2078,0.9999520275627666,4.797243723386152e-05,0.0,0.588,0.41200000000000003,"Well, I was prescribed medication.",ROOT,0,neu_vader
2086,2086,0.9960382060787064,0.0039617939212930435,0.142,0.858,0.0,"I also didn't sleep well on it, so that didn't become a regular medication.",attr,0,neu_vader
2087,2087,0.99987594531567,0.0001240546843112987,0.139,0.602,0.259,"I'd love to hear about any stories, mechanisms, rituals, supplements, or even meds that help you all through anger.",conj,0,neu_vader
2111,2111,0.999529672774683,0.0004703272253294459,0.0,0.7070000000000001,0.293,"Bipolar ll in remission (no meds and healthy over 3 years) 

I've recently started smoking thinking it would be a nice relaxing way to chill out.",appos,0,neu_vader
2115,2115,0.99816823873388,0.0018317612661284878,0.063,0.8859999999999999,0.052000000000000005,I reached out to the office of students with disabilities and got someone to take notes for me due to my hands shaking from medication side effects.,compound,0,neu_vader
2122,2122,0.9998336393617074,0.00016636063827759752,0.0,1.0,0.0,Following jail and court ordered medication (lithium) I have gotten control of my life enough to move forward again.,nmod,0,neu_vader
2160,2160,0.9998538986313434,0.00014610136866142646,0.0,1.0,0.0,"This was the first time I realized I may be manic, my weekend doctor observed this in me but didn't know if I was bipolar or it was the meds.",attr,0,neu_vader
2173,2173,0.9982544112526848,0.0017455887473284163,0.0,1.0,0.0,Six months into the relationship she experiences her first mixed episode (several months after a medication step-down) and rips me new ones emotionally and socially.,nmod,0,neu_vader
2183,2183,0.9995157790352128,0.0004842209647700023,0.276,0.7240000000000001,0.0,"- suicide prevention
- when is the right/wrong time to ""talk about it""
- changing medication
- coercion into therapy (again)
- communicating through mania

- dealing with my own frustration
- when not to just ""let it slide""
- dealing with him blaming me
- dealing with my guilt about doing the wrong thing sometimes",compound,0,neu_vader
2191,2191,0.9999628181842874,3.718181569306078e-05,0.231,0.769,0.0,"do you think age, time off drugs(~3 years), drug/alcohol/nicotine abuse, will influence current medication needs?",compound,0,neu_vader
2200,2200,0.9999423422251345,5.7657774846748315e-05,0.0,1.0,0.0,Is there any kind of alternative treatments besides therapy and medication?,conj,0,neu_vader
2216,2216,0.9999334908973232,6.650910267408131e-05,0.0,1.0,0.0,"Even if I could find one, I don't have the money for the appointment or meds.",conj,0,neu_vader
2220,2220,0.9999859137783952,1.408622159058202e-05,0.0,0.815,0.185,"My meds : depakine 500, abilify 5mg, paroxetine 20 

Anyone feels like this ?",ROOT,0,neu_vader
2222,2222,0.9999414144731908,5.8585526823824876e-05,0.0,0.892,0.10800000000000001,"And this morning, while I was still calm, before I had coffee or my morning meds, I realized I had not showered in 4 days.",conj,0,neu_vader
2225,2225,0.9904118966555392,0.009588103344474123,0.083,0.8059999999999999,0.11," I have been taking lithium for one year, and although it is the only medication that has had *any* effect in controlling my disease, it has also been the source of great suffering.",attr,0,neu_vader
2238,2238,0.9998258075791868,0.00017419242083211478,0.193,0.807,0.0,"It seems the right medication, not Jesus, will save me from myself.",oprd,0,neu_vader
2246,2246,0.9996652713690738,0.00033472863094522284,0.21600000000000003,0.784,0.0,"For bipolar disorder it seems as though everything can effect it, exercise, sleep, nutrition, relationships, stress and what doctors give us, medication.",conj,0,neu_vader
2247,2247,0.9983319209237782,0.0016680790762050098,0.084,0.9159999999999999,0.0,"No meds on a regular, scheduled basis, except the following as a PRN: clonazepam (Klonopin), Trazadone, or Seroquel 25mg when I need it (on nights I haven't been drinking).",ROOT,0,neu_vader
2267,2267,0.9998994191782888,0.00010058082170730844,0.256,0.62,0.124,"without therapy and meds, are we just the unlucky chosen to struggle and pretty much be left for dead?",conj,0,neu_vader
2282,2282,0.999947884262487,5.211573752080087e-05,0.0,1.0,0.0,Anyone have any insight as to how I could expedite the medication process?,compound,0,neu_vader
2287,2287,0.9979649072138262,0.002035092786182915,0.195,0.805,0.0,"At what point do I need to put into writing exactly what problems I'm having, and explain to a fucking psychiatric clinic what Bipolar disorder is, and how it and my medications have directly affected my sleep to the point of missing doctor's appointments and being late to work, or missing nights of sleep?",conj,0,neu_vader
2300,2300,0.9999669964206068,3.300357940562821e-05,0.0,1.0,0.0,Bye bye medication.,ROOT,0,neu_vader
2301,2301,0.999960916772139,3.90832278745815e-05,0.127,0.68,0.193,"I'm terrified of accepting this huge part of me that is just like my mother (ironic because she never stays on her damn meds and I'm currently off-meds, making me more like her than if I would just man up about this, huh?).",acomp,0,neu_vader
2302,2302,0.9998775109553162,0.0001224890446779099,0.0,0.8759999999999999,0.124,"Life is heavy right now as things begin to go into winter where I'm at, as well as my financial concerns, medication concerns, romantic concerns, and education concerns that have been building up over some time.",compound,0,neu_vader
2307,2307,0.995526086632105,0.0044739133679004,0.0,1.0,0.0,"I went from INTJ, after a few years of therapy and medication.",conj,0,neu_vader
2313,2313,0.9999950895833929,4.910416598037911e-06,0.0,0.902,0.098,I want to know if this is just because I am bipolar or my medication?,conj,0,neu_vader
2314,2314,0.9992484402134868,0.0007515597865019268,0.0,1.0,0.0,"Within the past year or so, I began to eat at least one to two meals a day again, and then more recently have been working on my medication balance.",compound,0,neu_vader
2318,2318,0.9894730950485136,0.010526904951469672,0.121,0.879,0.0,"I tried out six different therapists and four different medications, including varying doses of Lexapro and Prozac (which gave me a tic that presents during panic attacks).",conj,0,neu_vader
2357,2357,0.9998991147447968,0.0001008852551940702,0.0,1.0,0.0,"Maybe it isn't the meds, maybe it's hypomania?",attr,0,neu_vader
2361,2361,0.9999658867871628,3.41132128181356e-05,0.0,1.0,0.0,I'm 20 years old bipolar take 3 diff meds etc.,compound,0,neu_vader
2365,2365,0.9994439210950326,0.0005560789049693905,0.091,0.475,0.435,"Maybe five solid months of feeling pretty good, little if any genuine medications and most certainly no medicinal routine.",appos,0,neu_vader
2375,2375,0.9961539671746916,0.003846032825308453,0.0,1.0,0.0,"I've been on a consistent medication regimen for the last 1-2 years, on and off meds for the last 8 years.",compound_npadvmod,0,neu_vader
2377,2377,0.9999723813727338,2.761862728421177e-05,0.096,0.904,0.0,My girlfriend talked me off my meds because she thinks that it affected my sex drive.,dep,0,neu_vader
2380,2380,0.999761138682711,0.00023886131729974693,0.27,0.73,0.0,"I guess it's just confusing, because I am not sure what to say to a meds person to take me seriously.",amod,0,neu_vader
2410,2410,0.9999422294265226,5.777057348157949e-05,0.276,0.7240000000000001,0.0,"Back STory:

I have been one various medicines and dosages for severe depression and anxiety for 7-8 years now, effexor, paxil, ciprolex and now pristiq.",attr,0,neu_vader
2418,2418,0.9964085706309518,0.003591429369052271,0.35100000000000003,0.649,0.0,My medication journey began in 2010/2011 with a diagnosis of anxiety and depression.,compound,0,neu_vader
2426,2426,0.999942691724004,5.7308275978371985e-05,0.0,1.0,0.0,Several months and numerous medications have seemed to only inflame the situation...,conj,0,neu_vader
2433,2433,0.9995514098234746,0.0004485901765053874,0.34600000000000003,0.654,0.0,I hate the medication dance that comes with it.,compound,0,neu_vader
2446,2446,0.9999745102986785,2.5489701334678456e-05,0.0,0.885,0.115,"I've got BP 2 rapid/ultra-rapid cycling, lithium's the only medication so far to not give me awful side effects... until now.",attr,0,neu_vader
2472,2472,0.9989004147942182,0.0010995852057817204,0.0,1.0,0.0,"Hey,
I was diagnosed with BPII about a year ago and underwent several treatments (mostly medication) until I was rediagnosed with rapid cycling.",appos,0,neu_vader
2479,2479,0.9999464595967108,5.3540403301832643e-05,0.0,1.0,0.0,I cannot afford more doctors and medication.,conj,0,neu_vader
2483,2483,0.9958671090010304,0.004132890998979723,0.0,0.805,0.195,"Seroquel has by far, with Lithium a close second, the most effective medication I have ever taken.",appos,0,neu_vader
2486,2486,0.9992002117442476,0.000799788255752374,0.10400000000000001,0.741,0.156,She agreed to pay for the appointment and medication out of pocket.,conj,0,neu_vader
2492,2492,0.9999497507173922,5.024928259986305e-05,0.535,0.465,0.0,It's always hell switchin meds.,attr,0,neg_vader
2505,2505,0.9999786278207556,2.137217924547884e-05,0.0,1.0,0.0,"and he said ""I don't have an answer for you"" and prescribed bipolar meds.",conj,0,neu_vader
2521,2521,0.9999320760349368,6.792396507208628e-05,0.109,0.8909999999999999,0.0,"Hey, I am having problems in deciding what emotion is real, what is bipolar, what is medication induced, and what is caused by booze.",npadvmod,0,neu_vader
2522,2522,0.9999424688891071,5.753111090571106e-05,0.0,1.0,0.0,"They halted all treatment, medications, contacts.",conj,0,neu_vader
2524,2524,0.9819877019385528,0.01801229806145177,0.034,0.84,0.126,".. she's (w/ her Dr.) adjusting her meds a little this week, and is in the pms phase of things also ... she's come slightly off the rails, and is ready to send an email to quit her job over what is possibly a trivial issue... how can i best say ""honey you are PMSing and in a med adjustment please wait 48 hours before making serious life choices""?",ccomp,0,neu_vader
2534,2534,0.9984282663076832,0.0015717336923352745,0.038,0.9279999999999999,0.034,"I've gone to my psychiatrist about it and he just said ""There really aren't any anxiety medications"" and that he wouldn't prescribe Xanax to a teenager when my mother suggested it (although that was when I was 17 and I am 18 right now, I'm not sure if he'd consider that any different).",attr,0,neu_vader
2540,2540,0.9997355600218292,0.00026443997818819184,0.0,0.721,0.27899999999999997,I returned to therapy and meds last month and it seems like I'm feeling fine for several days now.,conj,0,neu_vader
2552,2552,0.9991167344602044,0.0008832655397831614,0.16699999999999998,0.7070000000000001,0.126,Then probably a month later I was off my medicines for like 5 days because I was sick of them.,attr,0,neu_vader
2557,2557,0.9999679757595568,3.202424045769395e-05,0.0,0.741,0.259,Certain meds that go with Bipolar NOS?,ROOT,0,neu_vader
2563,2563,0.999974163902378,2.5836097632097727e-05,0.0,0.8009999999999999,0.19899999999999998,"I haven't encountered any bad side effects yet, so this might be the medication for me !!!",attr,0,neu_vader
2565,2565,0.9999257530028844,7.424699711876366e-05,0.0,1.0,0.0,She's extremely medication-sensitive--especially when drowsiness or nausea are listed side effects.,npadvmod,0,neu_vader
2570,2570,0.999946574052596,5.34259474096697e-05,0.10800000000000001,0.8009999999999999,0.091,"I'm trying my best to stay on track (meds, psychiatrist, psychologist) but my parents say I'm crazy and don't try to fix it at all.",dep,0,neu_vader
2573,2573,0.9996700066884568,0.00032999331153196266,0.0,1.0,0.0,"i went into a wild psychosis and got a 5150, 10day inpatient, meds, etc, and everything.",conj,0,neu_vader
2581,2581,0.9984601611510296,0.001539838848965975,0.0,0.9229999999999999,0.077,I am an older female with type 1 who has been getting treatment for several years now and is more or less on a stable meds cocktail.,compound,0,neu_vader
2593,2593,0.999109175207343,0.0008908247926599994,0.147,0.853,0.0,"Soon, she's going to notice that something is wrong with me, I see doctors a lot, I take meds morning and night.",compound,0,neu_vader
2596,2596,0.9989031721107192,0.0010968278892700175,0.0,0.8420000000000001,0.158,"Anyways, I am just glad to (hopefully) be getting into the right kind of treatment and medications now.",conj,0,neu_vader
2597,2597,0.9994830565490872,0.0005169434509279891,0.0,1.0,0.0,He said he usually does a 2 medication combo for bipolar patients.,compound,0,neu_vader
2600,2600,0.999757064363904,0.0002429356361044106,0.0,1.0,0.0,"It's been a year since my ""official diagnosis"" and medication.",conj,0,neu_vader
2616,2616,0.9997267825142988,0.0002732174857063126,0.192,0.715,0.094,I was put on an SSRI again (I swear to god those are the most useless medications ever) and welbutrin.,attr,0,neu_vader
2619,2619,0.9998252678319638,0.00017473216803600474,0.267,0.589,0.14300000000000002,"The more meds the better, just as long as I can't hear myself think..

Fuck dude :/",dep,0,neu_vader
2621,2621,0.9999951121011474,4.88789884091562e-06,0.099,0.9009999999999999,0.0,"Until I am no longer covered, have this preexisting condition, and can't afford health insurance and thus my psychiatrist and my meds.",conj,0,neu_vader
2623,2623,0.9999483521052088,5.164789478148493e-05,0.21100000000000002,0.621,0.168,"If I don't know how to act socially, will meds help or hurt?",ROOT,0,neu_vader
2637,2637,0.9994574372376128,0.0005425627624034089,0.0,1.0,0.0,"When I'm either in a manic or a mixed episode (like I am right now), I sleep anywhere from 5 to 0 hours a day, even when taking sleeping pills and antipsychotic medication.",conj,0,neu_vader
2651,2651,0.9997251820415683,0.00027481795844847446,0.11900000000000001,0.7759999999999999,0.105,About a year ago I quit taking the medication cold turkey and ended up getting into a huge fight with my parents.,nmod,0,neu_vader
2656,2656,0.9994399150932098,0.0005600849067926694,0.174,0.826,0.0,I held back tears and finally lost it when I met with the nurse who discussed her diagnosis and the medications she was taking.,conj,0,neu_vader
2659,2659,0.9996577922391569,0.0003422077608613928,0.0,1.0,0.0,"I met with my first psychiatrist and began my medication regimen, completely unguided by those before me but instead in the expert hands of my doctor.",compound,0,neu_vader
2660,2660,0.9999649877789708,3.5012221040442714e-05,0.19699999999999998,0.8029999999999999,0.0,"If you have bipolar, you need clinically-tested, proven medication for your illness.",oprd,0,neu_vader
2665,2665,0.99996905140608,3.094859392873797e-05,0.10300000000000001,0.897,0.0,I really don't want to rely on antipsychotics or benzodiazpenes or self-medication just to sleep.,conj,0,neu_vader
2666,2666,0.9999449401602084,5.505983979357336e-05,0.0,1.0,0.0,"A Parkinson's medication, and it's addictive.",ROOT,0,neu_vader
2680,2680,0.9993473270893802,0.0006526729106007285,0.08,0.92,0.0,"This medication, I might add, is so new that I had never heard of it, and that its mechanisms of action aren't well understood.",npadvmod,0,neu_vader
2685,2685,0.9999692597799028,3.0740220100294395e-05,0.0,0.865,0.135,I'm bipolar II and I'm applying for an undergrad NSERC grant so I can study medication-induced cognitive blunting.,npadvmod,0,neu_vader
2722,2722,0.9999202575657112,7.974243427837334e-05,0.0,1.0,0.0,I was wondering if it could be the meds.,attr,0,neu_vader
2731,2731,0.9988813551331556,0.0011186448668486252,0.0,0.774,0.226,"Started a new medicine- Risperidone- and wow, what a difference it is to feel in control.",compound,0,neu_vader
2745,2745,0.9872443113728662,0.012755688627136656,0.0,1.0,0.0,I was diagnosed with bipolar a few months ago and I've been able to handle the cost of medication psych visits through the university health center.,compound,0,neu_vader
2749,2749,0.9972697545437266,0.0027302454562783763,0.0,1.0,0.0,"Night 1 I took a half dose so, 10 mg of Belsomra along with my other night time meds: 400 Seroquel, 300 trazodone, 900 mg lithium, 600 mg carbamazepine.",conj,0,neu_vader
2751,2751,0.9992186742230976,0.0007813257768989649,0.11900000000000001,0.772,0.109,"If i am diagnosed, treated and the medication or whatever effects me in a way that *changes* me, perhaps in a negative way, will this actually make me happier?",conj,0,neu_vader
2770,2770,0.9996408346983386,0.0003591653016648386,0.19699999999999998,0.7140000000000001,0.08800000000000001,"Everything about this is scary: the diagnosis itself, the medications and their side effects, and the thought of losing my ""ups,"" creativity, and individuality.",conj,0,neu_vader
2777,2777,0.9992051384334396,0.0007948615665688606,0.0,0.902,0.098,"I see a psychologist and a psychiatrist, who agree that I am textbook type I, and I’m on the road to finding a medication cocktail that works for me.",compound,0,neu_vader
2778,2778,0.9999215188700852,7.848112991533506e-05,0.086,0.914,0.0,"My psychiatrist thought it was depression, but after several visits and several medications (mainly antidepressants causing me to be hypomanic), he concluded that I am type II.",conj,0,neu_vader
2782,2782,0.999834071341542,0.00016592865845796104,0.0,1.0,0.0,I know I need either a higher dose (she started me on 25mg on November 20th) or a new medication.,conj,0,neu_vader
2789,2789,0.9993911626861058,0.0006088373138806713,0.0,0.87,0.13,"well I shouldn't read the rest of my medicine info, or eat hamburgers for my heart.",compound,0,neu_vader
2794,2794,0.9997574571250556,0.00024254287496162084,0.0,0.7040000000000001,0.29600000000000004,If we're lucky we'd look forward to meds time because that's often our source of relief.,compound,0,neu_vader
2797,2797,0.9883997644846868,0.01160023551529518,0.0,1.0,0.0,"The meds side effects are a sensitive topic for me, as there are a lot and they have changed who I am over the course of taking them.",amod,0,neu_vader
2798,2798,0.9709129879549278,0.029087012045071824,0.0,0.883,0.11699999999999999,"A person, who with maybe the right combination of therapy and meds might not be dead or in jail and who might still be remembered as a person (i.e.",conj,0,neu_vader
2803,2803,0.9982922166963574,0.0017077833036292002,0.134,0.866,0.0,"going for different anxiety meds tomorrow, might even try a different mood stabilizer.",advmod,0,neu_vader
2808,2808,0.9999109591381083,8.904086190197674e-05,0.098,0.8,0.102,"For clarification, I'm curious to see if anyone after being diagnosed, has chosen no medication treatment, and use alternative options.",compound,0,neu_vader
2813,2813,0.966253269052346,0.033746730947653375,0.0,0.86,0.14,"I sure have a lot to learn in keeping with my mental health care - mood journals, medication, therapy, education, but I think it's time I had a change of scenery.",conj,0,neu_vader
2815,2815,0.9999739707850384,2.602921497860308e-05,0.0,1.0,0.0,Could it be my add medication exacerbating symptoms?,attr,0,neu_vader
2830,2830,0.9995383069428789,0.0004616930571389932,0.171,0.8290000000000001,0.0,What other sort of non medication type things can I do to keep it from getting worse?,compound,0,neu_vader
2834,2834,0.9999800020449184,1.999795508052281e-05,0.0,0.513,0.48700000000000004,I am currently pretty stable (thanks meds and therapy!),appos,0,neu_vader
2838,2838,0.9994242983212556,0.000575701678727815,0.0,0.785,0.215,"I have a stable, full-time job that doesn't pay much but I have incredible health insurance that's definitely helped with paying for all my bipolar needs (psychotherapy, pdoc, meds).",appos,0,neu_vader
2843,2843,0.999577493052424,0.0004225069475933157,0.084,0.9159999999999999,0.0,"We got her into a talk therapist for a couple months and today the psychiatrist confirmed, bipolar type I, medication prescribed, starting low and going slow.",compound,0,neu_vader
2844,2844,0.999919876537258,8.012346274015071e-05,0.0,1.0,0.0,"She never explained what it was, and immediately prescribed medication.",conj,0,neu_vader
2853,2853,0.9999851468967564,1.4853103238196842e-05,0.0,1.0,0.0,A medication thing?,compound,0,neu_vader
2865,2865,0.9931895351268434,0.006810464873174366,0.0,1.0,0.0,I have questions though about some of the 'side effects' I think I'm having as a result of BP and/or the meds.,conj,0,neu_vader
2880,2880,0.9989441293336488,0.0010558706663542964,0.0,0.8490000000000001,0.151,"During all of the good days I have, I know that it's not due to me getting better, but it's the medication just doing its job.",attr,0,neu_vader
2882,2882,0.9995406378473428,0.0004593621526672073,0.0,1.0,0.0,Don't repeat episodes of mania/depression indicate to you that it's just the medication working?,attr,0,neu_vader
2903,2903,0.998774485395207,0.0012255146047888588,0.155,0.845,0.0,"My docs say it's normal considering my mental health, chronic pain, and all the meds I take fore these ailments.",conj,0,neu_vader
2909,2909,0.9997247060186752,0.00027529398133165696,0.0,0.73,0.27,"I'm not an idiot, I'm aware of how prescribing meds works and yes, I'm aware that I can change docs if I want to, which I already have, that's just common sense surely?",compound,0,neu_vader
2912,2912,0.9999774484193212,2.255158066078888e-05,0.0,0.6,0.4,"[article][mania][depressed][medication] etc
Happy mania week for me!",ROOT,0,neu_vader
2919,2919,0.9999658881221756,3.411187783323419e-05,0.0,1.0,0.0,One thing holding me back is access to medication and the effects trips could have on me.,nmod,0,neu_vader
2926,2926,0.9999652256034952,3.477439650573483e-05,0.18100000000000002,0.8190000000000001,0.0,Edit: Aaaaaand the mirror door over the medicine cabinet in the bathroom is now broken.,compound,0,neu_vader
2940,2940,0.9999507549414968,4.9245058486995005e-05,0.0,0.7340000000000001,0.266,I'm still under good treatment with therapy and medication.,conj,0,neu_vader
2941,2941,0.9999726744293492,2.732557063493537e-05,0.0,1.0,0.0,"[LifProTips](http://www.reddit.com/r/LifeProTips/comments/15zhpd/lpt_having_trouble_affording_your_medication_or/)

[Health Trans Cashcard](http://cashcard.lc.healthtrans.com/Pages/default.aspx)",ROOT,0,neu_vader
2944,2944,0.9999717225466684,2.827745333084496e-05,0.099,0.9009999999999999,0.0,I have no idea what meds she might be on and whether or not she will find a doctor once she is here.,relcl,0,neu_vader
2950,2950,0.9999418459788592,5.815402112254419e-05,0.075,0.879,0.047,"I need a way to find a doctor with a cheaper copay (they were like $25 or $35 where I used to live) and keep getting my bipolar (and possibly anxiety) meds too, but I have no idea what I'm doing.",dep,0,neu_vader
2951,2951,0.9974074914384816,0.0025925085615369626,0.13699999999999998,0.725,0.138,"I also haven't been on a stable medication combo yet, for what it's worth.",compound,0,neu_vader
2961,2961,0.9997016699083304,0.0002983300916784023,0.0,0.8590000000000001,0.141,It wasn't until a police escort to his psychiatrist appointment was required that he was admitted to psychiatric care for a week and a half and extra meds were added to his routine.,conj,0,neu_vader
2963,2963,0.9999314598009952,6.854019901678319e-05,0.0,0.8240000000000001,0.17600000000000002,Does anyone get their med refills from their primary care doc (general medicine) instead of a psychiatrist?,appos,0,neu_vader
2968,2968,0.99997074953042,2.925046956457641e-05,0.0,1.0,0.0,Here's little background about myself and medication.,conj,0,neu_vader
2970,2970,0.999979169587832,2.083041214973781e-05,0.203,0.7170000000000001,0.08,"I've tried mood stabilizers and antidepressant medications since I was 16 (now 23) and unfortunately, none have assisted in easing my illness.",conj,0,neu_vader
2973,2973,0.9999668386495923,3.316135040829923e-05,0.162,0.662,0.175,"Plus, I have two teenagers to support, and if I divorce him, I will lose all my health benefits, which will mean no more therapy or meds.",conj,0,neu_vader
2979,2979,0.9999425812675596,5.7418732447567575e-05,0.306,0.6940000000000001,0.0,"I was diagnosed with OCD, depression, and panic disorder many years ago, and I've been in treatment for those for some time now (meds and psychotherapy).",advcl,0,neu_vader
2984,2984,0.9999901346495758,9.865350419349446e-06,0.0,0.722,0.278,Has anyone been there and did medication help?,compound,0,neu_vader
2990,2990,0.9897265915582248,0.010273408441782726,0.0,0.769,0.231,"You also have to know that before being diagnosed, I've always had been against medication amd thought the idea of a ""happy pill"" was pretty absurd.",compound,0,neu_vader
3008,3008,0.9989012867828152,0.0010987132171894774,0.05,0.862,0.08800000000000001,"What I'm really getting at is that no matter what progress I may make as a person, whatever coping strategies and medication keeps me relatively level headed, as soon as someone notices my scar I know it will bring me back to square one.",conj,0,neu_vader
3010,3010,0.9999889579297558,1.1042070223186693e-05,0.0,1.0,0.0,Can this be the medicine?,attr,0,neu_vader
3017,3017,0.9998939503880656,0.0001060496119338832,0.192,0.774,0.034,"I also really hate being bipolar, no matter how much I learn about it, how many techniques I learn on controlling my swings, or how many meds I try or don’t try.",conj,0,neu_vader
3023,3023,0.9950053287125256,0.004994671287462795,0.057999999999999996,0.782,0.16,"I already know a lot about Bipolar Disorder and the medications used to treat it, but I feel like he gets enough of the clinical stuff from his therapist and psychiatrist.",conj,0,neu_vader
