,Unnamed: 0,neg_prob,pos_prob,neg_vader,neu_vader,pos_vader,post,dict,identifier,sentiment
3,3,0.21191239091760555,0.7880876090823963,0.124,0.736,0.14,"Looking for some advice or perhaps just understanding. I have always been a glass half full individual and I have been in love with my long term girlfriend for almost 5 years. It is apparent that she has had anxiety/depression issues over these years. The primary trigger has always seemed to be her stressful job - but this is only a first position out of college. I hoped this would pass. There are days where she cannot leave the house or cannot even leave the bed.

These episodes could be very extreme so she (thankfully) began therapy and medication. It's been a roller-coaster of pharmaceutical cocktails and diagnoses ever since. Recently things seem to have honed in on a well defined diagnosis of Bipolar Disorder. 

I try to be as supportive as I can. I think it's been very well appreciated. However, depression is the dominant cycle and I can't help but feel there is a constant cloud of negativity present in our household. It's slowly chipping away at my own psyche in a number of ways: limited social interaction, lessened physical activity, unsatisfactory sex life (I'm embarrassed to admit just how much this last one bothers me - I know it's not her fault...) I'm developing my own sense of anxiety related to some of the bigger questions looming in our future. Can we still get married and be happy? Move back to our hometown where our families are? Can we still have kids? Would it even be responsible to think about kids if this emotional environment can't be drastically improved?

I cannot imagine my life without my girlfriend but perhaps my idealistic vision of our future needs to be disregarded for the time being. I'm afraid to discuss how much some of these things are bothering me at this time because my sole focus is on helping improving her emotional state. I would hate to make the situation even worse and make her feel guilty for what is happening to me. The last thing I would want is to induce any anxiety that I am considering leaving (even if this dark thought does cross my mind from time to time.)

I hope this is an OK post to make here. I would really like to hear how other couples have dealt with a similar situation. ",['conj'],0,neu_vader
4,4,0.010470916654163264,0.9895290833458216,0.11699999999999999,0.746,0.13699999999999998,"Well here is some background on me http://www.reddit.com/r/bipolar/comments/2ygdpf/at_a_standstill/


I highly lack motivation. I'm unsatisfied with my life but not doing anything anything to change it. I don't even know where to begin. The lack of interest isn't helping.

On one hand:
A friend of mine that lives a few states south east of me is planning to start a video game company. I've talked to him about for 6 months now. I've  given input, opinions,  and ideas. He considers me his partner.

I'm highly reluctant this business will gain footing. Definitely not a quality a business partner should have. While I have some schooling in programming , like math and Japanese. The lack of use has had time fade it all away. He too has some schooling in game design. He does have an associates in Marketing. 

Together we just don't have the knowledge and experience we are just two people with ideas. 
I'm here saying it's not going to work and he's all overly positive and believes we will become rich enough to live comfortably. Maybe call me a pessimist. I consider it being a realist. 

On the other hand:
I just recently started taking care of my nephews  before and after school. 11 year old takes care of himself is highly into Destiny on the Xbox one , barely goes outside. 7 year old he's a handful, but love him dearly. Has autism , loves to be outside. Easily angered/upset. 

Watching them always seems to be the back up plan. I watched them prior to working last year as I was jobless and also homeless I lived with them.before that it was after my break down in school in 07. 

Don't get me wrong I love my nephews but I just don't see myself doing it as a career. It does give me a little money to pay bills. I Moved out of there last April after my anxiety filled episode. Prior to that I was thinking I wasn't good enough to watch the kids. 

I now live with my parents AGAIN. I bounce back and forth between my brothers , my parents , and then trying to live on my own. 

I'm deathly afraid of getting a job. I fear I will repeat last year. I feel like I'm no good for any job. I fear I  just don't have the energy and will get fired anyways.  

I've been working with the states division of vocational rehabilitation. Not only am I bipolar, but comorbidly ADHD and Generalized Anxiety Disorder with social phobia. I like my counselor. I haven't seen her lately as we moved to the next step in me and my job consultant trying to find a volunteer position where I can be assessed in working. Not a bad plan, has me anxious. First time we met we talked about me my struggles my worries. Second time we met we worked on my resume. Third time got cancelled he was ill. 

We have been corresponding through email. He reached out to my job from last year HR contact I had who encourages me to reapply, BTW they are rehiring. The requirements have changed to require more experience. I apply anyways, to find out my application still exists in the system.

 My job consultant, then said to contact my recruite, which I did. She emailed me back, and said she'd call, but she hasn't.  While all this time I was really reluctant. I expressed my fears and he said we could just move on from this. I told him my fear of getting overwhelmed, not learning the job fast enough, not meeting standards were not just fears for that job, but for all jobs in general. That's where I'm At with that.

I keep getting asked what my goal for treatment is from both  my pdoc in my bipolar medication group which also has a small therapy element . I just started and gone twice. Then from my therapist. My answer is always something like to be better. For years. My therapist (2nd one in this clinic, 5th overall)now that I'm not in such a high panic state I think is trying to emphasize setting goals. I've never been good at that. Nor do I know what to set a goal for. I just don't want to be like this. Too afraid to work/live.

I don't even know what I'm asking for or expecting for a response. Any feedback would be great. I guess I just want to start some conversation about what's been going on. Someone to talk about it other than my therapist, job consultan, and couple friends.

TL;DR have two different job choices(one doesn't pay as of now), I'm not interested in anything fun, I just blabbed a lot of stuff. Any/All feedback is appreciated.",['compound'],0,neu_vader
16,16,0.8432660536664078,0.15673394633358864,0.091,0.8270000000000001,0.08199999999999999,"I've read that this isn't grounds for a Bipolar (I or II) diagnosis while others disagree. Some say antidepressant induced hypomania is just that, and not grounds for a bipolar diagnosis. Others talk about those who experience hypomania while taking an antidepressant for Major Depressive Disorder means I'm on some kind of bipolar spectrum.

All I know is that I should really stay away from standard antidepressants because I get hypomanic then eventually crash. I've tried 4-5 different antidepressants in the past 6 years and it's always the case when starting a new antidepressant.

I also know that I've been seriously depressed since I was in high school, and looking back, in-between my depressive states I experienced subtle highs in my mood, but I'm not sure these highs in my mood qualify as hypomanic. I know they weren't as high as when I started taking antidepressants a number of years after high school.

I know I need to talk to a psychiatrist about all of this, but the psychiatrist I'm currently seeing only sees me for medication management, and I only see her once every 3 months for a follow up, and each follow up is 15-20 minutes long to determine if she should renew my prescription. So I know I have to look into seeing a different psychiatrist for a real sit down and talk.

I was just wondering what some of you guys thought about all this. Do I really need to see a psychiatrist to determine if I have bipolar II (for a more focused treatment plan if the Lamictal doesn't work out) or am I just one of those people who become hypomanic while on antidepressants with no underlying bipolar disorder?

Thanks. 

EDIT: I mention Bipolar II explicitly because I don't THINK I've ever gone full blown manic. I've never been hospitalized for any extreme behavior during my highs. I've just received comments in the past from friends and family about my mood. I've been asked if I was on drugs, or why am I so happy lately. I've been called annoying and have been told by family members that I need to calm down, but I don't think I've ever felt like I was a threat to myself or others. And, when the depression strikes again and I look back at how my behavior was, I KNOW that wasn't the real me.

Thanks again, any comments, thoughts, or whatever welcome.",['compound'],0,neu_vader
22,22,0.9450340378556994,0.0549659621443167,0.11,0.7609999999999999,0.129,"I need to move on with my life, move out of my parents toxic home and get a job that's not with my dad. How do I stop feeling sorry for myself and get my ass in gear? I'm tired of feeling this way all the time. Hopefully a good pdoc and proper meds will help but I can't wait for that.",['conj'],0,neu_vader
24,24,0.9993587856027918,0.0006412143972116295,0.08199999999999999,0.853,0.065,"I *think* I've developed a facial tic. I say 'think' because I'm not sure if it's just a habit I picked up without realizing. 

But I've started having to take very long blinks in which I close my eyes very tightly. I can't really help it, and it's starting to become a problem when I'm driving.

It's not constant, or maybe I'm only noticing it when it's an issue. My general blinks has become a little more forceful, if that makes sense.

I believe this started a few months after I started taking lithium in June, but I'm only taking 600 mg so I'm a little surprised that a low dose would cause this.

Could this actually be medicine-related? Or is it just a habit I started? Or both?

Also, I'm not sure how to explain this to my SO. How to explain that I don't want to drive because I blink too long? Lol

Thanks!",['npadvmod'],0,neu_vader
28,28,0.9951049162072091,0.00489508379280321,0.23199999999999998,0.682,0.085,"I've had ADHD most of my life, and I've managed it semi-effectively (at times) alternatively through self-imposed organizational tools and habits (which work for short periods, usually), medication (which I can seldom afford now that I'm on my own), and extensions and incompletes from my professors (which I hate, but is usually what I end up needing).  The ADHD, ever since I got into doctoral school, has brought with it intense anxiety issues that have gotten worse and worse with every semester.  It got to the point this semester that I've even had panic attacks when I sit down to try and complete late assignments, I'm so scared and anxious.  When I'm not, I'm completely and utterly depressed about feeling like an utter sack of shit and not being able to function like a normal person.

Now, I never would have thought of bipolar disorder, but a friend of mine has apparently been dealing with it for years.  She knows me pretty well and says that she thinks I should go talk to the campus psychiatrist about the possibility, because she thinks I'm demonstrating the same kinds of cycles that she goes through.

I really don't have much experience with this, but I'm just scared as hell because it's one more frightening psychological burden to deal with.  I know that, if I have it, that I'm really treating it as a burden now by not dealing with it... but I feel like if I go to the doctor and I DO have it, then it becomes real.  Right now it just feels like a theory a friend of mine had, like it's not real.

Anyway, I'm sorry if I spoke of anything inappropriately or offended anyone, I'm just scared that I'm going to be adding one more lifelong psychological struggle to the battle that I fight every day.  I'm scared that I'm going to fail out of school and not get a job and my life is going to fall apart and everything is going to collapse around me.

Anyway, my friend isn't a doctor and neither am I, I just needed to vent...  If it turns out I DO have bipolar disorder, I might be coming by here more often.

Once again, I'm sorry if I spoke incorrectly or insensitively or offended anyone.",['conj'],0,neu_vader
29,29,0.9965134115910708,0.003486588408916026,0.136,0.7979999999999999,0.066,"So I am hypomanic, been seeing my psychiatrist and meds being adjusted etc.... However, I am restless and bored out of my mind. I have cleaned the house and find all kinds of errands during the day to keep me busy, but I have run out of things to do and am so restless, can't read or even watch Tv etc(which really sucks since I am a full-time uni student, and there go my grades), I am also not the nicest person to be around at the moment so hiding from friends. I ask you my fellow bipolar redditor for help and suggestions on things I can do( cant cost $$$$, cause I dont have any).",['conj'],0,neu_vader
40,40,0.9996288395304326,0.00037116046954885037,0.171,0.746,0.083,"I need some serious advice/help right now I think. The past few nights I've been feeling my mood elevate but have been putting off doing anything about it. Now, here I am at about 4:30 in the morning and my mania is out of control. I find myself researching random topics obsessively on the internet, blogging the same picture over and over, initiating sexual conversation with people on my Facebook, and unable to sleep. I feel like maybe I should go up to the hospital here soon and get myself stable before I do something REALLY stupid. I haven't been taking my medication lately, so I keep telling myself just to start it up again before I go to work today, but I have to work 3 different jobs (out of my now 4 jobs) today and I'm really afraid that I'm going to do something insane. But if I go to the hospital and get admitted, not only is that money that my pissed of parents do not want to spend, but I would miss my shifts and probably lose my jobs or at least cause severe issues for my coworkers and managers. I don't really know what to do because I've had to leave one of my jobs for a manic episode before and I know they all think I'm just crazy or trying to make excuses. And my other boss doesn't know I'm bipolar and I'm really scared to say anything. And what do I even say when I get to the hospital I feel like they're going to treat me like a goddamn basket case and I'm scared and embarrassed that I let things get to this point and I don't know if I should tell my dad because that's just time and money out of his day and I don't want him to get mad at me because I'm notorious for not taking my medication shit i don't know what to fucking do at all and I don't want to fuck myself over today PLEASE HELP!",['compound'],0,neu_vader
62,62,0.9999167589880852,8.324101191660714e-05,0.26,0.657,0.084,"I am worthless. The disease makes it worse, but I think the problem is that, underneath all the symptoms and the medication, I'm just a worthless little pussy. I don't have the strength to be a real human being. I am less than. I don't believe in myself. My family doesn't believe in me. I don't take care of myself, I can't keep a job, I can barely manage to just sit in front of a computer and hide from who I am. That's what I do here. I hide from the fucking pathetic excuse of a life I live because if I looked it in the face I'd kill myself. What am I good for? I don't contribute to anything, I can't sit in front of a piece of art long enough to finish it, I don't even have the motivation to deal with my feelings or lack thereof. I'm a disappointment to my family. I'm a disappointment to myself. And I don't know how to fix it. I don't have the strength, the motivation, the consistency to fix anything about myself. Why am I even alive? What fucked-up, piece of shit deity decided I was a good idea? I'm broken.",['conj'],0,neu_vader
78,78,0.9396825309369004,0.060317469063112236,0.069,0.764,0.16699999999999998,"Hi guys - this is a throwaway.

**Decided to see shrink because my Dad is dying. Could use support**
I went to see a shrink because i needed someone to talk to. My father is dying and I am struggling with my Masters while being unemployed. I figured I needed a paid friend to ""hold my hand"" ( for want of a better term) through this difficult time. I was experiencing anxiety and mild depression, but nothing out of the ordinary - and certainly quite normal considering the stress I am dealing with.

**She asks me a series of questions including:**

Do I notice patterns?

Do I ever feel that everything is going to be OK?

Do I sing?

Have I ever had a mystical experience?

Does the Mayan Calendar have any special significance to me?

She then diagnoses me with Bipolar. 

**I question her** - how can she diagnose me with Bipolar from an arbitrary set of questions that are utterly unscientific?

She seemed affronted that I challenged her.

I countered. If I am Bipolar - certainly a blood test will ascertain whether I have a chemical imbalance?

**She notices me challenging her and then goes on to say.**

""Some of the the greatest artists in history have Bipolar. You are enhanced"".

**I really feel like she is trying to ""sell"" me Bipolar.** She wants me on lamitral which are anti seizure meds. I think this is rather drastic considering she has known me for less than two hours of my life. 


**Reddit, has your shrink ever told you that being Bipolar is being enhanced?**

I do not trust this diagnoses - and am reluctant to re-wire my brain with drugs based on her pseudo science questionnaire.

Some illumination would be great. Thanks!


*Edit: Bold headings for easy reading*


",['attr'],0,neu_vader
91,91,0.999062109741284,0.0009378902587306662,0.131,0.8009999999999999,0.069,"Does anyone else have a hard time remembering to do things? I'm not sure if it's my medications or I'm just losing my mind with racing thoughts, but I will go into another room and forget why I got up in the first place. Yesterday I forgot to eat. I didn't realize it until today when I felt really dizzy and tried to figure out why. Please tell me I'm not alone.",['attr'],0,neu_vader
102,102,0.983104693873162,0.016895306126820636,0.077,0.894,0.028999999999999998,"i have been taking xanax, prescibed by family doctor, and have taken occasionally for a couple years for my anxiety/panic/irritability. I began counseling a few weeks ago and my counselor influenced me to go see a psychiatrist. it is believed i have either bipolar 2 or maybe borderline along w anxiety problems, but we'll see in a couple weeks what the psych says. have mood stabilizers and other medications for bipolar 2 been worth the risk of side effects? make a difference in the quality of life? ",['conj'],0,neu_vader
114,114,0.9996837565895764,0.0003162434104378975,0.0,1.0,0.0,"Met with my pdoc this morning. She wants me to get off of the lamictal, as she doesn't believe it to be having the proper effect. 
I'm starting Symbyax. Anyone have any tips on what to expect? From both the transition and the medicine itself. ",['conj'],0,neu_vader
119,119,0.9968844110505416,0.003115588949451136,0.047,0.79,0.16399999999999998,"""No matter where you move, you'll still be with you"". 

That's what my doctor told me two days ago when I told him I was thinking about moving to Nova Scotia. That was the day after I was moving to northern Alberta. To write the great untold love story - a book that needed to be written. 

And Nova Scotia? My mom just said ""That's interesting"". That's interesting? I was going to go work at a video game company! That was cool! Not interesting!

And today? I've agreed not to move anytime soon - added extra therapy and another medication and my doctor has approved a week off work for me to get to a place where I can focus again.

And all this with thoughts of suicide. It's been one heck of a week. ",['conj'],0,neu_vader
123,123,0.38589527745623103,0.6141047225437868,0.228,0.674,0.098,"I'm bipolar II but I'm fairly certain I'm on my way to being type I.
Some background: I'm a university student home on break for Thanksgiving. I've been hypomanic for the past few weeks and despite medication increases (going from lamictal 100mg to 200mg and seroquel 25mg to 100mg), exercise, and eating right, I keep going up and up and up and up. I came home and was an absolute bitch to my family, argued with them about everything, and was extremely irritable. When I'm hypomanic it manifests itself on the internet too. I'm an activist of sorts and I start posting tons of shit on facebook related to things I advocate, but then I fear I'm alienating my friends and family. I guess I shouldn't give a fuck because that's just who I am, but the fact that these things reflect my mood kind of freaks me out. What's worse, I've started having delusional thinking about government conspiracies. It's really making me nervous. 

I smoke weed quite a bit, I find it very calming when I'm hypomanic and it brings me up when I'm depressed. Last night I got high and it made me feel normal. I started to realize how I've been acting and I got so furious with myself. I came home to my parents crying and apologizing for how I've been acting. They were very supportive but it still kills me inside to know that I hurt them. I'm also quite frightened about my sanity. I've been in denial of how bad my illness is getting. I need to find creative outlets so I don't keep flipping a shit at my loved ones. I think if I do something productive and creative in this state it will be awesome. So sometimes I'm grateful for being this way but at the same time I hate it. Do you guys feel this way?


**tl;dr** I'm becoming delusional, going from manic to hypomanic, I'm upset my illness is getting worse and I'm freaking out about it.",['compound'],0,neu_vader
127,127,0.9989239726315506,0.0010760273684429123,0.127,0.687,0.18600000000000003,"... not to sound dire, but even when you think you have EVERYTHING going - insight, doctor access, medication, general health and employment, supportive partner and friends - this shit comes back and hits you and WILL topple things.

A month ago I was employed full time and doing lots of volunteer stuff, started to feel my sleep disrupted and mixed mood stuff so managed to quit my job gracefully but now I feel utterly in the gutter. Im sure Ill get out but basically-

If your feeling crap for not doing well remember that this too shall pass

If your feeling great for doing well, remember that this too shall pass


",['conj'],0,neu_vader
130,130,0.8755646412347186,0.12443535876528435,0.11,0.737,0.154,"I just wrote this for all the people in my life who just do not understand.

--

The last few sticks are burning. 

I understand what I've done, and I understand how it sounds, but I haven't been fully in control of my actions, possibly since my mother died. 

I'm sorry. I am. All I can say is that I'm trying to learn and come to terms. But I'm threading a fine needle here, between learning what I have to do to make myself healthy and learning what I have to do make myself happy. 

I'm not a monster! I'm not an invalid. I'm still ME. 

Don't you GET it??? I'm sick, but I AM IN HERE, and I am fighting as hard as I can. I have been. Sometimes I win and sometimes I lose. And sometimes neither of those things look the way that you want them to. But I'm fighting.

If you can't be part of that fight anymore, fine. Take your stick and go. It's a choice we all have to make. 

But I'm still fighting. Every day, every hour, every motherfucking goddamn MINUTE. 

Do you know what that is like? Do you? Statistically, one or two of you might.

One or two of you might know what it's like to question every moment of happiness, to fear every moment of sadness. One or two of you might know what it's like to do things, over and over because they feel good, not just good, but amazing. 

No one gets to feel good all the time you say, but what if there was a part of your brain that, in the absence of feeling that good, felt the exact opposite, at least 35% of the time. 

One or two of you may understand what it is like to question a relationship every day for YEARS, wondering whether this was it, whether you could ever handle something that made you feel more alive without literally going insane. 

One or two of you may understand what it is to have your affect blunted for most of TEN YEARS, your sexual desire coming out for MAYBE one week every three months, and wondering every day if it's the medication, the situation or YOU. Miserable, failing you. 

Or do you know what it is to be the best and the brightest, but not be able to hold onto a job, or a career? To be down to your last $200 and know you can renew your professional license, pay your student loans, make your car payment, or pay the electricity bill, but only one?

One or two of you might know that this is all the tip of the iceberg of what my life has been like, since I was about 14 years old.

And now all of you know. Or you think you do.",['attr'],0,neu_vader
