,Unnamed: 0,neg_prob,pos_prob,neg_vader,neu_vader,pos_vader,post,dict,identifier,sentiment
3866,3866,0.9873768520099468,0.012623147990062656,0.14400000000000002,0.76,0.096,"Back in April I was hospitalized against my will and had a pretty harrowing experience in which my meds were repeatedly forgotten, I never got to talk to a social worker or therapist, I was terrified of my roommate, didn't sleep for three days, and in which the only other person I got to talking to was sexually assaulted during my time there and stopped talking altogether after the event.

Now today, opening up my mail, which I'm getting with about a seven-day delay because I have no address to call my own, I get a bill from my three days in hell. I was assured countless times upon being admitted that I wouldn't be responsible for any of the cost, and now I'm on the hook for hundreds of dollars for...??? Care I didn't receive. I left the hospital in a worse state than I entered, and if I had money I would be putting it towards getting back on my feet, not pouring it into the gaping maw of a travesty of a hospital.

What are my options? Who can I contact? I called the billing department and was told that I could ""apply for a reduction in cost."" I'm currently receiving no care and have no doctor/therapist I can call. These past couple of weeks have been littered with my own miserable ""warning signs"" and this event, I fear, is triggering an episode that was probably on its way anyway.

Part of me wants an easy out. The other part of me is hoping that someone in this subreddit has some words of wisdom that can help me deal with the financial side of this, as well as the repressed memories that are coming back with this fucking bill. Help?",['nsubjpass'],0,neu_vader
3874,3874,0.9774409390744356,0.022559060925569432,0.131,0.769,0.1,"I just looked up this subreddit because I'm really concerned and scared right now.

I've been dating my boyfriend for about 4 months now. He told me he was diagnosed with bipolar disorder, but he's not exactly sure which type. I'm familiar with the disorder, but I've never really experienced. It never manifested itself until last Sunday when he came over in a depressive episode. I had never seen him like that before. He mentioned he was scared because, around this time last year, he had tried to commit suicide and was hospitalized for it. The next day he woke up seeming to feel better.

Then on Monday, he seemed different. He was at my house while my best friend was confronting her boyfriend about lying to her, and he was fuming. He kept talking like he thought my friend was going to be attacked. Even after the guy left, he seemed paranoid and kept looking out the window. We were asking him to calm down and kept telling him to calm down, but he wouldn't listen.

Last night is what worried me the most. I arrived at my friend's house where my boyfriend was, and he immediately starts talking about his plan for his life. He explains how he was planning to go to Colorado for a week to practice a new ""healing"" business he wants to start with magnets, crystals, lotions, oils, etc. He is in the process of switching to a different store of the company that he works for, and he said he was going to tell them up front he was leaving for a week. He's going to sell his car to someone shortly, but didn't talk about buying another one that will work. He also keeps talking about working as a promoter and living off of a barter system. He also kept telling me how perfect I was and how I do things flawlessly.

I asked him if he was manic, and he said he was just very excited. My best friend was there with me, and she said he was acting very strange. My other friend even told him that he was making very rash decisions in such a short amount of time without a backup plan.

Two people who know him well agree that he is not acting normally. I'm not sure what to do. He hasn't seen a therapist or psychiatrist in a while, and I'm not sure that he is consistently taking whatever medicine was prescribed to him. Am I just overreacting? Should I not be worried? I'm not sure what to do or what to say to him. I was hoping some people here could share their thoughts.

Update: His behavior has become increasingly erratic. This morning, he was telling me how afraid he is that I'm going to Europe for a week the day after Christmas. He kept saying that someone could have drugs in their system that could get into my body through my pores when they touch me. He also kept saying how dangerous Europe is, and how naive I am about bad people. Even though I told him my father and brothers will be with me, he still thinks I'm going to be in danger. He kept saying if he could go with me, he could protect me. He also kept telling me he was afraid I was going to come back completely changed and break up with him. He then began explaining all of the connections we have, and how the Atlantic ocean will break those connections.

I could go on and on about the things he was saying and doing last night and this morning. I spoke with my mother, and she thinks I need to call 911. At this point, I'm seriously concerned that he might hurt himself when I'm gone. I'm worried he's going to have a psychotic break - he seems to losing touch with reality more and more. He's also acting much more paranoid lately. His mother and sister have even noticed his behavior, and agree he isn't well.

Thank you for all of your advice. It's going to be hard for me to have him admitted to a hospital, but I would much rather have him angry with me and be safe. Please keep him in your thoughts.",['nsubjpass'],0,neu_vader
3886,3886,0.9975929635519902,0.0024070364479995237,0.114,0.8009999999999999,0.085,"Hey guy so yeah for the last few days I've been up all night no sleep and feel refreshed as ever all day the next day. Usually this is a sign that I'm either manic or about to go into one, but I haven't messed with meds at all and I'm very hyper selfaware of either getting manic or depressive. Maybe it's my meds? I'm on Lithium max dose for my body weight? Any advice or help I'm going a little crazy with the no sleep",['attr'],0,neu_vader
3888,3888,0.973200811819766,0.026799188180252724,0.113,0.833,0.054000000000000006,"My problems: Whenever I study/read I have a real hard time concentrating because of racing thoughts/wanting to do everything at once. I tend to form incoherent speeches and stutter a lot more than I used to (it's something that I can't really control). It takes a bit longer for me to process what others are trying to say, too. Could it be one type of bipolar disorder, other disorders, or simply chronic depression?

For people diagnosed with bipolar disorder, are there any medication you are or were on? Does/Did it work for you?

Are there any 'natural' ways to help regulate the symptoms? 

I've been on a vegetarian diet (still drink milk and have a few eggs per week) for over a few weeks, but I don't think it helps a lot, or maybe this lifestyle should take longer to see better results? Has anyone tried changing their diet?

EDIT: Just went to talk to a psychiatrist. She said what I've been going through is normal (highs and lows, demotivation) for a lot of people and it doesn't sound like bipolar to her (though she said I should come back to see her again when I have an elevated mood). She recommended seeing a psychologist to help deal with depression. ",['attr'],0,neu_vader
3890,3890,0.986774062445472,0.013225937554538714,0.068,0.764,0.168,"Hi everyone,

I've been on abilify and Effexor for a while now and today I've started feeling those restless, energetic, elated, highly productive, money spending, can't sleep feelings and I'm scared it could get more unstable or switch into mania. Not sure if it's the meds or my natural BP cycle but I have an appointment with my pdoc on Monday. What do I do until then to stay safe? Is this common?",['attr'],0,neu_vader
3930,3930,0.9919318156644789,0.00806818433552956,0.075,0.865,0.059000000000000004,"I am so scared. Diagnosed after a 24 month manic/pregnant/manic phase, Bipolar 1, I was so happy to have a ""fix"" for all the crazy. After several ""med resistant, up the dose"" appointments, my doctor informed me today that we are moving in the direction of a bipolar schizophrenic (currently schizoaffective) diagnosis, with a new cocktail tba. I have a family history of both disorders, bipolar only skipping 1 of 4 adult women in my family, and already diagnosed in a little girl to boot. Only 1 schizophrenic so far. Me makes 2.

I have never been so scared. 

Current meds:
300 Seroquil
900 Lithium ER
200 Lamictal
Q96
And every single vitamin on that sheet they give you",['ROOT'],0,neu_vader
3952,3952,0.9952777403186946,0.00472225968131906,0.087,0.816,0.09699999999999999,"Hey guys, I've noticed a trend I've had and I'm wondering if it's a common theme to those of you also on meds.

SO... Of course, I'm bipolar, that's why I'm here, but I'm also an introvert, or rather I'm more towards the introverted side of the scale. I'm not socially awkward like people like to think introverts are. I'm quite confident, but a lot of time around people just overwhelms me. 

On a night out I usually drink a lot of beer, it's a way to get me to open up and actually talk to people. As I said, I don't normally have a problem talking to people, rather it's more the saying what I'm thinking thing. Alcohol brings that out of me.  I used to drink to excess when younger, thinking that was good. But now I'm older, I don't. I drink enough to open up and then steady myself to stay at that point.

Anyway, I've noticed a trend lately, I'm drinking for a while, having a good time, getting to a good point then BAMM I get this feeling ""I want to be home in my bed"" and then I'm tired and just want to leave.

I know I shouldn't drink much while on meds, buuuuut it's part of my lifestyle habits and it doesn't happen too often.

I've only just realised it's kinda happened since I've been on meds and wondering if this happens to you guys? Is this the meds kicking in and killing a sort of high? :S
",['attr'],0,neu_vader
3961,3961,0.7694880026907708,0.23051199730923785,0.16,0.775,0.066,"I recently had a decent bit of trouble with my stability.  I had to take time of from work to do outpatient because I had severe rapid cycling and was starting to idealize suicide for the first time in two years.

I don't feel like I'm having defined episodes, but I will randomly have bursts of needing to cry for no reason or boiling over with rage. I feel like I have no control. Like I can't do anything to improve my situation. I'll randomly get impatient and judgmental in conversations.  I frequently get stir crazy within minutes of arriving at work or home because I'm imediately bored. I want to go do some fun. I want to be social with everyone I know and I get angry(very angry) when no one wants to go out. Also there's the occasional paranoia or weird thoughts in my head that don't ""feel"" like things I would think. All or any combination of these things (and more that I can't think of at the moment) will happen for anywhere from a few minutes to several hours, and for the time in between them I feel fairly normal, though sometimes a little blank...

Current stressors I have:

Work is making a lot of changes because it's not making enough money. It's a musical repair shop, and we're literally throwing out hundreds of ""junk"" instruments that could be used for parts...

Boyfriend is unemployed (for 4 months) and the only place that's called him for an interview gave him tons of bs saying that they couldn't accept his high school diploma as an actual diploma.

I'm frustrated with my pdoc because she let me down while I was trying to get disability insurance after she took me out of work; i had to get my pdoc at the hospital to do the physician forms for me instead. She also neglected to schedule an appointment with me and now because I'm angry with her I can't bring myself to call, so I'm 2 months behind on the B12 shots she gives me.

I'll be aging out of my parents insurance in September,  so I'll need to find a new pdoc anyway.

My work insurance doesn't cover regular pdoc OR therapist visits -- only group therapy which is not run well.

I'm paid so little it's looking like I won't be able to afford insurance that covers my meds/psychiatric care needs enough for me to afford them

So basically this is partially me venting and partially me asking for any input on how to handle this shit. I'm not sure if these things feel so hard to handle because I'm still unstable or if it's these things that are causing me to be unstable... or a super fun circle of both... 

Either way, thanks for reading",['compound'],0,neu_vader
3966,3966,0.982371956382616,0.017628043617369724,0.098,0.847,0.055,"I'm extremely confused. To say the least. I was diagnosed with Bipolar five days ago. Currently working with two doctors to come up with a medication plan and determine if it is Bipolar I or II.

I'm really just having a hard time with my memory. I was on Lexapro from June 2009 until September 2013 and in October when I was all the way weaned off, I felt like I woke up from a very confusing dream. I can't justify my actions and feel like most everything I did was crazy. I also did a lot of molly and cocaine in October-December. I think I was trying to get the full blown mania back. I haven't told my doctors about my substance abuse other than alcohol. It has probably not helped with the memory loss but it was there before the drugs. All of the symptoms were. 

I feel like I have different personalities because I can only remember what I was thinking and all of what happened while I was manic when I am manic and same goes for the depression. Is this something you all can relate too?

I starting to think it may be Borderline Personality Disorder. But I don't have all the symptoms of it. I think maybe the Bipolar has led to Borderline because I have been forced to repress my mania. Or is it even possible to repress the mania? Does the fact that I have taught myself to do that mean I am not actually Bipolar but something else?

I am 19 years old and I have known something was wrong my whole life I have been in and out of doctors offices going back and forth between mental and physical symptoms since I was 5 years old. I just want to handle it like a gentleman and get it figured out. I dropped out of college to do so. I would just like some advice/answers/testimonies. And if any of you have taken Lexapro for an extended period of time without a mood stabilizer can you please explain to me what your side effects were. ",['compound'],0,neu_vader
3994,3994,0.9002562916887216,0.09974370831126647,0.066,0.804,0.129,"Hey group, I just discovered /r/bipolar earlier tonight and I just wanted to say that it was really neat for me to read through some of the recent posts--it was just nice to know that other people have similar experiences to the one's I have (e.g. BP in college, meds, hospitalizations, etc.).  

I wanted to pose a question: how prevalent have you found the BP diagnosis to be in your area/life?  (Stats always say that it's like 1-2% of the population, but I've always been skeptical of that high of an incidence rate because of my own lack of exposure). Note: I live in a a decently large city (two-pro-sports-team-sized)

One of the hardest things that I face with my condition is support.  As the title states, I have never actually met anyone in real life who has been to a psychiatric hospital for instance, or even has BP.  NAMI is like non-existent in my city, and there is a general mental support group program, but I went to it a few times and everyone was like over 50 and had been recently diagnosed and it was like a how to get on SSI and retire early get together  

So aside from seeing my psych, I find it difficult that no one ""experientially-knows"" what it feels like to have BP. Thanks for being open on this forum.

Current: depressed (and improving :) titrating-up lithium &amp; ativan

EDIT: About me:  29yo M, Philosophy BA from top-tier Ivy in 2010 (started 2002 and took multiple medical withdrawals) and now I have an archane diploma and no job (to be expected)",['conj'],0,neu_vader
3997,3997,0.8611139941412945,0.1388860058586716,0.17800000000000002,0.631,0.191,"Recently I've been suspicious that I may be developing bi-polar disorder. The last few weeks I've been watching myself and seeing for any symptoms. I'll give an overview of what its been like.

Last year I was diagnosed with OCD/GAD and took two SSRIs which didn't work and made me feel dead inside.

About two months ago, I started the generic of buspar. An atypical anxiety medication that has substantially decreased my base level of anxiety, plus! No more OCD thoughts and tendencies. All seemed well.

In the time period of Oct. 1 (after stopping zoloft) to about Dec.15 ish I suffered from what felt like a major depression. Break started and I found myself happy to be out of school but I felt A LOT happier than normal. (Another note, I moved a year and half ago, and so I suffer from depression and home sickness a lot.) I found myself saying how much I loved the city I'm living in (I normally say how much I fucking hate it) and just generally being excited and super active all the time. Granted, during this whole time I use cannabis (everyday) and drink alcohol frequently.

Then after Christmas I felt bad. But not too bad. I wasn't depressed really.. but I wasn't happy either. I was just relaxed and a little down Christmas had passed.

I felt pretty normal for a while, until a few days ago. I seemed to come up again, except this time I was feeling very paranoid. A friend I hadn't talked to in ages spoke to me on facebook about a job opportunity. This kid is a good kid and I shouldn't have a reason to distrust him. But when he was talking to me I felt very anxious and I felt like he was trying to scam me and rip me off. I freaked out and told him I wasn't interested. Right afterwards I went and got pizza, and the whole time I felt bug eyed and I looked at everything suspiciously. Afterwards, I barely remember what I did the rest of the night. 

Finally, comes to yesterday and today. Yesterday I felt great all day! I was super positive and had tons of energy. I talked all day during class . I talked pretty quickly and made tons of jokes. I felt amazing and on top of the world. That night I smoked a ton cannabis with friends before going home. Then I smoked even more wiwth my brother later into that night well knowing I had to get up early the next morning.

This morning after no sleep I felt terrible physically. I was irritable, restless, and frustrated. I drank coffee, started stressing out, started freaking out and went into a rage (Note: this rrage is probably the most angry I've ever been about something extremely trivial) about a friend not texting me back the night before. I drove around cursing and hitting things in my car. I came back home and kicked shit over in my room before I started crying and being angry simultaneously. I went to a book store and calmed down, and now I feel pretty good again. What do you guys think?",['ROOT'],0,neu_vader
4022,4022,0.7844474214943112,0.2155525785056548,0.18899999999999997,0.71,0.10099999999999999,"The last three weeks or so, I have put a lot of time and energy into trying to stop a fellow Redditor with a mental illness from trying to commit suicide. At least 4 times during this time, the person told me that they had in fact overdosed on their Lithium and other meds as well as alcohol.

I got very involved in this fight to try and save them from themselves, and very damn frustrated at the lack of help they seemed to be receiving in America. Over 100 messages flew back and forth between us, with them wanting to/ trying to die and me trying to help them see how they could live. It was heartbreaking and incredibly stressful for me. I cried long and hard for this person I had in fact never met. Especially those times when they said they had overdosed and then stopped communicating with me, stating they could not afford another hospital trip or ambulance ride.

Now, some of you are sitting there saying you were/ are doing an amazing thing. You have helped someone get through a really rough time. Good on you. You have it so damn hard yourself, but you did this anyway. Ok, I understand that. Thing is, the mental illness they have and I may also have on top of Bi Polar type one can make us incredibly skilled at emotional manipulation. After a traumatic childhood with serious abandonment issues/ abuse etc, this illness can make us seek attention in terrible ways. Self harm. Huge dependency way beyond normal on our partners and friends. I love you/ I hate you/ get out/ I will kill myself if you leave me. These are all too often said or screamed at loved ones. Usually in the very same conversation or argument

This leads me to where I am right now. How do I know this person wasn't just manipulating me? They certainly changed to a more hopeful tone of message after I told them I had overdosed because I couldn't cope anymore with not being able to help them and generally hating myself / seeing no way out of my condition(s). I spent 5 days in a psychiatric care facility , the first night on all kinds of monitoring because of what I took. ( essentially half my full weeks medication combination) I am still trying to scrub off the last of the tacky stuff from the heart monitor lead pads. ( 3M, you make awesome stuff but damn that glue...)

I have so many new appointments to keep. My partner wasn't able to work much so we had to hit up the charities for food for our family. So much damage wrought, so much potential for a far worse outcome. I was in and out of consciousness for two days. 

I am by no means a social worker, or someone at all qualified at suicide counselling. I should have directed this person to their local helplines and the suicide watch forums within reddit. I didn't and it nearly cost me my life and my kids a mother. 

Let this be a warning: look after number one first. Offer advice on matters you can speak to. Point people in the direction of proper assistance. Do not take on saving someone's life yourself. Do not necessarily believe that someone wouldn't troll you and take advantage of you, and fuck with you.

I am not by any means saying that I think that this is in fact what the person concerned was doing. However, I will never know for sure. They are just a nickname on a screen. No context and no contact in real life.

https://www.youtube.com/watch?v=5NZsCYOM4j0

I will just leave that link as a final word.
","['conj', 'compound']",0,neu_vader
4025,4025,0.9808438858888904,0.019156114111120764,0.039,0.8440000000000001,0.11800000000000001,"Recently I've just been to a wedding and it lasted until 1am, which means I put off taking my pills until then. In turn I had a violent episode. It seems that if anything gets in the way of my strict routine I'm unable to function properly. Could this be because of my age? (19), my coping abilities? medication? Any help would be great, it just seems like I'm constantly increasing my medication dosages in order to stay in the realm of sane because any little step out of routine makes me go flying...",['compound'],0,neu_vader
4030,4030,0.9922205147646146,0.007779485235367655,0.068,0.872,0.06,"I took this semester off due to a combination of poor grades and what I thought was simple depression. After a full blown manic episode which landed me in the hospital, I was diagnosed as bipolar. I now wish to go back to school but I have a few questions/ concerns:


1) My major often requires very late nights in the lab (it's not uncommon for half of my class to leave at 2AM). How do I deal with that, while still getting enough sleep?


2) I go to an out of state school more than 1,000 miles from home. The mental health services at my university aren't exactly fantastic, and there aren't, to my knowledge, any student support groups. Should I look for an outside psychiatrist for medication management or just use the school provided one?


3) Should I disclose my bipolar diagnosis to my academic adviser? I really don't want to use this as an excuse but last year she, along with two of my professors, urged me to seek professional help. ",['compound'],0,neu_vader
