,Unnamed: 0,neg_prob,pos_prob,neg_vader,neu_vader,pos_vader,post,dict,identifier,sentiment
1268,1268,0.6025674687172463,0.3974325312827604,0.109,0.7959999999999999,0.096,"Hey guys!

Here's a little bit about me: I'm 20 (almost 21) and for work I'm a Music Producer and Mix Engineer. I also have Bipolar Disorder, High-Functioning Aspergers, Post Traumatic Stress Disorder, and Anti-Social Personality Disorder tendencies.

This is the story of how I witnessed my Mum attempt suicide twice, myself beating alcoholism, and both my Mum and I being in the same Psychiatric Ward at the same time. The best thing about this story? We're both alive today. And we're the best we've ever been.

It all started when I was 15. I was in my final year of School, but unfortunately, there was something not quite right about me. I was constantly tired; I didn't want to leave my house for anything; and I didn't want to speak to anyone. I pretty much became a recluse who went from being a B-Grade student, to not turning into school anymore. And on the rare occasion that I did go into school, I was a nightmare. I'd argue with Teachers just because I didn't want to be there. I didn't see the point because all I did was fall asleep in all my lessons, which resulted in me being kicked out of all but 3 of my Subjects. After a couple of weeks of this, I went to see my Doctor. He made a referral to the Child Physician to see what he thought about it.

After a few more weeks of me going on like I did, I got in to see the Physician, and he sent me to a Neurological Hospital for various tests due to him suspecting that I had Narcolepsy. When the results came back, there was nothing irregular and nothing to point in the direction of Narcolepsy. The Physician then referred me to CAMHS (Child and Adolescent Mental Health Services).

It was there that I saw a Professor who, after seeing me a couple of times, came to the conclusion that I had Paediatric Bipolar Disorder. He then started to Medicate me and saw me every month.

After a while, the Bipolar was under control, and I was back to my usual self. It's what happened after that, that I really wasn't ready for. I woke up in the April of 2010 to my Mum coming into my room to wake me up. She didn't look well at all, and as if she'd be crying. I asked her what was wrong. She went on to tell me that she was Sexually Assaulted on the previous night. I didn't know what to say. Seeing my Mum like she was, was absolutely devastating. For a while after it happened she was very on edge, and the littlest noise made her jump. After this, she found the best way to deal with it would be with alcohol. She didn't know what else to do. She wasn't getting anywhere near the amount of help that she needed. This led to her drinking 6 days a week, and coming home crying after pretty much every time she went out. During this period I witnessed my Mum cutting herself; she went missing a couple of time in the night; and she'd tell me that she can't cope with it. Unfortunately, in the August of that same year, she tried to kill herself while I was asleep, one night. I found her when I woke up in the morning. Including the leftovers from her overdose, and the note she left.

Luckily, her best friend at that time was a Nurse who only lived two doors down from our House. I called her friend, and we got her straight up to the hospital. Mum was still breathing, but couldn't say anything. As soon as we got to the hospital they took her straight into ICU. I wasn't allowed in there with her, at this point. After waiting for about an hour and a half, the Doctor came to see me and my Mum's friend. The Doctor told us that if she survives what happened, then it was almost guaranteed that she would be severely Brain damaged. Later on that day, my Mum came round. And miraculously, she wasn't Brain damaged at all. All she did was apologise profusely to me. I told her it was okay and that I understood. I did understand. Mental Health Problems can make a person do something that they wouldn't usually do. It changes people completely, but it's not that person's fault. They have no control over it, and most importantly; they don't want to be feeling the way they do, either.

After this, my Mum got professional help from the Adult Mental Health Department, and more importantly, she got the help that she needed.

About 2 years after all this happened, things started getting rather worse again. In the build-up to my 18th, I was drinking heavily. From my 18th onwards, I was doing what a typical 18 year old does: I was out every weekend getting so drunk I threw up everywhere. Unfortunately, this led to me not only drinking on the weekend, but also slowly started drinking more and more throughout the week, too. This obviously led to me becoming more and more unwell again, mentally. My medication was all changed around by my Psychiatrist, and he told me so often to cut down on the drinking. At that time I obviously knew best, and ignored what he had to say. Along with what my Community Mental Health Nurse had to say, as well. The drinking progressively started getting worse. My whole family was concerned about me, but I didn't see what I was doing wrong at that time. Little did I know that the reason I was drinking so much was to try and get rid of the flashbacks I was having due to everything I saw over the previous years.

When my drinking was at it's worst, I'd be having a bottle of Whisky a day, at least. This led to my medication being hiked up in dosage on a regular basis. This, along with the amount that I was drinking, resulted in about 10 stone of weight gain and enough medication to knock out a Horse. When I wasn't sleeping, I was eating or drinking.

In the New Year of 2013 I was admitted into an acute Psychiatric Ward. I'd hit rock bottom and I didn't see any way out. They managed to safely get my off the alcohol, and started sorting my medication out. I was in there for a month until I was then transferred to a Rehabilitation centre, which I stayed at for another 2 months. When I was in there, I was made aware of how bad my weight was. I was 22 stone. This, for me, was horrifying in itself. I'm a former World Champion Martial Artist, who was about 68kg when I was fighting, which was only 2 years prior to this. I was told that I needed to shift the weight, otherwise I'd have about 6 months left before I had Diabetes.

During my time in Rehab, I was pulled into a room for a meeting with my Mental Health Nurse. I was then told that the previous night my Mum had attempted to commit suicide again, but she was still alive. I went over to the hospital to see her immediately. It was then that I learned what was going on at home with Mum, whilst I was in Rehab. She split up with her boyfriend, was undergoing a lot of stress at work due to short staff, and she was up visiting me every night. Her Psychiatrist prescribed her Valium the day before she attempted suicide, and it was that which triggered her Depression and let to this happening again.

A couple of days after the attempt, she was admitted into the same ward that I was in. In the history of the hospital, we were the only Parent and Son to be on the same Psychiatric Ward, at the same time. When I saw her in there, I was relieved. I was relieved because I knew she was safe in there. More importantly, I knew they were going to get her sorted. Unlike me, my Mum spent 6 months in there, and I must say, she's never been better.

I relapsed a few months after coming out of Rehab, but I've now been sober for just over a year, now. Along with my Mum. Neither of us drink anymore, we're the healthiest we've been and we're the closest we've ever been. Along with that, since I stopped drinking and my medication was sorted out properly, I managed to lose 8 stone. 

Some people, including my Mum, ask me this question: Why aren't you mad at her for what happened? This is why: My Mum brought me up on her own, and always managed to keep a roof over our heads, and both of us fed and warm. She made sure I knew I was loved, and that was more important to her than anything. Mental Illness can severely distort how a person acts and behaves, and until that person is properly treated, they won't be themselves. This is what happened with my Mum. I knew it wasn't really her doing all of that. I knew that when she got the help that she needed, she'd be back to her usual self. And I was right.

There's a bit that I haven't touched on, but all the key events are there.

The reason for me sharing my story with you guys is to help. I want people to know that things do get better. Times won't always be hard, and the bad times will pass. Even if it seems like it's going on forever, it will end and things will get better.

This is 100% a true story, and if anybody has any questions about anything that I've said, then I'd be more than happy to answer your questions.

Much love.",['nsubjpass'],0,neu_vader
1279,1279,0.9844602509348084,0.01553974906520161,0.0,0.636,0.364,"I have been diagnosed for some time.  I have tried a number of things, meds, life-style changes, etc.  Just like many of you on here, I have been up and down but I am finally ready to make sacrifices to be ok.  I am now making a few big life changes and want to incorporate meditation as part of me well-being approach.  Does anyone have any experience with meditation?  What forms work best? And can you point to some resources.  Thank you all!  

Edit: Thanks for all the great tips!  Wish me luck :D ",['conj'],0,neu_vader
1290,1290,0.9996896056931841,0.00031039430680862,0.243,0.667,0.09,I suffer from bipolar disorder (diagnosed) and have been curious to see what type of medication treatments others have been on.,['compound'],0,neu_vader
1306,1306,0.04298285155409722,0.957017148445922,0.063,0.821,0.11599999999999999,"I remember back when I was in high school to a few conversations with friends about dreams. My dreams have always been cyclic (as with many things in my life) and I described periods of vivid dreaming and periods of no dreaming. Additionally, my vivid dreams periods would be dominated by either hyper realistic desires-come-true dreams, or they fantastical adventures of nonsense and wonder. Usually these periods would go on for a week or so before they changed, and my most common state was no dreaming. This fits exactly with my mood cycles. **mind blown**

I'm gonna pay attention to my dream patterns from now on and see if I can use it as a tip off for what mood I'm in. I'd say, though, that on medication my dreams are toned down compared to what they used to be like. One time I had a dream that I was adopted and my real dad was my favorite professor. He was cool, but it was crazy to go through. When I woke up that experience lingered as if it had been reality. It took days for me to recover from it, and every couple months during my depression it crops back up in my mind. 

When I was taking trazodone for insomnia I always had dreams that everyone was ""out to get me."" I also didn't sleep well on it, so that didn't become a regular medication.

Incidentally, several songs I've composed have to do with dreaming including one of my favorites to date.",['attr'],0,neu_vader
1307,1307,0.4533854664142781,0.546614533585704,0.16699999999999998,0.693,0.14,"After almost two decades of diagnosis, I have learned to manage many of my most acute bursts. But every once in a while, usually during mixed states, I completely lose myself to anger. I'd love to hear about any stories, mechanisms, rituals, supplements, or even meds that help you all through anger. In daily life I am hardly ever angry, and it is the emotion that I feel the most shame in demonstrating. 

I'm always very inspired by you, so thanks for any thoughts.",['conj'],0,neu_vader
1322,1322,0.9951774788535354,0.004822521146462072,0.028999999999999998,0.835,0.136,"Bipolar ll in remission (no meds and healthy over 3 years) 

I've recently started smoking thinking it would be a nice relaxing way to chill out. Personally, after a few bong rips I end up thinking faster. Not manic, it doesn't affect my mood, as I feel I can control it. But usually I'll sit there and get nervous about how massive Space is; watching Interstellar really had me going. When I lie down for bed I can recall every dream I've ever had. In addition it's like my mind takes random objects and forms them together (like a chair will form into a dog's head, then the ears will become an ocean lol). It's messed up and has really made me think twice about the benefits, if any beyond expanding your mind. 

Just wondering if anyone else has similar experiences or what's it's like when they get high. Cheers folks,",['appos'],0,neu_vader
1327,1327,0.3664387597418111,0.6335612402581923,0.09699999999999999,0.765,0.139,"My life is finally coming back together after having my first manic episode in late 2013 after being undiagnosed (I'm Bipolar 1 with recurring mania) until 26 years old. My life was always chaotic but I was able to fight through everything and the Dr. told me I was able to hide the symptoms due to my intelligence. 

I was able to complete an A.A.S., a B.B.A, and an M.B.A all with a focus in Accounting. I went from starting a career as a financial analyst with a major corporation and being engaged living in a beautiful apartment to being on the streets and living in my car by choice for 8 weeks as a way to toughen myself up. I ended up getting caught stealing and fought 4 police officers (mania made me a beast I was immune to pepper spray and a tazer) leading to 5 months of incarceration and a year and a half of probation (no felony luckily). 

Following jail and court ordered medication (lithium) I have gotten control of my life enough to move forward again. I have enrolled in a DBA program and start at the same time I get off of probation. During probation I worked as a plumber and speculated in stocks to squeeze together some cash to be semi self dependent again. Unfortunately I had to move out of state back into my parents house again. But I've been together with a wonderful logical understanding woman (a litigation attorney) for a year now and we will be moving in together shortly after probation finishes up. 

Our lives are full of extreme highs and lows, but I want everyone to remember two things:

1.) If it doesn't kill you, you become stronger.
2.) Keep moving forward: whether you are experiencing heaven or hell. Keep moving forward. Never quit.

I love you my bipolar brothers and sisters. Strength and growth come only through continuous effort and struggle. We have more hardships than most due to our condition. On the flip side just remember from that you have the potential to be stronger than most. 
",['nmod'],0,neu_vader
1336,1336,0.9882507207915029,0.01174927920848737,0.10099999999999999,0.7809999999999999,0.11800000000000001,"Hey BP it's been awhile, I do hope everything has been dope for y'all in the last few months. Anyway, I just need some advice, and I'll keep it as short as I can. I've been very off recently. I've been as down as I can be on my meds, and I've been trying hard to shake it, and well you know how it is. For a month now, every other thought in my mind is about offing my self. It's like my inner monologue is betraying me in the worst way. If I don't take my meds' (forget, or the whole ""I don't want to move, and they're over there, so I'll try again tomorrow"") it kinda gets over whelming, but I guess that's sorta the nature of it all. If I wasn't half convinced my doctor is experimenting on me, I'd probably go see him, but that's another issue. I have great support, good friends, hobbies to keep me distracted, ect, and I know that my feelings and thoughts are irrational but it doesn't change that they exist. 

To cut to the chase, I feel like shit, though I shouldn't, and while I am trying to push threw it, I can't stop thinking about just ending it. It's maddening. I don't need to go into it, because I know most, if not all, of you know exactly what I mean, and how I feel. How do I get it to stop? What is your coping mechanism? It's been a while since my brain was out to get me, and I forgot what to do. 

I hope this all makes sense. ",['poss'],0,neu_vader
1350,1350,0.9991391583485404,0.0008608416514454176,0.064,0.8490000000000001,0.087,"The last 3-5 days I have been sleep deprived more than usual. It hasn't sent me into manic or hypo symptoms yet but I feel like its only a matter of time. The thing is.. I'm on heavy duty sleep medication... I take 30mg Restoril, 50-100mg trazodone and sometimes I use up to 6mg melatonin.. Tonight I got 2 hours of sleep  and I am UP..praying for more sleep because my whole schedule gets screwed up if I don't get at least 7 hours in. 

What are your suggestions, tips or comments regarding this, I could really use some help!",['attr'],0,neu_vader
1355,1355,0.9995157790352128,0.0004842209647700023,0.276,0.7240000000000001,0.0,"- suicide prevention
- when is the right/wrong time to ""talk about it""
- changing medication
- coercion into therapy (again)
- communicating through mania

- dealing with my own frustration
- when not to just ""let it slide""
- dealing with him blaming me
- dealing with my guilt about doing the wrong thing sometimes",['compound'],0,neu_vader
1361,1361,0.9967799191823422,0.003220080817644725,0.20800000000000002,0.748,0.044000000000000004,"22 year old female here. I've experienced bouts of depression since I was a child. My mom had severe psychological problems and I ran away from home when I was 12 after years of abuse. I never saw her again, as she died of a drug overdose when I was 19. I was young but her behavior was simply and at best described as maniacal. 

When I was 15 or so, it really started kicking in. I was always depressed, and dipped into suicidal thoughts frequently. I used to carry razors in my wallet to school and self harm in the bathroom stalls during lunch. I remember spending the entire summer break from school in my room in the dark, watching TV and reading. I barely ate or slept. I didn't talk to anyone. 

The mania spells the last few years have gone from not eating and sitting in a dark room crying to fainting, vomiting, crying uncontrollably, lashing out at everyone around me, hating everything and having morbid thoughts. Recently, I found out that my boyfriend was kissed by some drunk girl at a concert. We were arguing over the whole thing and I was being unfairly angry at him about it and at one point, I had a pair of scissors pressed into my neck and was threatening to kill myself in front of my boyfriend. I cut my neck and bled a bit, and the look on my boyfriend's face after he fought the scissors out of my hands and we fell over in the process. I'll never forget that. 

I'm starting to hate myself and feel hopeless. This is something that I've realized isn't just sporadic melancholy and it's something out of my control. If this is something that can be treated in anyway, I need to do something as soon as possible. 

I'm generally skeptical of being medicated for psychological issues (from observing my mom on everything from lithium to prozac). If you're on any kind of medication for bipolarism, what is it and how has it affected you.. negatively or positively? Is there any kind of alternative treatments besides therapy and medication? I'm not looking for mysticism or yoga retreats - some real shit with testimonies and research that back it. ",['conj'],0,neu_vader
1367,1367,0.986286595988618,0.013713404011367754,0.188,0.6809999999999999,0.131,"I'm really nervous posting because I'm not sure exactly how to phrase how I'm feeling and I feel like I'm putting myself out there, but here goes. 

I'm feeling extremely stressed and anxious the last few days. It's been a very difficult month with school and money and all that good stuff. I ran out of one of my meds a few weeks ago and have been feeling fine until recently. I'm having trouble finding a doctor as I've just moved in the last couple months. Even if I could find one, I don't have the money for the appointment or meds. I also have had trouble getting a good answer from a doctor about which type of bipolar I am so I'm really confused I can sometimes tell when my moods change, sometimes it's like a drop of a pin, sometimes it's gradual. I sometimes feel like I'm having a battle in my head as my brain will tell me that people don't like me, I'm awful, blah blah, but I know it's not true. 

It's just a really weird feeling and I guess I could just use some encouraging words. I don't know a lot of people and I don't know anyone well enough to talk about this with. Sorry for the wall o' text and maybe the disorganization.",['conj'],0,neu_vader
1368,1368,0.9997675556007192,0.00023244439929036143,0.252,0.616,0.132,"First post here. Me, 34 yo, long history of depression, finally diagnosed BPII around 7 years ago, struggled with meds, finally found the right combination 4 years ago. 

Before finding the right meds, I was so anxious and depressed I -never- left my home. I was a prisoner to my anxiety for almost 3 years. I stopped living. Learning to live again with my new meds, I started to enjoy life, I can now travel, move around, I have friends, a job, a place, a boyfriend ... But now what ?

For 4 months now I have been feeling ... nothing. The only time when my life seems to be interesting is when I get a slight surge of hypomania. Other than that, I feel numb. Dull. Like this time, I have nothing else to look for. Like I'm sad that I'm cured. But not sad. Just bleeeeeh. I don't want to kill myself. I'm in no danger. I just hate my numbness. And I'm so tired all the time. I have no joy. I have no sadness. I only have this weird dull state of nothing. 

My meds : depakine 500, abilify 5mg, paroxetine 20 

Anyone feels like this ? Any clue ? Any hope ?

Thanks

GGG",['ROOT'],0,neu_vader
1369,1369,0.9985259728142044,0.0014740271857826262,0.07400000000000001,0.7609999999999999,0.165,"After quite the interesting upswing yesterday (worked, went to the chiropractor, refilled meds, bought groceries, and then went on a 7 mile walk with a super huge smile on my face because everything was beautiful) most likely induced by lack of sleep, I managed to get 10 hours of sleep last night. 

And this morning, while I was still calm, before I had coffee or my morning meds, I realized I had not showered in 4 days. I managed to remedy that this morning before taking my kids to the store and BUYING ALL THE THINGS. I don't usually buy expensive things. Today I bought $150 of random crap because it was fun. We got 6 bags off little stuff. On the plus side, my youngest told me I am a great mom today. (Yeah, right)

But I feel like I am on the brink of doing something stupid. I have permission to raise my dose of seroquel to 200mg, but I don't know if I should. We (kids and husband and I) are going somewhere in the morning and I don't want to be too sleepy to be the mom. Plus, so far it has been mostly harmless (just expensive) fun.

There is that little tiny warning light blinking in the back of my brain. I feel great though. Logical me says this can't be good. But then there is that feeling that everything is awesome and I am totally in control (red flag!). Why can't I just enjoy feeling great for a while? 

I think I will enjoy this a bit longer, but give my husband permission to force me to take seroquel if he thinks I need it. That's rational, right?

This is so bizarre. I can't believe I am arguing with myself about loving life.",['conj'],0,neu_vader
1379,1379,0.9934190469943072,0.006580953005710031,0.131,0.708,0.161,"Does dealing with bipolar disorder make it hard to have a relationship with church, religion, or God for you?

I have turned away from going to church and church groups.  In a way, turned away from God too.  I rarely pray anymore, not before bed every night like I used to.  I still believe in God, I'm not an atheist, but I don't think religion can help me the way it helps most people.  I do think some good can come out of prayer.  Honestly, I am a little bit pissed off at God for laying this curse on my life, I think anyone would be.

It seems the right medication, not Jesus, will save me from myself.  Nothing against Jesus, I'm a fan, but no amount of prayer is going to level me in the midst of a psychotic manic episode.  Only heavy anti-psychotics will do that.",['oprd'],0,neu_vader
1405,1405,0.9935392416860342,0.006460758313977859,0.066,0.8290000000000001,0.10400000000000001,"Hey All,

Longtime lurker here.  So, several months ago, I had the brilliant idea to go off my medication because I convinced myself my bipolar II diagnosis was completely baseless.  One hypomanic state later, I'm now severely depressed.  I'm trying to see the silver lining in this; that is, now my bipolar diagnosis has been clearly illustrated, and I can't really deny its existence in me.  Anyways, I'm in quite the quandary.  I'm all out of medication because I threw it all away (thank you hypomania).  Closest psychiatrist appointment I've been able to schedule is for 9/8.  This seems like such a long time to have to endure daily deep depressive states.  Anyone have any insight as to how I could expedite the medication process? ",['compound'],0,neu_vader
