,Unnamed: 0,neg_prob,pos_prob,neg_vader,neu_vader,pos_vader,post,dict,identifier,sentiment
2414,2414,0.6299245358514696,0.370075464148498,0.11800000000000001,0.706,0.17600000000000002,"    I love this sub.  I come here when shits bad, or when I'm doing well to try to encourage others to get through their hard times.  About 2 weeks ago, I aired a short list of grievances after crying in a bathtub, and I managed to get it out of my system, go to work, and have a good day.  It seems everyone around me IRL is depressed if not suicidal.  Seeing as how I'm open with my diagnosis, they seem to come to me to advice I'm not qulaified to give.  I try to calm them down, and get them to seek treatment, but that's not what they want, they want a quick fix ""because I'm doing so well!"". Yeah, well that took time, effort, and more time.  It's been about 7 years since I was diagnosed, and I sort of knew I was before it was confirmed, but I'm not liking my new role as the go to girl, when I barely have a handle on things myself half the time.  Outwardly I do.  When I need help, I get it, but I don't want to bog people down with my problems.  Venting here and there, ok, but being Debbie Downer isn't going to fix anything.  These are people I care about, but there's no nice way to say ""Hey, I'm having trouble myself.  I have my own problems.  If you're as bad off as you sound, nothing I can do or say will be the band aid you're looking for. If you don't want to go to a doctor, then I can't help you.  Kindly fuck off.""
     Last summer I had my gall bladder out, and it was supposed to be a simple operation and a speedy recovery.  HA!  I feel worse now then I ever did before.  I was in so much physical pain for so long, I actually didn't have any bipolar symptoms. Well, maybe a few, but with that much physical pain to focus on, it was a distraction to say the least.  My family doctor and various specialists agree there's something going on, and the gall bladder wasn't my main problem.  There's a good chance I have Crohn's or something like it.  Even with good health insurance, I can't afford the constant doctor visits, tests, and meds (that don't seem to do jack shit).  I was more or less fine from Thanksgiving until the middle of April, and now I'm back to sharp pain, not being able to keep food in or down, and fatigue.  It sucks.  My eyes and joints are in agony, and I just turned 30, wtf?
     My fathers staying with me and my husband...it's going better then last year, but I'm on edge.  My husband likes my dad, but this is the 3rd time in 7 years he's stayed for an extended period of time.  His divorce from my mom left him with all of $550 a month in social security.  To his credit, he's been traveling the world and meeting people, living out of a carry on bag.  But, how do you tell a parent you love ""get out, you're kind of fucking up my marriage?""  My husband and father like each other, and respect each other to an extent, but it leaves me in an awkward fucking position.  We told my Dad, one month, which is the month of May.  He's now making plans in June.  Not cool.  But I'm so exhausted and fear conflict, so I've been putting off telling him that at the end of the month he has to go.  
Ona final note of my update, seeing as you all seem like nice people, to help make ends meet I took a job as a fetish model. I love it, it's so much fun.  I thought about it for about 2 months before I signed the contract, my husband fully supports the idea, and close friends and family know.  It's not a secret, I'm not ashamed (I smoke cigarettes, pop balloons, have pillow fights, and there's no nudity), but it's strange.  I'm getting fanmail from around the world.  It's surreal.  So, I do hair 3 days a week in my dream salon with an awesome boss, and have a side job 2 days a week as a fetish model, it's crazy, but in a good way.  It's hard to believe this is my life.  
So, even with all the mental, physical, family, and financial problems, I can say I'm doing pretty well all things considered.  I don't really know why I'm sharing this with all of you....I just wanted to talk and have someone who has no idea who I am IRL listen, even if only one or two people reas this, cool.  Bipolars not the end of the world.  I've been hospitalized, and think about offing myself more then I care to admit, but...I feel all super cliche saying you never know where life is going to take you, and for all the many sucky aspects, try to make the little things count.  I do, and it really, really helps.
     Sorry for typos, I took sleeping pills and they're not working...that's not a good sign, but I'm using the time to be productive around the house, and enjoy the peace and quiet while my husband and dad are asleep.  
     Thank you to anyone who reads this.",['conj'],0,neu_vader
2431,2431,0.8948316984913798,0.10516830150862863,0.19899999999999998,0.755,0.047,"I can't afford my therapist or my meds anymore and that sucks because I've never been this depressed in my entire life. I sleep for 12-14 hours a day, don't eat.. I don't do anything.. well except drinking. Nothing lately seems to go right. I even cry at work. I hate my job, in a mountain of debt from school and credit cards, barely making ends meet and struggling to keep my head above water. I dislike the person I am, if that makes sense. Sometimes it just seems easier to take a bunch of sleeping pills and not wake up from it. Assuming that still works. ",['conj'],0,neu_vader
2488,2488,0.9997201179009609,0.00027988209901963425,0.11199999999999999,0.8009999999999999,0.087,"After a very odd reaction to antidepressants (during which I had daily visits from the local health crisis team,  apparently tried buying all sorts of drugs, cycling to London and back and was convinced I controlled the weather) words like 'bipolar' and 'manic' were thrown around a lot. 

I've since stopped taking the antidepressants, and have come crashing back down to earth... I don't think I've ever been this low. I can't stop crying, I've had constant thoughts of self-harm and suicide even though I thought I'd got over that, and had developed better ways to deal with those thoughts. I can't go back to the doctor because I'm terrified that if they give me another antidepressant, I'll just go right back up and bump my head on the moon again. The only thing keeping me going is the hope that whatever the last two weeks were (I don't actually remember any of it, the only accounts I have are from friends and family, who unanimously say I was acting completely out of character) can ultimately be sorted out. I've been discharged from the crisis team, because I'm no longer moonlighting as Mother Nature, and am now waiting for a referral to an actual psychiatrist (my case workers were mostly nurses because I was with my parents and therefore was unable to do anything serious enough to put myself at actual risk, and therefore warrant expensive inpatient treatment. God bless the NHS) and a formal diagnosis, and more information about what exactly that entails, medication and how to deal with my troll brain. In the meantime, I find myself wondering what the fuck went wrong and how I'm supposed to get up from this.

I'm 19 years old, am/ was attending a prestigious university and doing a degree I absolutely loved. (I've been advised to take a year out and change courses). All of the careers I was considering will now probably be off-limits to me because of the events of the last two weeks, and certain aspects of the course could cause quite a few problems for my future mental health. 

I just feel incredibly alone and terrified right now because it seems like my whole life is falling apart around me and I have no idea what to do, and it would be nice to speak to people who have been there, and know that it can and does get better. 

",['conj'],0,neu_vader
2496,2496,0.9999113373529892,8.866264700525905e-05,0.235,0.691,0.07400000000000001,"I have a history of substance abuse, am bipolar type 1, with ADD inattentive. Meds I'm on: Lamictal, Risperdal.

The ADD, I can describe as... lack of motivation, lower likelihood of finishing what I start, easily distracted, lack of general social skills, trouble remembering events and skills.

The bipolar type 1: Very prone to depression. Medicines/caffeine can cause hypomania leading to mania. Used to have opposite of euphoric mania (forget term). Loss of sleep. Eating more in depression, no exercise. Eating less hypo/mania, excessive exercise. Obsessive behaviors.

Substance abuse: Very prone to stimulants/affinity. ""Dry drunk"" at times.

I can't take ANY stimulants ADHD medicine, including Provigil which we just tried. He offered to last choices: Wellbutrin XL and Strattera. With my background, which do you think is better? Anyone else on these combos?",['npadvmod'],0,neu_vader
2502,2502,0.996670330210324,0.003329669789659689,0.127,0.8009999999999999,0.071,"It all happened my first week of school. I had been smoking a lot of pot and took 3 edibles one night and I think thats when it all began. From those 3 edibles I was really high and started having crazy ideas about my future. I decided to pursue them and dropped all of my classes to switch my major to being a veterinarian(i have always loved animals). I started sleeping less and was very excited and energetic about my new major and lifestyle(i wanted to be healthy work out alot and be a better person). All of my friends thought the change was good I was no longer a bum. However my mother (a social worker) knew something was wrong. We spoke a lot and I realized I didn't want to change my major and was getting everything back in order to what it was. Still had the good energetic mood though. My mom saw I still wasn't normal though and drove up to school and caused me a lot of stress. The stress made me more energetic and irritable. She ended up calling the police cause I wouldn't listen to her, which brought me to my hospitalization. At the hospital I was very irritable and didn't want to listen to any of my doctors, I thought I was there under my own will and just wanted to leave. I wasn't and when I found out went ape shit. All I knew was that I didn't want any more drugs in my body. So I refused all medication cause I didn't even know what they were treating me for. There were so many different doctors who would talk to me I couldn't remember anyones names, and wouldn't listen to anybody. I eventually gave up and just started taking whatever they gave me (lithium and respirdal). During my stay there I had a terrible short term memory and would leave shit everywhere. I got very paranoid of the other patients thinking some were even my own doctors. But even now that I'm out a month later, I still know or think something was fishy. A lot of my paranoia I think was justified and still is. Other patients messed with me at times and I couldn't take a joke in my state. I did eventually come back to myself and got released and am now staying at home for 2 months working a boring job, waiting to get back to school next semester. I have no depression and didn't at any point. I think if my mother didn't intervene I would have had a hypomanic episode at school. However, because she intervened and had me hospitalized the episode got much much worse. I am never anxious and never stressed out from anything literally nothing in the world stresses me out. Is it possible the whole experience was only brought on from a month long of smoking weed and 3 edibles in one night, and is it possible that I can avoid having another episode by never doing that again? Can I still get drunk with my friends if I've never had an issue with drinking and used to drink a lot with no problems?

TL;DR This is the story of my first episode.",['compound'],0,neu_vader
2512,2512,0.9999601570462596,3.984295374540855e-05,0.419,0.581,0.0,"Main post here:

http://www.reddit.com/r/bipolar/comments/39un5n/bipolar_ii_medications_almost_killed_me_and_will/

New Diagnosis:

Multiple Organ Failure due to Lithium toxicity (even at low doses), severe additional damage to Kidneys due to Topomax.

Expected prognosis: Death.

There you go. I'm fucked.
",['appos'],0,neu_vader
2513,2513,0.9874582938985252,0.012541706101485896,0.175,0.735,0.08900000000000001,"EDIT: I Am currently med free. I had a diagnosis several months ago (BPII) and have been on the waiting list for help/treatment ever since. The last month things have become so severe that I tried to take my own life. As a result the local Mental Health Crisis Team have stepped in (UK).

A crisis team psychiatrist is coming over in the next hour to discuss meds/treatment plan after a failed suicide attempt and extreme trauma as a result.

I already have a type II diagnosis but they have been assessing me to form their own conclusions about me for the past week. Lots of home visits / signed off work etc.

Depression is definitely my biggest problem, not just right now but in general so I really want that addressed with the right meds ASAP. I just can't take much more of this.

BUT I know that anti depressants are a no-no and can just kick you into hypomania rather than treat depression, at least on their own. I also know from what he suggested before that a mood stabiliser would be his preferred choice to start out with. But can SSRI's work in conjunction with mood stabilisers?

Have read stories of people saying stabilisers can work wonders and really help hypomania's but not so much with depression?

I'm just freaking out a little because I NEED these depressions addressed a lot more quickly than I need the hypo's calming down right now...

Argh sorry was meant to be a short post but has ended up as a rushed rant.

Thanks as always for any help!!! xx","['amod', 'compound']",0,neu_vader
2526,2526,0.9863699712471884,0.01363002875281573,0.087,0.8,0.113,"$50,000.  
I feel like shit.  
edit: It is a combination of insurance, out-of-network psych/therapist visits, and meds.  
It's not quite $50k, it's more like 30k. We changed my insurance today and I cut my therapy visits in half. Zzz   
  
The last in network psych I went to was a pill pusher. He gave me lexapro the first day I met him and I dropped out of school to pursue my gaming career... Who gives a bipolar person SSRIs? Lol..  
edit 2: Thank you for being nice to me",['conj'],0,neu_vader
2532,2532,0.3324486491083002,0.6675513508916956,0.158,0.7809999999999999,0.061,"Hey guys,

So first of all, I know you guys are probably wondering why I'm posting here instead of going to the doctors? Well, firstly I am in the process of seeking medication help, but there are limitations due to my current residence in order for me to get a psychiatric evaluation. Anyways, I don't want to go on too much so I'll get to the point.

I won't go into too much detail about my past. But I used to have crippling OCD from the age of 13-17, back then it had a lot of physical compulsive behavior. I still have OCD, but it is mainly mental compulsions. I've had severe depression, insomnia and anxiety all of my teenage years. However, I want to focus on the last couple of years in which gives rise to the notion of thought that I may have Bipolar. 

I suffer from very extreme daily mood swings, they can be quite drastic, one minute I can be fine and the next minute I simply feel suicidal and that my whole world is falling apart. I suffer from general irritability, I have trouble sitting still sometimes and especially when I'm trying to do school work. I mean it takes me extra HOURS to do assignments, in which others have ease with. In the last week I've been having anxiety attacks, I've been getting 1-2 hours sleep because my heart is racing so much. I've ALWAYS had racing thoughts throughout my head, depending on my mood. I've seemed to notice extreme episodes and periods of depression and sometimes I as if I fit the criteria of a 'mix mania episode', though these mixed episodes are only for a few days. The problem is that from my understanding someone with bipolar should be experiencing episodes that last for months. And well for me I experience heavy episodes of depression for months at a time, and there's been one or two months that I've randomly felt completely normal in the last two years. The thing I feel as if I don't fully fit the criteria for is a manic episode, I've felt as if I've experienced manic episodes for one to four days at a time, but I haven't experienced it for months at a time. 

I'm in desperate need at the moment, due to my mental health difficulties I'm incredibly behind. I have exams coming up and I have phenomenal amounts of work to do in order to prepare. But I'm unable to prepare because I have to spend hours battling my emotions, and I can have mental fatigue randomly throughout the day then I can suddenly be fine.

I do think I could potentially have Borderline personality disorder, I'm really not sure at this point and I'm incredibly stuck :(

I would appreciate any help given.
Thanks a lot.",['compound'],0,neu_vader
2548,2548,0.9890122883188496,0.010987711681134837,0.077,0.833,0.09,"My cousin is, as I understand it, Bipolar.  He's gone through hell and back over the last few years getting through the initial diagnosis, medication, etc.  He has been really good the last little while.  He's fun to talk to, rational, wants to learn and get life together, however I'm worried he's slipping into a manic episode.  

I think I now know what his mania looks like.  Conversations begin to feel jagged and awkward.  Often feeling as though he begins in the middle of a conversation.  He starts to ramble, and get scattered and unorganized, and his humour turns deranged.  He'll make up some rambling story about finding money under the tongue of a boy with syphilis or some such nonsense.  I guess he thinks it's funny, because in this state, he has no regard for who might hear these stories and seems to act like other people are in the wrong for not liking them.  I get the feeling that he just craves attention in this state, good or bad.  I saw him today, and he showed all of these symptoms when I tried to talk to him.  I talked to his parents and apparently he is no longer working, and has, on a number of  occasions, been out all night wandering around after going to parties and drinking or whatever.  Just tonight, my aunt and I called him to go get him from whatever party he was at, and he gave us an address we couldn't find and then we couldn't get a hold of him after that.  I'm going to call him as soon as I wake up and see if I can talk to him or something.  We're worried he isn't sleeping

Sorry about the stream of thought, but onto my question.  How do I talk to someone going through a manic episode?  Should I be direct and tell him ""You aren't making any sense."" Or should I try and ignore the obnoxious behaviour?  I really want to help my cousin, but I have no idea how to approach him when he starts derailing the conversation.  Any and all suggestions, or anecdotes are greatly appreciated.  ",['conj'],0,neu_vader
2549,2549,0.9998606986027551,0.00013930139723677528,0.15,0.85,0.0,"You shouldn't be on antidepressants if you're bipolar. They make bipolar disorder worse. I'll see a thread asking people what medications they're on and a lot of people say they're on antidepressants. I've asked my psychiatrist about going on antidepressants and he won't even consider it.

Edit: Woah you guys got mad it was just a question.",['dep'],0,neu_vader
2553,2553,0.9975073266192092,0.0024926733808107713,0.057999999999999996,0.855,0.087,"I am temporarily without insurance and am on a budget, so I have to go about two more months without meds or seeing someone. I've been without meds for about four months now, so the ""just coming off meds"" hell isn't really a thing right now. But is there any advice on diet or anything a person without a lot of money can do to help regulate bipolar symptoms as best as one can on one's own?",['nmod'],0,neu_vader
2556,2556,0.3184032459694105,0.6815967540305822,0.08,0.762,0.158,"First, forgive any errors in formatting please, I'm on my phone. 
Obviously this is a throwaway account. We are both Redditors, my partner may even see this, but after reading the posts in this subreddit I figured I'd throw my story out there and see what advice other people in my situation could give me. 

My partner is bipolar, and we have always known, but she was recently diagnosed (rediagnosed really) after seeking out help and finally getting on meds. This all happened after I left about three weeks ago. In the 5 years we have been together she has cheated on me several times, twice with the same person, and up until the last time I forgave her for all indiscretions because I know about the mania and the fact that bipolar people have a tendency to cheat to satisfy it. She was always remorseful, apologetic, and regretful, so I always forgave her with the hope she could control it. The last year, however, I feel her manic episodes reached a level in which she could not control herself whatsoever. So, long story short, she cheated again with someone she has cheated on me with before, I reached my breaking point, and I left. 

Now she is seeking help, she is medicated, and she is doing much, much better. Therapy is allowing her to finally see why she has been behaving the way she has, and she is coming to terms with her illness and that therapy and meds are a lifelong commitment she has to make to stay stable. I love her with all my heart and support her decision to get help 100%, but I am scared this will all happen again one day. I want it to work, I really truly do. I can work with the mood swings, I can work with the healing, the ups and downs, but I can't work with the cheating. She wants it to work as well, and has done everything I asked her to do to get herself better since I left. 

So, I suppose what I am asking is if anyone here, whether the spouse, significant other, or the person who is bipolar themselves, has been in a similar scenario and what your outcome was.  I know redditors have a certain hive mind, so please refrain from the old ""gtfo while you can"" comments. I am just looking for similar scenarios and what the outcome was. Thanks guys - this sub has really helped me view things from a different perspective.  ",['conj'],0,neu_vader
2557,2557,0.9924504958782,0.007549504121792414,0.11599999999999999,0.773,0.111,"I've been reading a lot of posts lately about how we think and process information faster than the average bear, of this I'm already aware. The problem is that I feel like I'm perpetually stuck interacting with people who get lost on the straight line I draw them in big black sharpie. I'm logical, methodical, grossly overeducated, and try to provide scientifically founded explanations and suggestions to people. I openly admit that I am a seeker of knowledge and love sharing it. I hate seeing people making uninformed decisions as.  So I'm baffled when I lay out a simple line of logic and people are lost and respond with vitriol and ignorance.

Example: I wrote an email to one of those daily deals type companies suggesting a feature that is available on the website but not the app - see what was removed from expired cart. Get reply about how the cart must be randomly emptied at x time so other shopper's can buy things. Replied, let's not all pretend that you haven't had the same items listed for months, you have stock, and placing an item in a cart does mean no one else can buy it, that's not how online purchasing works. Ergo, no reason to randomly empty the cart. But that's still not the point. The point is the janky app. Pass along the app suggestion that you can easily locate dropped items to the app Dev team. 

Why was it necessary to spell that out for said person? 

Example 2: ""used this shampoo and grew 3 inches of hair in a month"" posted on a board for people with trichotillomania. I explain all the scientific reasons this is unreasonable, explain sources of error in measuring hair length (mostly its stretchy and no one has hair all one length unless it's Flowbee'd or buzzed.) Also scientifically measured hair growth rates. Get accused of being negative, breaking spirits, hurting feelings. Counter that snake oil salesmen are alive and kicking, point out lack of critical thinking on their part, and willingness to try anything for a cure. Do your research, know that when things sound too good to be true they usually are, challenge these claims, stand up for your intellect, don't be pandered to. Don't fall victim to these charlatans. ""But it's ancient Chinese medicine that may be a possible treatment."" ""nothing lost by buying a bottle of shampoo""

Well actually yes, there is. You, with great and unsurpassed effort, continue to miss the point. Just put a giant target on your face and label it, fool. And while you're at it, let's possibly maybe but definitely perhaps consider the probability of maybe kinda sorta having some almost success at growing what could be 3 inches of hair in a month with a ""may be a possible treatment."" Because WHAT THE FUCKING FUCK?! Today it's shampoo, tomorrow it's vitamins, the next fad could be smearing coconut oil on your scalp.  

I don't get it. I truly don't. They're lost on a straight line. Is this how ""normal"" people really think? What is wrong with people?",['attr'],0,neu_vader
