,neg_prob,pos_prob,neg_vader,neu_vader,pos_vader,sentence
0,0.9999874757948365,1.2524205144202838e-05,0.0,1.0,0.0,I have been recently diagnosed and have just started therapy.
1,0.9999678160658454,3.218393417477676e-05,0.0,1.0,0.0,I am having an issue concerning my therapist.
2,0.9998204378749951,0.00017956212500482268,0.154,0.714,0.132,"On one hand I feel I should share this information with her, but on the other I fear this would have me switched to another therapist."
3,0.9998368713612061,0.00016312863878406366,0.081,0.791,0.128,I've tried medications but they only made me feel like a zombie and going to sit down with a therapist only increases my anxiety.
4,0.9999088321004836,9.116789953289915e-05,0.086,0.914,0.0,"I think I might have social anxiety (but since I've never been diagnosed I can't really say, I'm really afraid of therapists/psychologists)."
5,0.9997909127877211,0.00020908721227741174,0.155,0.714,0.131,"I've been through my share of doctors, therapy, emergency room visits, diagnoses, breakdowns, etc."
6,0.9998178493495792,0.00018215065042325408,0.337,0.663,0.0,"I didn't really like going to therapy, I felt it didn't help me."
7,0.9998532629480916,0.00014673705192398283,0.0,0.833,0.167,"I've been going to another therapist I kind of like, I've gone twice."
8,0.9997357288444085,0.000264271155592063,0.0,1.0,0.0,"I've talked to my mom about it and she says that I probably don't need it and if I do, the therapist will prescribe some to me."
9,0.999170802003095,0.0008291979969083493,0.251,0.749,0.0,I scheduled a GP appointment last week and he diagnosed me with anxiety and panic disorder and referred me to a psych for further evaluation and medication and a therapist.
10,0.9997805264763358,0.00021947352367042235,0.042,0.595,0.363,"My first therapist appt will be next week and I'm sure it'll be a long and hard journey, but I'm super excited!"
11,0.9997864249443116,0.0002135750556948303,0.243,0.757,0.0,"I've been to therapy, but it didn't help at all."
12,0.9997277427657958,0.00027225723420223587,0.069,0.931,0.0,"I'm also trying to find work, or at least something I can do through my computer to make money, so I can start seeing a proper therapist, getting some new glasses, and just buying some things that I desperately need."
13,0.9999784313110802,2.1568688920631223e-05,0.0,1.0,0.0,After about the fifth med he said lets just throw that all out and go for psychotherapy.
14,0.9953418009046466,0.004658199095356565,0.095,0.905,0.0,"Problem being, the area I'm in is extremely underserved for psychiatrists and therapists and I have to go with a hospital group that has pay on a sliding scale for uninsured/poor people, and the only one anywhere close is apparently booked for two months."
15,0.9956258149753271,0.0043741850246790245,0.055,0.945,0.0,"My doctor refuses to prescribe TCAs or benzos, and I'm currently facing barriers getting therapy (can't self-refer for treatment for anxiety over using the phone without making a 30-minute phone call)."
16,0.9984353787854863,0.0015646212144973034,0.0,0.929,0.071,"This morning I had an intense therapy session, basically had a meltdown and worked my way through a stack of tissues."
17,0.9987431915303808,0.001256808469635451,0.073,0.833,0.094," I'm a high school senior and I'd like to get help for my anxiety/depression, ( doctor not a therapist) but i have no idea how to bring up the topic with my mother or how to go about it."
18,0.9997938063142142,0.00020619368578769873,0.0,1.0,0.0,Another option I could take is using a therapist - maybe using a CBT based approach.
19,0.9998199180868405,0.0001800819131623778,0.086,0.705,0.208,"He told me to get a doctors note but as I have no money right now I'm not sure how to get one, I would like to see a therapist and discuss it (I'm feeling better now but I'd like to understand more about why it happened) Are there any options I could look at for free or set up to pay after i get my paycheck for a first session?"
20,0.9999604245707546,3.957542922902256e-05,0.0,0.87,0.13,I don't see how therapy can really help right now and I don't think talking about this is an option with my parents.
21,0.9945115401648498,0.005488459835163086,0.0,1.0,0.0,"I go to the gym several days a week, see a therapist and am about to begin taking antidepressants."
22,0.966872635377241,0.033127364622755014,0.086,0.822,0.092,"I'll try not to make this a wall of text so let's try bullets:
  
- Been in therapy for 4 years (psychodynamic)  
- Hitting a point in my life where I need to figure out what I'm doing with it  
- Lost faith my therapist can help me (he gave me advice in past that didn't work out well, he maintains he's not to blame for the emotions that resulted)  
  
Now, I'm scared and don't know what to do next."
23,0.999931228703067,6.877129692491934e-05,0.0,1.0,0.0,I will also look into meditation and possibly therapy.
24,0.9996238591565867,0.00037614084340269985,0.0,0.909,0.091,I have to figure out what I want in life and I need to talk to a therapist.
25,0.9983526636144879,0.001647336385496655,0.0,1.0,0.0,So recently I've been thinking about seeing a therapist to see if I can approach the issue from a different direction.
26,0.99781631578326,0.002183684216737503,0.0,1.0,0.0,"For those that see/have seen a therapist:  
What kind of realistic expectations should I have going in to therapy?"
27,0.9984291005275658,0.001570899472438868,0.0,1.0,0.0,Is it normal to start therapy without having a goal?
28,0.992594790898514,0.007405209101500882,0.099,0.858,0.043,"I am taking the 5-HTP and meeting with a therapist to try to help, but this week after my first meeting I have had even more attacks of itching (even reading this group to find some answer had me scratching all over)."
29,0.9955510391186259,0.004448960881390661,0.138,0.862,0.0,The body needs darkness at night just as much as it needs an appropriate amount of sunlight during the day (you may of heard about darkness therapy).
30,0.999849699722555,0.00015030027743222354,0.104,0.896,0.0,Anyway I decided to try these glasses to cut down blue light since I kept coming across this type of therapy.
31,0.9997507448486321,0.00024925515138467686,0.0,1.0,0.0,"I think I found that I was overdoing the therapy, I was doing this every night from sundown till the moment I shut my eyes in bed."
32,0.9999703088934185,2.9691106578412448e-05,0.0,1.0,0.0,"I remember how, when I was going last year, she would ask me often: ""Has the therapist helped at all?"
33,0.9999861672731841,1.3832726821929788e-05,0.0,1.0,0.0,She was an alternative-medicine type therapist and helped me talk some things out and give me some coping strategies.
34,0.9999500641838002,4.993581618739296e-05,0.221,0.683,0.096,"My doctor recommended therapy, but there's absolutely no way I can afford it."
35,0.9998187910930585,0.0001812089069529287,0.0,0.809,0.191,"I refrain from going out in public as much as possible, including going on walks, which my therapist recommended to help me."
36,0.9993799101851687,0.0006200898148434942,0.0,1.0,0.0,"Anyways, I had my first appt with a therapist last week."
37,0.5323803479251423,0.4676196520748553,0.054,0.946,0.0,"Consequently, ativan has become a big part of the strategy that she has used to combat her anxiety for most of her adult life (she has regularly attended therapy for as long as I've known her but it has never been much of a help); and now it has been taken away with nothing to replace it."
38,0.999694603346481,0.00030539665353643974,0.0,1.0,0.0,"I saw therapists and a psychiatrist, who put me on Lexapro, which has helped me tons."
39,0.9998970369888839,0.00010296301110127789,0.0,0.709,0.291,"I go to therapy and am on fluoxetine, which has been awesome."
40,0.9997812822716369,0.00021871772835766143,0.0,0.762,0.238,They also offer some perks like 6 sessions of therapy.
41,0.9944481169008192,0.005551883099161669,0.12,0.717,0.163,"I always feel the need to make them feel better, its as though my brain just picks up all the uneasiness of others, makes them feel better and in return i end up stuck with all these shit feelings...

i dont know what to do and am honestly considering therapy or some medications that will just calm me down."
42,0.9998730124423659,0.00012698755762133432,0.0,0.884,0.116,"But does anyone maybe have any tips for dealing with things like I've described, short of therapy or more/different medication?"
43,0.9974156771915206,0.002584322808479916,0.0,0.823,0.177,I'm also talking to a therapist who seems to have all the faith in me.
44,0.9997236482991837,0.00027635170082678315,0.0,0.886,0.114,I do CBT therapy and it helps but this week has been the hardest for years.
45,0.9998375013630081,0.00016249863699104334,0.0,0.778,0.222,"After finally listening to my therapist, I once again cleared my mind and saw major improvements."
46,0.9991568191705841,0.0008431808294118555,0.044,0.898,0.058,"She started going to therapy for her own issues and wants me to go with her this coming Thursday, as much as I want to go I don't want to promise her anything because I'm afraid I won't be able to go when the time comes."
47,0.9949009442939927,0.005099055705992745,0.0,0.769,0.231,I've contacted some local therapists and have a blood test next week so hopefully I'll have a greater understanding of it all fairly soon.
48,0.999882225740886,0.0001177742591001274,0.08,0.737,0.183,I'm currently in group therapy which I primarily like because I'm meeting wonderful people who are going through the same thing and would never judge me for my problems.
49,0.9996602434281877,0.0003397565718052498,0.0,1.0,0.0,"I remember thinking, when I started going to therapy at that age, that this would be something I'd grow out of by the time I was the age I am now."
50,0.9995562452896495,0.00044375471036612154,0.0,0.899,0.101,"I'm on an SSRI that helps but hasn't been much the past month, I go to therapy weekly."
51,0.9992365303572622,0.0007634696427215328,0.123,0.877,0.0,I have a very hectic schedule with full time work and school so I can't fit more therapy in than I do.
52,0.9970267833225219,0.0029732166774788515,0.061,0.864,0.075,"My armchair opinion (and that of a couple therapists) is that I've basically had pretty severe GAD my whole life, and when you combine that with stuff that's happened through my life, I've picked up the symptomology of other disorders."
53,0.992539553806405,0.0074604461935926115,0.151,0.849,0.0,"When I'm in therapy, I'm always at such a crisis point that the therapy has to focus on the immediate need, and not on long-term."
54,0.9999319400633193,6.805993668252489e-05,0.119,0.881,0.0,"I just really wanted to put this out there, not sure if it makes sense, but I'm seeing my therapist tomorrow and I'm sure I'll be hashing all this out there too."
55,0.9999106246459796,8.937535401939162e-05,0.268,0.635,0.097,I am just exhausted emotionally and wanted to hear some POV of fellow anxious redditors who may have good / bad experiences with medication therapy.
56,0.9987233238067051,0.0012766761932904104,0.0,0.93,0.07,I started seeing a psychologist/therapist in March for couples therapy with my partner for reasons I've posted about previously and also meet with her individually to work on things I'd like to work on about myself.
57,0.999983416291065,1.6583708924449872e-05,0.0,1.0,0.0,"It's ""only"" been 5.5 months since I started talk therapy and trying CBT."
58,0.9999071312020249,9.28687979778179e-05,0.0,1.0,0.0,"In that regard, talk therapy has helped."
59,0.9999626288302436,3.7371169774733224e-05,0.244,0.635,0.12,"I would really like to ask my therapist about medication, but I'm scared."
60,0.9999399323875023,6.006761250648935e-05,0.105,0.758,0.137,"I don't want to stop therapy, but I don't think it's enough."
61,0.9998352807400689,0.0001647192599422713,0.248,0.752,0.0,"I'm going to therapy on Monday for my first appointment, but I'm extremely scared."
62,0.997562363594636,0.0024376364053659227,0.139,0.673,0.188,"I'm irritable at the best of times, which my therapist told me is related to my GAD."
63,0.9992577986356446,0.0007422013643507855,0.172,0.828,0.0,"I keep putting off making an appointment with a psychologist because I have no insurance (but I do have savings to use), and having to get back into therapy makes my heart hurt."
64,0.9609428864491216,0.039057113550893245,0.264,0.736,0.0,I'm getting my own therapy to deal with the childhood abuse (to disclose it was sexual abuse and I'm a guy so that presents some unique problems via stigma with an order of extra stigma.)
65,0.9994912991915041,0.0005087008084882226,0.0,0.785,0.215,"Meditation and talk therapy are also part of my regiment, but this is one medicine change I've been very happy with."
66,0.9989929406221217,0.0010070593778805027,0.0,1.0,0.0,I haven't been in therapy for a few weeks now because I've run out of money and my health insurance is gone.
67,0.9986368164017364,0.0013631835982629674,0.098,0.902,0.0,"I originally started going to a therapist in January for an eating disorder, but that turned out to be a symptom."
68,0.992067310662624,0.007932689337394718,0.091,0.749,0.16,"So I started seeing a different therapist for the anxiety, and I've started seeing improvement almost right away."
69,0.9980645496737016,0.0019354503262862758,0.062,0.793,0.145,"So, I wanted to share the ""strategies"" I'm using (I'm not sure which are the most important factors or if they're working in combination): 

* **CBT** with the new therapist."
70,0.9995373168752371,0.00046268312477943757,0.197,0.642,0.161,"As a side note, I went to therapy once for some emerging anxiety issues as a teenager, but I had a bad experience and have been stressed about trying that again, eventhough its a pretty broad suggestion for people like me."
71,0.9996619599357888,0.0003380400642211985,0.155,0.845,0.0,"In panic, I tried to contact my specialist before I left, only to be told that I should go see a psychiatrist/therapist instead."
72,0.9972046833859105,0.0027953166141013873,0.206,0.794,0.0,"I am seeing therapy, but I cannot take pride/comfort in myself for having potentially ruined the lives of others."
73,0.9999726087025221,2.7391297465438694e-05,0.055,0.851,0.094,"I still have anxiety, but I know what causes them and I am able to if not avoid, at least lessen them through self-taught behaviour therapy."
74,0.9987334629089668,0.001266537091023858,0.159,0.841,0.0,"I'm also on medication for anxiety, and I'm seeing a therapist."
75,0.9997726925884957,0.00022730741148683324,0.204,0.757,0.039,I've had experiences in the past with therapists who haven't identified that I have anticipatory anxiety and actually ended up dreading my appointments from anticipation so much that I stopped going to them.
76,0.9998019501169066,0.0001980498830790751,0.0,0.847,0.153,"So, finally to my question, what kind of therapist should I seek out for help with this?"
77,0.9951802125729928,0.004819787427020114,0.243,0.679,0.078,I don't want a repeat of last time where my therapist wasn't even able to identify this even though my research shows that this is a pretty common anxiety problem with anyone who has an anxiety disorder.
78,0.9994669921262176,0.0005330078737671303,0.0,0.833,0.167,I'm thinking that a cognitive behavioral therapist may be my best bet since they can work with me to give me coping skills.
79,0.9999127433314616,8.725666852588441e-05,0.0,0.816,0.184,I'm aim to start therapy and get help because I can't do it anymore.
80,0.9980890262571616,0.001910973742824836,0.111,0.889,0.0,I've scheduled an appointment with a therapist to work through this phobia but it isn't until next week.
81,0.9965663149636869,0.0034336850362990585,0.087,0.797,0.116,I finally was able to get to a therapist with the help of my mom dragging me out of the house but I have only had one visit so far and the progress is going to be slow because I'm also suffering from PTSD.
82,0.9999174827676726,8.25172323427955e-05,0.077,0.818,0.105,I still plan on going to therapy and I now am optimistic that with these herbs and therapy I can overcome my anxiety.
83,0.9984633340200058,0.0015366659799800058,0.0,0.87,0.13,"I was seeing a great therapist back home, but obviously had to quit seeing her when I left this past August."
84,0.9997665149734686,0.00023348502652859783,0.139,0.861,0.0,"I got so desperate that I had an appointment with a therapist on campus here, on my birthday last Friday."
85,0.9589903686397663,0.041009631360226666,0.046,0.886,0.068,"I've also gone to a therapist, and that had no outcome other than strengthening my preconception that talking to a random person that happens to have a degree in the same way that I've talked to dozens of others in the past wouldn't do anything for me."
86,0.988469871792252,0.011530128207745894,0.061,0.818,0.121,"Up until a few weeks back I was OBSESSED with the idea of developing schizophrenia, but a simple consultation with my therapist was enough to clear this up."
87,0.9980437513667603,0.0019562486332242836,0.0,0.853,0.147,"Now, me and my therapist and my psychiatrist talk alot, and we agreed that a stimulant of some sort would be beneficial for me to become more extroverted and talk to people."
88,0.9999825268484068,1.7473151601339833e-05,0.0,0.899,0.101,I told him how I've been trying to fix myself at home because my last doctor gave me pristiq which I couldn't handle and didn't give me any suggestions for therapy and he told me how he thinks I would benifit from having some professional help just to guide me better at overcoming my issues.
89,0.9999435615628753,5.643843711518598e-05,0.0,0.743,0.257,I also see a psychiatrist for psychotherapy every two weeks and he is amazing.
90,0.999963769392169,3.6230607849467324e-05,0.0,1.0,0.0,"Also, any other alternative therapies you have tried that I didn't list."
91,0.9990709553631212,0.000929044636895386,0.197,0.803,0.0,I've been living with depression and anxiety for quite some time now; I've been in and out of therapy for these issues since 1999.
92,0.999836403294015,0.00016359670598928245,0.0,1.0,0.0,"I called my doctor last week and asked for an appointment to see what I can do,  maybe get referred to a therapist."
93,0.9966544698743198,0.0033455301256614793,0.0,1.0,0.0,"I went to one other therapist in my life a couple summers ago, but froze up."
94,0.9872485683606864,0.012751431639306176,0.044,0.881,0.075,"My conundrum is whether I should continue on from Thailand to Australia now, or come home and get some proper therapy for the anxiety and go to Australia  in september when I'm in a better frame of mind."
95,0.9998622677895259,0.00013773221046851333,0.22,0.538,0.242,My therapist recommended this app to me to help combat some of my anxiety.
96,0.9995939794972115,0.00040602050279443634,0.0,0.838,0.162,"Did my therapy, kept it up, gradually coming off the citalopram with my doctor's help."
97,0.9997355267973752,0.0002644732026152725,0.162,0.838,0.0,I have been seeing a therapist who said after numerous test that I have ADD and a possible disorder.
98,0.996115405921567,0.0038845940784178125,0.169,0.831,0.0,"Previously he said he wanted to see a therapist, but now he keeps saying 'I don't trust people, I don't want to talk to them, it won't help'."
99,0.9807799273195913,0.01922007268041792,0.0,1.0,0.0,"I've seen a therapist in the past, after I bailed on a sort of similar trip at the last minute."
100,0.9998272204736453,0.00017277952635376978,0.0,1.0,0.0,"i've been to therapy, have been taking remotiv(can someone confirm on tihs ) and magnesium twice a day."
101,0.9999458836405957,5.411635938871209e-05,0.087,0.742,0.171,I would never go to a therapist because nothing is bothering me on the inside – or more likely because I don’t want to admit I have any problems speaking to a doctor.
102,0.9998602635849468,0.00013973641504593995,0.0,1.0,0.0,Before I start I gotta say I have been to a therapist and talked to them about this issue.
103,0.9995066727732728,0.0004933272267099171,0.091,0.788,0.121,"I just asking for some second hand knowledge on something like this or a second opinion other then my therapist who was helpful in most other problem area's but when ever I covered this topic they just said ""keep up your defense against it, if you believe you can you will"" but doing so is just extremely exhausting."
104,0.9999759800123532,2.401998764018666e-05,0.113,0.833,0.054,"I mentioned this to my therapist and she advised me to think ""I want [crush's name] to reject me"" whenever I interact with him."
105,0.9995765366617312,0.0004234633382708081,0.0,1.0,0.0,Trying to go to therapy but the campus counseling center is so booked they can only work me in twice a month.
106,0.9905316965880638,0.009468303411951057,0.0,1.0,0.0,I'm on waiting lists for the 2 other places in town offering therapy and it's been months and I've never gotten a call.
107,0.9972849505401213,0.0027150494598599238,0.228,0.772,0.0,"It's gotten worse and worse over the past few months and all my therapist says is ""take a de-stress day, try going to yoga."""
108,0.9998169743976083,0.00018302560238886065,0.0,1.0,0.0,"5 years on and with hypnotherapy, exercise , proper sleep and  cbt I'm 99% over it."
109,0.9997794094353062,0.00022059056468111743,0.314,0.686,0.0,"I can't afford therapy, I'm a student, and I'd feel terribly guilty asking my parents money for therapy."
110,0.9999122254132237,8.777458676091436e-05,0.0,1.0,0.0,"I've been in therapy on and off for about 8 years, and have been seeing my current psychologist for almost 2 years."
111,0.999497821248168,0.000502178751820496,0.0,1.0,0.0,I told myself I'd go to therapy the next day (for the first time).
112,0.9992089089897996,0.0007910910101877622,0.0,0.838,0.162,"I still wanted to go to therapy the next day, but I felt unable to because I wasn't really upset."
113,0.9985374844661385,0.001462515533875762,0.0,1.0,0.0,"I understand that the obvious answer is to go see a therapist, which I plan on doing."
114,0.9999513379720147,4.866202798753884e-05,0.0,1.0,0.0,I can't even bring myself to get into therapy.
115,0.9988066478221611,0.0011933521778228623,0.0,1.0,0.0,"I have an appointment with my doctor but it's not until Tuesday, and I heard it can take months to get an appointment with a therapist."
116,0.9962044693715205,0.003795530628499045,0.0,0.842,0.158,"However, towards the end of our relationship (1.5 years) I started to benefit from the school therapy groups."
117,0.9998749683024921,0.00012503169752703188,0.0,0.86,0.14,"However, it seems that everything I do and everything my therapist helps me with are all preventative stuff."
118,0.9999729423808197,2.705761919512409e-05,0.406,0.594,0.0,I am on meds to no effect I suppose and therapy seems insane and stressful to me.
119,0.9997039471507189,0.0002960528492907741,0.0,1.0,0.0,"I have since seen a psychiatrist, tried AD and am now in therapy."
120,0.9999442676544903,5.5732345506929356e-05,0.223,0.777,0.0,Cue psychiatrist and therapist and I realize what I resent in him is the same thing I resented in myself.
121,0.9963456827377273,0.003654317262269975,0.315,0.598,0.087,I get grief from my therapist because I am incapable of having a solid definition of self.
122,0.9999555989704276,4.440102955480371e-05,0.128,0.775,0.098,So fuck off you dimwitted fuckwitted sugartits that think you are better than me because you hold the clipboard and the misconceptions that are therapy.
123,0.9975283067325601,0.002471693267457741,0.213,0.507,0.28,"On the other hand - therapy is good for learning tool sets to battle anxiety, depression and generally just share things that you can't share with others."
124,0.9998254865074081,0.00017451349260627982,0.219,0.461,0.32,"I want my therapist's approval and praise, but on the other I want them to fuck off."
125,0.9999769588381309,2.3041161850022834e-05,0.068,0.932,0.0,"She already said I can't do therapy either because we don't have the money, and even if we did I'd have no way to get to appointments once college starts back up."
126,0.9892119278209569,0.010788072179047054,0.282,0.718,0.0,I've also been diagnosed with depression (although right now it isn't so much a problem) and an eating disorder and I see a therapist for the ED and we often talk about both my depression and anxiety.
127,0.9998880430579289,0.00011195694207431036,0.0,1.0,0.0,I started mindfullness with my therapist but I can't afford to see him anymore.
128,0.9999656405362672,3.435946372006577e-05,0.0,0.726,0.274,"Recently, my symptoms have greatly improved with therapy and meds."
129,0.9994264580366221,0.0005735419633701191,0.0,1.0,0.0,"This has helped me to find breathing exorcises, meditation, and got me to talk to a therapist."
130,0.9984259028867422,0.0015740971132436276,0.0,1.0,0.0,I went to see a therapist and the intern (the person who gathered my info) said SA is usually treated with 50/50 medication and therapy.
131,0.9991533739944537,0.0008466260055336305,0.0,1.0,0.0,I have also gone to several sessions with a therapist.
132,0.9993191444308532,0.000680855569156145,0.441,0.559,0.0,Tried therapy but I'm so shy it didn't help a ton.
133,0.999546216125155,0.0004537838748467231,0.0,0.859,0.141,I've applied for some more scholarships and another college in town that can help save some more money but give me a few more prephysical therapy classes.
134,0.9991946607097986,0.0008053392901817932,0.211,0.789,0.0,My grades aren't amazing so I won't be able to get into a physical therapy school and my art isn't amazing so I couldn't change to art school.
135,0.999276102278822,0.0007238977211759417,0.0,1.0,0.0,"I'm not in therapy now, but I have briefly seen psychologists several times over the years."
136,0.9999325119292377,6.74880707749278e-05,0.078,0.922,0.0,I take amitriptylene 50mg for headache and general anxiety but my therapist wants me to try an SNRI.
137,0.9998889469625948,0.00011105303741710322,0.0,1.0,0.0,I'm wondering if behavioral therapy worked for any of you and how long did it take?
