3038,3038,0.999828606843766,0.00017139315623925945,0.149,0.634,0.218,"First, I'd like to start out by saying that I've recently got a new job and a new therapist and my anxiety and depression have been like 30 times better.",conj,0,neu_vader,pos_vader
3040,3040,0.999350437647644,0.0006495623523693438,0.136,0.8640000000000001,0.0,I picked up [Pearls IC](http://www.enzymatictherapy.com/products/Digestion/Daily-Digestion-Support/04363-Pearls-IC.aspx) which contained two of the probiotic strains mentioned in the episode.,compound,0,neu_vader,neg_vader
3042,3042,0.9999836898422928,1.631015768945795e-05,0.0,0.619,0.381,Yay therapy for teaching me this technique!,ROOT,0,neu_vader,pos_vader
3044,3044,0.9999423814241256,5.7618575862072006e-05,0.166,0.613,0.221,Did you feel like you were wasting the therapist time with 'trivial' matters?,compound,0,neu_vader,pos_vader
3046,3046,0.9999144748034844,8.552519650462425e-05,0.0,0.7909999999999999,0.209,"I know people believe me that I have this issue, but the best doctors and therapists can come up with is that ""I have anxiety"".",conj,0,neu_vader,pos_vader
3047,3047,0.9995699320791914,0.0004300679208156568,0.0,1.0,0.0,So I started seeing a therapist two months ago.,npadvmod,0,neu_vader,pos_vader
3061,3061,0.9993467724162732,0.0006532275837381191,0.0,1.0,0.0,"I have tried almost everything, including exercise 4 times a week, taking supplements such as magnesium  (every form such as chloride, glycinate, nitrate), amino acids,  l-theanine,  GABA, and kava and therapy.",conj,0,neu_vader,pos_vader
3068,3068,0.9992417979756862,0.0007582020243092863,0.0,0.833,0.16699999999999998,"So in a therapy session last night, i was asked the following question 
""what do you think are your positive attributes ?",compound,0,neu_vader,pos_vader
3070,3070,0.9964708137628986,0.003529186237110178,0.20199999999999999,0.7979999999999999,0.0,"But eventually - with a combination of meditation, therapy and Sertraline - I was panic attack-free by 2014.",conj,0,neu_vader,neg_vader
3072,3072,0.9963578009907936,0.003642199009208071,0.214,0.7859999999999999,0.0,"Despite meds and therapy I keep sliding down to where I am, unable to function at work and so afraid of failing little things that I always fail the big things.",conj,0,neu_vader,neg_vader
3075,3075,0.9998044407618842,0.00019555923812036486,0.0,0.731,0.26899999999999996,"I want to thank my psychiatrist, therapist, fiance, and family for being so understanding and helping me get through it all.",conj,0,neu_vader,pos_vader
3085,3085,0.9997630371078171,0.00023696289218091558,0.0,0.838,0.162,"Don't wait as long as I did to get help, whether it be therapy/medication/or something else.",attr,0,neu_vader,pos_vader
3087,3087,0.9913117355360518,0.008688264463964408,0.20600000000000002,0.758,0.036000000000000004,"She was always complaining that I don't know how to run a company, I am not brave enough in professional and social situations, that my car is not good enough, my apartment not large enough, I am not ambitious enough, even my therapy (I am well aware of my problems) was not good enough.",dep,0,neu_vader,neg_vader
3096,3096,0.9999874267441844,1.2573255825599033e-05,0.0,1.0,0.0,School is also keeping me from my therapy groups and I can't skip class every week.,compound,0,neu_vader,pos_vader
3098,3098,0.9895878335384942,0.010412166461511385,0.217,0.691,0.09300000000000001,"I just started treatment (meds + therapy) for depression and GAD, and a new major source of anxiety for me is that my health care providers don't believe me -- I worry that I'm just whiny, it's just first world problems, I'm somehow faking it, I'm not sick enough, it's all in my head, etc.",appos,0,neu_vader,neg_vader
3099,3099,0.9999874202322109,1.257976777697458e-05,0.171,0.8290000000000001,0.0,"I have had bad experiences with doctors and therapists before, so this is not really coming out of nowhere.",conj,0,neu_vader,neg_vader
3102,3102,0.9990512222433926,0.0009487777565935279,0.319,0.6809999999999999,0.0,"Im only 22 and have meds and regular therapy, but still this waking panic is such a shit way to start the day.",conj,0,neu_vader,neg_vader
3104,3104,0.98037186252154,0.019628137478453548,0.0,1.0,0.0,"In that short space of time we have been seeing each other once a week for EMDR sessions, and the latest session was an exposure therapy session.",compound,0,neu_vader,pos_vader
3114,3114,0.9988101755661842,0.001189824433799675,0.12300000000000001,0.728,0.149,"And to top it off I can't believe that exercising, having a good diet, doing some 5htp/omega 3/ therapy/ meds can stop these thoughts or this identification with anxiety.",compound,0,neu_vader,pos_vader
3119,3119,0.999969996530238,3.0003469756173543e-05,0.0,1.0,0.0,They are all my therapists.,attr,0,neu_vader,pos_vader
3122,3122,0.9988498375597544,0.0011501624402290036,0.10099999999999999,0.732,0.16699999999999998,"*I guess this is the best subreddit for writing about my experience.. so here I go..*

Its sometimes difficult do describe your exactly 'ilness' or in better words: to be exact as possible when using words like anxiety disorder or depression, but thinking of all that I've read, experienced and got explained from my psychotherapist/ psychologist, the title describes it at best.",compound,0,neu_vader,pos_vader
3131,3131,0.9846405535832546,0.015359446416727547,0.0,0.789,0.21100000000000002,"With the help of (very weak) meds, a therapist and a lot of sports I got rid of them (hadnt had one in two/three weeks) which I am very happy about.",appos,0,neu_vader,pos_vader
3137,3137,0.9985404921909344,0.0014595078090617506,0.073,0.927,0.0,Not therapy though cause I was going abroad again for school where I am uninsured and there is a bit of a language barrier.,ROOT,0,neu_vader,neg_vader
3149,3149,0.998626742678699,0.0013732573213093911,0.0,1.0,0.0,"I'm actually currently training to become a psychologist, so I'm familiar with therapy options.",compound,0,neu_vader,pos_vader
3152,3152,0.999958276727796,4.172327220719917e-05,0.0,0.914,0.086,I thought I'd make this post and see if I could therapy myself back down to feeling balanced again.,ccomp,0,neu_vader,pos_vader
3156,3156,0.9991049429720048,0.0008950570280126703,0.0,0.9520000000000001,0.048,"I've never been one to want to go to an actual doctor or therapist for anything, I'd rather find another way of going about treating it/handling it.",conj,0,neu_vader,pos_vader
3159,3159,0.9996924982309546,0.0003075017690403375,0.0,1.0,0.0,"I have done the therapy thing, and it has helped, but presently that's not something I can afford to do.",compound,0,neu_vader,pos_vader
3162,3162,0.9998055659624242,0.00019443403758836789,0.0,1.0,0.0,"I've been getting over it slowly thorugh meditation and mindfullness/acceptance therapy, and also through yoga, bike rides, CBT, DBT, etc.",conj,0,neu_vader,pos_vader
3184,3184,0.9999704743349188,2.9525665094445392e-05,0.0,1.0,0.0,I've been through therapy/meds/partial hospitalization etc.,amod,0,neu_vader,pos_vader
3192,3192,0.9985864902271976,0.0014135097728144985,0.24600000000000002,0.6990000000000001,0.054000000000000006,"I've mentioned this to my Psych and Therapist, but I don't want to play ""medication bingo' again with all the side effects it entails, and my therapist, while well meaning is no match for the anxiety and pessimism in my head.",conj,0,neu_vader,neg_vader
3207,3207,0.9988057630553958,0.0011942369445970705,0.0,1.0,0.0,"She prescribed me .25 Xanax and told me to take when I felt myself get worked up, a chiropractor, PT, and a regular therapist.",conj,0,neu_vader,pos_vader
3214,3214,0.9999875042305116,1.2495769498778063e-05,0.175,0.825,0.0,Has treating your anxiety (meds/therapy) helped this at all?,appos,0,neu_vader,neg_vader
3225,3225,0.9998902875705112,0.00010971242948859925,0.0,0.778,0.222,My dream has always been writing and therapy.,conj,0,neu_vader,pos_vader
3228,3228,0.9969812944048501,0.0030187055951352835,0.213,0.569,0.218,"***

My desire goes on waves, and right now my desire is low and my depression is getting worse, my fears are still very bad, I have no money for doctors, and therapy sessions, I really want help some how and hope that I can find it either in the real world or on a platform like reddit that can lead to real world help.",compound,0,neu_vader,pos_vader
3231,3231,0.9998719064708512,0.00012809352915996579,0.0,1.0,0.0,"So, I have two questions: First, are there any ""pro-choice"" therapy choices in the US, that are not associated with the APA?",compound,0,neu_vader,pos_vader
3238,3238,0.9997106967670198,0.0002893032329831656,0.168,0.8320000000000001,0.0,I'm just now starting the physical therapy process and I'm wondering if all of these changes and events have caused me more stress and anxiety than I realize.,compound,0,neu_vader,neg_vader
3240,3240,0.9999401213773432,5.987862265496948e-05,0.184,0.816,0.0,"If you need, get a psychologist, psychiatrist or a psychotherapist, and talk about your problems.",conj,0,neu_vader,neg_vader
3242,3242,0.9975175037477624,0.0024824962522209198,0.138,0.7979999999999999,0.064,i saw a therapist/psych combo for about two years (for anxiety as well as quite a few other things) until i realized it was a waste of too much money because nothing was working.,compound,0,neu_vader,neg_vader
3243,3243,0.9992435981537128,0.0007564018462952815,0.0,0.91,0.09,"I really don't know how I could talk this out with a therapist(I guess they could tell me to find something to do that is relaxing but I need to be able to just sit still and just chill and hangout with my fiance, the kids, the rest of the family, ect... without having to look like I""m going 90mph.",amod,0,neu_vader,pos_vader
3244,3244,0.9864180851282092,0.01358191487178218,0.0,0.9279999999999999,0.07200000000000001,After about 5 years of the therapy / drug game (people tend to play in their teens if things aren't going well) I only recently figured out that I inherited a sensitivity to substances from my mother.,nmod,0,neu_vader,pos_vader
3246,3246,0.9989095723160502,0.0010904276839593507,0.243,0.556,0.201,"I went through a whirlwind of medications, therapists, good and bad times.",conj,0,neu_vader,neg_vader
3260,3260,0.9966675248358372,0.003332475164161202,0.042,0.81,0.147,"Towards the end of my therapy session today we were talking about my childhood and the lack of comfort and emotion given to me, and all of a sudden I had this massive realization that I don't have a single memory of ever being held, hugged, cuddled or comforted by my mother.",compound,0,neu_vader,pos_vader
3263,3263,0.9968226846113458,0.0031773153886635232,0.266,0.657,0.077,"However, I hadn't had good luck at finding a psychiatrist who is good at both the therapy side as well as the medication side.",compound,0,neu_vader,neg_vader
3264,3264,0.9997375862567416,0.00026241374325926747,0.0,0.833,0.16699999999999998,"It seems like I either find a shrink who just wants to push pills, or someone who thinks everything can be solved without drugs and only therapy.",conj,0,neu_vader,pos_vader
3307,3307,0.9999659248380296,3.407516198227378e-05,0.141,0.789,0.069,"I have just started thinking its the problem, and well I don't talk to people and this therapy thing is tricky, since thats what they expect me to do.",compound,0,neu_vader,neg_vader
3315,3315,0.9999626505972208,3.734940276513452e-05,0.17,0.773,0.057,"I decided to tell them about my anxiety so I could go about getting help from doctors and therapists, but all they've (my parents) done is make me feel worse.",conj,0,neu_vader,neg_vader
3319,3319,0.9994894170452436,0.0005105829547606247,0.25,0.6709999999999999,0.079,"i have to go to a domestic violence class, an AA class and mandatory therapy.",conj,0,neu_vader,neg_vader
3322,3322,0.9999786635281609,2.1336471829326386e-05,0.0,1.0,0.0,I've been trying to handle this by going to therapy through my college's psych services.,xcomp,0,neu_vader,pos_vader
3325,3325,0.9999595139155364,4.0486084474648635e-05,0.126,0.8740000000000001,0.0,"Or should I try to go all out and tackle my anxiety to the fullest and try to stop it before it picks up any steam via medicine, therapy, etc?",conj,0,neu_vader,neg_vader
3329,3329,0.9994788774355912,0.0005211225644074916,0.076,0.924,0.0,I'm not sure what's happening right now and the therapist (who the referral was for) said she'd look into it and get back to me.,conj,0,neu_vader,neg_vader
3342,3342,0.9500392262649198,0.049960773735097365,0.085,0.718,0.19699999999999998,"Pop culture likes to show single therapy sessions as effective enough for people to just do it occasionally to top off the mental health tank
I have the ramblings of a mad man.",compound,0,neu_vader,pos_vader
3343,3343,0.9999942575874212,5.7424125798062876e-06,0.321,0.679,0.0,Now I'm on meds and therapy but I soil have really bad days.,npadvmod,0,neu_vader,neg_vader
3356,3356,0.9999808455319286,1.9154468059916448e-05,0.13699999999999998,0.713,0.15,I'm new to this whole Internet group therapy type-thing so forgive me if I make mistakes.,compound,0,neu_vader,pos_vader
3375,3375,0.99756377219754,0.002436227802455623,0.08199999999999999,0.9179999999999999,0.0,"Since then, I've been able to manage my anxiety through medication (Paxil, once a day) and therapy, which I still attend sometimes.",conj,0,neu_vader,neg_vader
3390,3390,0.9999698593637909,3.0140636219359693e-05,0.207,0.634,0.159,"I sent my therapist an email apologizing, but I feel like they will just think I am avoiding treatment.",dative,0,neu_vader,neg_vader
3396,3396,0.9998893539982048,0.00011064600179518992,0.26899999999999996,0.615,0.11699999999999999,I never thought my anxiety was bad enough to go a therapist.,npadvmod,0,neu_vader,neg_vader
3402,3402,0.999990010938658,9.989061335935848e-06,0.0,1.0,0.0,"Psychologist, psychiatrist, or therapist?",conj,0,neu_vader,pos_vader
3406,3406,0.9986890560352399,0.001310943964742168,0.0,0.904,0.096,"He lives in another state and normally I don't ever attempt long-distance things, but somehow this person is different (someone I know mutually for years) and at the behest of my friends and therapist, I am going to pursue it, whatever the consequences.",conj,0,neu_vader,pos_vader
3413,3413,0.9998277627394792,0.00017223726051499575,0.07200000000000001,0.813,0.115,"I haven’t gone to my last two therapy appointments because I just don’t feel that I can leave the house (thank goodness my school offers some of their classes online) and I have cancelled on my psychiatrist (just gives me meds) twice, as well.",compound,0,neu_vader,pos_vader
3419,3419,0.9984517229069568,0.0015482770930436527,0.247,0.6409999999999999,0.11199999999999999,"So I finally managed to start CBT for my depression and anxiety, and the therapist agreed with me that dealing with the anxiety first would make it easier for me to deal with the depression.",conj,0,neu_vader,neg_vader
3420,3420,0.9994357264541756,0.0005642735458068946,0.326,0.615,0.059000000000000004,"It's basically aversion therapy, treating my anxiety like a phobia and forcing me to face it by going in social situations to see that there isn't too much that can go horrible wrong.",attr,0,neu_vader,neg_vader
3423,3423,0.9999156124770542,8.438752293123067e-05,0.113,0.779,0.109,"I don't get panic attacks like some of you guys do (I used to have them, but zoloft and therapy made them go away), but my mind and general anxiety won't let me enjoy life because I'm so afraid of changes and new experiences.",conj,0,neu_vader,neg_vader
3425,3425,0.9997407479206069,0.00025925207938265476,0.2,0.8,0.0,"The option has always come up during my therapy discussions, but I never forfeit to it because I don't want to feel worse than I already do.",compound,0,neu_vader,neg_vader
3427,3427,0.9890589038012192,0.010941096198782559,0.17,0.787,0.043,"It is as simple as believing you are okay
If you are scared of something do not let that stop you from doing it, FEAR IS NOT REAL, Most fear that stems from anxiety comes from a fear of the unknown or the nonphysical so why worry about something that is essentially nothing
It does go away, and you don't need to tell yourself it won't, that's extremely counter-productive

Anxiety is something we as ALL humans have evolved to have, it helps us when the situation arises, right now your brain is just fritzing and stressing about every little thought ""would a crazy person think this"" ""Why am I acting this way"" ""will I ever go back to normal"" Guess what guys, you are already normal, you don't need meds or even a therapist.",conj,0,neu_vader,neg_vader
3431,3431,0.9999213034979408,7.8696502043955e-05,0.349,0.6509999999999999,0.0,I'm also struggling because my therapy sessions aren't going particularly well.,compound,0,neu_vader,neg_vader
3436,3436,0.9986949134426713,0.0013050865573210188,0.078,0.826,0.096,"I have noticed that my anxiety, even with medication and therapy, has been higher than it's been in well over a decade.",conj,0,neu_vader,pos_vader
3437,3437,0.975734588351482,0.0242654116485058,0.069,0.9309999999999999,0.0,The Prozac didn't make a lick of a difference and before I went off it I was on 60mg and 10mg of bus par...  For the therapy side I just didn't feel right...  Every time I went in I couldn't explain what was wrong and sometimes felt nothing was wrong...,compound,0,neu_vader,neg_vader
3442,3442,0.9998300031520791,0.00016999684793789707,0.14800000000000002,0.792,0.061,Been going to therapy for as long as I can remember however worries never seem to leave me.,xcomp,0,neu_vader,neg_vader
3446,3446,0.999239537550731,0.0007604624492787885,0.214,0.7859999999999999,0.0,I thought once my pcs went away the anxiety would too but my therapist it's now a disorder caused by the pcs.,intj,0,neu_vader,neg_vader
3450,3450,0.9998477433108488,0.00015225668915923754,0.0,0.867,0.133,What can I do to try to calm down until I can see my doctor or a therapist again?,conj,0,neu_vader,pos_vader
3465,3465,0.9991992205568412,0.0008007794431459058,0.0,0.69,0.31,Both my therapist &amp; I agree a few weeks of inpatient would be good for me.,npadvmod,0,neu_vader,pos_vader
3468,3468,0.9927924247758222,0.007207575224168749,0.0,0.765,0.235,"I want to help him in any way I can, while also recognizing that I am not a therapist.",attr,0,neu_vader,pos_vader
3473,3473,0.9909939205389096,0.009006079461099216,0.0,0.86,0.14,"I've spoken to a few advisers in the school and even a therapist, but I feel like none of them have really helped much.",conj,0,neu_vader,pos_vader
3475,3475,0.9999720452203976,2.795477961695982e-05,0.23600000000000002,0.637,0.127,Last therapy session when I had calmed down I realised that worrying won't do anything good for me.,compound,0,neu_vader,neg_vader
3479,3479,0.9999259870010868,7.401299890974731e-05,0.0,0.833,0.16699999999999998,"I am going to physical therapy, myofascial therapy, ultrasound sessions, doing relaxation exercises, eating right and trying to pace.",conj,0,neu_vader,pos_vader
3490,3490,0.9999612418927832,3.8758107233963067e-05,0.124,0.8759999999999999,0.0,I haven't seen my friends in about two months since I have been recovering from unexpected knee surgery and physical therapy.,conj,0,neu_vader,neg_vader
3492,3492,0.9981496301651273,0.0018503698348566575,0.09300000000000001,0.723,0.184,"I have a therapist, a relaxation therapist and am currently on 40mg of Fluoxetine a day (which is being revised in a week or so) however since seeking help I only feel worse.",conj,0,neu_vader,pos_vader
3494,3494,0.9999745928792332,2.5407120762157167e-05,0.0,1.0,0.0,Apparently it's all about exposure (and talk therapy).,conj,0,neu_vader,pos_vader
3499,3499,0.9999449401602084,5.505983979358204e-05,0.0,1.0,0.0,"Cognitive behavioral therapy, mindfulness.",ROOT,0,neu_vader,pos_vader
3513,3513,0.9952726991750888,0.004727300824925063,0.23199999999999998,0.644,0.124,There are actually a lot of studies on it and it's considered a safe alternative therapy for anxiety and depression.,oprd,0,neu_vader,neg_vader
3520,3520,0.998421013407006,0.0015789865929767824,0.0,0.9390000000000001,0.061,"There is still a copay, though, and I don't make much money, so I want to know ahead of time: does any sort of non-medical therapy work for this particular issue?",compound,0,neu_vader,pos_vader
3527,3527,0.9999472514380642,5.274856192806133e-05,0.28600000000000003,0.7140000000000001,0.0,I've been in trauma therapy and marriage therapy.,conj,0,neu_vader,neg_vader
3538,3538,0.9984123341246816,0.0015876658753353884,0.0,0.838,0.162,I also haven't gotten far enough with them to know if it will be a good therapist/client relationship.,compound,0,neu_vader,pos_vader
3539,3539,0.9997701369889512,0.00022986301104413516,0.41700000000000004,0.583,0.0,I just started anxiety and panic therapy about a month ago.,conj,0,neu_vader,neg_vader
3541,3541,0.9999341013936086,6.589860640472798e-05,0.0,0.8740000000000001,0.126,But the doctor asked me lots of questions calmly and gave me two options; psychotherapy or medication.,appos,0,neu_vader,pos_vader
3548,3548,0.9999563619795988,4.3638020394824594e-05,0.0,1.0,0.0,tl;dr: Made myself go to my first therapy appointment.,compound,0,neu_vader,pos_vader
3566,3566,0.9998725349855928,0.00012746501440009762,0.17,0.6940000000000001,0.136,"Age: 22 M
Current Meds: Zoloft
Previously prescribed: Xanax, Ativan, and Paxil
Psychiatrist diagnosis: Social Anxiety Disorder
Therapy: No therapy, only been once and left with little hope that it would help me.",appos,0,neu_vader,neg_vader
3575,3575,0.9998243530722714,0.00017564692772762286,0.0,1.0,0.0,I see a psychiatrist and a therapist once a month.,conj,0,neu_vader,pos_vader
3578,3578,0.9999854862037464,1.451379626358771e-05,0.10099999999999999,0.536,0.363,My friends believe I have anxiety and could benefit from meds and/or therapy.,conj,0,neu_vader,pos_vader
3583,3583,0.9999006977705452,9.930222943809433e-05,0.0,0.345,0.655,"Yes, I am in therapy haha.",compound,0,pos_vader,pos_vader
3586,3586,0.999858366436036,0.00014163356396719099,0.0,1.0,0.0,We both got puppies to train as therapy dogs...,compound,0,neu_vader,pos_vader
3609,3609,0.999857438388342,0.0001425616116559822,0.0,1.0,0.0,the article went on to discuss how this is not talked about enough in therapist/client relationships and the whole mental health community in general.,amod,0,neu_vader,pos_vader
3610,3610,0.998738820519525,0.0012611794804817432,0.0,0.937,0.063,"today me and my therapist talked about how a huge issue with me is that i give control of my thoughts and my self to those around me, allowing myself to think that they are judging me.",conj,0,neu_vader,pos_vader
3614,3614,0.9998615035529712,0.0001384964470416158,0.049,0.871,0.081,"It's frustrating because I have had so much time to get over this, and I've been doing all the right things (therapy, meds, exercise, diet, work, etc), but I feel like I'm exactly where I was when I was with him.",conj,0,neu_vader,pos_vader
3636,3636,0.9998354279233777,0.00016457207661384424,0.0,1.0,0.0,I just don't really know where to o from here (next therapy appointment is a little away),compound,0,neu_vader,pos_vader
3638,3638,0.9994949192354756,0.0005050807645334423,0.0,0.777,0.223,I thought it might be a muslce knot or something but my massage therapist friend couldnt find one.,compound,0,neu_vader,pos_vader
3659,3659,0.9999690716548532,3.092834515434411e-05,0.10400000000000001,0.7040000000000001,0.193,The reason I'm making this post is because I've been trying different therapy and self help methods to overcome fears like this.,nmod,0,neu_vader,pos_vader
3667,3667,0.9999215568510268,7.844314896841651e-05,0.33299999999999996,0.667,0.0,"Went to my first therapist appointment and was told I'm suffering from ""worry attacks"".",compound,0,neu_vader,neg_vader
3674,3674,0.9995592609880236,0.0004407390119619865,0.0,0.8540000000000001,0.146,"Finally after a month I quit, but I feel like a let my Mom down who has been paying for my meds and therapy.",conj,0,neu_vader,pos_vader
3678,3678,0.9947321709311654,0.0052678290688321855,0.0,0.8590000000000001,0.141,"I don't meet with a real psychiatrist or therapist until later this month, but the counselor gave me this link - www.e-couch.anu.edu.au - it's an Australian program that's free, kind of CBTish.",conj,0,neu_vader,pos_vader
3703,3703,0.9962957321500698,0.003704267849919999,0.069,0.784,0.147,"this weekend i took a true test of my anxiety and went on a trip to las vegas and went to a bunch of shows and out to eat, all these things would normally give me terrible anxiety but thanks to posting on here (and therapy of course lol) i was able to keep it all under control, so thank you everyone in the sub-reddit",conj,0,neu_vader,pos_vader
3716,3716,0.9998134662033742,0.0001865337966254976,0.27,0.73,0.0,"She just kept being dismissive and bitchy, and she's a nurse practitioner, not even a doctor, definitely not a psychotherapist.",appos,0,neu_vader,neg_vader
3720,3720,0.9996750799493432,0.0003249200506419357,0.0,0.828,0.172,"He's gotten a lot better and is only on one medication, plus his monthly therapist visits.",compound,0,neu_vader,pos_vader
3721,3721,0.9971638245233804,0.002836175476613531,0.0,1.0,0.0,"My work insurance only covers 5 therapist visits a year before it becomes solely out of pocket and on a teacher salary, that's a ton of money.",compound,0,neu_vader,pos_vader
3724,3724,0.9999672178224522,3.278217754743857e-05,0.0,1.0,0.0,I've been on every drug and therapy that has been thrown at me.,conj,0,neu_vader,pos_vader
3726,3726,0.9993543252077608,0.0006456747922380907,0.0,0.9229999999999999,0.077,I started going to therapy my freshman year after a complete breakdown where I finally told my mom how I had been feeling.,xcomp,0,neu_vader,pos_vader
