,neg_prob,pos_prob,neg_vader,neu_vader,pos_vader,sentence
1226,0.9999562788591264,4.372114086273879e-05,0.218,0.596,0.186,I'm quite sure I have an anxiety disorder (therapist will hopefully confirm in 2 weeks) and I'm thinking ADHD wouldn't be too surprising either.
1227,0.9948282759434517,0.005171724056560166,0.0,0.858,0.142,"I've been seeing a therapist for several months now and have found her very helpful, but I'm not moving fast enough, and she encouraged me to see a psychiatrist to deal mainly with the physical symptoms."
1228,0.9998449437814579,0.00015505621852292175,0.21,0.657,0.133,"Anyway, I'm just really nervous about it, I guess partially because I'm so comfortable with my therapist and I'm worried I won't like the psychiatrist as much."
1229,0.9999505689826135,4.9431017399215215e-05,0.172,0.686,0.142,"I've had some bad therapists in the past, so that doesn't make me feel any better."
1230,0.9997888283133198,0.0002111716866708693,0.0,1.0,0.0,None of them even know I'm in therapy.
1231,0.9996118304534455,0.00038816954655368697,0.0,0.728,0.272,"I was in therapy for awhile, great therapy, and it helped so much."
1232,0.9999603358982297,3.9664101776460515e-05,0.188,0.812,0.0,I have ocd with health phobias (which my old therapist said was different from hypochondria).
1233,0.9997979396215568,0.00020206037844599335,0.0,1.0,0.0,I'm debating going to a clinic today to see a doctor to just try to get a referally to a cheap therapist or something.
1234,0.9999214063310109,7.859366897105546e-05,0.0,0.712,0.288,"She's also helping em try to sign up for Obama care, and she's going to help me find some therapy I can afford here."
1235,0.9977718126384391,0.002228187361550298,0.109,0.891,0.0,"I did not feel comfortable with the last therapist I went to, and it will take about 4 - 5 months until I get an appointment with different one."
1236,0.99931811767297,0.0006818823270130192,0.0,1.0,0.0,"About 2 years ago when I was still at school, and had a therapist at my disposal, I frequently would see her."
1237,0.9872328472320069,0.012767152767988442,0.079,0.853,0.068,We tried to get her to see a therapist - who she then shades the truth with - and then claims that she already knows all of this - it doesn't work - so why bother.
1238,0.999631706151592,0.0003682938484172573,0.245,0.755,0.0,"An emergency room doctor, a school therapist, and a couple psychologists."
1239,0.9999657571382325,3.424286175613454e-05,0.3,0.7,0.0,"I didn't want to believe I was ""crazy"" therefore I refused proper therapy."
1240,0.9994265614594466,0.0005734385405536501,0.275,0.582,0.143,I'm on a waiting list for a 12 week therapy program to help combat my worries.
1241,0.9999630854070252,3.691459296506953e-05,0.0,1.0,0.0,I've never been to therapy or anything.
1242,0.9656497161562668,0.034350283843722955,0.0,0.704,0.296,"I've been to a therapist a couple of times, but I'm managing rather well on my own and with the support of my significant other."
1243,0.9980205367741491,0.001979463225847119,0.243,0.757,0.0,"I tried seeing a therapist a few weeks ago, but it didn't help."
1244,0.9810580610675664,0.018941938932415373,0.0,1.0,0.0,"It has taken therapy, medication and a lot of willpower on my behalf to make even the smallest changes in my communicative and cognitive behavioral habits."
1245,0.9998539113266506,0.00014608867336321428,0.145,0.855,0.0,"I started seeing a therapist (for CBT), started working out, and I finally realized that I avoid everything that gives me anxiety or potentially could make me feel anything."
1246,0.999973720465224,2.627953475881138e-05,0.182,0.631,0.187,With my therapists help I have accepted those feelings and challenged my perfectionism enough to (partially) complete my resume but I'm still struggling.
1247,0.999949940710884,5.0059289106875236e-05,0.126,0.705,0.169,My therapist has helped me with my motivation and my perfectionism but I still feel stuck and afraid.
1248,0.9993950301204805,0.0006049698795142103,0.081,0.841,0.078,I don't know if I should wait until I start an antidepressant and then look for a job or start apply now and hopefully be able to cope with the stress with just my therapist.
1249,0.9997237268307276,0.00027627316928951584,0.0,1.0,0.0,"He has just started therapy and drug treatment combined and it's working, but it's still the first stages."
1250,0.9999580963273722,4.190367263076637e-05,0.073,0.813,0.114,"I was diagnosed with OCD and Dermatillomania at 16 and I'm 22 now, and my process was much smoother than his; I got help with medicine and therapy right away and I have an extremely supportive family, while his is supportive but misinformed and closed."
1251,0.6663445434117996,0.3336554565882059,0.082,0.918,0.0,"The thing I'm asking is, I'm a lot farther along in the journey of recovery than he is; I'm not acting as his therapist, because he has his own, but he's having a hard time right now, and while I remember what I needed to hear during that time when I was there and I remember how I felt, I know that the disorder is different for everyone."
1252,0.9999540446419144,4.595535807408288e-05,0.347,0.653,0.0,I go to therapy and take drugs but i'm really only depressed because of how terrible this all has been.
1253,0.9998859226972138,0.00011407730279801496,0.0,0.846,0.154,"It's gotten to the point where I can't even make appointments with my therapist, or hang out with friends."
1254,0.9997993491705413,0.00020065082943882375,0.0,1.0,0.0,"In the meantime, I had been researching local therapists who are covered by my insurance and working up to finally setting an appointment."
1255,0.9934591006434849,0.006540899356496391,0.0,1.0,0.0,"I've never been to anyone regarding my mental health before this, so it's all new to me, but I knew there was a possibility it might take a while for me to find the right therapist for me."
1256,0.9969364551644194,0.0030635448355809175,0.134,0.796,0.07,"But the more this therapist talked, the more it was clear she was directly correlating my lack of relationships to my weight (and completely disregarding the social anxiety I told her I recently realized I'd dealt with for as long as I could remember), even going so far as to say, ""I'm sure you wouldn't want to go out with someone who's overweight and doesn't work on their appearance."""
1257,0.9913541652960955,0.008645834703888043,0.057,0.88,0.062,"I'm new to this, but I figured I would do most of the talking and that the therapist would ask questions to help get a fuller picture of my struggles -- similar to my experiences with the intake interview I did at my job's Employee Assistance Program and my first session with the psychologist I saw there."
1258,0.9992126766798943,0.0007873233201218076,0.0,1.0,0.0,But I barely got to cover any of that because the therapist talked for most of the time.
1259,0.9926022053353759,0.007397794664608389,0.181,0.678,0.141,"TL;DR: Like the title of my post suggests, I had a disappointing first session with a therapist."
1260,0.9993333630641736,0.0006666369358385381,0.0,0.906,0.094,"I guess I'm just looking to know I'm not overreacting, and also seeking advice on how to use this experience to better feel out other therapists before making a new appointment."
1261,0.9991505849545482,0.0008494150454634612,0.084,0.643,0.273,"I was too nervous to really ask this therapist any questions before making the appointment, just hoped for the best."
1262,0.9741751483371847,0.025824851662814487,0.0,0.922,0.078,"But before spending another $40 on a copay for another therapist who clearly isn't right for me, I thought I'd see what advice y'all might have in terms of things to ask on the phone."
1263,0.9988512101359766,0.0011487898640378665,0.109,0.738,0.152,"Back when I was seeing a psychiatrist and therapist they BOTH told me and my parents that because my anxiety is so severe, they don't believe I am going to recover fully unless I live in a peaceful relaxing household."
1264,0.9996542537123746,0.0003457462876242424,0.0,0.792,0.208,I may talk to my therapist about it as well.
1265,0.9899117781708852,0.010088221829104503,0.113,0.887,0.0,"Have you thought of harming yourself daily because the idea of leaving your house and dealing with a job, something that apparently everyone else in the world can deal with without psych meds, therapy and tears, is too much to deal with at least 3 times a week?"
1266,0.9980291421829727,0.001970857817027746,0.0,1.0,0.0,I've been seeing a therapist (LCSW) for a couple of months now.
1267,0.9179502885299059,0.08204971147011178,0.319,0.681,0.0,"Last night, I came to therapy with the same litany of problems - immediate, near-sighted problems: Worried about a possible new relationship, worried about sexual performance, stressed out by work and life in general."
1268,0.9996402755362095,0.00035972446377285374,0.0,0.929,0.071,"I've talked to my therapist and I have an appointment with my psychiatrist soon, but I have a feeling he is going to prescribe me something different."
1269,0.99993807002208,6.19299779321283e-05,0.0,0.682,0.318,"However, I sought therapy (CBT) which I found helpful."
1270,0.986602469317975,0.01339753068202361,0.081,0.861,0.057,"I apologize for the rant, but there's a lot on my mind and I don't see my therapist for another couple of days."
1271,0.9897754460425191,0.010224553957481453,0.0,1.0,0.0,"So I've been seeing a therapist for a few months now and while she has helped a little during my last session she concluded that I should be taking the xanax that I have more often and that I should start by taking it two to three times a day for two weeks ""just to see."""
1272,0.9997636744130851,0.00023632558689868846,0.0,1.0,0.0,I don't really know if I should take her advice and was wondering if I should seek a different therapist.
1273,0.9999691116439096,3.0888356093391e-05,0.0,0.813,0.187,"My therapist was going over deep breathing/relaxation techniques with me at my session tonight, really emphasizing relaxation."
1274,0.99996295109684,3.704890314174052e-05,0.0,0.828,0.172,Yesterday I had my first psychotherapy session and my therapist read me like a book.
1275,0.9998315813066739,0.00016841869334487987,0.202,0.798,0.0,"I have come to the point where I don't trust therapists anymore, and I desperately need CBT to get out of my current way of thinking."
1276,0.9999490124552289,5.09875447518555e-05,0.12,0.659,0.221,"The one therapist who I do trust, but unfortunately he has gotten too old to properly help patients, is Nathaniel Branden."
1277,0.9961872024475249,0.0038127975524672297,0.0,0.933,0.067,"I plan on doing the CBT work myself since I can't find a reliable therapist, so I would like to know from personal experience if any of you have found something that works, or if this kind of thing would be sufficient for CBT."
1278,0.9998907535657705,0.00010924643424137677,0.0,1.0,0.0,He is in therapy and takes medication somewhat regularly.
1279,0.9999691088149761,3.0891185017312675e-05,0.196,0.804,0.0,"I am fully recovered from my fucking awful mental illnesses, but I wouldn't have been able to do that without group therapy."
1280,0.9999078978526532,9.21021473486817e-05,0.0,0.905,0.095,"Here's why group therapy works: ""You control, and are ultimately responsible for, what, how much, and when you tell the group about yourself."
1281,0.9999719824234168,2.8017576567072575e-05,0.0,1.0,0.0,Group therapy is often more enriching for some than individual therapy.
1282,0.9999086482582137,9.135174179284728e-05,0.0,1.0,0.0,"Currently, group therapy on average costs $50 per session."
1283,0.9998782934166287,0.00012170658335450388,0.0,1.0,0.0,We are making an app for anonymous group therapy that's as cheap as Spotify premium.
1284,0.9999235995829739,7.640041703136067e-05,0.0,1.0,0.0,"Essentially, you'd be able to sign up for chat/audio group therapy led by other users who've gone through whatever you are going through now."
1285,0.9999458214908058,5.417850918560704e-05,0.215,0.785,0.0,i think i will try some Logotherapy and always ask me what could happend in the worst case?
1286,0.9998601738051155,0.00013982619489028722,0.0,1.0,0.0,I asked my doctor (I did not go so far as to visit a therapist – just making a doctor’s appointment is a lot for me) what she could give me.
1287,0.9999693692847585,3.063071522218656e-05,0.0,1.0,0.0,"Has meditation, yoga, hypnotherapy, etc worked?"
1288,0.9978012961665793,0.0021987038334133936,0.0,0.885,0.115,"I don't even go to my favorite websites pertaining to the subjects anymore, which use to be one of my biggest therapy methods during school."
1289,0.9993606690345757,0.0006393309654261594,0.095,0.796,0.11,"Or I would tell myself ""it's not so bad, you are overreacting, others have it much worse then you"" and talk myself out of going to the school therapist."
1290,0.9999184002786096,8.15997214088204e-05,0.25,0.75,0.0,"Every single day I feel sick, because apparently (according to my therapist/doctor) the anxiety altered my gastrointestinal system."
1291,0.9996005267338904,0.0003994732661080069,0.131,0.869,0.0,"So I can't take medication, meditation doesn't help, and the therapy doesn't seem to stick with me."
1292,0.9996813291619012,0.00031867083809626395,0.161,0.839,0.0,Am currently in therapy and am trying to use CBT stuff but it doesn't always help.
1293,0.9999795002441682,2.0499755815195245e-05,0.0,1.0,0.0,Exposure therapy!
1294,0.9935546813743956,0.006445318625598278,0.0,1.0,0.0,(I do all the normal therapy stuff...being seeing a therapist for 8 years)
1295,0.9997479908567962,0.00025200914319851753,0.0,1.0,0.0,"My therapist suggested seeking medication, something I was deathly afraid of."
1296,0.9998789685545463,0.0001210314454699278,0.132,0.662,0.206,"I postponed, hoping the therapy would work and I would turn the corner."
1297,0.9948511473368242,0.005148852663190333,0.0,0.896,0.104,"Throughout the incident last year up until now, I've been doing regular weekly therapy sessions, and recently picked up a good therapist in our new home city."
1298,0.9994838148581517,0.0005161851418340754,0.0,0.863,0.137,Okay so I've been wanting to go to therapy for about a year now.
1299,0.9997659404221444,0.00023405957785247933,0.0,0.763,0.237,So I've decided to be proactive &amp; look for a therapist.
1300,0.9988281182857118,0.0011718817142972364,0.0,0.714,0.286,I just need help with how to search for a good therapist that will work on sliding scale.
1301,0.9996535109063849,0.00034648909361455877,0.0,0.807,0.193,"I confided in friends and family, was open about it all and went to therapy."
1302,0.9970105846196219,0.002989415380391332,0.288,0.712,0.0,"Therapist wasn't the best so I found a new one, still nothing although I feel hopeful (still my current therapist.)"
1303,0.999984553688354,1.5446311631753135e-05,0.381,0.619,0.0,I have been having therapy and doing depression workshops and my depression has really lifted.
1304,0.9998978587961203,0.00010214120389378235,0.252,0.748,0.0,"I am more anxious than ever, and having some follow up therapy and CBT to begin to attack this."
1305,0.9991393085551493,0.0008606914448609835,0.124,0.833,0.043,"I've recently lost my job 
through sheer agoraphobia which is a 
byproduct of my GAD, and I just feel so alone and pathetic,, I'm on tablets which I 
feel do nothing, I'm in two different types of 
therapy (cognitive and emotional) and I just feel like there is no light at the end of the tunnel."
1306,0.9999395726112443,6.042738876835111e-05,0.188,0.812,0.0,"(heart racing,light headed, breathing issues,arms and legs shaking and numb/tingling) I've started therapy with someone at the clinic here and I'll have another appt with them soon, but is there anything I can do in the meantime to take my mind off of having another panic attack?"
1307,0.9977176993364175,0.002282300663595498,0.089,0.772,0.139,"But, I quickly remembered meditation techniques my therapist gave me, and I also looked at my notes of positive thoughts, and I fought it off."
1308,0.9996070600267224,0.0003929399732964205,0.0,1.0,0.0,I had never been to a therapist or a clinic before.
1309,0.9969164276013232,0.003083572398671432,0.15,0.717,0.133,I started seeing a therapist as well as the mental health clinic and she told me that she thought my problems were mostly anxiety and recommended neurofeedback.
1310,0.9981748225819947,0.0018251774180240974,0.082,0.787,0.131,"My therapist says that the ""feeling"" is just my anxiety, but it's a completely different feeling."
1311,0.9966239251634978,0.003376074836489626,0.087,0.844,0.069,This isn't the first time this has happened to me (probably not even the hundredth at this point...) and I think it's time I start going to therapy but there's a large part of me that can't accept that something serious isn't actually wrong with me medically.
1312,0.9992108967472157,0.0007891032528001898,0.281,0.719,0.0,"I have OCD and severe anxiety, and am seeing a therapist for those very issues."
1313,0.9999426807044526,5.7319295551972434e-05,0.064,0.759,0.177,"My anxiety has gotten much, much better since starting therapy, but there is one thing I can't seem to shake."
1314,0.9999245728715994,7.54271284152463e-05,0.142,0.671,0.187,"My therapist says that I don't validate my own emotions, and I completely agree."
1315,0.999924522298468,7.547770154332374e-05,0.0,1.0,0.0,"My Story:

I've gone to therapy for OCD since I was ~10, now 25."
1316,0.9990507563370428,0.0009492436629595037,0.0,1.0,0.0,I've been in this loop and working with a therapist on and off the whole time.
1317,0.9999204923234766,7.950767651395787e-05,0.0,0.783,0.217,"But so far, I feel like I've gotten nothing out of therapy."
1318,0.9997632487200248,0.00023675127997330124,0.0,0.842,0.158,The 'rabbit in the headlights' feeling my therapist described.
1319,0.9172960672145427,0.08270393278546154,0.109,0.759,0.133,"I have always experienced a moderate amount of anxiety when dealing with social situations since I was a child, but with the help of therapy and CBT I have been able to quell most of my fears when engaging in social situations except for one, checking Facebook."
1320,0.9995112665806751,0.0004887334193369446,0.0,1.0,0.0,"So basically, I showed up, talked to the therapist about my week for a few mins while he set things up (got the induction script out, set up some white-noise), and then we started."
1321,0.999403639856497,0.0005963601435087331,0.295,0.659,0.046,"I'm nervous alone in talking to my doctor, I've feared it for looking like some pill fiend....my dad was a severe manic depressive/bipolar - even been in mental health places and recieved shock therapy and that terrifies me more if i dont do anything about this."
1322,0.9971909579690648,0.0028090420309450975,0.0,1.0,0.0,"With a little refresher from my CBT therapist, I am back to life within a couple months at most."
1323,0.9947720964287168,0.005227903571296654,0.0,0.814,0.186,I'm still mustering up the courage to see a therapist (my first experience was not great).
1324,0.9908374260162869,0.009162573983700293,0.145,0.855,0.0,"After years of no insurance, I will finally be able to see a therapist next month."
1325,0.9998609329153153,0.0001390670846909492,0.0,0.745,0.255,"I recently started somatic therapy, and I've already had some great insight from it."
1326,0.9964235243681568,0.0035764756318424546,0.074,0.926,0.0,"I've had issues with anxiety for as long as I can remember, but I've never seen a therapist about it."
1327,0.993439814364021,0.006560185635998063,0.317,0.683,0.0,I was constantly in a state of anxiety and had constant panic attacks to the point that I got a therapist and began medication.
1328,0.9999781990567023,2.180094330089028e-05,0.0,1.0,0.0,"I was thinking about showing this to my therapist later on (or at least reading it to him), but I wanted to know if anyone has experience anything similar?"
1329,0.9972222906039073,0.0027777093960852047,0.195,0.805,0.0,"Part of the problem of my anxiety is it's hard to put it into words to describe to someone, which is why I have resisted going to a therapist."
1330,0.999659070005204,0.00034092999478463066,0.0,1.0,0.0,I'm starting with a new therapist this week and I'm currently not medicating my condition.
1331,0.9979655945671939,0.0020344054328172287,0.0,0.833,0.167,"I decided to give therapy a chance, after 20 years of not going."
1332,0.999148012062822,0.0008519879371600272,0.0,0.775,0.225,I finally have good insurance that covers most of the therapy costs.
1333,0.9999507896630916,4.921033689024561e-05,0.0,1.0,0.0,I researched CBT trained therapists in my city.
1334,0.9994647845308691,0.000535215469145037,0.0,1.0,0.0,"Last wekk after only 4 visits, my therapist said that I need to find a new therapist."
1335,0.993810555179071,0.006189444820918982,0.0,1.0,0.0,"She claimed that CBT will not work for me, and that I need to find a therapist trained in DBT, after she had done research on it."
1336,0.9989837416248036,0.0010162583752049146,0.152,0.758,0.091,"I feel hopeless, and afraid to contact any of the therapist that my former therapist recommended to me."
1337,0.9999067548242498,9.324517576336e-05,0.08,0.853,0.067,"I recently got insurance and I do plan on getting to a therapist and eventually getting medicated if that's what they think is best, but unfortunately I don't think two weeks is enough time to get that all sorted."
1338,0.9995380688385084,0.0004619311614755281,0.102,0.898,0.0,I have different cases of anxiety on file at the doctors office and years of psycho therapy.
1339,0.9999509241439741,4.9075856033703246e-05,0.172,0.828,0.0,I am seeing multiple therapists and doctors and am on meds but it just isn't getting better.
1340,0.9995166820286906,0.0004833179713028246,0.198,0.802,0.0,I have an extreme fear of throwing up that I'm working with s therapist to overcome.
1341,0.9999243501505422,7.564984944527358e-05,0.0,1.0,0.0,Did your therapists approve of this decision?
1342,0.9995860260717484,0.00041397392823746816,0.115,0.72,0.165,I want to seek help of a psychologist or therapist but am scared to..My whole family should go to counselling but there is slim chance that anyone would go willingly.
1343,0.9998089024336625,0.00019109756634897555,0.0,0.882,0.118,"Up until that point, I was SUPER against taking medication, but things were getting out of control (clearly) and just therapy wasn't working."
1344,0.9974560746630633,0.00254392533692344,0.26,0.71,0.03,"During that period where I went off my medication, I was also not in therapy at all, and I ended up going to the walk in crisis centre as I was having anxiety attacks and the heart palpitations were coming back and I was feeling suicidal."
1345,0.9999215939209752,7.840607901563724e-05,0.116,0.683,0.201,"I'm currently scheduled to go to some cognitive behavioral therapy or something like that, but I feel like that won't help."
1346,0.9994856871700986,0.0005143128299015409,0.0,1.0,0.0,I realize now that I need to see a therapist...but it's too late for this trip.
1347,0.9966110195589684,0.0033889804410222987,0.273,0.662,0.065,"Basically, I'm kind of stuck because after I got out of the psych ward and abusive group a few years ago  my therapists abandoned me because I ""wasn't traumatized enough."""
1348,0.9983985118133532,0.0016014881866597878,0.094,0.879,0.027,"I'm to the point where I have been sick for about a oslid year now with a severe sinus infection and my gum lines are receeding (wisdom teeth may be causing infection too) I can't go to the doctor or hospital becuase

I'm going ot order al ot of books from amazon soon to learn how to do cognative behavoiral therapy myself."
1349,0.9977886994033567,0.0022113005966544193,0.0,0.821,0.179,"I took medication back in my early middle school days for like a month, then I tried a few therapists since then and I didn't really like it at all."
1350,0.9961949960366718,0.0038050039633227765,0.0,1.0,0.0,"My therapist told me that I can't and shouldn't compare my life to what I learn in school, because it's the norm and my life is not normal."
1351,0.9982374965810912,0.001762503418901065,0.067,0.794,0.139,"I'm in therapy now for anxiety, but it doesn't seem to be all to helping with the throat."
1352,0.9961918068538825,0.003808193146125892,0.182,0.818,0.0,I was seeing a therapist for a short time but the sessions really didn't seem to help.
1353,0.9993932471684441,0.0006067528315733477,0.0,1.0,0.0,My new years resolution is to find a new therapist and get back to where I was before or at least somewhat back.
1354,0.996114223047175,0.0038857769528300085,0.133,0.779,0.088,"I've since learned to manage my anxiety free of drugs &amp; therapy, but recently I've had a recurrence with my face falling asleep."
1355,0.9996393295571346,0.00036067044287928945,0.0,1.0,0.0,"It's going to be a few weeks until I can find a therapist, so any tips on how to deal?"
1356,0.9994687433544124,0.000531256645587398,0.191,0.716,0.093,"I had my first therapy in 1½ years last week and it felt good, but I still feel hopeless."
1357,0.9998554612208082,0.0001445387791801886,0.0,0.886,0.114,"I'm going through the hardest thing I've ever been through and I need to discuss it/vent and receive positive input from any psychiatrist, psychologist, therapist, or just people in general."
1358,0.9997858384443429,0.0002141615556428981,0.0,1.0,0.0,I have an appointment with a therapist in two days and an appointment with a psychiatrist in 25 days.
1359,0.9994895335014178,0.0005104664986006634,0.0,1.0,0.0,I don't have a car at school and the place that offers therapy is a $40 taxi ride every week that I can't afford.
1360,0.9998003550856569,0.00019964491433665683,0.0,1.0,0.0,So next week we're going to look into a different doctor and maybe a therapist.
