1526,1526,0.9991056583346184,0.0008943416653749115,0.0,1.0,0.0,"We got talking about work and I found out she works as a secratery....

...at the place I'm going to get my therapy session...",compound,0,neu_vader,pos_vader
1537,1537,0.9998440181038778,0.00015598189610462399,0.0,0.847,0.153,The programs are basically healthy eating and work outs accompanied by lots of cognitive therapy exercises.,compound,0,neu_vader,pos_vader
1542,1542,0.9993488334515304,0.0006511665484573543,0.0,1.0,0.0,"I've been taking Zoloft for about a week, and have my first therapy session in a week.",compound,0,neu_vader,pos_vader
1552,1552,0.9977261787621452,0.002273821237838502,0.084,0.609,0.307,"While things aren't completely better and I am still going to go to a special therapy/camp thing, I am happy and fell confident in my life.",compound,0,neu_vader,pos_vader
1560,1560,0.9999797205542484,2.0279445754519213e-05,0.0,1.0,0.0,"I know some use EDMR therapy and exposure therapy but if those don't work, what other options are there?",appos,0,neu_vader,pos_vader
1561,1561,0.9998653659451554,0.0001346340548382158,0.228,0.677,0.095,"I don't know what to do anymore, I am not smart enough to articulate myself well to a psychiatrist or therapist to make any progress :(...I'm so alone and pathetic it's starting to make me sick to my stomach that I continue on with life",conj,0,neu_vader,neg_vader
1562,1562,0.9999076959681258,9.230403187426672e-05,0.0,1.0,0.0,"I'm on several meds, and am going to therapy regularly.",xcomp,0,neu_vader,pos_vader
1563,1563,0.9955586704425688,0.004441329557417448,0.19,0.767,0.043,"I already have a history of anxiety and depression and am working through it with the help of anti-depressants, exercise and therapy every two weeks, but during this time, I can’t concentrate on anything else but our relationship possibly failing.",conj,0,neu_vader,neg_vader
1564,1564,0.9999740311769814,2.596882301542926e-05,0.0,0.805,0.195,"What are good coping mechanisms that I’m not already doing (pills, exercise, therapy)?",conj,0,neu_vader,pos_vader
1572,1572,0.9999023510581212,9.764894187670762e-05,0.0,0.879,0.121,"Right now my beloved lavender lemongrass candle is almost done, and I figured, instead of just replacing it, I would see what aromatherapy items have worked for you guys!",compound,0,neu_vader,pos_vader
1575,1575,0.9999847624670928,1.5237532916710754e-05,0.0,1.0,0.0,"My therapist's suggestion was to ask myself ""Why do I feel this way?""",poss,0,neu_vader,pos_vader
1582,1582,0.9998448385307172,0.00015516146926809486,0.0,1.0,0.0,I see a psychiatrist and a therapist.,conj,0,neu_vader,pos_vader
1585,1585,0.9992723305562186,0.0007276694437878307,0.095,0.691,0.214,"I'm starting to get anxiety about having to drive, which is a problem because for me getting outside and doing things with friends is really great therapy for me and I can't do that as easily if I can't drive.",attr,0,neu_vader,pos_vader
1590,1590,0.9981810896987364,0.0018189103012448363,0.162,0.838,0.0,"If you are to combine the two approaches though (cognitive-behavioral therapy), the faults of each are suppressed.",parataxis,0,neu_vader,neg_vader
1593,1593,0.9996902534383983,0.0003097465616213373,0.214,0.65,0.136,"Well, I had another therapy session yesterday and it wasn't great (I had one on Monday this week as well and that wasn't great either).",compound,0,neu_vader,neg_vader
1594,1594,0.9997379615232878,0.0002620384767015196,0.45899999999999996,0.48200000000000004,0.059000000000000004,I felt ok but anxious when I arrived but felt very frustrated and depressed when I left the therapist's office.,poss,0,neu_vader,neg_vader
1595,1595,0.9998508558025312,0.0001491441974585184,0.0,0.8540000000000001,0.146,"We (well, my therapist, I was quite passive) spent the session talking about what I can do to feel better.",dep,0,neu_vader,pos_vader
1607,1607,0.9998142202090314,0.0001857797909733699,0.078,0.922,0.0,"I spent about 9 months isolating myself from the world, trying to figure out how to manage my anxiety without meds or therapy.",conj,0,neu_vader,neg_vader
1621,1621,0.9998353637699612,0.00016463623005551962,0.55,0.45,0.0,"I was forced into therapy, the wrong therapy.",appos,0,neg_vader,neg_vader
1624,1624,0.9998179916065444,0.00018200839346558788,0.14300000000000002,0.564,0.293,"I really really want to go to a mental hospital or maybe a therapist, but I feel like I'll be disappointing my friends and family.",conj,0,neu_vader,pos_vader
1634,1634,0.9998589715435859,0.00014102845641519112,0.10400000000000001,0.8959999999999999,0.0,"The finding a therapist thing doesn't show any near me, and there's no sliding scale clinics anywhere near me listed either.",compound,0,neu_vader,neg_vader
1636,1636,0.9998032497546959,0.00019675024529451336,0.0,0.526,0.474,Would getting a therapist help?,compound,0,neu_vader,pos_vader
1653,1653,0.9999628090781032,3.719092190471463e-05,0.19399999999999998,0.8059999999999999,0.0,"http://sharedlife.tumblr.com/post/26222392129/anxiety

I tend to have difficulty expressing my feelings, so on my therapist's suggestion I wrote about my experiences with anxiety.",poss,0,neu_vader,neg_vader
1656,1656,0.9992947246815068,0.0007052753184777144,0.223,0.62,0.157,I would prefer not to see a therapist/take meds but looking at my own writing it appears I'm pretty fucked up.,compound,0,neu_vader,neg_vader
1659,1659,0.999654918137165,0.00034508186282970337,0.335,0.665,0.0,"I also don't have particularly great therapy experiences, so I'm not sure how well that will work for me.",compound,0,neu_vader,neg_vader
1668,1668,0.9999312320645956,6.876793540880264e-05,0.0,0.778,0.222,"I am not making him my therapist or anything like that, but having him there to talk to helps so much.",ccomp,0,neu_vader,pos_vader
1675,1675,0.9999013444414732,9.865555853348033e-05,0.078,0.922,0.0,"I should add that she's not the type to take medicine, go to counseling, therapy, or understand that she even has anxiety.",conj,0,neu_vader,neg_vader
1684,1684,0.9974674558820924,0.002532544117894607,0.0,0.9179999999999999,0.08199999999999999,"I did one session, she said it was going to be focused on changing thoughts and behaviours (as CBT) and it was going to be a short term therapy (6 months - 1 year).",attr,0,neu_vader,pos_vader
1692,1692,0.9998952769163107,0.00010472308370434769,0.083,0.639,0.278,"The doctor and therapist both told me that this medication had minimal side effects, no weight gain, and withdrawal was easy.",conj,0,neu_vader,pos_vader
1693,1693,0.9998439694294696,0.00015603057053375865,0.0,1.0,0.0,I'm not big on taking medications but I figured I would start the Zoloft and use Xanax as needed until my therapy sessions start.,compound,0,neu_vader,pos_vader
1703,1703,0.9997076816221749,0.00029231837784564417,0.0,0.828,0.172,"Is there any hope for fixing myself naturally with just exercise, those things, and a therapist?",attr,0,neu_vader,pos_vader
1704,1704,0.9999884667872057,1.1533212790080029e-05,0.10300000000000001,0.7090000000000001,0.188,My brain was almost completely locked up no matter how much I tried to do relaxation exercises or cognitive therapy techniques.,compound,0,neu_vader,pos_vader
1707,1707,0.9994814074533892,0.0005185925466115674,0.052000000000000005,0.8590000000000001,0.08900000000000001,I am 20 years old and have had social anxiety my whole life and even though its gotten better with medication and therapy it still holds me back in many regards.,conj,0,neu_vader,pos_vader
1710,1710,0.999921933079619,7.806692036795692e-05,0.375,0.625,0.0,He started an aggressive chemotherapy routine that destroyed his body.,compound,0,neu_vader,neg_vader
1722,1722,0.9994544515321018,0.0005455484679032926,0.0,1.0,0.0,"But then the school year ended-and with it,the therapy sessions and medication intakes.",compound,0,neu_vader,pos_vader
1725,1725,0.9984015934350864,0.0015984065649317974,0.0,0.843,0.157,I'm seeing both a doctor and a therapist about these things but it doesn't seem to be helping.,conj,0,neu_vader,pos_vader
1747,1747,0.99995938281557,4.061718443407354e-05,0.095,0.905,0.0,There were no counsellors or therapists to talk to me and my other siblings (I was the oldest) about what was happening.,conj,0,neu_vader,neg_vader
1756,1756,0.9999268510154472,7.314898457245029e-05,0.0,1.0,0.0,"She then said I could be put on the wait list for actual therapy session, which would take about 2 months.",compound,0,neu_vader,pos_vader
1789,1789,0.9999686578333028,3.13421667124909e-05,0.0,0.873,0.127,"I took my therapist's advice and starting saying things when I wanted (sorry if that's unclear), and it has made me feel better.",poss,0,neu_vader,pos_vader
1795,1795,0.9985774128469364,0.0014225871530503767,0.0,0.8270000000000001,0.17300000000000001,"I haven't been able to afford therapy/a psychiatrist in about 6 years, and am well aware at this point I definitely need to start looking into more options.",det,0,neu_vader,pos_vader
1801,1801,0.9999859716859644,1.4028314014256565e-05,0.306,0.6940000000000001,0.0,I have let my doctor and therapist know and I have been diagnosed with intrusive thoughts and there is no risk of suicide for me.,conj,0,neu_vader,neg_vader
1813,1813,0.9999442380462404,5.57619537497172e-05,0.124,0.8759999999999999,0.0,"Do any of you have advice about medication, or therapies for General anxiety?",conj,0,neu_vader,neg_vader
1822,1822,0.9989862428218858,0.001013757178099631,0.0,1.0,0.0,I had my first  therapy appointment (well not my *first* but my first in a few years) yesterday.,compound,0,neu_vader,pos_vader
1824,1824,0.999974908064959,2.509193504247784e-05,0.0,1.0,0.0,Are there therapists who do both?,attr,0,neu_vader,pos_vader
1842,1842,0.9997516646846256,0.0002483353153858623,0.0,1.0,0.0,"I decided to contact the psychology department at Emory University in Atlanta, and I start therapy sessions next week.",compound,0,neu_vader,pos_vader
1849,1849,0.9996153340814352,0.0003846659185697155,0.07400000000000001,0.9259999999999999,0.0,"I have anxiety, and I've been going to therapy for the last couple years, but this feels totally different.",xcomp,0,neu_vader,neg_vader
1856,1856,0.9998907594513,0.00010924054870770948,0.21600000000000003,0.56,0.22399999999999998,Starting to lose faith in therapy's potential for me.,poss,0,neu_vader,pos_vader
1857,1857,0.9998855264334492,0.00011447356655982351,0.0,0.9279999999999999,0.07200000000000001,There is one more therapist that was recommended to me but I have yet to call him for an appointment.,attr,0,neu_vader,pos_vader
1865,1865,0.9998852300603828,0.00011476993961541577,0.059000000000000004,0.941,0.0,"I haven't seen my doctor or therapist in this time, and today me and my mom just got a letter from my therapists office saying ""Since you haven't kept contact, we assume our services are no longer needed.",conj_compound,0,neu_vader,neg_vader
1866,1866,0.9999662189853016,3.37810146901654e-05,0.113,0.615,0.272,I have no faith in medication or therapy anymore because I feel like i've tried it all.,conj,0,neu_vader,pos_vader
1869,1869,0.9920116173313934,0.007988382668610572,0.0,0.86,0.14,"So I've been pretty put off of seeking professional help unless someone is willing to PM me and lives in the Northern Virginia area to give me a personal recommendation to a doctor, therapist, or social worker who will hear me out.",npadvmod,0,neu_vader,pos_vader
1870,1870,0.9965503267134058,0.00344967328657865,0.209,0.7140000000000001,0.076,"I've tried a million things to get rid of my anxiety: doctors, therapist, supplements, running, improved posture, you name it I've probably tried it except for medication because I'm scared to death of them.",conj,0,neu_vader,neg_vader
1874,1874,0.9999575621863928,4.243781361801666e-05,0.397,0.603,0.0,Ever since I've started going to therapy my anxiety has just gotten worse and worse.,xcomp,0,neu_vader,neg_vader
1902,1902,0.9889225169269636,0.01107748307302782,0.126,0.8009999999999999,0.073,I met my partner towards the end of that period (summer 2012)... At that point I was still depressed (and in a group therapy group) but on my way to being better and I'd say I haven't been depressed since early in our relationship (a year and a half ago...,compound,0,neu_vader,neg_vader
1904,1904,0.999807199645631,0.000192800354351396,0.0,1.0,0.0,"I've been seeing a psychiatrist, and therapist since my diagnosis.",conj,0,neu_vader,pos_vader
1911,1911,0.9999807906704022,1.9209329611002265e-05,0.0,1.0,0.0,"I've gone to the psychiatrist, psychologists and group therapies and have learned every ""coping mechanism"" they have given me, but nothing has helped.",conj,0,neu_vader,pos_vader
1914,1914,0.9996079266650194,0.0003920733349830379,0.0,1.0,0.0,The next 6 - 7 months consisted of medication and therapy.,conj,0,neu_vader,pos_vader
1939,1939,0.9993297034158016,0.0006702965842009775,0.309,0.691,0.0,"I've been variously diagnosed as depressed, bipolar, severe anxiety, paranoia....every shrink has a different idea, different therapy, different drugs, none work.",appos,0,neu_vader,neg_vader
1947,1947,0.9996928639150959,0.00030713608488670905,0.0,1.0,0.0,I haven't seen a therapist for..whatever it is I have.,compound,0,neu_vader,pos_vader
1951,1951,0.9992671837515372,0.0007328162484447926,0.139,0.861,0.0,I had a quite upsetting therapy session yesterday where I got to know I won’t get to see my psychologist for at least a couple of months.,compound,0,neu_vader,neg_vader
1954,1954,0.98979499427065,0.010205005729339824,0.13,0.812,0.057999999999999996,"After spending a week in the hospital for attempted suicide, I took advantage of my school's mental health services (got set up with a new psychiatrist, a new therapist, and registered with Disability Services).",conj,0,neu_vader,neg_vader
1959,1959,0.9968730631252488,0.0031269368747613977,0.0,0.667,0.33299999999999996,I've gone down the therapy path a few times but I don't think I was really ready to accept it.,compound,0,neu_vader,pos_vader
1961,1961,0.979670977176342,0.020329022823654626,0.106,0.792,0.102,"“Consequently, clinicians could employ new treatment models for social anxiety or similar types of distress administering MDMA on one to several occasions within the context of a supportive and integrative psychotherapy protocol.”
MDMA is also being looked at to treat other psychiatric conditions.",compound,0,neu_vader,neg_vader
1963,1963,0.9455283312912928,0.05447166870870905,0.0,0.845,0.155,"Rising in popularity in the the late 1970s and early 1980s among a circle of underground chemists, therapists and psychedelic drug enthusiasts, it later became infamous as the drug that fuelled all-night raves.",conj,0,neu_vader,pos_vader
1969,1969,0.7831974548582699,0.2168025451417392,0.031,0.87,0.1,"I've recently been dealing with a lot of anxiety, and while there are many different ways of dealing with it, medication, meditation, therapy, or the million other things you can do, I have found a really easy way to take about 1% of the edge off, and I'm sure a lot of people do it.",conj,0,neu_vader,pos_vader
1970,1970,0.9993195936903602,0.0006804063096524149,0.0,0.6990000000000001,0.301,"If you're able to even discuss your findings with someone, whether it be a trusted friend or family member, or a therapist, it could be useful information!",conj,0,neu_vader,pos_vader
1971,1971,0.999970616233196,2.9383766815820344e-05,0.0,1.0,0.0,I am on medication now and regular therapy.,attr,0,neu_vader,pos_vader
1972,1972,0.999633136587369,0.00036686341262082156,0.0,0.7809999999999999,0.21899999999999997,"I need to get out of the house more often, yes I know you probably live miles away, but I'm just looking for someone who can motivate me, and is willing to start exposure therapy

cheers
Im 25/m/ Canada",compound,0,neu_vader,pos_vader
1986,1986,0.9997703712880884,0.00022962871191522133,0.242,0.669,0.08900000000000001,"I know that the common advice for anxiety is therapy and medication, but I'm far too anxious for the former and strongly dislike the latter.",attr,0,neu_vader,neg_vader
1998,1998,0.9964176564693904,0.0035823435306019647,0.045,0.8370000000000001,0.11800000000000001,"I have been linked in with various college services like counselling, occupational therapy, and hopefully will see a psychiatrist soon and have been trying to negotiate extensions and accommodations, all the while unsure of how or if I can turn this ship around.",conj,0,neu_vader,pos_vader
2000,2000,0.9985620210917938,0.0014379789082186259,0.1,0.78,0.12,That + my parents and others not giving me attention as a child made me think that no one really was interested in me and I had to raise myself basically (this is something me and my therapist agreed upon).,conj,0,neu_vader,pos_vader
2008,2008,0.9999125358449444,8.746415507020414e-05,0.0,1.0,0.0,The doctor will subtly hint at seeing a psychiatrist or therapist.,conj,0,neu_vader,pos_vader
2009,2009,0.9993792905867851,0.0006207094132243961,0.03,0.816,0.154,"It is somewhat helpful that DM has some psych skills as originally he wanted to be a therapist and he knows that when I am having them it is better to just mostly let me alone, maybe jokingly remind me in a way that breathing is useful to living and let it be as opposed to work's constant omg are you okay?",attr,0,neu_vader,pos_vader
2024,2024,0.9999821041554664,1.7895844518634038e-05,0.0,0.924,0.076,I have thought about going in and talking to someone either a therapist or my doctor I am just curious if anyone else has had anything similar and what they have done.,amod,0,neu_vader,pos_vader
2041,2041,0.9994465867001676,0.0005534132998274108,0.0,1.0,0.0,I've been going to therapy for a few months now.,xcomp,0,neu_vader,pos_vader
2045,2045,0.9991992205568412,0.0008007794431459058,0.0,0.69,0.31,Both my therapist &amp; I agree a few weeks of inpatient would be good for me.,npadvmod,0,neu_vader,pos_vader
2047,2047,0.988854500226264,0.011145499773753216,0.14300000000000002,0.772,0.085,"* I've seen multiple doctors, therapists, and psychologists for the sleep and anxiety over the past 5 years - no one has been able to pinpoint a solution.",conj,0,neu_vader,neg_vader
2060,2060,0.9998143395378096,0.00018566046218503605,0.0,1.0,0.0,I don't know if I should try to get medication/therapy if in a couple months I won't even be living here anymore.,acomp,0,neu_vader,pos_vader
2065,2065,0.9999699216634936,3.0078336519791107e-05,0.0,1.0,0.0,I wonder if there are any therapists that would reveal some inside info.,attr,0,neu_vader,pos_vader
2079,2079,0.9980806008434324,0.0019193991565656808,0.054000000000000006,0.7659999999999999,0.18,"I'm seeing a psychiatrist at a therapist's recommendation in September, but I would really like somebody with experience with anxiety to sort of help me get an idea of what's going on in my head.",poss,0,neu_vader,pos_vader
2087,2087,0.9979331398217014,0.002066860178279974,0.147,0.853,0.0,Ever since I started on my Prozac and started going to therapy my panic attacks went from 1-4 a day to about 1-4 a month and recently only getting one if something big happens and not just out of the blue.,xcomp,0,neu_vader,neg_vader
2103,2103,0.9999307700671104,6.922993289437996e-05,0.0,1.0,0.0,"I regularly do Cognitive Behavioral Therapy, exposure therapy, reading books, etc.",appos,0,neu_vader,pos_vader
2106,2106,0.9999465760566528,5.342394335750835e-05,0.0,1.0,0.0,I've been to two psychiatrists and two therapists for my GAD.,conj,0,neu_vader,pos_vader
2122,2122,0.9998728812389016,0.00012711876110776724,0.0,1.0,0.0,"But she’s back: church, group therapy, the shopping strip where I work.",conj,0,neu_vader,pos_vader
2123,2123,0.9999622695144356,3.773048556235757e-05,0.16899999999999998,0.831,0.0,I don't want her to be my therapist.,attr,0,neu_vader,neg_vader
2124,2124,0.999747005883904,0.0002529941160911669,0.0,0.882,0.11800000000000001,"Whenever I ask my doctor or therapist if it is okay to start exercising again, they tell me ""if I feel ready"", which should not be as difficult a question to answer as it is.",conj,0,neu_vader,pos_vader
2141,2141,0.9999681032334043,3.189676659257339e-05,0.0,1.0,0.0,and scheduled my therapist's sessions once every *three* weeks.,poss,0,neu_vader,pos_vader
2146,2146,0.9999762078922732,2.3792107740485785e-05,0.0,1.0,0.0,"To myself, my doctor, my girlfriend, my therapist.",appos,0,neu_vader,pos_vader
2159,2159,0.990469965234536,0.0095300347654516,0.0,0.868,0.132,"A group therapist visits/is visited once a week or so to help with the dynamic, group walks are held semi-daily as an alternative to sit-down meetings, and some meals are probably prepared at regular times for practical reasons; but routines are kept minimal to allow as much time as possible for individual schedules and group projects.",compound,0,neu_vader,pos_vader
2168,2168,0.9998904735890584,0.00010952641095244244,0.0,0.754,0.24600000000000002,"Well, soon I will have full access to therapy/counseling/what have you if I so choose to take the opportunity.",dep,0,neu_vader,pos_vader
2194,2194,0.9987093073086608,0.0012906926913267161,0.14300000000000002,0.857,0.0,"And the ways to fix it are difficult (therapy, finding right meds, diet, exercise, meditation, socialization).",npadvmod,0,neu_vader,neg_vader
2199,2199,0.9996841618776152,0.0003158381223766643,0.0,0.7020000000000001,0.298,"*

She's also the most effective therapist that I've had.",attr,0,neu_vader,pos_vader
2200,2200,0.9971527657496866,0.0028472342503205504,0.036000000000000004,0.898,0.066,She's really nice and is the first therapist that I've had that seems to really understand what's going on in my head (probably because of our common age group and that she's been in school recently and is familiar with the newest anxiety work).,attr,0,neu_vader,pos_vader
2205,2205,0.9999856011211814,1.4398878825778824e-05,0.27,0.73,0.0,I hate myself thinking I had this under control and not continuing therapy.,conj,0,neu_vader,neg_vader
2211,2211,0.99995610449887,4.389550114177465e-05,0.159,0.703,0.138,"I've tried the anxiety exercises, cognitive behavioural therapy, but only anxiety medicine (clonazepam) calms me enough to function.",conj,0,neu_vader,neg_vader
2212,2212,0.9992781354234958,0.0007218645765158357,0.038,0.9620000000000001,0.0,"Yesterday, I called the local Health Centre (you call them and they call you back and book a time with a doctor or therapist and you go there, and if it's too big for them you go to the hospital) yesterday and told them about my anxiety.",conj,0,neu_vader,neg_vader
2223,2223,0.9985581638222112,0.0014418361777728088,0.076,0.843,0.081,"The reason I am here, now, is that I've realized my problems will improve only with regularly scheduled and frequent therapy sessions (as opposed to the session-here-session-there style of treatment I was getting before).",compound,0,neu_vader,pos_vader
2227,2227,0.99970637850091,0.0002936214990963848,0.145,0.855,0.0,I made a therapy appointment after I was prescribed anxiety medication a few weeks ago.,compound,0,neu_vader,neg_vader
2235,2235,0.9998592509634888,0.0001407490364983453,0.0,1.0,0.0,Is there a specific therapist for my age group and gender?,attr,0,neu_vader,pos_vader
2252,2252,0.9999623846879776,3.761531200683554e-05,0.0,1.0,0.0,I have weekly group therapy meetings from 4:30 to 6 on Tuesdays.,compound,0,neu_vader,pos_vader
2257,2257,0.9991787551239469,0.0008212448760386435,0.0,1.0,0.0,"So I started doing what my mom, who, is a psychotherapist, told me to tell myself.",attr,0,neu_vader,pos_vader
2260,2260,0.999653552016622,0.0003464479833708032,0.09699999999999999,0.903,0.0,"I saw the signs that I was headed for a bad place, but I've been trying to mask the symptoms with medication and declining therapy.",conj,0,neu_vader,neg_vader
2262,2262,0.9978817897452038,0.002118210254791032,0.0,0.8320000000000001,0.168,"The host is a Naturopathic Doctor in Canada, but the tips are generally broadly what you'd hear in a good therapy session.",compound,0,neu_vader,pos_vader
2268,2268,0.9997174284109691,0.000282571589035105,0.064,0.789,0.147,"Hey guys, I've never been to a therapist or been diagnosed but one thing I know for certain is that I'm a very anxious person and a therapist could probably give me a label =P

I don't know if it's necessary to describe my symptoms...",conj,0,neu_vader,pos_vader
2272,2272,0.999864993648366,0.00013500635161468527,0.147,0.853,0.0,"I feel as though this is partly why meditation and therapy has not helped me, since I ultimately conclude that no effect is taking place and subsequently become more anxious.",conj,0,neu_vader,neg_vader
2273,2273,0.9999678674667848,3.2132533205254624e-05,0.091,0.909,0.0,"I've finally woke up, kept up with counseling, psychotherapy and mindfulness meditation sessions, and struggled through school to get caught up on homework and chapters.",conj,0,neu_vader,neg_vader
2276,2276,0.9999449401602084,5.505983979358204e-05,0.0,1.0,0.0,"I've tried meds, therapy, acupuncture, yoga, meditation, supplements, etc.",conj,0,neu_vader,pos_vader
2278,2278,0.9999271066849644,7.289331502537063e-05,0.083,0.917,0.0,"CBT seems to be the most common psychotherapy for anxiety, but my therapist's approach is mindfulness-oriented.",attr_poss,0,neu_vader,neg_vader
2300,2300,0.9999295956687472,7.040433124828745e-05,0.0,1.0,0.0,"Today I had to call and make an advising appointment at my university, I had to call and reschedule my jury duty, and I had to call this new therapists office and try to schedule an appointment.",compound,0,neu_vader,pos_vader
2309,2309,0.9998417284819928,0.0001582715180206394,0.0,1.0,0.0,He asked if I wanted someone to throw pills at me or a therapist.,conj,0,neu_vader,pos_vader
2311,2311,0.996611737369259,0.003388262630741972,0.0,1.0,0.0,"So my Dr. says ""Well, my brother is a therapist who deals with adoption cases, foster children, and works with a lot of church groups.",attr,0,neu_vader,pos_vader
