,Unnamed: 0,neg_prob,pos_prob,neg_vader,neu_vader,pos_vader,sentence,dict,identifier,sentiment,only pos or neg
5,5,0.9997909127877213,0.0002090872122774117,0.155,0.7140000000000001,0.131,"I've been through my share of doctors, therapy, emergency room visits, diagnoses, breakdowns, etc.",conj,0,neu_vader,neg_vader
9,9,0.999170802003095,0.0008291979969083492,0.251,0.7490000000000001,0.0,I scheduled a GP appointment last week and he diagnosed me with anxiety and panic disorder and referred me to a psych for further evaluation and medication and a therapist.,conj,0,neu_vader,neg_vader
14,14,0.9953418009046466,0.004658199095356565,0.095,0.905,0.0,"Problem being, the area I'm in is extremely underserved for psychiatrists and therapists and I have to go with a hospital group that has pay on a sliding scale for uninsured/poor people, and the only one anywhere close is apparently booked for two months.",conj,0,neu_vader,neg_vader
16,16,0.9984353787854864,0.0015646212144973036,0.0,0.929,0.071,"This morning I had an intense therapy session, basically had a meltdown and worked my way through a stack of tissues.",compound,0,neu_vader,pos_vader
17,17,0.9987431915303808,0.001256808469635451,0.073,0.833,0.094," I'm a high school senior and I'd like to get help for my anxiety/depression, ( doctor not a therapist) but i have no idea how to bring up the topic with my mother or how to go about it.",appos,0,neu_vader,pos_vader
23,23,0.999931228703067,6.877129692491934e-05,0.0,1.0,0.0,I will also look into meditation and possibly therapy.,conj,0,neu_vader,pos_vader
33,33,0.999986167273184,1.3832726821929788e-05,0.0,1.0,0.0,She was an alternative-medicine type therapist and helped me talk some things out and give me some coping strategies.,attr,0,neu_vader,pos_vader
82,82,0.9999174827676726,8.25172323427955e-05,0.077,0.818,0.105,I still plan on going to therapy and I now am optimistic that with these herbs and therapy I can overcome my anxiety.,conj,0,neu_vader,pos_vader
87,87,0.9980437513667604,0.001956248633224284,0.0,0.853,0.147,"Now, me and my therapist and my psychiatrist talk alot, and we agreed that a stimulant of some sort would be beneficial for me to become more extroverted and talk to people.",conj,0,neu_vader,pos_vader
90,90,0.9999637693921691,3.623060784946733e-05,0.0,1.0,0.0,"Also, any other alternative therapies you have tried that I didn't list.",ROOT,0,neu_vader,pos_vader
103,103,0.9995066727732728,0.0004933272267099171,0.091,0.7879999999999999,0.121,"I just asking for some second hand knowledge on something like this or a second opinion other then my therapist who was helpful in most other problem area's but when ever I covered this topic they just said ""keep up your defense against it, if you believe you can you will"" but doing so is just extremely exhausting.",dep,0,neu_vader,pos_vader
116,116,0.9962044693715204,0.0037955306284990454,0.0,0.8420000000000001,0.158,"However, towards the end of our relationship (1.5 years) I started to benefit from the school therapy groups.",compound,0,neu_vader,pos_vader
120,120,0.9999442676544904,5.5732345506929356e-05,0.223,0.777,0.0,Cue psychiatrist and therapist and I realize what I resent in him is the same thing I resented in myself.,conj,0,neu_vader,neg_vader
122,122,0.9999555989704276,4.440102955480371e-05,0.128,0.775,0.098,So fuck off you dimwitted fuckwitted sugartits that think you are better than me because you hold the clipboard and the misconceptions that are therapy.,attr,0,neu_vader,neg_vader
124,124,0.999825486507408,0.0001745134926062798,0.21899999999999997,0.461,0.32,"I want my therapist's approval and praise, but on the other I want them to fuck off.",poss,0,neu_vader,pos_vader
132,132,0.9993191444308532,0.000680855569156145,0.441,0.5589999999999999,0.0,Tried therapy but I'm so shy it didn't help a ton.,ROOT,0,neu_vader,neg_vader
133,133,0.999546216125155,0.00045378387484672314,0.0,0.8590000000000001,0.141,I've applied for some more scholarships and another college in town that can help save some more money but give me a few more prephysical therapy classes.,compound,0,neu_vader,pos_vader
134,134,0.9991946607097986,0.0008053392901817933,0.21100000000000002,0.789,0.0,My grades aren't amazing so I won't be able to get into a physical therapy school and my art isn't amazing so I couldn't change to art school.,compound,0,neu_vader,neg_vader
145,145,0.9999864447503426,1.3555249636506873e-05,0.0,1.0,0.0,"It is not ""talk"" therapy so I cannot ask the psychiatrist for advice on how I should handle this.",npadvmod,0,neu_vader,pos_vader
151,151,0.9849056788528504,0.015094321147142375,0.0,1.0,0.0,"**

So three weeks ago I was in the middle of my weekly therapy session [when a different person took over for me.",compound,0,neu_vader,pos_vader
155,155,0.9981769771414329,0.001823022858549695,0.071,0.875,0.054000000000000006,I've had a sleepless night due to intense anxiety and I need to keep myself occupied until I go to my therapist meeting in a few hours.,compound,0,neu_vader,neg_vader
161,161,0.9997018545578359,0.00029814544215233264,0.0,1.0,0.0,And a therapist.,ROOT,0,neu_vader,pos_vader
170,170,0.9980983230066608,0.001901676993339788,0.0,1.0,0.0,"The patient must go through a series of Cognitive therapy practices and medication must be supplemented to overcome these harmful thoughts.""",compound,0,neu_vader,pos_vader
176,176,0.9999279895898691,7.201041012800715e-05,0.0,0.775,0.225,Has anyone else successfully been treated by their doctor and not a therapist?,conj,0,neu_vader,pos_vader
178,178,0.9999651985511392,3.480144886403136e-05,0.094,0.9059999999999999,0.0,I've been seeing psychiatrists and therapists since I was 11 and they've given me so many different pills and treatments and nothing helps.,conj,0,neu_vader,neg_vader
180,180,0.9998304896733908,0.00016951032662288767,0.0,1.0,0.0,"Hello everybody,

my name is Pedro and I'm a psychologist and psychotherapist from Brazil.",conj,0,neu_vader,pos_vader
184,184,0.9962482152430197,0.0037517847569736758,0.0,0.7390000000000001,0.261,"It has movement classes and yoga, individual and group therapy, and a very relaxing, holistic and natural ""healing"" vibe to it that you just don't get in inpatient psychiatric care.",conj,0,neu_vader,pos_vader
185,185,0.9985269776835424,0.0014730223164408788,0.07200000000000001,0.743,0.18600000000000003,"The only problem is that I don't have the time to devote to creating my own program at home, and it wouldn't have the kind of support and therapy system I'm looking for.",compound,0,neu_vader,pos_vader
186,186,0.999521315185208,0.00047868481478589023,0.385,0.615,0.0,"Bloodwork, physical therapy...but holy shit, I can not get rid of this back pain.",appos,0,neu_vader,neg_vader
188,188,0.9999569166342508,4.308336576494102e-05,0.0,0.7340000000000001,0.266,"Apart from therapy ofcourse, how can I make it better?",compound,0,neu_vader,pos_vader
190,190,0.9997155169280248,0.00028448307197975737,0.152,0.609,0.239,i've been in (sliding scale) therapy for a year and a half and am pretty sure i suffer from GAD.,dep,0,neu_vader,pos_vader
199,199,0.9988729017446971,0.001127098255310636,0.0,0.8420000000000001,0.158,"I can only imagine a therapist meeting where, oh, I feel better and not being able to take anything away from it because I'm not a serious case.",compound,0,neu_vader,pos_vader
203,203,0.9983581153392964,0.0016418846607110249,0.0,0.912,0.08800000000000001,"I just posted my short life story here on another post but I wanted to start this one to be more specific, here is a brief summery of my anxiety/depression :

It took YEARS (nearly a decade) to find a good therapist/psychologist combo to diagnose me correctly.",compound,0,neu_vader,pos_vader
204,204,0.9935992415397148,0.006400758460285617,0.106,0.8240000000000001,0.07,"I finally found a medication and therapist  that works for me (the combo was a complete game changer), my life is 10 fold better and I know many of the triggers that can kick in this anxiety so I can avoid them.",conj,0,neu_vader,neg_vader
213,213,0.9990113307136784,0.0009886692863190255,0.0,1.0,0.0,"I'm going in today for a therapy session, and then am being diagnosed soon and put on medication soon after that.",compound,0,neu_vader,pos_vader
223,223,0.9996370870147016,0.00036291298528286746,0.11,0.89,0.0,"They discouraged me from seeing a therapist/taking meds, but this isn't about them, this is about me.",compound,0,neu_vader,neg_vader
224,224,0.9998379741547406,0.00016202584525069552,0.098,0.902,0.0,"I am planning to tell my therapist this story tomorrow, as if I am actually going crazy, he would be the one that knows right?",dative,0,neu_vader,neg_vader
236,236,0.9999505040687384,4.949593126178464e-05,0.22899999999999998,0.634,0.13699999999999998,"I never ever thought I would be able to do this (scared, wasting therapist's time, etc) but today the psychologist told me: I have to stop feeling bad for trying to improve my life.",poss,0,neu_vader,neg_vader
237,237,0.9999853933684872,1.460663152536434e-05,0.0,1.0,0.0,To anyone putting off appointments or therapy: you can do it!,conj,0,neu_vader,pos_vader
239,239,0.9995873375673492,0.00041266243264566224,0.247,0.753,0.0,"A list:

colonoscopy

endoscopy

various bloodworks (too many to count, really)

urologist x 3

cat scan

therapist

chest xrays

I have panic disorder and depression and general anxiety ...

what's going on recently is I have proteinuria, and my urolgist is sending me to a nephrologist in August, so I'm nervous about that.",compound,0,neu_vader,neg_vader
240,240,0.9998667249968906,0.0001332750031239651,0.0,1.0,0.0,Foundation of my therapy was samatha and vipassana meditation + cognitive behavioral therapy rather than taking meds.,conj,0,neu_vader,pos_vader
277,277,0.9608909702745904,0.0391090297253982,0.207,0.6940000000000001,0.099,"I went through a week long 8 hour group therapy session for attempting to commit suicide over a year ago, but none of the techniques are helping the pain of anxiety in my head and belly and my racing thoughts.",compound,0,neu_vader,neg_vader
280,280,0.9998964239177588,0.00010357608222533318,0.243,0.691,0.066,"I'm not on xanax or the other medication thats for anxiety (I'm really sorry I'm such a noob at this, the meds that start with a C) and I'm trying to get an appointment with my psychiatrist and a therapist, but I really hate relying on meds to be ""okay""  

I feel really weak and pathetic because I need almost constant reassurance that things will be okay eventually",conj,0,neu_vader,neg_vader
281,281,0.9969518087816276,0.003048191218359978,0.109,0.718,0.172,The therapist lady was a bitch it came to the point that we just had to tell her everything was perfectly fine to not have to see her anymore.,compound,0,neu_vader,pos_vader
285,285,0.99805747424129,0.0019425257586908266,0.0,1.0,0.0,I've seen about 3 doctors and a therapist in the last five years.,conj,0,neu_vader,pos_vader
302,302,0.9998902727557996,0.00010972724419692036,0.4,0.6,0.0,"Yesterday I know realized I took three - trouble sleeping, stressful day, exposure therapy.",appos,0,neu_vader,neg_vader
305,305,0.9999605103240752,3.948967594428699e-05,0.19699999999999998,0.8029999999999999,0.0,"I'm not sure what - therapy, counseling, medications, whatever ...",ccomp,0,neu_vader,neg_vader
310,310,0.9958372257504956,0.004162774249497106,0.0,1.0,0.0,"I went to visit a psychologists last tuesday for the first time ever, and she said something that we are going to start with something called ""cognitive therapy"".",oprd,0,neu_vader,pos_vader
318,318,0.9997106082476096,0.00028939175237284643,0.0,0.648,0.35200000000000004,"Her mom, a massage therapist, worked on my neck pretty well and I'm sure she would've discovered anything.",appos,0,neu_vader,pos_vader
323,323,0.9996015752302666,0.0003984247697347121,0.0,1.0,0.0,This then lead to a group therapy session.,compound,0,neu_vader,pos_vader
343,343,0.9999916463578608,8.353642135541666e-06,0.205,0.795,0.0,I've had terrible pill pushing doctors and psychiatrists and therapists and social workers.,conj,0,neu_vader,neg_vader
348,348,0.9999884740748614,1.1525925139971055e-05,0.162,0.736,0.10099999999999999,"I'm 24yo and don't have many things to do this summer, i want to do an interrail now that my anxiety is better, but none of my friends want to come with me since they have no money or simply don't want to, so i decided i could/should go alone, my parents and therapist are very supportive but now that i have come to realize i was traveling alone for three weeks my anxiety spikes up and i feel overwhelmed with fear because of what i would go through if i decide to make this trip, i know it would be very good for me since i always lived with my parents and never traveled alone, i don't know what i'm looking for here, maybe some advice or people with similar experiences who traveled alone.",conj,0,neu_vader,neg_vader
351,351,0.9999908077032332,9.192296757374595e-06,0.0,1.0,0.0,The suggestions provided here are not explicitly medical advice and are not intended to replace psychotherapy treatment.,compound,0,neu_vader,pos_vader
358,358,0.9998076190107548,0.00019238098925348,0.289,0.68,0.032,"If I ever have kids or divorced or anything, the last thing I want is my therapist subpeonad and then forced to discuss how I am anxious, fearful and all other negative issues that I tell him.",compound,0,neu_vader,neg_vader
373,373,0.9998352162963255,0.00016478370366188752,0.0,0.815,0.185,"It seems like it might be overkill now, but somehow the weekly therapy and monthly psych visits don't feel like they will be enough.",nmod,0,neu_vader,pos_vader
384,384,0.998884631053081,0.0011153689469221221,0.078,0.848,0.07400000000000001,I then spent the rest of the week coming down from that and recovering - missing my therapy appointment on Tuesday as well as all of my classes.,compound,0,neu_vader,neg_vader
395,395,0.9999972363242282,2.76367579203534e-06,0.0,0.872,0.128,"I know you guys aren't supposed to be therapists or anything, but I just wanted to share and maybe get some advice.",attr,0,neu_vader,pos_vader
406,406,0.999894946741438,0.00010505325854756442,0.066,0.82,0.113,"I have been anti-pharmaceuticals and have been using exercise, diet, and cognitive-behavioral therapy which had good (but not great) results in controlling my anxiety.",conj,0,neu_vader,pos_vader
409,409,0.9767583072717192,0.02324169272829971,0.304,0.696,0.0,"I was able to control it after only a few therapist visits, but just last summer, with my mothers cancer becoming worse, and the stress of college, my PTSD came roaring back into focus into my life.",compound,0,neu_vader,neg_vader
420,420,0.9957728011446676,0.004227198855325926,0.0,0.862,0.138,"I attended numerous therapy sessions with a general family psychiatrist, which helped clear a lot of demons but had yet to solve my intimacy issue.",compound,0,neu_vader,pos_vader
425,425,0.9998345324802264,0.00016546751976408968,0.11699999999999999,0.841,0.042,"I'm glad that I'll be able to catch up on school work and actually graduate on time but I'm afraid that I won't have any social interaction anymore, I only leave my house for school and therapy as it is, and I'm just really scared.",conj,0,neu_vader,neg_vader
432,432,0.9999919137156056,8.086284391919763e-06,0.0,1.0,0.0,"I have an appointment on friday with my psych, maybe I need to start going to therapy too anyway.",xcomp,0,neu_vader,pos_vader
440,440,0.999971285374838,2.871462515673233e-05,0.0,1.0,0.0,These animals are my therapy.,attr,0,neu_vader,pos_vader
447,447,0.9999788712194508,2.112878056919829e-05,0.18100000000000002,0.745,0.075,"My friends all said that it wasn't healthy to mess with my medication and constantly be going on and off, but none of them had any problems (or so I had thought), medication, therapists, so I would get in arguments and have breakdowns.",conj,0,neu_vader,neg_vader
453,453,0.9999418466434736,5.815335653938942e-05,0.0,0.628,0.37200000000000005,"It seems like I've learned to control that better now - thanks to meds, therapy, and my girlfriend.",conj,0,neu_vader,pos_vader
463,463,0.9998016095318838,0.0001983904680991001,0.0,0.773,0.22699999999999998,"I'm happy to give people the names of my doctors (GP, therapist, psychiatrist) if you want - just PM me.",appos,0,neu_vader,pos_vader
472,472,0.9991004459648848,0.000899554035103726,0.0,0.877,0.12300000000000001,"But I would really like to hear from people with a therapy animal if possible, and the pros and cons they have encountered.",compound,0,neu_vader,pos_vader
477,477,0.9993463970821684,0.0006536029178430223,0.066,0.7959999999999999,0.138,"I try using some stuff I learned from an ""Emotion Regulation"" group therapy class over summer, but after a certain point it's like I have no more control over my own body and I just watch everything start going out of control.",compound,0,neu_vader,pos_vader
479,479,0.9999667924014574,3.320759852571369e-05,0.0,0.9129999999999999,0.087,It will be an intense short term therapy but I need to start somewhere.,attr,0,neu_vader,pos_vader
484,484,0.9994949192354756,0.0005050807645334423,0.0,0.777,0.223,I thought it might be a muslce knot or something but my massage therapist friend couldnt find one.,compound,0,neu_vader,pos_vader
488,488,0.9995780741299995,0.00042192586998772,0.0,1.0,0.0,"Oh, did I mention I'm training to be a psychotherapist?",attr,0,neu_vader,pos_vader
489,489,0.9888287615592716,0.01117123844071113,0.402,0.555,0.042,"Through drug treatment and continual therapy I know it will, but over a decade of feeling anxious about most things, panic attacks, and deepening depression will not be fixed quickly.",conj,0,neu_vader,neg_vader
490,490,0.999898255109527,0.00010174489048684609,0.0,0.68,0.32,"He enjoys aromatherapy items, especially candles and incense.",compound,0,neu_vader,pos_vader
498,498,0.9997345369855204,0.00026546301448141066,0.19,0.81,0.0,"I know this isn't healthy but I don't think there's any way she's ever going to be able to totally understand, and I'm sick of making her be my therapist.",attr,0,neu_vader,neg_vader
508,508,0.9999730868639948,2.691313601013166e-05,0.0,1.0,0.0,Are there therapists who operate in this manner?,attr,0,neu_vader,pos_vader
510,510,0.9522592490223984,0.04774075097759771,0.043,0.9570000000000001,0.0,"I'm a little nervous to bring it up -- which is me being non-confrontational, of course -- but I'm really looking for other people to chime in about how their therapy sessions work.",compound,0,neu_vader,neg_vader
517,517,0.9994878988586112,0.0005121011413793524,0.0,0.775,0.225,"Have a therapist appointment (first one) next week, so hopefully I can last until then.",compound,0,neu_vader,pos_vader
518,518,0.9909878228035464,0.009012177196447308,0.127,0.718,0.155,"It just goes to show that sometimes hard work, a good support system, a therapist, and medication (looking at you Xanax &amp; Wellbutrin) can get you through even the darkest of days.",conj,0,neu_vader,pos_vader
526,526,0.99994363027354,5.636972646203308e-05,0.145,0.855,0.0,I'm waiting outside the door to my therapists office (it's locked no one there).,compound,0,neu_vader,neg_vader
527,527,0.9766509168087016,0.02334908319129924,0.141,0.8290000000000001,0.03,"Granted, I'm 5 minutes early and there is a culture of 'late' where I live but I'm having a flashback to the other time I waited at another therapists office for an hour, while no one was there, in the middle of a snow storm and finally went home crying.",compound,0,neu_vader,neg_vader
530,530,0.9994949192354756,0.0005050807645334423,0.0,0.777,0.223,I thought it might be a muslce knot or something but my massage therapist friend couldnt find one.,compound,0,neu_vader,pos_vader
533,533,0.9998735244142476,0.00012647558576924517,0.141,0.706,0.153,"I see a therapist weekly but I feel like I get nowhere without medications, and even then, I don't notice any progress.",compound,0,neu_vader,pos_vader
553,553,0.999863958483206,0.00013604151679102658,0.0,0.83,0.17,I really just want to know if it's worth the time and financial investment to go with the therapy route.,compound,0,neu_vader,pos_vader
554,554,0.9996044309326028,0.00039556906739197554,0.098,0.82,0.08199999999999999,"he kind of sat there and acted like he was the therapist, and that he knew all my problems and where I was coming from, and tah dah!",attr,0,neu_vader,neg_vader
559,559,0.999813701453383,0.00018629854662579907,0.132,0.693,0.17600000000000002,"I have a psychiatrist and therapist I see regularly, but I don't feel like I'm getting all that much help.",conj,0,neu_vader,pos_vader
562,562,0.997072933106932,0.0029270668930730273,0.07200000000000001,0.9279999999999999,0.0,"Im 18, i started having anxiety when i was about 16 from there i went through a phase of zoloft and therapy that ended up quelling it.",conj,0,neu_vader,neg_vader
563,563,0.9981326198007484,0.001867380199249111,0.0,1.0,0.0,I waned off both the meds and therapy only to find myself back drowning in it as soon as college started.,conj,0,neu_vader,pos_vader
570,570,0.9999809905885716,1.900941141267859e-05,0.0,1.0,0.0,My doctor has prescribed my Citalopram which I started today and CBT therapy which I start next week.,npadvmod,0,neu_vader,pos_vader
577,577,0.9992778739221574,0.0007221260778533347,0.294,0.706,0.0,"I'm a 30 y/o biology postdoc (woman), with a 10 y/o history of GAD and panic disorder (under treatment with .75 mg Xanax/2 die and 100 mg Venlafaxine HCl/die, no psychotherapy) and a past diagnosis of major depression (treated at the time with fluoxetine and psychotherapy).",conj,0,neu_vader,neg_vader
589,589,0.9997450936619612,0.0002549063380356868,0.107,0.7,0.193,"I wasn't doing great, but I was a bit better when I was on medication, seeing my doctor &amp; a therapist.",appos,0,neu_vader,pos_vader
590,590,0.999948196744364,5.180325561903098e-05,0.0,1.0,0.0,"To me, living through every day is exposure therapy.",attr,0,neu_vader,pos_vader
591,591,0.9999820086462359,1.7991353771911933e-05,0.0,1.0,0.0,all this happened when i started medication and therapy.,conj,0,neu_vader,pos_vader
607,607,0.9994905852657168,0.0005094147342941659,0.27,0.73,0.0,"Needless to say, I’m anxious about a one-on-one (two technically) anxiety therapy program.",compound,0,neu_vader,neg_vader
608,608,0.9985604177524914,0.001439582247506392,0.073,0.927,0.0,"I'm torn between the two therapy session choices, but my contact wants an answer by the end of the week.",compound,0,neu_vader,neg_vader
618,618,0.9946504181107436,0.0053495818892545285,0.146,0.818,0.036000000000000004,"Hey guys just thought id like to vent my thoughts on what anxiety i have witch my g.p and therapist classify as Severe Anxiety which is a mix of all kinds of anxiety :Z the earliest time i can remember when it started was in year 6 when we had a multicultural day and had to parade around the school in monk costume, i was 10 at this time.",conj,0,neu_vader,neg_vader
644,644,0.999937270154864,6.272984515234962e-05,0.2,0.8,0.0,My family and therapist are still really worried for me though.,conj,0,neu_vader,neg_vader
648,648,0.9999816397331962,1.836026680321117e-05,0.0,1.0,0.0,A therapist?,ROOT,0,neu_vader,pos_vader
660,660,0.9988041490963387,0.001195850903672566,0.10800000000000001,0.737,0.156,"Yes, I smoke daily as it's my happy place routine and the nurse practitioner today wasn't thrilled, but the regular doctor and every damn therapist have advocated to stay on it as it helps me more than any pharma drug ever has.",conj,0,neu_vader,pos_vader
666,666,0.9999735828329152,2.6417167067566586e-05,0.0,1.0,0.0,"I have tried meditation, breathing exercises, and therapy.",conj,0,neu_vader,pos_vader
670,670,0.9999703670073656,2.9632992616055506e-05,0.076,0.823,0.102,"I just keep trying to plan out how to say what I need to say to feel better, this will be my 5th therapist, so I shouldnt feel so anxious about it, but I dont know what this place will be like and if the psychologist will take me seriously.",attr,0,neu_vader,pos_vader
671,671,0.9994039220421296,0.0005960779578730648,0.068,0.932,0.0,I haven't had the chance to start on any medications or therapy since I've been visiting my dad in another part of the country all summer.,conj,0,neu_vader,neg_vader
677,677,0.9999287281210436,7.127187893994794e-05,0.0,0.755,0.245,"tl;dr: Tried meds and therapy, but I'm ready to try again.",conj,0,neu_vader,pos_vader
678,678,0.9996317072171896,0.0003682927827983456,0.0,0.75,0.25,Does it really help to talk to a doctor or a therapist?,conj,0,neu_vader,pos_vader
679,679,0.9999532448657364,4.67551342560694e-05,0.077,0.8420000000000001,0.081,"I am not a psychiatrist, a psychologist, or a therapist, and I have no intention of charging you for a solution you could potentially stumble upon yourself, given enough time and effort.",conj,0,neu_vader,pos_vader
680,680,0.9999404286028454,5.957139715791109e-05,0.21600000000000003,0.784,0.0,"After speaking with various counselors and therapists, my condition only seemed to worsen.",conj,0,neu_vader,neg_vader
681,681,0.9997872903849828,0.00021270961501600958,0.245,0.755,0.0,"New meds, more therapy, move back home with parents because I can't be trusted to be alone.",appos,0,neu_vader,neg_vader
682,682,0.9999584694710822,4.153052890816471e-05,0.0,1.0,0.0,I plan on telling her this fall in my therapist's office.,poss,0,neu_vader,pos_vader
687,687,0.9994640230233286,0.0005359769766728254,0.0,0.40299999999999997,0.597,Whether it's a therapist or your best friend.,attr,0,pos_vader,pos_vader
693,693,0.9998046731306416,0.0001953268693628789,0.19399999999999998,0.8059999999999999,0.0,"I made it to my first therapy session today, and the doctor said I should go on medication considering how long I've had panic disorder (almost 10 years now).",compound,0,neu_vader,neg_vader
