,neg_prob,pos_prob,neg_vader,neu_vader,pos_vader,sentence
3683,0.99872445380543,0.0012755461945750436,0.0,1.0,0.0,"I am currently in between therapists because of insurance issues, but I should be starting with someone the first week of september."
3684,0.9801002614531913,0.019899738546796487,0.075,0.801,0.124,"I keep it fairly under control most of the time now, thanks to therapy and medication, but there are moments of intense anxiety that I still experience."
3685,0.9999161170010125,8.388299898380939e-05,0.11,0.775,0.115,"i dont trust my GP to prescribe me, i barely trusted this guy after 2 years of intensive therapy and he just dropped me."
3686,0.9997758231966911,0.00022417680329651335,0.0,0.863,0.137,Two weeks ago I got a therapist and I have been working with them and given tools to help further manage.
3687,0.9997492365556692,0.0002507634443475902,0.0,1.0,0.0,I will be looking for a therapist this upcoming week.
3688,0.998414714802688,0.0015852851973306142,0.0,1.0,0.0,I just discovered the concept of ESAs today and I'm going to talk to my therapist about it when I see her next week.
3689,0.9998485939720679,0.00015140602792204421,0.0,0.698,0.302,Would they accept documentation from a talk therapist?
3690,0.9999381088114361,6.189118854651162e-05,0.0,1.0,0.0,I tried hypnotherapy but it didn't do much.
3691,0.9993547342452901,0.0006452657547058941,0.0,1.0,0.0,I saw a therapist and got it somewhat under control.
3692,0.999432888503364,0.0005671114966512672,0.0,0.751,0.249,I have been in therapy and on medication for a long time and thought I had it pretty well under control.
3693,0.9980594067713503,0.0019405932286426762,0.225,0.683,0.092,"Within the last 6 months I've made huge headway with my depression, stopped seeing a therapist, and weened off the generic zoloft."
3694,0.9763574749745394,0.023642525025475838,0.166,0.793,0.041,I see a therapist for my anxiety and she advised me to adopt a phrase to say to myself (in my head or aloud) when I'm nervous or on the verge of an attack to kind of talk myself down.
3695,0.9996892404289748,0.0003107595710135464,0.0,1.0,0.0,Do I go to my regular doctor?or do I need to talk to a therapist of some sort?
3696,0.9994531881412216,0.0005468118587928853,0.209,0.791,0.0,I was working as an massage therapist for the last five years and I just hate it.
3697,0.9962792850935032,0.0037207149064909604,0.076,0.712,0.213,"I have found myself in a bit of a catch-22: My anxiety is so high that my therapist strongly recommends medication so that I can effectively engage in therapy, however my anxiety is so high that I'm afraid of starting a new medication."
3698,0.9997284720411217,0.0002715279588717107,0.076,0.924,0.0,Can you give me resources and guidelines on how to start Cognitive Behavioral Therapy without having to go to a therapist as I am a medical student and I absolutely have no time for that.
3699,0.9995385673824024,0.0004614326176109945,0.0,1.0,0.0,I've been seeing my therapist for over a year now.
3700,0.9995550610275349,0.00044493897245735187,0.0,0.752,0.248,"I think it's time for a fresh start with someone new, but I don't know how to gracefully end my relationship with this therapist."
3701,0.9109247661127231,0.08907523388728186,0.085,0.915,0.0,"I know the root cause for my anxiety is this and I've spoken to therapists about it a lot 

My family generally are very selfish people, my mum is unsupportive too and I've never been able to talk to any of them properly about anything so I feel mega alone... Its always about them and I can't get a word in edgeways.."
3702,0.9999602650128372,3.973498716013989e-05,0.286,0.714,0.0,Been in therapy too but no real breakthroughs.
3703,0.9962957321500698,0.0037042678499199988,0.069,0.784,0.147,"this weekend i took a true test of my anxiety and went on a trip to las vegas and went to a bunch of shows and out to eat, all these things would normally give me terrible anxiety but thanks to posting on here (and therapy of course lol) i was able to keep it all under control, so thank you everyone in the sub-reddit"
3704,0.9998994033564969,0.00010059664351771139,0.0,0.927,0.073,"Hey, I was just wondering if anyone would be willing to share some of the exercises their therapist/counselor/psychologist has given to them and what they involve/and are supposed to achieve."
3705,0.9999371507230433,6.284927696169642e-05,0.0,1.0,0.0,I'm just looking for some more relaxation/concentration/grounding exercises to practice in my own time so i can talk to my therapist about their effectiveness for me.
3706,0.9999754224898078,2.45775101831935e-05,0.0,1.0,0.0,have an appointment tommorow with my therapist.
3707,0.9997336314467726,0.00026636855323346426,0.0,0.909,0.091,I constantly feel the physical symptoms of GAD and I am actively trying therapy and medicine however I'm wondering what it is doing for my health.
3708,0.999932886009076,6.711399092597454e-05,0.286,0.603,0.112,"I wish I had more money to continue therapy, but its so damn expensive."
3709,0.9993246676549181,0.0006753323450801891,0.0,0.687,0.313,"Through therapy and meds I got through that, began to believe I was invincible and over the next 4 years I went to college and then University, my life was on the up, I made great friends and fell in love."
3710,0.9729848068863045,0.027015193113712508,0.043,0.886,0.071,"I was referred, at first, to a therapist who tried counselling for the anxiety, although this helped and got me out of the house, it wasn't till I was referred to a therapist for CBT that I really started to make progress."
3711,0.9999525917570947,4.74082428941268e-05,0.0,0.881,0.119,"I have listened and learnt so much from my therapist, taken on all the advice and help she could have given me."
3712,0.9999642793431144,3.5720656900895865e-05,0.446,0.554,0.0,"I have severe panic disorder, with depression and OCD with health phobias (not hypochondria, which helped me so much when my old therapist explained it)."
3713,0.9976482750564989,0.002351724943509418,0.0,0.905,0.095,"I've been out of therapy (looking for one now) but I've been too multiple, including one that was considered a top psychotherapist globally."
3714,0.9997486452785558,0.00025135472145786477,0.304,0.696,0.0,I said it was still bad and I was seeking a therapist.
3715,0.999968588289232,3.141171078260568e-05,0.23,0.652,0.117,I told her three therapists had all told me no med would help me and would make me worse.
3716,0.9998134662033742,0.00018653379662549762,0.27,0.73,0.0,"She just kept being dismissive and bitchy, and she's a nurse practitioner, not even a doctor, definitely not a psychotherapist."
3717,0.9999794383235278,2.056167646222368e-05,0.131,0.655,0.214,I told I would happily tame meds except every therapist so far has said no.
3718,0.9997582449265714,0.00024175507343632204,0.0,1.0,0.0,I started seeing a therapist and a counselor and was put on Prozac (generic) and Ativan (generic).
3719,0.9999431656219515,5.683437805600705e-05,0.14,0.777,0.084,"They drugged him up so bad that when his therapist suggested writing letters to us to help explain what he was going through, I didn't call him ""Dad."""
3720,0.9996750799493431,0.0003249200506419357,0.0,0.828,0.172,"He's gotten a lot better and is only on one medication, plus his monthly therapist visits."
3721,0.9971638245233804,0.002836175476613531,0.0,1.0,0.0,"My work insurance only covers 5 therapist visits a year before it becomes solely out of pocket and on a teacher salary, that's a ton of money."
3722,0.9998957197887928,0.00010428021120367288,0.115,0.885,0.0,And medication of any sort is no substitute for therapy or making changes to current thinking patterns/behavioral patterns.
3723,0.9999464095880413,5.3590411968239734e-05,0.0,1.0,0.0,"I have seen several therapists, I'm on Zoloft (new - recently on effexor) and Klonopin."
3724,0.9999672178224522,3.278217754743857e-05,0.0,1.0,0.0,I've been on every drug and therapy that has been thrown at me.
3725,0.9994500314800686,0.0005499685199277835,0.0,0.812,0.188,"He leaves the fixing it for the therapist, and I'm actually grateful for that."
3726,0.9993543252077608,0.0006456747922380908,0.0,0.923,0.077,I started going to therapy my freshman year after a complete breakdown where I finally told my mom how I had been feeling.
3727,0.9985257604073705,0.0014742395926242264,0.274,0.726,0.0,I started seeing a therapist and after the first session I started lying.
3728,0.9996464625453507,0.00035353745466376455,0.095,0.634,0.271,"Just not my happy place)

Last year I decided was a fresh new start and I would see a therapist, and be honest and really get some help."
3729,0.9976303722901181,0.0023696277098809344,0.222,0.778,0.0,"This therapist would constantly question why I was crying, and I know that's probably part of the job but most of the time I don't know what causes my crying and whenever she would ask I just would either sit in silence or make up a bullshit answer."
3730,0.9994640233927894,0.000535976607193676,0.125,0.875,0.0,My therapist had cancelled a few sessions in a row and I just faded out from seeing her.
3731,0.9951990633284431,0.004800936671547383,0.152,0.791,0.058,"I would like to start seeing a therapist again, but it would have to be in the same office as my last therapist and that is terror inducing."
3732,0.9999897097744169,1.0290225603222205e-05,0.0,1.0,0.0,What do I do or say if I see my old therapist?
3733,0.9999510354492442,4.8964550740181935e-05,0.105,0.67,0.225,I want to go back to therapy but I might run into an old therapist I didn't like and stopped going to without warning.
3734,0.9985970842235784,0.0014029157764226178,0.0,0.833,0.167,"If it helps, I have been diagnosed with moderate OCD by a therapist a couple years back."
3735,0.9896116139692017,0.010388386030794595,0.0,0.959,0.041,"I start community college in a week or two and I'm not to nervous about that, but despite seeing two therapists during these weeks that I haven't been at school, I still haven't been able to have sleepovers."
3736,0.9990473190082152,0.0009526809917992296,0.0,0.681,0.319,"As a side note I am taking medications and seeing a therapist, and they are helping me wonderfully."
3737,0.9467893991480304,0.0532106008519783,0.105,0.848,0.047,"I am currently waiting for cognitive therapy classes later in the week on Tuesday or Wednesday and I am still so scared of the world and all of this anxiety has built up over the course of months; my mom was talking to me about living on my own just in case something happens to her, she found someone online she liked in Arkansas and wants to move there in the upcoming years, due to me having severe GAD that I was good at keeping out of my thoughts for a while; found the cracks, and all of the worries and anxieties started seeping in: ""what happens if mom gets in an accident?"""
3738,0.9970235545279202,0.0029764454720894577,0.0,0.886,0.114,"I have a therapist, a psychologist, and some decent friends at the place I work, its a non-profit film organization that matches high school kids with professionals in the field."
3739,0.9998150817781721,0.00018491822181089878,0.199,0.663,0.138,It's shit like this that drives me into therapy in the first fucking place.
3740,0.9999159405851401,8.405941487101804e-05,0.0,0.861,0.139,"I have been off the therapist's couch for years now, and off my meds for the same - I thought I was better."
3741,0.9997034708074616,0.00029652919252837125,0.0,1.0,0.0,"I'm looking for a therapist, but money is tight and it's another expense I'm afraid we can't afford."
3742,0.9999634182600762,3.658173993178983e-05,0.383,0.617,0.0,My therapist says to walk into any panic attacks I might come across.
3743,0.9863365801203012,0.013663419879705065,0.202,0.755,0.043,I've been avoiding the medication route for a while and I've been thinking of going back to therapy but I just find it odd that I can feel fine for an hour or so and all of a sudden I'm flooded with a few seconds of anxiety and panic.
3744,0.9916802323158586,0.008319767684152808,0.19,0.745,0.065,"I've seen my therapist twice in the last week and at our last appointment she suggested that I see her husband for a treatment called [Neurolink](http://www.neurolinkglobal.com/), which she felt might help with my anxiety and panic attacks."
3745,0.9925300398499732,0.007469960150044385,0.241,0.759,0.0,I'm considering dumping her and finding a therapist who does cognitive behavioral therapy but I'm a little concerned about doing this in the middle of having a crisis.
3746,0.9996159039552114,0.00038409604479516004,0.159,0.841,0.0,I've been seeing a therapist weekly for over 3 months for anxiety.
3747,0.9932016938842441,0.006798306115760442,0.25,0.75,0.0,"Both my anxiety and ADHD symptoms have been making my life difficult, but I've had trouble getting ahold of a therapist that understands both."
3748,0.9997708575677068,0.00022914243229120147,0.341,0.659,0.0,I'm afraid a new therapist would be worse.
3749,0.9997481937100812,0.0002518062899151022,0.0,0.8,0.2,"Maybe I should be more patient with my current therapist, but I feel like that's a gamble."
3750,0.9997829880193094,0.00021701198067947957,0.269,0.694,0.036,"**TL;DR- I'm afraid a new therapist would be worse,  uncertain whether I should remain patient with current therapist, and have no clue how I'd tell my therapist I want to stop seeing her."
3751,0.9976888253729611,0.0023111746270266854,0.0,1.0,0.0,"So, I was going to the therapist at my old college for a while but now I go to a school that doesn't have a clinic."
3752,0.999397705352004,0.0006022946479855718,0.0,1.0,0.0,I'm looking for a new therapist right now.
3753,0.999986908355396,1.3091644597590844e-05,0.124,0.876,0.0,The problem is... the therapist at my old school asked me on 2 separate occasions if I have been diagnosed with Asperger's.
3754,0.999554686822654,0.00044531317735452497,0.0,0.714,0.286,"Anyway, pretty soon I'll be going to a new therapist."
3755,0.9955521762562158,0.004447823743784837,0.09,0.793,0.117,i know i need to see someone but the thought of talking to someone like a therapist gives me even more anxiety to where i dont do it.
3756,0.9999629705819295,3.702941806212703e-05,0.0,0.889,0.111,I scheduled an appointment with my doctor for Monday because I may just give in and start medication and therapy like he suggested.
3757,0.9999707074591028,2.9292540887464402e-05,0.0,0.759,0.241,I've been in therapy and support groups for this since I was 16 and I know just how much they help.
3758,0.9996647431357374,0.0003352568642569806,0.0,1.0,0.0,I have a life coach therapist that i don't see often so i dont think i could go more days now.
3759,0.9884745750046964,0.011525424995295673,0.0,0.915,0.085,"I tried to get help through the school, but they just told me they'd send me a list of therapists and never did."
3760,0.9979553391535703,0.0020446608464375314,0.092,0.908,0.0,"You don't need to tell me to see a counsellor or therapist because I am currently seeing one, I just do not have the courage to bring this up yet."
3761,0.9996576684191304,0.00034233158085128376,0.0,1.0,0.0,I have my very first appointment with a therapist today.
3762,0.9997483495281418,0.000251650471842961,0.375,0.625,0.0,"I figured, with an appointment with the therapist today, I would be anxious as hell."
3763,0.9999670511367013,3.294886331932431e-05,0.0,0.821,0.179,My psychologist says that medicine and therapy are not needed anymore in my case which I am thankful for.
3764,0.9997127447609755,0.0002872552390366304,0.0,1.0,0.0,"I began medicinal therapy with a psychiatrist about a year ago, and I am prescribed Paxil, Ativan and Clonazepam."
3765,0.9980701571976045,0.0019298428024085912,0.145,0.783,0.072,"I know a lot of you will suggest ""take different meds,""  maybe ""find a new therapist,"" and of course, I will stop taking these things safely and under supervision... 

What I am really looking for are ways/techniques you might have for lessening severe anxiety?"
3766,0.9732968992923523,0.026703100707649825,0.0,0.823,0.177,"For some, medication is a great way to get a handle on it, for others, it may be some sort of therapy."
3767,0.9998415814073526,0.00015841859264994297,0.0,1.0,0.0,(I have a therapist but my next appointment isn't until 3/20)
3768,0.9957543189218341,0.0042456810781556845,0.146,0.854,0.0,"I have already made an appointment with a CBT therapy thing, but that isn't for a few weeks and I need something that will take away the panic in the moment."
3769,0.9999687527729184,3.1247227067549694e-05,0.086,0.914,0.0,I've circled the therapists' door 4 or 5 times and one time my coworker even saw me pacing nervously there...
3770,0.999949829876198,5.0170123810728104e-05,0.0,1.0,0.0,They told me to go to therapy so I did.
3771,0.9999163021909095,8.369780907592546e-05,0.0,1.0,0.0,"They told me to go to **group** therapy, so I did."
3772,0.9992451685826911,0.0007548314173031942,0.267,0.594,0.139,"I had social anxiety and what I can say that it is quite embarassing, but I sucessfully overcame it with exposure therapy,my social skills was improved dramatically.. Until the day I had panic attack, since then I have general anxiety disorder, now it is weird situation,because I can be anxious most of the time like everywhere, but I don't feel uncofortable or awkward around people, just expressing my thoughts and making conversations became difficult, like my mind gone blank or something, it is pretty annoying."
3773,0.9998318240731882,0.00016817592679360937,0.0,1.0,0.0,There are therapists at the school all the time and I see my therapist almost daily.
3774,0.9991815547872507,0.0008184452127466868,0.149,0.851,0.0,"I have a therapist at school who I have seen a few times, but my parents have no idea about it."
3775,0.9996744068966361,0.0003255931033449915,0.121,0.811,0.067,It's really not healthy for me to divulge my mental health issues to them because they are major contributors to my problems at home and have expressed that me seeing a therapist would just be an easy way out.
3776,0.9778532612998075,0.022146738700198513,0.166,0.834,0.0,"They have not supported the idea of me trying to find some answers to my problems through therapy, and I think it would be a major misstep to involve them yet again in such a low point of my life."
3777,0.9999589714881792,4.102851184114076e-05,0.0,0.863,0.137,"My therapist has even expressed that if I was interested, she could set me up to pursue that route."
3778,0.9958741504286949,0.0041258495713179695,0.0,1.0,0.0,"I've been seeing a therapist the last few weeks, she's someone I used to see back when I was in college."
3779,0.9919088765950298,0.008091123404977703,0.0,0.966,0.034,So I finially talked to my mom and made an appointment with a therapist with the condition that we don't tell my dad (after I put it off for almost 2 months because he wont leave me alone).
3780,0.9997908918574783,0.00020910814253264463,0.0,1.0,0.0,I have been seeing a therapist for 3 months.
3781,0.9775993642330646,0.02240063576692839,0.0,0.843,0.157,"Background: I've been doing the anxiety/depression tango for about 10 years, with meds &amp; therapy &amp; the whole shebang, &amp; as of about a year ago I felt like I got to a good place."
3782,0.9999402835911302,5.971640887713185e-05,0.217,0.783,0.0,And I'm really worried I'll be told to get therapy.
3783,0.9934585583822273,0.006541441617779774,0.0,1.0,0.0,None of my doctors or the Psychiatrists ever suggested this could be a side-effect and it was always treated with additional medication or therapy.
3784,0.9998390855084227,0.00016091449156498686,0.111,0.754,0.136,"No drugs have helped significantly, I've been through therapy multiple times, and tried the self help route."
3785,0.9999614312425064,3.8568757496487025e-05,0.0,1.0,0.0,This all happens with drug therapy and talk therapy or CBT.
3786,0.9999590246492192,4.097535078005697e-05,0.0,1.0,0.0,"Yesterday, I was turned down for Ativan by my med provider (separate from my therapist), but given Propanolol."
3787,0.9999425951313732,5.740486862535174e-05,0.0,0.854,0.146,I'm finally starting to feel better and can open up with my therapist while on Abilify and Ciprolex.
3788,0.9914473126419496,0.008552687358064312,0.062,0.872,0.065,"I'm seeing a cbt therapist, gone on two sessions so far and it feels good to be able to talk about the problem but I don't see this ever ending."
3789,0.9999417963029839,5.8203696998529413e-05,0.221,0.779,0.0,"I don't know why I do it, I started general therapy earlier this year and was put on generic Prozac for depression and anxiety."
3790,0.9998598305410736,0.00014016945893594664,0.0,0.791,0.209,I'm going to see my therapist on the 17th but really I just wish he understood more.
3791,0.9999647794675015,3.5220532490354875e-05,0.0,1.0,0.0,I am seeing my therapist tonight.
3792,0.9994691577514028,0.0005308422485854714,0.0,1.0,0.0,"I'm in therapy right now, but haven't seen my doctor for a month and a half or so."
3793,0.9800473572211724,0.019952642778809652,0.182,0.818,0.0,"The first, Mindshift, is a sort of condensed, portable cognitive behavioral therapy aimed at 7 of the most common problems people with anxiety have, e.g."
3794,0.9995072515686386,0.0004927484313494637,0.207,0.793,0.0,Obviously not a substitute for real therapy if anxiety is seriously interfering in your daily functioning.
3795,0.998014551029878,0.0019854489701029944,0.0,1.0,0.0,"Two SSRIs, heavy dosage of benzos, seroquel (both regular to sleep and SR daytime), multiple group therapies, followed closely by a psychiatrist, a psychologist, an ergotherapist, a nurse and a specialized educator."
3796,0.9992624280613553,0.0007375719386450435,0.0,0.779,0.221,Her doctors are good and they're doing alot - she has resources like a 24/7 hotline and therapists coming to her home weekly.
3797,0.9998361077812674,0.00016389221874154572,0.0,0.796,0.204,I want to help beyond what the system can provide and I wonder often if there's therapies outside Canada that can address the biological axis better than how we do it here.
3798,0.9999105009259875,8.94990740314378e-05,0.122,0.878,0.0,"It can't be behavioral therapy because frankly that option has been exhausted, just as commonly prescribed medication has been."
3799,0.9996755826385556,0.0003244173614589626,0.0,1.0,0.0,I'm thinking more along the lines of experimental biological therapy.
3800,0.9996229408922349,0.0003770591077781947,0.0,0.909,0.091,"My step-mom recommended hypnotherapy, but I don't know what effect a hypnotherapist can have in 30 days."
3801,0.9985704893552874,0.0014295106446999396,0.0,0.6,0.4,I was lucky enough to get a very good therapist from the start.
3802,0.9994554969283785,0.0005445030716281689,0.0,0.797,0.203,She was close to my age (early thirties...close compared to a lot of therapists I've had) and she never failed to make me feel better.
3803,0.9891923589941998,0.01080764100580048,0.0,1.0,0.0,I'd been out of town for two weeks prior to the cancellations so I'd gone without a therapist for a month.
3804,0.9997735938616157,0.0002264061383659176,0.0,0.803,0.197,"And it's happening to my therapist, the person who could help me."
3805,0.9999734022152768,2.6597784710382868e-05,0.268,0.732,0.0,"All I can picture is my therapist, young and thriving, being told about cancer."
3806,0.999650154428196,0.0003498455718000377,0.0,1.0,0.0,I haven't had therapy for a month.
3807,0.9993204613959416,0.0006795386040707952,0.0,1.0,0.0,"My...old therapist said that she'd get me into another therapist specifically for OCD and related disorders, but there's a long waiting list."
3808,0.9999677193765834,3.2280623419678845e-05,0.0,1.0,0.0,Is exposure therapy the only thing?
3809,0.9996751587186389,0.0003248412813420356,0.0,0.925,0.075,I go to regular therapy and take daily medication for all of this but I'm still just overwhelmed.
3810,0.9987521392936154,0.0012478607063763103,0.208,0.672,0.12,"Instead of thinking “I’m dying” during a panic attack, a CBT approach would be “I know this feels terrible, but it’s just a panic attack and I am going to be okay.” I didn’t go for any sessions with a therapist, although if this is something you think will help you I say go for it, because I’ve heard incredible success stories."
3811,0.9998849289062666,0.00011507109372558676,0.185,0.815,0.0,"I need therapy and used to go to it, but then I lost health insurance coverage."
3812,0.9999787581349294,2.124186507701317e-05,0.0,1.0,0.0,Should I start going to therapy?
3813,0.9995780690417144,0.0004219309582978451,0.076,0.72,0.205,"Since then, after multiple psychiatrists (paxil 30 mg) and therapists have tried their hand at helping me, I am still stuck in a cycle."
3814,0.9453801502869394,0.054619849713074584,0.0,0.837,0.163,"My therapist took it upon herself to write me a medical release note for me for that week, stating that it is in everyone's best interest if I am allowed a day off (if not two) in the middle of the week."
3815,0.9999866313963807,1.3368603627493907e-05,0.0,1.0,0.0,Any suggestions on medication or therapy?
3816,0.9989460761741393,0.0010539238258668432,0.086,0.839,0.075,"I don't have any personal or family history of mental health conditions, other than maybe some very minor attention deficit which I've been able to motivate myself through without medication or therapy."
3817,0.9994266375197824,0.0005733624802331992,0.097,0.837,0.065,"I just don't want to go in the office and look like some kid trying to walk in and pick up some Xanax, which I'm afraid they'll be suspicious of if I turn down SSRIs and therapy."
3818,0.999584669784389,0.0004153302156181696,0.0,1.0,0.0,I am going to a therapist soon.
3819,0.9998317178436213,0.0001682821563884221,0.0,1.0,0.0,I don't have a therapist.
3820,0.9999518770000257,4.812299996698774e-05,0.137,0.719,0.144,"I was still off meds and therapy, but surprisingly it didn't effect me like it should have."
3821,0.999972804776513,2.7195223505404715e-05,0.0,1.0,0.0,I started going to therapy and they put me on Paxil.
