2312,2312,0.9949986781831364,0.005001321816866754,0.09,0.813,0.09699999999999999,"I done it by exposure therapy - talking to random people at all possible public places, my fear finally gone forever and I became very social and confident person first time in my life.",npadvmod,0,neu_vader,pos_vader
2314,2314,0.99568805795799,0.004311942041993529,0.0,1.0,0.0,"She put me in a weekly therapy group, and told me that if my smyptoms are still there after 8 weeks to make another appointment with her, where she might reccomend that I take medication.",compound,0,neu_vader,pos_vader
2327,2327,0.9999735149963652,2.648500364448696e-05,0.0,0.847,0.153,Therapist said we're going to do DBT (dialectical behavior therapy) to help me overcome my issues.,appos,0,neu_vader,pos_vader
2341,2341,0.9999624888405416,3.7511159445933975e-05,0.0,1.0,0.0,"I've tried multiple meds (anti-depressants made me suicidal), therapy, and herbal supplements (L-Theanine, Lemon Balm, etc).",conj,0,neu_vader,pos_vader
2361,2361,0.9971831526522499,0.002816847347746252,0.0,0.88,0.12,"feeling like therapy isn't doing it for me (this is the second time ive been to therapy btw- saw a psychologist for a few months last year and got the same, it's nice to talk but not really going anywhere experience).",compound,0,neu_vader,pos_vader
2363,2363,0.998308868609345,0.0016911313906552,0.0,1.0,0.0,"I've been on a variety of medications, a bunch of different doctors and therapists.",conj,0,neu_vader,pos_vader
2368,2368,0.9978883151532992,0.0021116848466922844,0.0,1.0,0.0,"However, the clinic associated with my university was a behavioral therapy and not a medication type place.",attr,0,neu_vader,pos_vader
2377,2377,0.999919341030763,8.065896924016866e-05,0.0,0.728,0.272,Life has been so good since i started the meds and therapy.,conj,0,neu_vader,pos_vader
2382,2382,0.9999533715626092,4.662843738925969e-05,0.0,0.863,0.13699999999999998,"And FYI, my current coping strategies include exercise, meditation, therapy, journaling, medication, and talking to friends/loved ones.",conj,0,neu_vader,pos_vader
2386,2386,0.9999724017449748,2.7598255024706836e-05,0.0,1.0,0.0,I can't afford medication or therapy.,conj,0,neu_vader,pos_vader
2389,2389,0.9999716014227299,2.839857726941543e-05,0.355,0.645,0.0,"I needed no medication, no therapy, and managed my symptoms amazingly.",conj,0,neu_vader,neg_vader
2394,2394,0.9999820288613877,1.7971138612355905e-05,0.259,0.741,0.0,The only thing I haven't tried is therapy for trauma.,attr,0,neu_vader,neg_vader
2402,2402,0.9999740778855232,2.5922114476890038e-05,0.0,0.775,0.225,I'm currently on medication and going to therapy to get better.,xcomp,0,neu_vader,pos_vader
2409,2409,0.9988180641900976,0.0011819358099155782,0.198,0.5539999999999999,0.248,"I've told him exercise, better sleep, therapy, and eating better will not only help him feel better in general but may combat his anxiety as well.",conj,0,neu_vader,pos_vader
2411,2411,0.9988223817380224,0.001177618261986125,0.053,0.8270000000000001,0.12,So basically since I moved to the city I have been without regular therapy appointments and was having a hard time motivating myself to find a new one.,compound,0,neu_vader,pos_vader
2414,2414,0.9998855520350068,0.00011444796498033308,0.0,0.653,0.34700000000000003,I really hope it works since getting regular therapy sessions is integral to my well being and self care process.,compound,0,neu_vader,pos_vader
2421,2421,0.999243700279197,0.0007562997208034224,0.10400000000000001,0.82,0.076,I'm going to therapy in a week or so because my parent's think I'm depressed because all I do all day is sit on the computer or play my guitar.,xcomp,0,neu_vader,neg_vader
2428,2428,0.9999960000586796,3.99994132168494e-06,0.083,0.779,0.139,My therapist and I have started talking about anxiety issues and I know logically nothing horrible is likely to happen.,npadvmod,0,neu_vader,pos_vader
2432,2432,0.9995239241626024,0.00047607583741279667,0.048,0.848,0.10400000000000001,"The only things I haven't tried is therapy and medicine, I don't know what too say other than I need help, advice, and support............
(I pretty much stay in bed all day and pace a lot, I also have trouble sleeping [getting to sleep and oversleeping] and also feel that it is effecting my eating too)",attr,0,neu_vader,pos_vader
2438,2438,0.9999835546548526,1.6445345163475268e-05,0.0,1.0,0.0,My next therapy session (CBT) is tomorrow morning.,compound,0,neu_vader,pos_vader
2442,2442,0.9999836751053526,1.632489466407036e-05,0.0,1.0,0.0,I have literally spent about 12-15 hours studying every day since my last therapy session.,compound,0,neu_vader,pos_vader
2451,2451,0.9999890805540372,1.0919445973492953e-05,0.0,0.809,0.191,"Overall I'm seeking advice but my big question is this:

Medication, self help, meditation, or therapy?",conj,0,neu_vader,pos_vader
2454,2454,0.9999480014826768,5.199851730908423e-05,0.257,0.743,0.0,"Either way, I stopped seeing the doctor and the therapist, and I stopped getting medicine.",conj,0,neu_vader,neg_vader
2460,2460,0.9992039987417322,0.0007960012582729597,0.177,0.718,0.105,And lots of introspection and therapy is helping me see the negative talk that is taking place.,conj,0,neu_vader,neg_vader
2461,2461,0.9999971564864196,2.8435135714302938e-06,0.244,0.7559999999999999,0.0,"my mom was just diagnosed with cancer so i dont want to come out to my family because i dont want them to worry about something else, and i dont have much money so how much does therapy cost?",compound,0,neu_vader,neg_vader
2462,2462,0.9999910883520018,8.911647996733987e-06,0.0,0.545,0.455,how is therapy like?,ROOT,0,neu_vader,pos_vader
2470,2470,0.9998425298308028,0.00015747016919989904,0.0,0.867,0.133,I'm curious to hear what sort of experiences you all have had with counselors and therapists.,conj,0,neu_vader,pos_vader
2476,2476,0.9984890555645594,0.0015109444354344758,0.034,0.875,0.09,Belching and gassy and didn't want to eat most of Thursday--and had a therapist appointment (which also went pretty well)...and decided to take one dose of Pepcid with supper (should have probably been before?),compound,0,neu_vader,pos_vader
2481,2481,0.9999688126055049,3.118739449991571e-05,0.0,1.0,0.0,He's not my therapist.,attr,0,neu_vader,pos_vader
2482,2482,0.9997018545578359,0.00029814544215233264,0.0,1.0,0.0,Just a therapist.,ROOT,0,neu_vader,pos_vader
2484,2484,0.999437951915492,0.0005620480845156838,0.109,0.8909999999999999,0.0,How much information is too much information when you have a history of mental illness and you're in a relationship with someone who is a therapist?,attr,0,neu_vader,neg_vader
2491,2491,0.9975640825518372,0.0024359174481531558,0.152,0.848,0.0,"Similarly, **mindfulness** and **mindfulness based cognitive therapy** teach you to ignore, in a way, your thoughts.",dep,0,neu_vader,neg_vader
2493,2493,0.9706368701173028,0.029363129882690086,0.40399999999999997,0.596,0.0,"People who think that the modality is not as important a good therapist of some ineffective modality are dead wrong, and the research proves it.",attr,0,neu_vader,neg_vader
2498,2498,0.9996141216192136,0.0003858783807738676,0.132,0.868,0.0,"I know that for most therapy sessions, you just sound off without getting concrete advice for how to move forward in life, which is troubling.",compound,0,neu_vader,neg_vader
2505,2505,0.9997399377892644,0.0002600622107260528,0.0,1.0,0.0,He said he is a Medical Doctor not a therapist and that he is only a prescriber.,appos,0,neu_vader,pos_vader
2511,2511,0.9982451571334309,0.0017548428665711466,0.0,1.0,0.0,I've decided to seek treatment again and I have a psychiatrist appointment in 6hrs and a therapy appointment on the third of August.,compound,0,neu_vader,pos_vader
2518,2518,0.9993145594890692,0.0006854405109339393,0.0,0.807,0.193,-For those that are going to just go with the easy response and suggest meds or therapists please tell me about your experiences with it so I'm not as anxious about them.,conj,0,neu_vader,pos_vader
2522,2522,0.9988098588544916,0.0011901411455027288,0.151,0.8490000000000001,0.0,"For a while I wanted to be a physical therapist, but when I job shadowed I found out I didn't like it.",attr,0,neu_vader,neg_vader
2523,2523,0.9999780897070216,2.1910292961265742e-05,0.0,1.0,0.0,Maybe an art therapist?,ROOT,0,neu_vader,pos_vader
2525,2525,0.9999794519304518,2.0548069541068224e-05,0.0,1.0,0.0,Any stories or resources about therapy virgins?,compound,0,neu_vader,pos_vader
2526,2526,0.9986176716902369,0.0013823283097772405,0.17300000000000001,0.8270000000000001,0.0,"I'm on multiple medications, but I've been out of therapy for about a year and a half- I'm going to get into a domestic violence therapy thing to start up again.",compound,0,neu_vader,neg_vader
2529,2529,0.9961072942031716,0.0038927057968236095,0.0,0.9570000000000001,0.043,"I'm not ignoring the fact that I should go see a counsellor or a therapist, but it just doesn't seem as viable at the moment, and I guess ultimately, I'm trying to understand what's going on with me at the moment.",conj,0,neu_vader,pos_vader
2545,2545,0.9997737618343552,0.00022623816566207387,0.0,1.0,0.0,"For those who don't know what [this is](http://www.talkspace.com/), it's a text and video-based therapy service.",compound,0,neu_vader,pos_vader
2556,2556,0.9999925460860699,7.453913924897992e-06,0.0,0.9059999999999999,0.094,I know medication and therapy should be long term solutions but what about short term?,conj,0,neu_vader,pos_vader
2558,2558,0.9999185613482716,8.143865172937742e-05,0.203,0.652,0.145,But I'm still struggling and willing to give therapy another chance.,dative,0,neu_vader,neg_vader
2561,2561,0.9869708384242116,0.013029161575794649,0.23399999999999999,0.731,0.035,"I've been to all manner of councillors, cbt, therapy and psychologists and found them reassuring but not too helpful; the most helpful was the last one,  a trainee psychologist who decided to just teach me how the anxiety and panic reactions work in the brain.",conj,0,neu_vader,neg_vader
2570,2570,0.995147166856754,0.004852833143253319,0.10800000000000001,0.8440000000000001,0.047,"after awhile of home-schooling, I dropped my other subjects and only started to do english and maths , which was fine because I said I was stressed and the therapists/child physiologists took it seriously so I just went with it.",amod,0,neu_vader,neg_vader
2589,2589,0.999748802843282,0.00025119715671489056,0.0,1.0,0.0,"I've never spoken to anyone but my husband &amp; therapists about this, and I've never written about it.",conj,0,neu_vader,pos_vader
2601,2601,0.999859714661285,0.00014028533871046476,0.0,0.8420000000000001,0.158,"I am in therapy, its feeling therapy or primal therapy.",conj,0,neu_vader,pos_vader
2602,2602,0.972033537988746,0.027966462011244732,0.253,0.598,0.149,My therapist was shocked to learn that I admitted I was having a severe panic attack in her office but she couldnt the reality was I finally felt safe enough as a old man to admit the terror I feel on the inside.,npadvmod,0,neu_vader,neg_vader
2603,2603,0.9980417972270628,0.001958202772931105,0.13699999999999998,0.69,0.17300000000000001,"This job will involve traveling to new places and cities which I am not fond of, I just want to be able to do my job with no worries and not throw a panic attack, I used to be so laid back and I would have never guessed I could have panic attacks, I want to be like that again, my doctors and therapist aren't doing much for me.",conj,0,neu_vader,pos_vader
2604,2604,0.9979793251952148,0.0020206748047880414,0.153,0.847,0.0,Because all of the therapy work I've been trying to do toward that end has not been successful.,compound,0,neu_vader,neg_vader
2608,2608,0.9997891236935612,0.0002108763064193852,0.067,0.9329999999999999,0.0,My family physician doesn't want to be my de facto therapist because that's not her field of expertise.,attr,0,neu_vader,neg_vader
2609,2609,0.9998870385022888,0.00011296149770301168,0.0,0.773,0.22699999999999998,"But I never really opened up to doctors or therapists, and got very good at portraying myself as outwardly fine.",conj,0,neu_vader,pos_vader
2630,2630,0.9999690759280198,3.092407197303149e-05,0.0,1.0,0.0,"Or maybe even cognitive behavioural therapy, because my issues are bound to be deep engrained into me.",ROOT,0,neu_vader,pos_vader
2635,2635,0.9874522702170196,0.012547729782961668,0.127,0.873,0.0,Because of my fear I was not even able to tolerate having my therapy sessions indoors (there was a sushi restaurant in the same plaza).,compound,0,neu_vader,neg_vader
2646,2646,0.9982932054848715,0.00170679451511607,0.044000000000000004,0.7709999999999999,0.185,"I shared some of the difficulties I had with my counselor and group therapy, but I've decided to put that behind me and move on to find people who want to actually help me.",conj,0,neu_vader,pos_vader
2655,2655,0.999708721591163,0.00029127840882012143,0.0,1.0,0.0,Is this a normal post-therapy reaction?,compound,0,neu_vader,pos_vader
2659,2659,0.9999523683160052,4.763168401339861e-05,0.115,0.885,0.0,"I talked to my physician and therapist about this, but they were both unconcerned and said I would adjust which I did.",conj,0,neu_vader,neg_vader
2662,2662,0.9999930180220526,6.981977961263617e-06,0.26,0.74,0.0,I do not want to give her up for some group-therapy thing... what if they hate me?,compound,0,neu_vader,neg_vader
2676,2676,0.9999799913604868,2.0008639525548386e-05,0.0,1.0,0.0,I don't have another therapy appointment for 2 weeks.,compound,0,neu_vader,pos_vader
2683,2683,0.9897900133359214,0.010209986664072591,0.293,0.7070000000000001,0.0,"I've struggled with depression and anxiety since I was a little girl; I remember having random phobias come and go when I was a child, I was depressed in middle and high school and diagnosed with depression and GAD in high school, on and off of Lexapro and therapy through various stages of my life.",conj,0,neu_vader,neg_vader
2688,2688,0.9999279986645327,7.200133547511395e-05,0.0,1.0,0.0,She's my fourth therapist in two years.,attr,0,neu_vader,pos_vader
2693,2693,0.999954864810079,4.513518993019655e-05,0.0,1.0,0.0,"I dont know if i should go to a doctor or therapist, if i need meducation or just someone to talk this out with.",conj,0,neu_vader,pos_vader
2715,2715,0.9966509154729478,0.003349084527054701,0.179,0.755,0.066,The worst part of all this is that the only person who I can really talk to about my frustrations living with Mom without fear of it getting back to her is my therapist.,attr,0,neu_vader,neg_vader
2738,2738,0.9994115796745228,0.0005884203254786928,0.225,0.703,0.073,So I recently started a new anti-depressant because things have been bad since September (with a break up and one of my friends killing herself) and my usual diet + exercise + therapy wasn't enough to control my anxiety.,conj,0,neu_vader,neg_vader
2745,2745,0.9988853871106096,0.0011146128893826262,0.0,1.0,0.0,"When I am under, the hypnotherapist talks me through situations, says different mantras and explains things to me, which at the time I can kind of concentrate on, but is mostly getting through to my sub conscious.",compound,0,neu_vader,pos_vader
2746,2746,0.992977293631334,0.007022706368666238,0.077,0.747,0.17600000000000002,"Obviously I can't tell you how much of it is the hypnotherapy, or the meds, but day to day life is so much easier now and I feel so much calmer, so I am able to tackle uncomfortable situations.",attr,0,neu_vader,pos_vader
2750,2750,0.9988851658964192,0.0011148341035868029,0.049,0.865,0.085,"Trying to make a long story short, but I have been through everything possible when it comes to anxiety and have tried everything I could to help it (therapy, medication, meditation, reflexology, reike, homeopathy, chiropractic specialist, hypno therapy, breathing techniques etc).",ccomp,0,neu_vader,pos_vader
2751,2751,0.9999952151204112,4.784879582301249e-06,0.18600000000000003,0.654,0.16,I can't stand having this problem and I am wondering if therapy/ medicine can help.,det,0,neu_vader,neg_vader
2761,2761,0.99826637055555,0.001733629444436525,0.0,0.821,0.179,My therapist(who I also just started seeing) has set me a homework assignment of making a resume which will be a huge help if I can just get it done.,npadvmod,0,neu_vader,pos_vader
2767,2767,0.9995894893338488,0.0004105106661340073,0.161,0.8390000000000001,0.0,"I did an inventory of all the drugs, techniques, therapies, books and DVDs I've bought, and it's depressing what I've put myself through and still have no answers.",conj,0,neu_vader,neg_vader
2768,2768,0.9999566393732738,4.336062673871149e-05,0.0,1.0,0.0,"I have seen counsellors, therapists, psychologists, occupational therapists and psychiatrists.",conj,0,neu_vader,pos_vader
2782,2782,0.9999694149850424,3.0585014975480904e-05,0.0,1.0,0.0,"To get this extension, they need statements from your psych docs and therapist.",conj,0,neu_vader,pos_vader
2788,2788,0.9999563004168349,4.369958315855612e-05,0.0,1.0,0.0,How will talk therapy (and only talk therapy) cure me of this?,conj,0,neu_vader,pos_vader
2795,2795,0.9999466927508732,5.330724910681558e-05,0.0,0.732,0.268,"I get 4 free therapy appointments through work, so I went to them.",compound,0,neu_vader,pos_vader
2803,2803,0.998984829162366,0.001015170837615089,0.0,1.0,0.0,And has a therapy session booked for later this month (that was the soonest he could get an appointment).,compound,0,neu_vader,pos_vader
2807,2807,0.9996326134498078,0.0003673865501925943,0.0,1.0,0.0,So I have to get a different therapist cause I'll be switching health insurance.,compound,0,neu_vader,pos_vader
2818,2818,0.9999501235827476,4.987641726194883e-05,0.0,1.0,0.0,It was my therapist who had suggested to take breaks.,attr,0,neu_vader,pos_vader
2821,2821,0.999610460293763,0.000389539706253972,0.0,1.0,0.0,"Even my aunt, who is a therapist (not mine obviously), seems to feel I just need to 'keep working hard'.",attr,0,neu_vader,pos_vader
2837,2837,0.9996099119395776,0.0003900880604397709,0.22399999999999998,0.647,0.129,I'm not 100% cured but there is a clear way to get over this nasty thing without meds and therapy.,conj,0,neu_vader,neg_vader
2842,2842,0.9998219503120644,0.00017804968791885638,0.0,0.894,0.106,I just want to see a doctor or a therapist and get things sorted out.,conj,0,neu_vader,pos_vader
2843,2843,0.9999678831979774,3.211680202529828e-05,0.19899999999999998,0.39799999999999996,0.402,"I have anxiety and I'm pretty sure I'm depressed too, are therapists worth going to for help?",attr,0,pos_vader,pos_vader
2847,2847,0.9999169385670188,8.30614329766553e-05,0.0,0.826,0.174,Is it worth it to go through CBT and therapies?,conj,0,neu_vader,pos_vader
2860,2860,0.999984601400163,1.5398599851359872e-05,0.0,1.0,0.0,I have my second therapist appointment tomorrow.,compound,0,neu_vader,pos_vader
2865,2865,0.7690014117651172,0.2309985882348858,0.027000000000000003,0.8290000000000001,0.14400000000000002,"I started experimenting with a lot of different pills and ended up taking a liking to a pure form of synthetic pot which eventually led to psychosis and psychiatric hospitalization (was on zoloft at the time aswell)

Flash foward I'm a junior in college, pharm and therapy free, pretty much began treating my anxiety with pot by taking hits throughout the day.",conj,0,neu_vader,pos_vader
2871,2871,0.9953647876223312,0.0046352123776857825,0.066,0.934,0.0,In my therapy session yesterday I ended talking about how a big part of my anxiety was not knowing what I was going to do in the future.,compound,0,neu_vader,neg_vader
2875,2875,0.9997912078132568,0.00020879218673501158,0.0,0.855,0.145,"At that time, my mom was obviously still in control of my medical affairs, so she recommended that I opt out of any medication and seek natural remedies and/or therapy.",conj,0,neu_vader,pos_vader
2879,2879,0.9929008398352,0.007099160164792928,0.0,0.882,0.11800000000000001,"I am [a therapist in Oregon](http://www.hoperisingbend.com/), and will be incorporating the information you shared into some of my clients homework.",attr,0,neu_vader,pos_vader
2884,2884,0.9999542490782208,4.575092176428098e-05,0.217,0.7829999999999999,0.0,"And its not like I want them to be my therapist or something, just chats.",attr,0,neu_vader,neg_vader
2885,2885,0.9629015710106604,0.03709842898934936,0.048,0.8220000000000001,0.13,"I am currently seeing a therapist, but I seem to be able to keep it together for other people and my therapist to the point that it seems as if my anxiety isn't a problem and that I'm dealing with it well.",conj,0,neu_vader,pos_vader
2887,2887,0.9999289426906336,7.105730937133207e-05,0.0,1.0,0.0,So supposedly over summer break I was supposed to be on a therapy plan to work on cognitive behavior and therapy.,conj,0,neu_vader,pos_vader
2905,2905,0.9999688974753776,3.11025246246911e-05,0.0,1.0,0.0,I tried **traditional psychotherapy** for years.,compound,0,neu_vader,pos_vader
2913,2913,0.9999754148436688,2.4585156330077883e-05,0.135,0.625,0.24,"(currently on klonopin; last therapy session was Wednesday; next pscy appointment is May 8)

I just keep feeling like I'm going to die.",compound,0,neu_vader,pos_vader
2915,2915,0.999907729257279,9.227074271289064e-05,0.0,0.83,0.17,My one friend who I'm currently staying with would probably think I'm just making this all up to get sympathy b/c he wants me to move out and my other friends wouldn't understand at all b/c I don't let many people know that I'm in therapy IRL.,compound,0,neu_vader,pos_vader
2935,2935,0.9979308570056225,0.002069142994387666,0.055999999999999994,0.8370000000000001,0.107,"It was always something that troubled me as I had a sense that I was doing it to a point where it was pathological, but none of my counsellors or therapists could offer any useful advice.",conj,0,neu_vader,pos_vader
2936,2936,0.9999446077325492,5.539226746676383e-05,0.275,0.725,0.0,"And because the only proof I really have is my therapy bills and panic attacks, I worry that I can't be helped at all/will never get an on-campus job again.",compound,0,neu_vader,neg_vader
2949,2949,0.9981157633446959,0.00188423665528563,0.0,0.856,0.14400000000000002,"I have seen a number of professionals (therapists, psychiatrists, etc) and none of them seem willing to say straight up ""you have anxiety.""",appos,0,neu_vader,pos_vader
2950,2950,0.9995890106190336,0.00041098938096681187,0.047,0.917,0.036000000000000004,"Looking forward to your thoughts and experience on this... 

Just wanted to add, I have tried:

Depression meds

Bipolar meds

ADD (just vyvanse)

CBT and/or DBT (works a little bit)

Exercise (it helps some, but only temporarily)

Vedic meditation (helps a little, but is very time consuming - 40 minutes a day)

Psychotherapy",conj,0,neu_vader,neg_vader
2951,2951,0.9999669964206068,3.300357940562561e-05,0.0,1.0,0.0,http://www.connections-therapy-center.com/upload/burns_anxiety_inventory.pdf,compound,0,neu_vader,pos_vader
2958,2958,0.9999647963060462,3.520369393472362e-05,0.0,1.0,0.0,"I was just wondering, how have you guys found that the drugs and the therapy have worked out for you?",conj,0,neu_vader,pos_vader
2963,2963,0.9996900202593041,0.0003099797406801791,0.35600000000000004,0.644,0.0,Currently I don't have anybody to talk to about anxiety but my therapist because talking about it sends me into a panic attack.,conj,0,neu_vader,neg_vader
2975,2975,0.9668542036375052,0.033145796362499036,0.0,0.8440000000000001,0.156,"Over the past few months of twice-monthly therapist appointments, I've been building a plan to help me identify when I'm well/unwell and get well for longer periods of time.",compound,0,neu_vader,pos_vader
2976,2976,0.9993838563394304,0.0006161436605851988,0.0,0.9059999999999999,0.094,"Now that the plan's been crafted, the next logical step )in my mind) is to use the plan and therapy to address my triggers, and develop better coping skills.",conj,0,neu_vader,pos_vader
2977,2977,0.9997692224761456,0.0002307775238340564,0.27699999999999997,0.723,0.0,(Bonus points for really bad fear of failure) I've got an appointment with my meds doc tomorrow morning and a therapist appt.,compound,0,neu_vader,neg_vader
2980,2980,0.9996738846848768,0.00032611531513234153,0.0,0.883,0.11699999999999999,I'm looking at it as an extremely intense exposure therapy session for myself.,compound,0,neu_vader,pos_vader
2982,2982,0.999750582081936,0.0002494179180762776,0.172,0.828,0.0,"Ive been to counsilors and therapists and I improove tremendously, but then at some point, a couple weeks to a couple months later, my scumbag brain takes over and im self-sabotage central.",conj,0,neu_vader,neg_vader
2992,2992,0.9999730466242758,2.6953375721276378e-05,0.292,0.708,0.0,"Tried so much (serveral therapies, medication), failed so often.",dep,0,neu_vader,neg_vader
2995,2995,0.9997211889580662,0.0002788110419492149,0.0,1.0,0.0,I had mentioned to my boss in passing a few weeks ago that I had a therapist/psychiatrist appointment which I was going to attend.,compound,0,neu_vader,pos_vader
3015,3015,0.9999303612982622,6.96387017307683e-05,0.0,1.0,0.0,"* After seeing her, she suggested putting me on Zoloft starting at 0.25mg, but I wanted therapy sessions before I started taking medication.",compound,0,neu_vader,pos_vader
3019,3019,0.994010598166794,0.005989401833223544,0.0,0.8909999999999999,0.109,"For reference, I have been to therapy sessions a few times and have scheduled a session in the near future to try to help with situation.",compound,0,neu_vader,pos_vader
3036,3036,0.9992941502344111,0.000705849765582682,0.28600000000000003,0.7140000000000001,0.0,"I haven't had a flat out panic attack in years, but now...walking up stairs, going anywhere (including staying in a truck and going through a drive-through lane at the bank), stores, shops, even my therapist...it's all an instant panic attack.",appos,0,neu_vader,neg_vader
