,neg_prob,pos_prob,neg_vader,neu_vader,pos_vader,sentence
2433,0.9685412653140552,0.03145873468594365,0.202,0.558,0.24,"After years of pushing it down, avoiding therapy, pushing away the people I love, it's reached a critical point."
2434,0.9999337636239201,6.623637607194181e-05,0.0,0.8,0.2,I've been seeing a therapist but I don't know what therapy is supposed to be like.
2435,0.9997364812637992,0.00026351873620941615,0.13,0.779,0.091,"I've also been kind of avoidance towards therapists as well (bad experiences, I understand CBT, it's all repetition at this point)."
2436,0.998777004769265,0.0012229952307238542,0.185,0.815,0.0,Unfortunately I don't want to deal with going to a therapist for a few months before for them to screen me.
2437,0.9992035586934223,0.0007964413065581899,0.0,1.0,0.0,When she was in university she visited a therapist which helped a lot for her.
2438,0.9999835546548526,1.6445345163475268e-05,0.0,1.0,0.0,My next therapy session (CBT) is tomorrow morning.
2439,0.9976835174589311,0.0023164825410587025,0.261,0.739,0.0,"Last time I saw my therapist he sort of made me a bit annoyed and very frustrated by telling me to ""just do"" things and ""just stop"" other things."
2440,0.9994783471632632,0.0005216528367270461,0.156,0.844,0.0,I can't just become better at things because a therapist has told me to do so.
2441,0.9998461480822525,0.00015385191775758007,0.227,0.773,0.0,I haven't done it (and now I worry that he'll think I don't want to be in therapy etc).
2442,0.9999836751053526,1.632489466407036e-05,0.0,1.0,0.0,I have literally spent about 12-15 hours studying every day since my last therapy session.
2443,0.9999837026356603,1.6297364349345528e-05,0.0,1.0,0.0,Should I talk to my therapist about this?
2444,0.9999061330640724,9.386693592128347e-05,0.0,1.0,0.0,"Since then, I was in therapy until I was 15, and I've been on medication ever since."
2445,0.9999684785137862,3.152148621113906e-05,0.0,1.0,0.0,I probably need therapy again.
2446,0.9989488730562571,0.0010511269437411199,0.0,1.0,0.0,I tend to be judgemental and think therapy is a bunch of bull but I can't keep taking benzos forever.
2447,0.9999534034801879,4.6596519803690744e-05,0.0,1.0,0.0,Tomorrow is going to be the second time I have went to the therapist.
2448,0.9999193105267964,8.068947319320315e-05,0.0,1.0,0.0,How do I approach the subject with my therapist?
2449,0.999613744139323,0.0003862558606911223,0.0,0.688,0.312,My therapist tells me to get busy when I feel like I want to satisfy a compulsion and go down a spiral.
2450,0.9999728134330396,2.7186566941438627e-05,0.0,0.779,0.221,"My therapist tells me to ask myself ""Is this healthy for me?"
2451,0.9999890805540371,1.0919445973492951e-05,0.0,0.809,0.191,"Overall I'm seeking advice but my big question is this:

Medication, self help, meditation, or therapy?"
2452,0.9973196606662823,0.002680339333731647,0.0,0.899,0.101,"*

&gt; *This does not, of course, replace therapy or any therapeutic activities prescribed or recommended by a professional."
2453,0.9994307267701729,0.0005692732298417895,0.0,1.0,0.0,The doctors couldnt find any physical cause and suggested she see a therapist because he thought it could be psychosomatic.
2454,0.9999480014826767,5.199851730908423e-05,0.257,0.743,0.0,"Either way, I stopped seeing the doctor and the therapist, and I stopped getting medicine."
2455,0.9999481635302183,5.183646979206255e-05,0.0,1.0,0.0,I tried therapy and found that unhelpful.
2456,0.9996417399675213,0.00035826003249110963,0.124,0.876,0.0,I went to a therapist and I was prescribed effexor and learned to manage my anxiety.
2457,0.9999843872738208,1.5612726191889356e-05,0.157,0.7,0.143,"I have been going to therapy for years, meditating, distracting myself and practicing every coping technique i know.. but then I have episodes like this and I just want to scream."
2458,0.9997238098404057,0.0002761901595810524,0.12,0.783,0.097,"Doctors don't tell me anything factual, and I've done everything a therapist would recommend for anxiety/panic attacks, and I can't believe this is just anxiety - I had to walk for 30 minutes while barely feeling my legs."
2459,0.9999369552991826,6.304470080158778e-05,0.223,0.777,0.0,I had seen three therapist this year and one I notice seem to be dead on about him.
2460,0.9992039987417322,0.0007960012582729598,0.177,0.718,0.105,And lots of introspection and therapy is helping me see the negative talk that is taking place.
2461,0.9999971564864196,2.843513571430294e-06,0.244,0.756,0.0,"my mom was just diagnosed with cancer so i dont want to come out to my family because i dont want them to worry about something else, and i dont have much money so how much does therapy cost?"
2462,0.9999910883520018,8.911647996733987e-06,0.0,0.545,0.455,how is therapy like?
2463,0.9914507319882412,0.008549268011756959,0.156,0.844,0.0,"I've had a lot of bad experiences with therapy, and I wonder what the options are when it comes to treating this."
2464,0.9998712327724573,0.0001287672275589553,0.0,1.0,0.0,How did you bring it up to any sort of counsellor/therapist/psychiatrist/etc that you were seeing?
2465,0.9831936707420484,0.016806329257952692,0.0,0.925,0.075,"OK, to clarify, I've been occasionally seeing a therapist for a couple of years and after several months (okay, two) without contact i suddenly  got a letter from the hospital, telling me I had gotten an appointment for a brain scan next Tuesday."
2466,0.9997834794048736,0.00021652059510831337,0.119,0.881,0.0,"To make things worse, the last time we met I explicitly told the therapist I didn't want to start any big investigation right now, since I'm studying full time, so this really came out of nowhere."
2467,0.9999334612750909,6.653872492682974e-05,0.0,0.787,0.213,My therapist is really being patient with me and I appreciate it.
2468,0.9999857805591326,1.4219440873054574e-05,0.302,0.614,0.084,"It's scary and crippling but my therapist said I don't have any mental illnesses, not even anxiety."
2469,0.9982952293326983,0.0017047706672855083,0.292,0.708,0.0,"In 2012, I went and saw my first therapist, but the lady was a moron and I quickly realized I was wasting $150 per session."
2470,0.9998425298308027,0.00015747016919989904,0.0,0.867,0.133,I'm curious to hear what sort of experiences you all have had with counselors and therapists.
2471,0.992253705769774,0.0077462942302324094,0.0,1.0,0.0,"I've put off going to a therapist for so long because when I've gone in the past, it never helped me."
2472,0.9992148204242778,0.0007851795757136868,0.0,0.726,0.274,So I found what seems to be a good place and had placed a call to set up an appointment with a therapist whose description/background sounded like a good match.
2473,0.9999896613944085,1.0338605578696055e-05,0.27,0.56,0.17,What if therapy *doesn't* improve my anxiety?
2474,0.9999853230813845,1.467691861883126e-05,0.0,1.0,0.0,I've been thinking for awhile about trying sex therapy.
2475,0.9999800994970897,1.990050291316755e-05,0.0,1.0,0.0,Has anyone had any experience with sex therapy before?
2476,0.9984890555645594,0.0015109444354344758,0.034,0.875,0.09,Belching and gassy and didn't want to eat most of Thursday--and had a therapist appointment (which also went pretty well)...and decided to take one dose of Pepcid with supper (should have probably been before?)
2477,0.9997226361528289,0.0002773638471566953,0.0,1.0,0.0,"Additionally, I'll be looking into finding a therapist I can talk about this with."
2478,0.9871897293412486,0.012810270658747248,0.0,1.0,0.0,"Throughout the years, I've been going to therapy, and have found a combination of pills that works for me."
2479,0.9998763912468428,0.00012360875316179236,0.273,0.661,0.066,"After 21+ years of battling my anxiety, depression, and basic self-loathing literally by myself, and having no luck with various therapists, I have finally found one who doesn't make me feel even more crazy than I already do."
2480,0.9999382775052281,6.17224947612421e-05,0.0,0.84,0.16,"I guess I just wanted to get this off my chest, and maybe figure out what the best form of therapy would be for me."
2481,0.9999688126055049,3.118739449991571e-05,0.0,1.0,0.0,He's not my therapist.
2482,0.999701854557836,0.0002981454421523326,0.0,1.0,0.0,Just a therapist.
2483,0.9977968503729482,0.002203149627066252,0.0,0.673,0.327,I have a therapist of my own but I feel like I need to share things with him too because he's my significant other.
2484,0.9994379519154919,0.0005620480845156839,0.109,0.891,0.0,How much information is too much information when you have a history of mental illness and you're in a relationship with someone who is a therapist?
2485,0.9999955429537936,4.4570462095676485e-06,0.0,1.0,0.0,I've tried psychotherapy and EMDR (I'm having my fourth EMDR session today).
2486,0.9950948104934622,0.004905189506533005,0.44,0.56,0.0,I've been diagnosed as a sufferer of social anxiety when I was previously attending regular therapy due to severe depression.
2487,0.9986491886111086,0.0013508113888777227,0.132,0.868,0.0,I'm seeing a therapist for unrelated reasons but she said that's normal for a teenager but I'm not sure.
2488,0.993939633094838,0.0060603669051708855,0.075,0.925,0.0,What happened beginning in the 1950s with Albert Ellis and Aaron Beck is a new approach to therapy for people with anxiety disorders.
2489,0.999141712561113,0.0008582874388803463,0.196,0.804,0.0,"This is the basis of **cognitive behavioral therapy**, which I did for years and am cured of my generalized anxiety disorder."
2490,0.96163554475253,0.03836445524746211,0.031,0.591,0.378,"I still have anxiety, as does anyone who breathes, but it doesn't even come close to the shit I suffered for 10-15 years before finding a great CBT therapist and reading about it."
2491,0.9975640825518373,0.0024359174481531558,0.152,0.848,0.0,"Similarly, **mindfulness** and **mindfulness based cognitive therapy** teach you to ignore, in a way, your thoughts."
2492,0.9990007576530993,0.0009992423469168386,0.0,0.817,0.183,"Very, very, very few discussions of successful therapies, links to scientific reports and research, and discussions of therapists."
2493,0.9706368701173027,0.029363129882690086,0.404,0.596,0.0,"People who think that the modality is not as important a good therapist of some ineffective modality are dead wrong, and the research proves it."
2494,0.9999764494014681,2.3550598518942113e-05,0.0,1.0,0.0,Exposure and Response therapy is phenomenal.
2495,0.999912181343178,8.781865681668575e-05,0.0,0.778,0.222,hey guys- anyone have success with a particular cognitive behavioral therapist/therapy in New York City?
2496,0.9993620832911512,0.000637916708853663,0.0,1.0,0.0,"and there were only two in my city on that ""finding a therapist"" link on the sidebar."
2497,0.9984974823137386,0.0015025176862552793,0.118,0.744,0.138,"I'm very self-aware, so I question what good it would do for a therapist to tell me what my problems are."
2498,0.9996141216192136,0.0003858783807738676,0.132,0.868,0.0,"I know that for most therapy sessions, you just sound off without getting concrete advice for how to move forward in life, which is troubling."
2499,0.99986128378017,0.0001387162198195226,0.0,0.649,0.351,Do I seek therapy or a support group?
2500,0.9999249281345531,7.507186545650224e-05,0.0,0.828,0.172,"I decide to watch it later, skip, get lunch and get ready for therapy."
2501,0.9999669964206069,3.300357940562821e-05,0.524,0.476,0.0,I missed therapy today.
2502,0.9999297637888851,7.02362111160406e-05,0.0,1.0,0.0,"I can go for therapy, but not medication."
2503,0.9997431089972598,0.00025689100273506335,0.0,1.0,0.0,My therapist sees me for a few minutes anyway.
2504,0.9999669964206069,3.300357940562821e-05,0.0,1.0,0.0,Neither offer therapy.
2505,0.9997399377892645,0.00026006221072605274,0.0,1.0,0.0,He said he is a Medical Doctor not a therapist and that he is only a prescriber.
2506,0.999703493331963,0.0002965066680534849,0.074,0.816,0.11,He told me that therapy wouldn't work well for me and it would only help after I got on meds/for the long run.
2507,0.9997478378663506,0.0002521621336530169,0.128,0.872,0.0,"I can't go to therapy, and I have no one in my life to talk to about it."
2508,0.9991217171890413,0.0008782828109492498,0.067,0.933,0.0,"I don't want to see a therapist and be put on meds, not to mention I don't even have the money."
2509,0.9981159149092851,0.0018840850907052894,0.109,0.891,0.0,"I am in therapy (twice a week for the passed 4 years), I cannot take anti-depressants due to a brain injury (I have tried, they have caused more issues)."
2510,0.9997569789397335,0.00024302106027550283,0.0,1.0,0.0,I'm visiting a therapist when I can.
2511,0.998245157133431,0.0017548428665711468,0.0,1.0,0.0,I've decided to seek treatment again and I have a psychiatrist appointment in 6hrs and a therapy appointment on the third of August.
2512,0.9999352937009571,6.470629905934344e-05,0.0,1.0,0.0,"I'm already on medication and I've been in therapy, so those bases are covered."
2513,0.999986605620292,1.3394379690883749e-05,0.0,1.0,0.0,I finished my therapy with my psychiatrist 2 months ago.
2514,0.9999243045425783,7.569545743042003e-05,0.0,0.928,0.072,"She told me I could always contact her (e-mail, but I have this number and we used to text when I was in therapy."
2515,0.9998871551147474,0.00011284488525484272,0.0,1.0,0.0,I'm counting down the days until I can start therapy.
2516,0.9834273333391065,0.016572666660885704,0.0,0.71,0.29,"I'll be seeing my therapist in a few days to help me sort out being triggered, but in the meantime I'm trying to be strong and take care of myself."
2517,0.9977680973440884,0.0022319026559269703,0.135,0.822,0.043,"Quick facts: 

-I'm 23 and shes 22
-We've been together almost 2 months now
-I don't take medicine or see a therapist
-I actually have health anxiety as well so I'm scared of taking medicine for my anxiety because of what it might do to me."
2518,0.9993145594890692,0.0006854405109339394,0.0,0.807,0.193,-For those that are going to just go with the easy response and suggest meds or therapists please tell me about your experiences with it so I'm not as anxious about them.
2519,0.9381329851391949,0.06186701486079208,0.159,0.776,0.065,"I saw a therapist in high school for it, who taught me some ways to cope with flashbacks/all the anger I was feeling."
2520,0.9977797389370209,0.002220261062970526,0.0,1.0,0.0,"I tried to tell my mom one day that I needed to see a therapist once I graduated, but she shut me down."
2521,0.9995628513170468,0.00043714868297174155,0.0,1.0,0.0,I haven't seen a therapist since.
2522,0.9988098588544917,0.0011901411455027288,0.151,0.849,0.0,"For a while I wanted to be a physical therapist, but when I job shadowed I found out I didn't like it."
2523,0.9999780897070216,2.1910292961265746e-05,0.0,1.0,0.0,Maybe an art therapist?
2524,0.9980443459179567,0.0019556540820372214,0.156,0.844,0.0,"I have been to family therapy as a kid and it was such a cluster fuck between my mom, step-dad, brother, and myself."
2525,0.9999794519304518,2.0548069541068224e-05,0.0,1.0,0.0,Any stories or resources about therapy virgins?
2526,0.9986176716902369,0.0013823283097772405,0.173,0.827,0.0,"I'm on multiple medications, but I've been out of therapy for about a year and a half- I'm going to get into a domestic violence therapy thing to start up again."
2527,0.996316940940078,0.0036830590599225385,0.103,0.739,0.158,"I am on meds (Effexor, Xanax as needed, both of them pretty low doses), and I do see a therapist."
2528,0.9999896088392947,1.0391160716331002e-05,0.0,1.0,0.0,i then asked him if he had any recommendations for therapy and he said there's none that's reliable in my country.
2529,0.9961072942031717,0.0038927057968236095,0.0,0.957,0.043,"I'm not ignoring the fact that I should go see a counsellor or a therapist, but it just doesn't seem as viable at the moment, and I guess ultimately, I'm trying to understand what's going on with me at the moment."
2530,0.9999769137614003,2.3086238607612034e-05,0.0,1.0,0.0,Perhaps therapy might aid me...
2531,0.9998461748756369,0.00015382512436501727,0.0,1.0,0.0,"I'm considering seeking out a therapist, assuming it's partially covered by my insurance...but I wanted to know if anyone had been through anything similar."
2532,0.9995493865089439,0.00045061349107306756,0.0,1.0,0.0,"I have been thinking about going to therapy for a long time, but I've always been too afraid to call."
2533,0.9998967550041703,0.00010324499581378475,0.0,1.0,0.0,"I know I need therapy, but I also know that it's going to probably be expensive."
2534,0.9998964579254098,0.00010354207460316045,0.0,1.0,0.0,"Do I see a psychotherapist, a psychologist, or someone else?"
2535,0.966229777936612,0.033770222063376536,0.202,0.798,0.0,"I did the first few pages of a ""procrastination workbook"" with one therapist, and it said I had every type of procrastination except doing it to spite people (I hate being an inconvenience)."
2536,0.9993419254886039,0.00065807451139259,0.0,1.0,0.0,"I haven't really talked to anyone about it besides my family/therapist, I just wanted to let a few strangers know."
2537,0.9784275450075204,0.0215724549924665,0.123,0.794,0.083,I'm testing a novel approach to exposure therapy designed to minimize or eliminate the sense of threat that is a basic part of modern exposure therapy.
2538,0.9953788579787708,0.004621142021227823,0.0,0.765,0.235,"After about a week of this, I decided to reach out to a family friend who works as a therapist."
2539,0.9998635835359004,0.0001364164641098737,0.25,0.75,0.0,"He also referred me to therapists, but I stupidly have not contacted them yet."
2540,0.9996447488214795,0.0003552511785184506,0.0,1.0,0.0,I started therapy a few weeks with my campus Counseling office.
2541,0.991024804145437,0.008975195854553086,0.322,0.678,0.0,"I went into therapy for many years, was in the hospital for a week because I had a panic attack for three days (mother was harassing me I don't want to do into it), nothing changed and I only got worse."
2542,0.9999778192770952,2.2180722891912547e-05,0.252,0.748,0.0,I (20 yr old female) first started therapy for depression when I was 13.
2543,0.9997278473549033,0.00027215264508489897,0.089,0.911,0.0,"I'm going to see a therapist in a few days about both problems, but is there any advice you guys can give?"
2544,0.9999213551668763,7.864483312133155e-05,0.103,0.714,0.183,I recently lost my therapist due to insurance changes and I have only one in-network therapist with not-really great reviews.
2545,0.9997737618343552,0.00022623816566207387,0.0,1.0,0.0,"For those who don't know what [this is](http://www.talkspace.com/), it's a text and video-based therapy service."
2546,0.9998371676098706,0.00016283239012264764,0.0,0.802,0.198,"Take care of yourself, get into therapy, switch up your meds, etc, do YOU."""
2547,0.9999562869309055,4.3713069083694995e-05,0.0,1.0,0.0,Both me and my boyfriend are in therapy.
2548,0.9998139043287068,0.00018609567128299263,0.184,0.597,0.219,Obviously I'm seeing a therapist and psychiatrist and I have a great support system but I am still struggling.
2549,0.9945476667533139,0.005452333246698385,0.13,0.87,0.0,How long did it take you to lose the physical side effects and learn new coping mechanisms with a therapist?
2550,0.9995619454788492,0.00043805452116095207,0.074,0.926,0.0,"I've been really considering seeing a therapist about my anxiety for awhile, but I'm uninsured and it's so expensive."
2551,0.999404778326039,0.0005952216739753143,0.0,1.0,0.0,I've been seeing a new therapist for a couple months now.
2552,0.9969521170826059,0.003047882917408925,0.093,0.832,0.075,"Talking to men tends to be stressful for me, but my old therapist (who was moving and was thus referring me elsewhere) thought it might be good for me to see a male, for that very reason (also, she didn't like anyone else in my insurance network)."
2553,0.9999913343185064,8.665681511106206e-06,0.196,0.804,0.0,Has anyone else had distracting sexual fantasies about their therapist?
2554,0.9998284429612403,0.00017155703875471574,0.086,0.914,0.0,I've only been to a few meetings with my therapist so far and we have narrowed down my anxiety issues.
2555,0.9971353036212182,0.0028646963787929934,0.0,0.876,0.124,She recognizes this issue and she's been saying for about 6 months now that she wants to see a therapist but has never actually sought out help before.
2556,0.99999254608607,7.453913924897993e-06,0.0,0.906,0.094,I know medication and therapy should be long term solutions but what about short term?
2557,0.9998823917987437,0.00011760820126417578,0.348,0.652,0.0,I was enrolled in therapy and it was AWFUL.
2558,0.9999185613482716,8.143865172937742e-05,0.203,0.652,0.145,But I'm still struggling and willing to give therapy another chance.
2559,0.9999521488738037,4.785112619519956e-05,0.152,0.736,0.112,"I'm Native American, so I get free healthcare, but unfortunately I can't see any other therapist but that one."
2560,0.9788242735571693,0.021175726442841707,0.054,0.946,0.0,"So, I've had anxiety for years and years now, but it has recently completely taken over my life and I am going to a therapist for the first time."
2561,0.9869708384242115,0.013029161575794649,0.234,0.731,0.035,"I've been to all manner of councillors, cbt, therapy and psychologists and found them reassuring but not too helpful; the most helpful was the last one,  a trainee psychologist who decided to just teach me how the anxiety and panic reactions work in the brain."
2562,0.9996374224754156,0.0003625775245812554,0.0,1.0,0.0,I go to a therapist regularly and I'm waiting to see a doctor who can prescribe me something.
2563,0.9978364219545462,0.002163578045457253,0.0,1.0,0.0,Ive been unemployed for about a month while the meds side effects slowed down and am going to a therapist on the tenth.
2564,0.9998086199663787,0.00019138003362681328,0.086,0.914,0.0,I put off seeking therapy for my self-doubt and anxiety for the longest time because I thought it was cost prohibitive.
2565,0.9999701690635894,2.9830936406987914e-05,0.0,1.0,0.0,"Now, maybe three months into therapy, my bosses are considering changing our health plan, and our copay will be quadrupling."
2566,0.9995635008174182,0.00043649918258439646,0.101,0.876,0.023,"I want to put my foot down and say I don't like the new plan, that we should stick with the regular one, but I'm the only person in the office who has this concern, and I feel uncomfortable having to tell the entire room that I'm in therapy."
2567,0.998800185645296,0.0011998143547113597,0.112,0.888,0.0,"At the same time, I decided it was too much burden to put only on myself, my mom, and my boyfriend, so I sought out a therapist."
2568,0.9980843838240734,0.0019156161759127618,0.168,0.832,0.0,"I went in every other week to talk things through, and though the act of going to the therapist itself usually made my anxiety worse, he helped me to realize that I shouldn't be so hard on myself."
2569,0.9998980340787041,0.0001019659212757555,0.0,1.0,0.0,I'm probably going to start cognitive therapy or whatever it's called in the future though.
2570,0.9951471668567541,0.004852833143253319,0.108,0.844,0.047,"after awhile of home-schooling, I dropped my other subjects and only started to do english and maths , which was fine because I said I was stressed and the therapists/child physiologists took it seriously so I just went with it."
2571,0.999598428238157,0.0004015717618406584,0.0,1.0,0.0,"I can't drive, so I can't see a therapist."
2572,0.998520401722479,0.001479598277534254,0.0,1.0,0.0,"She's talked to therapists, been prescribed Xanax, had bloodwork done, even had a colonoscopy to see if the IBS was caused by something physiological."
2573,0.9998030285077674,0.00019697149223199515,0.0,1.0,0.0,"Everything has come back normal so far, and therapy hasn't seemed to do much."
2574,0.9999258152059143,7.418479408610844e-05,0.286,0.714,0.0,My boyfriend got mad and said home therapies aren't good and to go to the doctor.
2575,0.9999232859963858,7.671400360886842e-05,0.0,0.86,0.14,"I would bring it up with my therapist, but she doesn't usually end up giving me advice I can use long term."
2576,0.998937059129103,0.001062940870882446,0.065,0.85,0.085,"What I think would be best for me is to start seeing a therapist again, but my situation doesn't allow me to at the moment, so I'm looking for alternatives."
2577,0.9991301676075947,0.0008698323924031322,0.0,1.0,0.0,"Is there, I don't know, some sort of homework you can do by yourself that can replace actual therapy for a time?"
2578,0.9997468477849267,0.00025315221506495167,0.0,1.0,0.0,I'm in therapy and on light medication for the time being.
2579,0.987878819668664,0.012121180331330124,0.0,0.843,0.157,"I don't know what to do, I haven't been to therapy in a month because of the holidays."
2580,0.9960084357789751,0.003991564221016967,0.209,0.791,0.0,"I have been struggling with mental health issues for years, and though I saw therapists as a teenager 5 years ago to work through some life events, I have never been diagnosed with anything such as depression or anxiety."
2581,0.9665652538319474,0.0334347461680403,0.054,0.825,0.121,I did see a family therapist about 10 years ago for unrelated issues to anxiety and at the conclusion of our sessions he told me I was afraid of being successful.
2582,0.999786289833883,0.00021371016609711264,0.0,1.0,0.0,"At first I thought it was my job, but now that it started again I think the therapist might have been right."
2583,0.9959272869805703,0.004072713019418329,0.0,0.847,0.153,I haven't been to therapy for a couple of years either so am wondering if it would help.
2584,0.9987814561588352,0.001218543841151883,0.119,0.881,0.0,"At the moment, I'm living in a foreign country (China) and while I can speak the language I have a few problems getting therapy here."
2585,0.9987658792770625,0.0012341207229458232,0.0,1.0,0.0,"Secondly, there isn't too much in the way of therapy."
