,Unnamed: 0,neg_prob,pos_prob,neg_vader,neu_vader,pos_vader,post,dict,identifier,sentiment
10,10,0.999877882326744,0.00012211767325025086,0.025,0.7659999999999999,0.209,"So I finally got a smart phone. I was looking for apps that can help with stuff. For example, I looked around at mood/sleep trackers and medication calendar/ reminders, maybe something that can help with anxiety. But I dont really know where to start. It's a bit overwhelming. So I was wondering if anyone had any suggestions for helpful apps? Any suggestions would be much appreciated.",['conj'],0,neu_vader
13,13,0.9950334022904828,0.004966597709518296,0.061,0.8859999999999999,0.053,I'm considering asking the Early Intervention in Psychosis team tomorrow (whom I see weekly) about getting me meds to help my avolition and poor attention span. I can't work for longer than 20 minutes at a time and can't complete my counselling sessions without a break splitting it in two segments...,['ccomp'],0,neu_vader
41,41,0.9998894093021801,0.00011059069783476133,0.16699999999999998,0.698,0.135," I'm wondering if anyone from experience or from just knowledge knows which hospitals are better than others in NY (I don't know if I could go to one in another state). I'm seriously considering going to one. I need a sort of plan in case things do not improve for me.  I can't go to the local p-ward. I don't see myself  getting better  in just a week or two. Plus they told me that I would be sent to state if I ended back there anyways.  

I haven't been to a *""psychiatric only""* hospital since I was a child 13 and I've had to work hard to paint over the memories of that trauma. I've had crappy p-ward stays  but my last few were actually awesome and I could see myself making good use out of time spent recovering in a better suited facility. Especially if it has grounds to walk on and a good staff and more things to do than a p-ward.

Are there hospitals in NY that have Nice grounds to walk on and best therapy? I don't want to be in a heavily locked down ward or confined to a room. I don't want to feel like I made a mistake and then get treated bad or neglected or hurt. I could see myself hurting myself really bad. I would really freak out and end up nowhere. 

Yeah I'm asking for help because I don't know what to do.  I need to hear that it would be ok if I did this because I really need help and have no one or even a doctor or any meds. I would be willing to drive to the hospital or take a bus or something. This option is really might be the last thing between me and disaster. I wish I could talk to someone about what's the matter. This loneliness is destroying me. 
  ",['conj'],0,neu_vader
49,49,0.2207386897293868,0.7792613102706464,0.147,0.7190000000000001,0.134,"I'd like to preface this by saying that I'm not schizophrenic, so if I say anything that comes across as stupid or intolerant, please understand that it's out of a real lack of understanding, and not prejudice.


So I have this really good friend who comes from a somewhat broken home, as a result she has spent a ton of time at my house or going on family vacations with us. She's more like a sister to me now. She's always dealt with severe ADHD and depression to some extent, but other than being a little spacey, she seemed pretty mentally grounded. There have been some incidents that worry me, were were camping one time and she left the RV to go outside. She didn't come back for a while so we went looking and found her sitting on a swing, she had this wide eyed stare and was extremely unresponsive to words, we tried rousing her by nudging her a little bit, but it was to no avail, it was like she had been hypnotized. After almost an hour, she started responding to us somewhat coherently, we took her back and put her to bed, but she had very little recollection of what had happened. She seemed better after that, and there were no more episodes like that. After a year or so things got worse, she spiraled pretty deep into depression that characterized itself by this complete lack of any emotion and she attempted to slit her wrists a few times, I thought that she just went into depressive phases, but she described it as a compulsion to hurt herself, like some power or entity was exerting their will over her. She had smoked some pot with me on a couple of occasions, and what I initially recognized as the paranoia of someone who had never smoked quickly spiraled out of control. She ran terrified away from me and my brother, with the look of a caged animal in her eyes, she crawled underneath the foundation of my house and was screaming for god to save her. We got her out and calmed her down, but I remember her sobbing like a helpless child who just experienced something terrifying. I resolved not to let her smoke after that. Right now she's been hospitalized for almost a week after she had another compulsion to kill herself, felt as if she could not fight against it anymore, and asked her family to take her to the hospital. She's being held there for a week, psychoanalysis is my guess, and is not allowed to see anyone but family.


I want to know how I can help make her feel more comfortable and happy, I've noticed in the last few months how destructive her battle with mental illness has been to her self esteem. She feels guilty about it I think, she is often apologetic about the way she feels and thinks, she seems to view herself as defective or wrong in some way. I tell her that she should never have to apologize for how she feels, but I don't know if I'm getting through to her. I can't imagine that being examined by doctors for a whole week I'd going to make her feel much like a human, and I just want to know what I can do for her other than just continue to be a friend to her and not to treat her like some kind of oddity. I just hate seeing her destroyed by her own feelings, and then on top of that destroyed by other people and their expectations, their unquestioning acceptance of what they perceive, their conviction that they or somebody else knows best.


On some limited level I think I can relate, I've done a lot of drugs, in particular LSD and psilocybin, altered states of consciousness and neurochemistry have always interested me. I view the brain as nothing more than a complex machine made of neurons, synaptic pathways, powered by an array of chemicals, and tuned in always to the stimuli around us that are filtered through the nervous system and sensory organs. Introduce a minute amount of some novel psychoactive chemical, and watch the reality around you crumble. This leaves me with the view that there is nothing wrong with having a different experience of ""objective reality"" which I'm not sure I even believe in, but that mostly what my friend suffers from is the isolating experience of perceiving or thinking differently from others. Although I see that some of the psychological phenomenon that she experiences are scary to her in their own right, and that is not to be ignored. Whatever she needs, be that medication or psychotherapy, I hope she gets, and I hope it helps her. I just hate to see her treated differently, although I recognize that suicidal people do have to treated differently to some extent, I can't stand to see her made to feel like less of a valuable or loved person because of how isolating her experience is. To her sense of self worth and happiness destroyed, because of the arrogant and single minded postulations of others, that because they don't experience life in a strictly comparable way to the majority, they are labeled as crazy or sick. I understand that in psychopathology that a disorder is only viewed as that because it inhibits leading a happy or functional life. But at the same time I feel that much of that dysfunction comes from the typical view of someone who experiences reality differently, and that because that persons experience differs from theirs it frightens them. /end somewhat incoherent rant.


I see a psychologist too, and I can relate very much to feeling isolated from others, sometimes for reasons that are the same as hers, as well as some reasons that are my own. I know what it's like to feel like less of a person because of who you are, I can even relate to not perceiving reality the same as others most of the time, but I did a lot of, and still do, drugs sometimes. I'm not a psychologist, I just want to help my friend.",['attr'],0,neu_vader
65,65,0.998441044437774,0.0015589555622262895,0.129,0.8290000000000001,0.043,"Hello, as a child I experienced many episodes and delusions which she thought I was just playing even though I wasn't. She still is not accepting my diagnosis and tried to get me off meds. Is this normal behavior? Is she scared?",['conj'],0,neu_vader
76,76,0.9941375442447656,0.005862455755238574,0.1,0.9,0.0,"i take 2MG of risperidone at night and i also take 2MG of bentropine for the side effects of the risperidone. now the risperidone has helped a lot with thevoices, but my paranoia and halucinations have gotten worse. is this normal? and have any of you guys taken risperidone and have gone through this. i see my doctor tomorrow, so he'll which medications. but is this normal for risperidone?  ",['advcl'],0,neu_vader
86,86,0.9999808301561968,1.9169843811817388e-05,0.305,0.654,0.040999999999999995,"Okay. I changed so many doctors and everyone said different things. My first and third doctor said schizophrenia and heavy depression. Second and third said OCD and heavy depression. Fourth said anxiety disorder and heavy depression. Fifth only gave me heavy depression, OCD and schizophrenia medicine without saying what is wrong with me.

I have some of the sympthoms like hallucinations, delusions, disorganized speech, extreme paranoia etc. But, those can be explained with different reasons too, i think. 

In short, what the fuck is wrong with me?
",['conj'],0,neu_vader
94,94,0.9999669964206068,3.300357940562561e-05,0.0,1.0,0.0,,[],0,neu_vader
101,101,0.9999662722321452,3.372776783927108e-05,0.138,0.735,0.127,"If you are reading this, which I bet you are, stop telling me and my family that I am mentally ill when I'm not.
I hate this, everyone is working against me and saying I'm ""schizophrenic"" when I'm not! I don't know who they are but they've made doctors tell everyone I know I'm mentally I'll when I'm not. Is this happening to the people of this forum as well? They will probably take down this post because I'm exposing their sick agenda, but if this has happened to any of you please help me!

They are following me, telling my family to work against me, I think they have mind controlled them. What do I do, I don't want to kill myself but its the only way out. I hate you scumfucks what do you want from me? 
Telling everyone I'm mental fuck up its all lies I'm not! That's what they're doing guys help me

They have made the doctor try and give me their mind control medicine and made family make me take it. I don't want to be the next mindless robot they create why are you doing this leave us alone. The mind control medicine let's them into my brain and they know all my thoughts and they communicate with me through my brain saying they are doing this to make me kill myself I don't want to let them win 

How did you stop them spreading this lies saying you have ""schizophrenia""",['ROOT'],0,neu_vader
110,110,0.9999669964206068,3.300357940562561e-05,0.0,1.0,0.0,http://www.medscape.com/viewarticle/849865,['ROOT'],0,neu_vader
146,146,0.997192110189528,0.002807889810474951,0.127,0.818,0.055999999999999994,"*This is for reference only. Diagnoses can only be made by professionals qualified and experienced in mental health. Please see a doctor or mental health professional if you think you experience any of the symptoms here.*

From the current **Diagnostic and Statistical Manual of Mental Disorders, 5th Edition** (DSM-5):

**Schizophrenia 295.90 (F20.9)**

A. Two (or more) of the following, each present for a significant portion of time during a 1-month period (or less if successfully treated). At least one of these must be (1), (2), or (3):

    1. Delusions.
    2. Hallucinations.
    3. Disorganized speech (eg, frequent derailment or incoherence)
    4. Grossly disorganized or catatonic behavior.
    5. Negative symptoms (ie, diminished emotional expression or avolition).

B. For a significant portion of the time since the onset of the disturbance, level of functioning in one or more major areas, such as work, interpersonal relationships, or self-care, is markedly below the level achieved prior to the onset (or when the onset is in childhood or adolescence, there is failure to achieve expected level of interpersonal, academic, or occupational functioning).

C. Continuous signs of the disturbance persist for at least 6 months. This 6-month period must include at least 1 month of symptoms (or less, if successfully treated) that meet Criterion A (ie, active phase symptoms) and may include periods of prodomal or residual symptoms. During these prodromal or residual periods, the signs of the disturbances may be manifested by only negative symptoms or by two or more symptoms listed in Criterion A present in an attenuated form (eg, odd beliefs, unusual perceptual experiences).

D. Schizoaffective disorder and depressive or bipolar disorder with psychotic features have been ruled out because either 1) no major depressive or manic episodes have occurred concurrently with the active-phase symptoms, or 2) if mood episodes have occurred during active-phase symptoms, they have been present for a minority of the total duration of the active and residual periods of the illness.

E. The disturbance is not attributable to the physiological effects of a substance (eg, a drug of abuse, a medication) or another medical condition.

F. If there is a history of autism spectrum disorder or a communication disorder of childhood onset, the additional diagnosis of schizophrenia is made only if prominent delusions or hallucinations, in addition to the other required symptoms of schizophrenia, are also present for at least 1 month (or less if successfully treated).

",['conj'],0,neu_vader
151,151,5.24867671075489e-05,0.999947513232926,0.129,0.805,0.066,"My sister and I recently had a pretty deep heart to heart where she confessed she believes she may have schizophrenia. She is 29. She says she thinks she's had it most her life however her hallucinations really got out of control when she was around 15 years old. She has auditory, visual, and occasionally textile hallucinations. As a child our mother says she was always talking to imaginary friends. She remembers seeing weird things on rare occasion but around 15 it got out of control. She started failing all her classes, sleeping all the time she wasn't at school, had no friends, and ate only candy bars and soda (she lost a lot of weight as she only had one a day). She started to talk about seeing ghosts and would scare the crap out of me. Eventually she became very suicidal and was hospitalized twice in a few months for extended amounts of time. She was eventually was diagnosed as bipolar and released from the hospital. She took lithium for less than two months. She was supposed to get follow up care but my mother never did that for her. 

Fast forward to 14 years later and we are now adults. My sister has not talked about these ghosts she used to see since she was 16. I assumed they were hallucinations brought on by bipolar psychosis and that she no longer sees them. She is a normal stay at home mom of two kids. She lives a normal life now with no doctors or medication. You would never know this about her. But she did confess to me that she still sees them. All the time every day. They never went away but when she was 16 she simply stopped talking about them because she didn't like how no one believed her. She said she also stopped interacting with them which made the ""ghosts"" less abundant and less aggressive. These days if she sees them she does not look at them. If they talk to her she ignores them. She finds that when she talks to them they come around more and get more aggressive and demand more of her attention. 
When she was younger she was convinced they were spirits. Some lost souls, some demons, some she called judgers. But as an adult she is now atheist and believes they are hallucinations brought on my schizophrenia. She isn't absolutely convinced this is the case though because she says they sometimes know information she had no way of knowing. 

Her hallucinations are almost completely of these ""ghosts"". She says most of them look human, some with deformities or injuries. She says that though they look human it's obvious they aren't because look duller than the world around them. The light in the room doesn't reflect off them. Sometimes they glow. They sort of hover in the air a few inches off the ground. Sometimes they are not human at all but monsters or beasts. These ones usually give her a sense of terror. Some are judgers but she doesn't see those any more. I'll explain judgers later. Most of the ghosts will try to talk to her. They love to talk about themselves (they all have a story of how they lived and died). They will also talk to each other but she can't hear those conversations. She says she can always tell who is talking because the sound will come from their direction. She says she can still hear them just find even if she is at a concert or loud place. They are more populous in big cities. Scary ones are often at parks. She says they are assigned by someone to be where they are and will stay in that place (like house, park, store, ect). She says trying to avoid them when they pop up by leaving the room does not work because if they think you are avoiding them they follow. Sometimes in public they will be preoccupied with something like looking in a store window and won't acknowledge her at all. She says sometimes they can be assigned to follows specific person. She says they will stay around for a few hours to a few weeks. She can talk to them by thought and they will speak back. She can ask them questions and they will answer her or go ask another ""ghost"" for the answer. She says they were often wrong about the questions she would ask ""like winning lotto"" but a few times seemed to know things. They can also show her images in her mind of certain situations or whatever if they want to show her something that happened. She says they can touch her but not the environment. When they touch her it feels cold. They can walk through her. If she touches them her hand goes right through. They never tell her to do bad things or hurt people or herself. They do not criticize here. On rare occasion they will criticize the things people around her say. 

She told me that now she completely ignores them and it makes the occurrences of seeing them a lot less. She doesn't talk to them any more or about them because it makes them show up more and be more aggressive about getting her attention. She says sometimes they can be incredibly beautiful or absolutely terrifying. She still sees them on a daily or weekly basis but now it's usually from a distance and the grocery store or standing on the side of the road she is driving down. Rarely they are in her house or close enough to touch. She does not believe they can hurt her or anyone else.

She says she is not paranoid and does not think anyone is out to get her. Only once has she ever heard a voice where there wasn't a visual ghost attached to it. Twice years ago her reflection disappeared in the mirror and was replaced with something else. Sometimes the ghosts can shoot ribbons of light out of their hands and seem more important. Sometimes the ghosts are just orbs of light that still communicate with her. She says she never feels like media like books or news papers or movies or radio are sending her special messages. Her environment and real people around her never change or anything like that. The hallucinations are strictly with these ""ghosts"".
 
The judgers I mentioned before looked like grim reapers and almost always showed up in pairs. One good, one bad. The bad one wore a black robe and the good had a gold robe. They showed up places like hospitals or car accidents or around people my sister thought were going to die soon. They talked to each other but never her. Their faces look like those decorative porcelain masks and they can take them off. After they remove their face a judgment is made to determine who gets the soul. The winners face would smile and the losers face would cry. 

Like I said, when my sister hit puberty and these hallucinations grew she was convinced she was seeing spirits and demons. She thought she was special. Now, 14 years later she thinks it's much more likely she is schizophrenic. I believe completely she sees these things and feel bad I thought she was lying when were were kids and then chalked it up to psychosis. She hasn't talked about it in so long I honestly thought it was over. But my sister refuses to get help because she doesn't want to be locked up, drugged, or loose her kids. And like I said she lives a completely normal life with random annoyances.  

Also, she can't watch shows like the walking dead as she becomes legit paranoid that a zombie plague is coming. That's the only real paranoia she has.  So what do those of you think? Does she sound like she may have schizophrenia? 

TL;DR my sister sees dead people. ",['conj'],0,neu_vader
163,163,0.9999798895843268,2.0110415691230345e-05,0.225,0.628,0.147,"Hi guys, I have schizoaffective disorder and I take 800mg seroquel per day. I've gained weight steadily since I started taking it. Now I weigh close to 300 lbs and I need to get off this shit before it kills me. Are there any good antipsychotic meds that don't cause weight gain? Because I'm growing tits.

Thanks!",['attr'],0,neu_vader
173,173,0.9988248801064672,0.0011751198935460447,0.081,0.722,0.19699999999999998,"So Iv been wondering, what are your experiences with the plant? Does it effect you negatively? Positively? Has it improved/worsened your condition? Has anyone used a mainly CBD strain? (Which apparently is a great anti psychosis medication) ",['attr'],0,neu_vader
182,182,0.9999910219668032,8.978033209972708e-06,0.193,0.684,0.12300000000000001,What are some promising medications currently being researched for schizophrenia? Anything against cognitive symptoms? And negative symptoms?,['nsubjpass'],0,neu_vader
185,185,0.4702842960928584,0.5297157039071582,0.14800000000000002,0.7979999999999999,0.054000000000000006,"I am a 22 year old female. I'm a paranoid schizophrenic and well, I have no idea how to cope. I don't take meds and I don't go to therapy anymore. Reasons being is I don't have the money to and don't have insurance at the moment. In January I'm considering submitting myself to a type of ward. I haven't chosen one yet still researching but everyday my PS gets worse. I don't see this world as real. I have almost fully detached myself from this world and it being REAL. I hear voices, tried suicide many times but they were not successful either because I was stopped or rescued, I can't keep jobs, I have other realities, every night I feel like multiple people will take over my conscious one at a time. One in particular cries and screams out for me to write down what they say and to make the truth known. That's all I really remember. But I can't move I just lay there listening or stand there in the mirror talking to the me ""inside"" if that makes sense. There are prob 4 different people who take over my conscious at night. Doesn't happen every night though. Prob 3-4 times a week. I struggle with depression and extreme anxiety. Along with so much more, but I'm wondering if anyone else has any techniques that really work with helping them cope. Esp if not meds or therapy are involved at the time. This is my first post so I'm sorry if its rough.",['nsubjpass'],0,neu_vader
197,197,0.9999214078124454,7.859218756748697e-05,0.1,0.865,0.035,"The last time I went to see my pdoc I told him I still had sexual problems on 10mg Abilify and he said he would lower the abilify the next time I saw him...

Is anyone else on only 5mg Abilify for psychosis or schizophrenia?

Abilify 10mg is currently the only medication I take for psychosis but like I said my pdoc said he would lower the dose next time I saw him so I was just wondering is it common for people to be on only 5mg or lower then 10mg for psychosis/schizophrenia?",['attr'],0,neu_vader
