,Unnamed: 0,neg_prob,pos_prob,neg_vader,neu_vader,pos_vader,post,dict,identifier,sentiment
626,626,0.9868440209124556,0.013155979087548855,0.115,0.8190000000000001,0.066,"Hello guys.  My mother has been living with schizophrenia for about 20 years or so. When I was still living with her, she was sort of fine, she managed to keep her symptoms under control and we lived normally together. as a family  At some point her medication changed and so did she. When I was 16, she had some psychotic episode, threatened to harm me and my sister and attacked my dad.  My parents split and dad took custody of me and my sister.  Mom lived with my grandma for a couple of years until she passed.  Meanwhile, my mom isn't capable of working with her arthritis, so she recieved SSI disability.  

After grandma died, she lived on her own for a bit, but she felt the need to spend everything she had on useless things.  It became a problem when she started missing her rent.  Her sisters and my dad had to help pay that off.  Eventually, she went to live her sister in Texas.  She was fine for the first year or so. She lost weight, became active, but had no social life. Again, her medication was altered. Recently (as of 4/5 moths ago) she's had delusions that someone was going to kill her, take her heart and other organs.  It became so bad for mom that she had a psychotic breakdown and called 911 on her sister claiming she was going to take her organs.

That's where we are today. She's currently hospitalized.  I am 21, living in NY with my dad and sister.  My dad won't let her live with us (there's a court order too). My aunts (mom's sister) can no longer keep my mom in her home. I do work (as a waiter), but I have my tuition to pay and such.  One of my aunts has mentioned assisted living.  Another said to find her an apartment and I should live with her, but I don't know if I can because honestly I'm too afraid to live with her. 

I just wanted to share this because hopefully someone here can help me out because I feel so overwhelmed about what to do for my mom.",['nsubjpass'],0,neu_vader
643,643,0.9997589967623474,0.00024100323765250322,0.043,0.84,0.11699999999999999,"Well I've been hearing voices since last year and I've been to a psychiatrist and the meds he prescribed helped. I haven't heard anything for about 6 months but recent it's been coming back, maybe once or twice a week. But somehow I am truly convinced that masturbating causes bad luck to myself. If I do do it I have to do it twice. Is it related to schizophrenia.
More info: I've mainly experienced hearing voices only when I'm trying to sleep. It takes me about 2 hours to get to sleep. There were a few instances where I heard voices in the day when I was wide awake.",['conj'],0,neu_vader
662,662,0.8371305364725011,0.16286946352751486,0.11199999999999999,0.821,0.067,"have you guys ever felt that desperation you know the one where you are the only person in the world that can truly understand you and your experiences, how everyone always peers inside the room that is you and takes small pieces of information out of that room and compares it to their experiences, kind of like comparing an apple to an orange and they completely misunderstand the point you are trying to make, for example while you read this you will project your own ideas into this because that's the only way people seem to understand things, that desperation then becomes depression, and its like oil to a flame, and everything just goes to shit delusions rise, hallucinations worsen, the placebo of the sanctuary ( medication) no longer works unless its in high doses you know what i mean( kind of like when you drink alcohol and one beer is not enough so you end up drinking and drinking until you go numb and forget who you are but you never truly forget who you are its always there like your shadow just waiting for you to notice it), soon after nothing seems real, you know its a dream and you lose the will to go on, you make excuses and argue with yourself about meaning. ",['appos'],0,neu_vader
679,679,0.9960750002810432,0.003924999718960777,0.133,0.815,0.052000000000000005,"For those diagnosed with schizophrenia or other forms of psychosis, does one usually have to take their medications for their entire life? Or is there a rule in psychiatry that, after x psychosis-free years one can discontinue medication?


The reason why I'm asking is that most anti-psychotic medications have been proven to cause diabetes, increased risk of heart attack, etc., and I don't want to take additional risks. But then again, I don't want to be psychotic, which is, often, even worse.


So how soon can one usually discontinue one's medication WITH doctor's approval?","['nsubjpass', 'compound']",0,neu_vader
684,684,0.9793838187016066,0.02061618129841042,0.151,0.774,0.075,"Here on reddit and in myself I've seen cognitive impairment problems. For myself, I experience minor memory problems that my doctor says may be due to my illness or the medication.

What I find interesting is the DSM-V doesn't mention cognitive impairments as a symptom of schizophrenia. Yet it is talked about as a symptom. Why the discrepancy?

&gt;Two (or more) of the following, each present for a significant portion of time during a 1-month period (or less if successfully treated). At least one of these should include 1–3.

&gt;1.Delusions
2. Hallucinations
3. Disorganized speech
4. Grossly disorganized or catatonic behavior
5. Negative symptoms (i.e., diminished emotional expression or avolition)

",['conj'],0,neu_vader
705,705,0.8513287549770123,0.1486712450229822,0.13699999999999998,0.763,0.1,"Hey. My older brother was diagnosed with Schizophrenia when he was 21 (and I was 19). He's been through some tough times, but is a tough guy and a survivor. As a therapeutic exercise, he's been writing about his experiences for a few years. The result is a book called 'Big Hearts, Broken Minds'. The book tells the story of how he fell in-love on a psychiatric ward, whilst detailing the horrors of medication addiction and severe mental illness.  

Due to the personal nature of the content, he wouldn't let me, or anyone read it until it was published on Kindle. This means that it hasn't been proof-read, and contains a few typos and misspellings etc - but, I feel that this adds to the authenticity of the reading experience. This is an adult book - there are graphic descriptions of sex, obscene language, as well as disturbing events.

Reading the book has given me a unique opportunity to understand better what it's like to have a serious mental illness. I suppose that this is a plug for his book, but I truly believe that it's worth reading. 

[Amazon Kindle Link] (http://www.amazon.co.uk/gp/product/B00DHSBNBW/ref=oh_d__o01_details_o01__i00?ie=UTF8&amp;psc=1  )    

edit: Maybe I should mention that he wishes to remain anonymous, so is using a 'pen-name'. Which is why I'm using a throwaway for this, as he could be traced through my 'real' account. ",['compound'],0,neu_vader
711,711,0.3228685921830751,0.677131407816909,0.10099999999999999,0.794,0.105,"Hello everyone! I'm new here and live with an undiagnosed/misdiagnosed ""disorder"". I am not looking for a diagnosis (not on here lol) and do not believe i have schizophrenia. I am posting here because i can relate to what many of you struggle with. That being said, here is my history:

As  a child, i was always in my own world. Memories of my childhood is very spotty and distant. I can recall being very imaginative and creative and spacing out until things looked different. I had very extreme emotions (unecessary outbursts of anger mostly) and struggled with depression. 

Jump to middle school and high school:
I began withdrawing socially. Being around people would make me very uncomfortable and i would always feel detached and paranoid (it was hell whenever people laughed.) I slept in class and my grades never came back up throughout the rest of high school. I began using marijuana at 15(it has induced ""episodes"" only twice and i never used regularly until after high school.). Now it helps me to be comfortable in my mind (i do not recommend it as medication esp. if you are psychotic!!!) 

At 17, i became depressed and believed i was the laughingstock of the entire world. I started drinking after getting sent to continuation and that made my mental state spiral into a place i can't remember very much. 

This is when things got bad. I began having these nights where i would stay up all night imagining stories in my head. I will not get into detail lol. Everything kept spiraling until one point when i didn't want to live anymore. After my second suicide attempt, i was finally hospitalized.

In the ER, i don't remember much other than rambling. My dad said he couldn't understand me (this was never brought up to any doctors because my parents weren't aware what this was) and that i would talk in circles. After getting put into the mental hospital, they put me on respiridol and celexa (anti-depressant). The respirdol turned me into a zombie that would echo the end of my sentences. The other one sort of blunted the emotion i was feeling (i stopped them after six months and felt free again)

Having a job has been hard. At mcdonalds (19 years old) i thought everyone was against me because of my skin color and heard everyone talking about me. It wasn't until i looked back that it may have possibly been in my head.

I remember being diagnosed with ""major depressive disorder"". Sorry if there isn't enough info it's very hard to remember. Let's jump forward to right now.

Now i am 22. I am a musician who plays blues guitar. Now, depression was definitely what i went through before but now it's different. I will make it clear that i have used psychedelic drugs (had a bad experience on mushrooms with delusions and auditory hallucinations that i'm sure was full-blown psychosis but it didn't last more than a few days so it's safe to say it was drug-induced). I am not worried about that because it has been a long time since then.

Having those experiences actually helped me become aware. What worries me now is that i have weird, inappropriate moods that switch on a dime like when i was a boy. I feel that people use code to talk shit about me and that even my best friends are talking shit about me. I feel that everyone is racist (which isn't far from the truth). I also have minor auditory disturbances (hearing crowds of whispers/jungle noises and hearing words where actual noises are like air conditioning and cars passing by) but honestly i think those are pretty cool. Some visual disturbances as well like if i stare everything changes (gets blurry/warps) and that has happened way before using any psychedelics. I am worried because i haven't been this way for a long time and it can't be from drugs because it has been a very long time since i have used

My therapist suggested schizoaffective and she hasn't been responding to me about my concerns lately. What's your opinion? Please do not play psychiatrist and try to diagnose. I just want to know if anyone can relate to this. I am only aware of these things when looking back, not as they happen. Marijuana doesn't seem to make things worse unless i am already aggravated. Sorry about the long post just want someone to relate no diagnosis and i am not looking to self-diagnose. Self-diangosers make me want to punch them in the face. Sorry again for the long post. Tis is only a glimpse of it if you have questions feel free to ask i will clarify to the best of my ability. And if you mention drugs please feel free to fuck off because i was this way before knowing anything about getting high. And sometimes it isn't until i smoke that i see things clearly but i am different than everyone else. I probably didn't paint a good picture so please let me know if you meed clarification. Currently i am sober and at baseline.",['compound'],0,neu_vader
722,722,0.6497554458999354,0.3502445541000792,0.10400000000000001,0.83,0.066,"My son was diagnosed withe psychosis, The dr also used the word schizophrenia.  This was approximately 90 days ago.  The onset he new something was wrong - My wife and him went to get help - They 'pinked' slipped him and put him in the hospital for 1 week.  After release, there is the most likely standard non - compliance to med, reluctance to go to therapy.  Since then there are no meds being taken and no counseling.  He is 24.  At this point The devil is in the back yard, he has left the house in 60 days, sees stuff in the bathroom, talks to self in room and cries.  It is predominately regarding religious subjects.  I have noticed the event subject is related to what he is reading or engaged at the time.  My wife an I have no idea what to do.

Options,  WE heard probate, but this seems to effectively turn him over to the state.
Conversation goes no where.  It immediately goes into a self deprecating, Im crazy and making everything up, leave me alone, Im not talking about it.   At 24 its not as if this can be forced.

This is my first post.
From those who have this - What could f your parents said to you that might have made sense to get some help?

Amyone else been through Probate to force this issue of help?

Does the disease progress.  My concern is he was 'pink' slipped they told us that he was a harm to him self, or otheres.  I see no reason why this would have changed.  He has not been physical but that is my current thought.  - I hat to say it but I put a knife under my pillow last night.  I truly do not know what to do.

Currently he is in the backyard burning his clothing and belongings with a bible
",['attr'],0,neu_vader
740,740,0.03322920528418091,0.966770794715802,0.17300000000000001,0.7709999999999999,0.055999999999999994,"I have paranoid schizophrenia with depression/anxiety.  I understand it to be a pretty common affliction for an ex drug user (predominately pot but a variety of others from time to time).

I've had two what I would call manic psychotic episodes. The first, was around the time of a messy break up with my first partner. I believed she'd cheated on me and, eventually, that she'd become some sort of crack whore. I manipulated this in my mind to be of benefit to me. Essentially I felt cuckolded, embarrassed and that my social standing was gravely damaged.

After hospitalisation and medication, I got depressed and went back to drug use pretty quickly. I developed delusions of reference over this time also.

These delusions of reference, largely related to my sexuality, which was very confused for a time.

My second psychosis was mostly fuelled by stimulants. It involved a lot of end of the world themes, along with delusions of grandeur. I was hyper-sexual over this period of time. And hurt a lot of peoples feelings through indiscretion.

What can I understand about myself from those experiences...

I am a narcissist at heart. Not that uncommon among my friends. The loss of my ex was destructive to narcissistic supply which collapsed what I considered to be mine. In this tiny space I had left, things twisted and as a reaction to the pressure I had to elate myself in an attempt to compensate.

My delusions of reference? Again quite narcissistic, self centred view of the world.

My second psychosis? Yet again an evolution of narcissism to a point of believing literally I was the centre of the universe.

And with that, I feel quite detached from reality a lot of the time. I've done things I regret, but at the time didn't have the capacity to comprehend the consequences. I was some what an automaton, driven by base instinctions of preservation and operating using a distorted view of social ideals (that from subsisting in a stoner/drug culture where people did very little except think highly of themselves)",['conj'],0,neu_vader
763,763,0.999638802995092,0.0003611970049001755,0.065,0.773,0.162,"This is my late night contemplation on an app I'd like and may build myself to help deal with Schizophrenia/schizoaffective symptoms. 

**I haven't found anything quite like it so far, but if you know of one, please let me know!**

**Suggestions on what needs to be added/done/taken away are most welcome!**


Areas to address:

--paranoia/delusions/hallucinations - tips on how to manage and address

--avolition/lack of motivation/interest - tips on self care, reminders for gentle exercise &amp; sunshine etc, reminders to shower, eat &amp; drink water etc, other methods to tackle it

-- medication tracker

--mood/symptom tracker

--tab with connection to fitbrains/lumosity/chess/sudoku/crosswords to address cognitive difficulties 

--in built chat to connect with other users when you need help/someone to talk to asap

-- emergency help tab with connections to crisis services 

-- appointment tracker ie doctors/therapy etc 

Name is pending, although I have one idea. App would be free &amp; available on web, android &amp; iOS. ",['compound'],0,neu_vader
765,765,0.9629702426072504,0.03702975739273396,0.115,0.775,0.11,"So I am an 18 year old male and I have used drugs heavily since a young age. I stopped using hard drugs in January, but still smoke marijuana. In January I was using the fake weed substitute Diablo very heavily and I had intense periods of derealization, hallucinations, fear, thinking I was somewhere else, and thinking I had gone insane and my family was trying to snap me out if a trance that was my life. I went to a mental hospital, got off drugs and things seemed to calm down, but I couldn't shake the feeling of unreality. I mostly got better but used dextromethorphan and weed one night and started thinking I was in the hospital repeating and overdose, I could hear the EKG and felt the shock paddles.
 I have also developed a very strange headache that has not gone away in over 3 weeks.  It feels like pressure in my head behind my face, it also seems to be felt in my hand at times, causing it to tingle and make it feel like there is blood or liquid on my hands. I take 25mg of seroquel in the morning and 225mg of seroquel at night as well as some other unrelated meds.
 Recently it seems like the fear and paranoia has come back and I find myself getting more and more worried about it again. It also seems like I am hearing strange sounds either way off in the distance or unintelligible so I can't make out what it is. It doesn't seem real, like I remember hearing it but I don't remember what the sound was. 
 I have also been having incredibly vivid dreams, and dreaming that I am hallucinating and hearing strange very vivid messages in my dreams.
 I have gone to hospitals, doctors, and psychiatrists and they all don't think I have schizophrenia or if they do they aren't telling me. 
 I don't know what to do and it is getting very anxiety producing to the point now that I am even writing this, I just don't know what to do.",['conj'],0,neu_vader
772,772,0.9997136936898086,0.00028630631018017853,0.096,0.882,0.022000000000000002,"Lately I've noticed that some of my ADHD symptoms have been coming back (I was predominantly inattentive), so I've been thinking about going back to my psychiatrist and asking if I can go back on medication for that also but the only problem is that the stimulant medication was the only meds that worked for me and as you know, stimulants can cause psychosis. Could I technically try the stimulants out again to see if they might work without causes psychosis or am I just putting my health at even more risk? I don't even know if she'll prescribe because of the schizophrenia, but it's causing problems with keeping attention on school stuff that I have to get back into.

Has anyone ever had experience with being on ADHD (stimulant) medication and having a mental illness like schizophrenia, or even bipolar?","['conj', 'attr']",0,neu_vader
808,808,0.38877182618275097,0.6112281738172527,0.14300000000000002,0.7240000000000001,0.133,"So my fiancé and I were regular smokers before the onset of his schizophrenia. We are three months past his diagnosis and he still is attaching to smoking weed. He has limited himself to waiting until after 6pm before he can smoke any because the ""come down"" makes him more than irritable. How do I show him that others things can be fun and make him happy besides smoking? He had NO symptoms during the day (now that his medications are straightened out) but smoking causes him to be more delusional (as in the tv and music is speaking specifically to him) and hear some of the voices again, so I'm not sure it's a great trade off. I know he's a grown man and it is technically his decision to smoke or not, but how can I help show him other things to make him happy? What are some calming techniques you have used when angry or anxious? 

TL;DR: Trying to help my fiancé find ways to be calm and relaxed during stressful situations without wanting to smoke trees. What do you do to calm yourself when angry or stressed?",['nsubjpass'],0,neu_vader
813,813,0.9999786252668468,2.1374733138247785e-05,0.0,0.853,0.147,I'm on 350mg of clozapine and am completely free of symptoms. I'm patiently waiting to gradually have my meds reduced and am hoping to one day be completely off meds and not have any symptoms. Has anyone experienced this?,['attr'],0,neu_vader
824,824,0.9984790483974254,0.00152095160257506,0.152,0.848,0.0,"I'm not any medication at the moment, much too scared to be on anti-psychotics. But I've been having odd tics. Blinking a lot, really impulsive, and spasms or twitching in my neck/head. ",['attr'],0,neu_vader
828,828,0.9671747581778152,0.03282524182216542,0.04,0.8170000000000001,0.14300000000000002,"A while back I started taking invega and it worked until it didn't. flash forward a couple years, 2 other medications, and a new doctor and I'm back on it but at a higher dose and this time in shot form once a month. I get my fourth shot soon. 
Anyway for the most part I'm steady and a lot happier. It's done a lot for the negative symptoms. However every once in a while at night right before I go to sleep I'll hear people talking/laughing/crying. I can tell it's not real and tune it out pretty well but I just wanted to know if Invega is any good. Does it have lasting potential? It's still pretty new and for as expensive as it is, well I don't want to try to wean myself off something if I can't afford it should I not have insurance in the future. 
What's your experience with it?",['conj'],0,neu_vader
837,837,0.9999745540089924,2.544599099840046e-05,0.22899999999999998,0.588,0.183,"I have schizophrenia but without any positive symptoms, my negative ones are significant though. I struggle to meet and communicate with people, no friends other than family, no motivation, hypersensitive, brain fog... I recently read that otc Pepcid (famotidine) was effective for treating them but I find that its side effects are that it reduces cognitive abilities and causes mild delirium so I stopped as it is unpleasant. Can anyone give me some tips or meds recommendations for reducing neg symptoms? Thanks

",['amod'],0,neu_vader
