,neg_prob,pos_prob,neg_vader,neu_vader,pos_vader,sentence
424,0.9999200475750532,7.995242495648074e-05,0.088,0.912,0.0,"i stopped taking the medication before for this reason, but I wonder now, does this subside over time?"
425,0.9990253699943532,0.0009746300056330927,0.0,1.0,0.0,"Some side effects of medication go away, others linger."
426,0.9999875330534537,1.2466946537536785e-05,0.109,0.891,0.0,He doesn't want me on ADD medication even though I have ADD.
427,0.9769232265707574,0.023076773429232818,0.255,0.67,0.075,"I've had ADD diagnosed since I was 12 but never took medication for it, but I'm sick of not being able to focus worth a damn."
428,0.9327189303728105,0.06728106962717463,0.069,0.815,0.117,"So my mother just tried to commit suicide earlier this month, she was feeling depressed a month before that, I just assumed that it was a side effect of her meds clozapine, she has what I assumed schizophrenia, but now after two weeks she's acting so different, it wasn't noticeable at first but she's become so hyperactive, talkative, happy, that it's weirding me and my relatives out."
429,0.999918999517412,8.100048257322276e-05,0.0,0.84,0.16,She's taking her meds and seems to be sleeping well at night.
430,0.9999247878892759,7.521211073926613e-05,0.093,0.791,0.116,"This has happened once before since I've started my new meds, and I was paranoid and catatonic for like 3 days."
431,0.9998959325280175,0.0001040674719999266,0.36,0.64,0.0,I'm worried that the paranoia might get worse than before once I'm off the medication again.
432,0.9998977597251899,0.00010224027482355832,0.0,1.0,0.0,Has anyone had any experience with coming off of meds?
433,0.9991201605342745,0.0008798394657233452,0.121,0.668,0.211,My very close friend is a diagnosed paranoid schizophrenic who refuses to take medication.
434,0.9990382160720301,0.000961783927958248,0.251,0.644,0.105,"Several times I have tried in the most empathetic and delicate way possible to convince him that he should seek treatment and take his meds, but this agitates him severely and causes him to distrust me."
435,0.9983011299089602,0.0016988700910426286,0.0,1.0,0.0,"He lives with his father who has also tried every approach in getting him to take his meds, but he is adamant in his refusal."
436,0.9997482138657527,0.000251786134230036,0.156,0.844,0.0,"A bit of my past-
I have had depression for over 10 years and have been on medication for most of those years."
437,0.9996633897644898,0.00033661023551951583,0.108,0.892,0.0,"About 1 year ago, I went off of all of my medications for my depression/bipolar and anxiety."
438,0.997791937573917,0.002208062426065209,0.234,0.651,0.115,"They're medicated, but the medicine doesn't seem to help with certain facets of the disease such as paranoia."
439,0.9889234790881293,0.011076520911851842,0.078,0.814,0.108,"He went to live with his mom across the country, was put on some very strong medication, and I just kind of lost touch with him for about four years."
440,0.9972672692325437,0.002732730767476007,0.0,1.0,0.0,"Is he able to return to his old life with medication, or will he be a stranger?"
441,0.9993865346131338,0.0006134653868669034,0.0,1.0,0.0,This is the longest relapse and period of time that she has been off medication for.
442,0.9996672527275646,0.0003327472724359836,0.183,0.817,0.0,She refuses to take her meds and will get extremely angry if the subject is brought up.
443,0.999933650621878,6.634937811468279e-05,0.0,1.0,0.0,He recently has been diagnosed for all three and has started with medication.
444,0.9895606419258681,0.010439358074126989,0.122,0.756,0.122,I will consume harmful medications and they shall be your poison as it is better that you be silenced and ignored for the betterment of my life and the satisfaction of others in the accuracy of their diagnoses and their judgement.
445,0.9978944119902197,0.002105588009795196,0.089,0.911,0.0,i am a diagnosed schizophrenic and am not on medication nor will anybody help me or give me the time of day with my condition even.
446,0.9999547249997449,4.527500026512107e-05,0.0,1.0,0.0,I can never tell when he's on his meds or not.
447,0.9997744706066806,0.00022552939333606178,0.0,0.96,0.04,"So I haven't been taking my meds, because the previous doctor would only see me every two months (impossible to balance meds with that much difference), and the side effects were too intense."
448,0.9992975960241505,0.0007024039758473419,0.0,0.854,0.146,"I haven't hallucinated at all for the past 3 months that I've been off my meds, but I have been smoking like a chimney."
449,0.9972815909698654,0.0027184090301209276,0.103,0.897,0.0,"Robert, a 7 foot tall man has schizophrenia, and has recently not been taking his medication, and as a result has been acting aggressively."
450,0.9974388519486082,0.0025611480513799286,0.153,0.847,0.0,"He tried to enter the building, and Dave refused to let him in, because his bizarre behaviour, and told him to go home and take his meds."
451,0.9986957196194441,0.0013042803805626303,0.029,0.861,0.11,"I'm imagining it is just like a mental hospital except you get to leave, because he said you can't cook or clean(laundry) for yourself or anything, there are staff that do that for you as well as monitor your medications."
452,0.9999687636718395,3.1236328157440366e-05,0.0,0.775,0.225,"I just switched medications about 2 months ago, and I've been doing really good."
453,0.9998747201948008,0.00012527980519363402,0.094,0.906,0.0,Anyways he left me with the medicine that i had left and i had to take it because i go crazy when im not on my meds.
454,0.999966787140554,3.321285945121576e-05,0.087,0.817,0.096,anyways the shaking wont stop even though i have switched off of the medicine (i found another doctor luckily).
455,0.9608792332104258,0.03912076678959392,0.187,0.694,0.12,"In his late teen years he went through a stage of legal problems, stealing pain meds, amphetamines, doing meth, in a small midwest town...after mandatory rehab sentences he came out and was clearly mentally troubled, but was staying with his family."
456,0.9999553254598218,4.4674540168818e-05,0.0,1.0,0.0,"So, long story short, my plan is to get off meds and street drugs."
457,0.9999665018786951,3.3498121313239826e-05,0.348,0.652,0.0,"I'm not sure I want to do this, they want me to stop the weed for 1 year before stopping the meds, so that year would be so boring."
458,0.9925989478769849,0.007401052123027126,0.068,0.932,0.0,"I'm off medication right now, I was on a really high dose of risperdal and I stopped taking it because it was slowing me way down and I couldn't stand it."
459,0.9999755232545514,2.4476745444770186e-05,0.0,1.0,0.0,So next time I can get new medication is July 2nd.
460,0.9994904029458165,0.0005095970541817949,0.097,0.635,0.268,"I keep going back and forth about whether I want to, but my therapist is really encouraging it, and reassuring me that I'm just sick and can't see it, so I guess I'll give meds a chance again."
461,0.9884201343246269,0.011579865675353936,0.262,0.738,0.0,"I felt guilty for years that I was using the medication as a performance enhancing drug, and that I was cheating out my peers."
462,0.9998260826843722,0.00017391731563365056,0.2,0.8,0.0,"She is hard to bathe, the has terrible odor, and for the most part when on meds sleeps all day."
463,0.9999734496124977,2.6550387500411873e-05,0.226,0.774,0.0,When she comes down from her meds or has episodes it is bad.
464,0.9997656981659526,0.0002343018340493954,0.0,0.833,0.167,"So making medication changes, or any sort of meaningful evaluation impossible."
465,0.9964570452179109,0.0035429547821015975,0.0,0.698,0.302,"My best solutions are
1) My Sister improves with proper medication
2) My Sister is placed in a facility to handle her care better
3) I remove the Minor Children from the situation

I'm venting, but I really need help here."
466,0.9993151411807197,0.0006848588192738925,0.0,1.0,0.0,It took forever for him to get an appointment with this new doctor and while he's been waiting he ran out of meds.
467,0.9999843376245153,1.566237547325857e-05,0.0,1.0,0.0,In December I was hospitalized and got out in early January and since then I've been taking my meds every day and haven't been hearing any voices at all.
468,0.9999821890475461,1.781095246456234e-05,0.0,0.667,0.333,I feel like.. like going off meds.
469,0.9999542980108607,4.5701989128132646e-05,0.0,1.0,0.0,"I'm slightly considering going off meds, with my doctor knowing though."
470,0.9999520570565961,4.794294339369398e-05,0.0,1.0,0.0,"The meds I'm currently on, Latuda, works miracles."
471,0.9993029327904744,0.0006970672095096191,0.0,1.0,0.0,But it makes me throw up at least once a week so I think I'm going to switch meds if not go off completely for a while and see where I land.
472,0.9999802213183749,1.9778681626245043e-05,0.148,0.759,0.093,"So I figure if I go off my meds and things get bad, it's ok if I have to go to the hospital."
473,0.9978931121049007,0.0021068878950909957,0.058,0.594,0.348,"I know a lot of people think they're better when the meds are working and go off and get sick again, but I feel like I could be better for good."
474,0.9967080850473699,0.0032919149526136654,0.0,0.888,0.112,"I may just try a new medication and see where that takes me, and not stop for a while."
475,0.9994765451271932,0.0005234548728169232,0.0,0.735,0.265,"I think therapy might be a good first step, and I've been more easily able to help people seek therapy over psychiatrists (though I know medicine can be effective)."
476,0.9995726994494168,0.0004273005505650523,0.073,0.852,0.075,I desperately need financial help because I had to reduce my work hours as the medication was unbearable but I cannot keep up with the bills.
477,0.9984964917701575,0.0015035082298578003,0.11,0.714,0.176,A friend of mine has paranoid schizophrenia and takes medication at morning and in the evening.
478,0.9996499137636877,0.00035008623629512636,0.07,0.93,0.0,"Yesterday evening, he took his evening meds right on time but he noticed that he forgot to take his morning meds and he INSISTED that he take his missed morning medication right after he took his evening ones."
479,0.9996405490339406,0.000359450966045368,0.0,1.0,0.0,I don't know what the name was of the medication he was taking.
480,0.9999488626015303,5.1137398463424984e-05,0.147,0.853,0.0,I stopped taking the last medicine I was on because it didn't do anything.
481,0.9990599557399937,0.0009400442599936811,0.073,0.727,0.201,I am a perfectly healthy 25 year old woman and my ignorance about this is making me afraid: are there any possible side effects of the medication on our conceiving?
482,0.9979121087377246,0.002087891262271917,0.198,0.577,0.225,"I do know that the medication lowers his fertility, but does it increase the chance of any birth defects?"
483,0.999980594207385,1.9405792617773768e-05,0.0,1.0,0.0,I was on meds for bipolar for almost ten years before they figured out I wasn't friggin bipolar.
484,0.9990958999837205,0.0009041000162885605,0.0,0.923,0.077,Is it a pipe dream to think that with medication and therapy that she could have a level of normalcy and that we could (potentially) have a relationship?
485,0.9998819700693712,0.00011802993060888304,0.0,1.0,0.0,I also throw up sometimes before I take my night meds.
486,0.9996830623732901,0.0003169376267063148,0.095,0.614,0.29,Things also feel super intense and I get a little paranoid before I take my night meds.
487,0.9996808047193155,0.00031919528068360893,0.203,0.797,0.0,"The medication, the therapy, the hypnosis, and intimidation will never change this."
488,0.9992166443412479,0.0007833556587441342,0.172,0.828,0.0,"I was prescribed a medication, but 8 days later I still have paranoid episodes and hear voices."
489,0.999869965407054,0.00013003459294256084,0.0,0.564,0.436,I really liked the medication otherwise.
490,0.9999822933646595,1.7706635323112735e-05,0.153,0.847,0.0,"I haven't been on medication for about 2 months now I think, dunno if it's that but if it is then, whatever, meds make this 10x worse."
491,0.9999517209887869,4.827901120367236e-05,0.0,0.763,0.237,"Also i promised i would never force her to take her meds but i do encourage it, do you guys have any advice for me."
492,0.9857159851248681,0.014284014875146751,0.0,0.815,0.185,"Everytime out of hospital, with doctors help I have gotten off meds completely, and lived a very healthy and normal life for 8-12 months at a time completely off meds."
493,0.9888760825419388,0.011123917458063348,0.17,0.703,0.127,"I find triggers that have caused me to go back to hospital have been
-alcohol (largest contributor)
-coffee/cafeine
-stress / lack of sleep

When any of the above hit, it's like a worldwind and I'm back in hospital and feeling like complete shit from medication."
494,0.9999277521760603,7.224782394907115e-05,0.0,0.777,0.223,"Is it worth trying to reduce meds again, and is it possible to live healthy lifestyle off meds?"
495,0.9999747760740347,2.5223925984612815e-05,0.0,0.811,0.189,Why do I do well off meds for such long periods?
496,0.9999837175009669,1.6282499015582014e-05,0.563,0.437,0.0,"I have an anxiety disorder, I take blood pressure medicine and anti-anxiety/ depression medicine."
497,0.9957740895643363,0.004225910435679206,0.0,1.0,0.0,"And even then, they just pump them full of zombie making meds and send them home within weeks.time for a change."
498,0.9999636496855244,3.6350314481361724e-05,0.083,0.827,0.09,"I've been taking my meds regularly, trying to keep myself distracted and be active but nothing seems to work."
499,0.9999421234692104,5.787653076892912e-05,0.169,0.831,0.0,I don't want to take any more meds.
500,0.9995696057842554,0.000430394215733573,0.0,0.862,0.138,"I just really want to sleep and rest for a while

edit: I've started taking a new medicine called Haldol http://www.nlm.nih.gov/medlineplus/druginfo/meds/a682180.html  
It's not going over very well with me I think."
501,0.9406551427143014,0.05934485728569088,0.0,0.948,0.052,"But since I am taking the medication, and I do not hear people inside my home anymore, I am fairly certain that people are talking about me, and that it is emanating from a source that has intimate knowledge of my medical records."
502,0.999187719667823,0.0008122803321853569,0.0,1.0,0.0,Some of these issues can be attributed to the meds I'm on and some of them are just part of living with schizophrenia.
503,0.9993081636776031,0.0006918363223802653,0.162,0.838,0.0,"At first I was in denial about it, but when she doesn't take her meds the crazy starts."
504,0.9999577125446805,4.2287455307459605e-05,0.0,1.0,0.0,What are some other meds that are known to alleviate cognitive deficits?
505,0.9999427598042311,5.724019576426622e-05,0.0,0.826,0.174,I don't mind taking my meds; they allow me to function.
506,0.9995493320077746,0.00045066799222727823,0.0,1.0,0.0,The hospital gave her some anti-anxiety meds and sent her home after a few hours.
507,0.9999826454251866,1.7354574810530205e-05,0.0,0.589,0.411,She's calmer now (anti-anxiety meds!)
508,0.9996008697954022,0.0003991302045822053,0.0,0.833,0.167,"We've had some luck with medication, before he started treatment his hallucinations were apparently a daily thing."
509,0.9994633349907144,0.0005366650092866752,0.111,0.758,0.131,After trying a few different medications to no avail I was given Geodon and things started to clear up.
510,0.9963364877855406,0.0036635122144416015,0.036,0.964,0.0,"I do BJJ, and I really do not want to be so medicated that I can't do the thing I'm living for, a life of working and medication and nothing else is not a life I have the slightest intention of living, that's not life, that's existence."
511,0.9966197767127598,0.003380223287241528,0.0,0.958,0.042,"Now that he is on medication and attending therapy it seems to be more under control,and most.of the time things are just fine, but he still has his moments and dramatic mood swings."
512,0.9999792356444354,2.0764355576215332e-05,0.0,1.0,0.0,She's never been on medication either.
513,0.9999653751004803,3.4624899536481936e-05,0.169,0.831,0.0,She doesn't want to be on medication.
514,0.9998768992146688,0.00012310078531436894,0.0,1.0,0.0,What are some medications that I should immediately be able to think of when someone tells me their diagnosis?
515,0.9994833138748118,0.0005166861251844981,0.132,0.868,0.0,"I have major depressive disorder and have went off my meds recently, and have a cousin who is bipolar schizophrenic, but I'm afraid to ask her these questions."
516,0.9964667976098693,0.0035332023901425012,0.0,0.789,0.211,"He's under the care of a psychiatrist and taking medication, which has helped a lot."
517,0.9999495216088984,5.047839111177105e-05,0.105,0.895,0.0,He has been on and taken himself off so many medications because he is paranoid about taking them.
518,0.9992882298764028,0.0007117701235964513,0.177,0.823,0.0,My son is also opposed to any kind of medication including advil and I am worried that he will not agree to medication.
519,0.9998564675419721,0.0001435324580288783,0.0,0.688,0.312,"If you can share your experience with medication, that would also be helpful."
520,0.9999155404860279,8.445951396031929e-05,0.0,1.0,0.0,"Anyway, all that being said, I'm usually not on medication."
521,0.9999636551477423,3.634485226184285e-05,0.149,0.851,0.0,I have tried many medications and few even begin to work and those that do are so awful when the side effects are considered.
522,0.9997146644147604,0.0002853355852519537,0.0,0.877,0.123,I am very schizophernic and going off my medication would cause me to be committed to a hospital.
523,0.9996351398735692,0.0003648601264330583,0.109,0.83,0.061,"I really have dreams of having children one day, but how can i if my psych meds are going to make my baby be born with birth defects among other things."
524,0.991944109618379,0.008055890381625026,0.175,0.733,0.092,"I blame it on the side effects of my meds, I have never had a problem with house work or laundry..and forget about cooking."
525,0.9994498704424434,0.0005501295575443811,0.155,0.788,0.057,"Even going to the store  is a huge chore...Feeling this way causes me to get depressed and get anxiety...I have been on different meds, they all have side effects I dont like....idk what to do I feel hopeless."
526,0.9998922880230203,0.0001077119769814411,0.0,1.0,0.0,I think I had a much higher sex drive when I was off my medication.
527,0.9999014422633625,9.855773664324742e-05,0.0,1.0,0.0,This was the first time having sex since I first started the meds.
528,0.9983929584093196,0.0016070415906624847,0.139,0.861,0.0,How do I explain that I have a low sex-drive because of the medication to my partner?
529,0.9999288285814993,7.117141849001735e-05,0.0,1.0,0.0,So they put me on meds and I later decided that that wasn't the route for me.
530,0.9999672377554404,3.27622445609102e-05,0.14,0.86,0.0,(I know you're thinking why don't you Google it but that shit is hard) I need someone to talk to at the very least that won't try to force me onto meds.
531,0.9543029746566858,0.0456970253433027,0.0,0.956,0.044,"I've been on meds for a while (Lamictal) and they've definitely helped me with mood swings, and I also take Latuda for the voices and that helped a little bit, but the past few weeks I've been seeing things at night on and off."
532,0.9997180184822948,0.00028198151771821416,0.089,0.911,0.0,"I'm not sure if what I am currently experiencing is normal in the ""recovery process"", or if the medications aren't entirely working."
533,0.9986400397422841,0.0013599602577300254,0.101,0.765,0.133,"Granted, when I was at my worst I firmly believed in my thoughts and felt that the meds were being prescribed for the same reason as above: to prevent me from seeing the truth about my life."
534,0.9996701999165799,0.0003298000834140755,0.161,0.739,0.1,I have been tempted to skip my meds fearing that they're getting in the way of my seeing the truth.
535,0.999824277594598,0.00017572240538707665,0.091,0.909,0.0,"My struggle with cognition: A drug induced recovery

I am currently perscribed two medications for my treatment and recovery of schizophrenia:  Zyprexa(anti psychotic) and Clonazepam(anti anxiety)."
536,0.9989745522678868,0.001025447732117289,0.0,0.71,0.29,"I am 24 now and with treatment my psychosis has been greatly subdued and the benefits of the medication are clear and undoubtedly necessary, cheers!"
537,0.9993710703267854,0.0006289296732294857,0.0,1.0,0.0,I am aware that such an experience could lead to a dependence but i am already dependent on two medications.
538,0.9947679804357217,0.005232019564287015,0.263,0.597,0.14,"I really needed my medication because I was under a shitload of stress with everything, kids bullying me, I had that one best friend but she was depressed too."
539,0.999965564544166,3.4435455822774936e-05,0.0,0.841,0.159,"I'm getting my medication soon probably but oh well, it probably wont do anything anyway."
540,0.9999762065492089,2.3793450805647685e-05,0.0,1.0,0.0,I am on medication (risperidone).
541,0.9990759613274994,0.0009240386725078645,0.096,0.904,0.0,I'm afraid it has something to do with stopping cold-turkey on all of my previous medications.
542,0.9998960176223727,0.00010398237763661024,0.214,0.786,0.0,I ended up abusing my Vyvanse all the time and resisting other medications.
543,0.9999525853837175,4.7414616268826386e-05,0.108,0.892,0.0,If I say my leg hurts they'll give me medication but I NEED my leg x-rayed to find what's inside.
544,0.9999675798756299,3.242012438234996e-05,0.147,0.853,0.0,I was hospitalized for 5 days and put on some various medications that just made me very confused.
545,0.9999640276108527,3.597238916543495e-05,0.297,0.703,0.0,I recently quit taking my medication because I fear the medicine is meant to keep me confused.
546,0.9999394502490059,6.054975099765266e-05,0.0,1.0,0.0,I'm afraid of medicine.
547,0.9999832811401069,1.6718859876894665e-05,0.0,0.92,0.08,At this point I have the psychosis under control (I even went off medication with help from my doctor and things are going well) I just can't get myself to do any real work.
548,0.9999853724385859,1.4627561414879225e-05,0.0,1.0,0.0,My doctor recently upped my meds.
549,0.9996933305640945,0.00030666943589164713,0.0,0.942,0.058,She does NOT want to take medicine and was baker acted appointed a court guardian at one point to have her take it.
550,0.9878009264791766,0.012199073520841663,0.087,0.688,0.225,"She took it for a bit, was deemed competent, relieved of her guardian, stopped her meds, and started over."
551,0.9994547710541569,0.0005452289458514228,0.0,0.858,0.142,Part of me just wants to hold her hostage and force meds upon her in order to rescue her from herself.
552,0.9997228867954178,0.00027711320458588995,0.12,0.781,0.099,"Some days I feel motivated and then some days I dont......I struggle with the voices and other issues, I am on medication that helps control things....I am on SSD but its never enough and I struggle every Month."
553,0.9999466855456289,5.331445438928515e-05,0.123,0.725,0.152,I have anxiety episodes every day as well and am currently on medication.
554,0.9976270312661621,0.0023729687338366907,0.08,0.92,0.0,"My doctor once tried to give me pills for my digestion issues (which, as I now know, are of a psychosomatic nature, so nothing you can treat with medication)."
555,0.999992921498673,7.078501334151414e-06,0.0,0.748,0.252,Are there any meds available which could treat this?
556,0.989690996067194,0.010309003932820046,0.063,0.804,0.133,"The medication (diazepam, I remember lexaurin as well) wasn't prescribed for her, but her mother works in a hospital and got it for her from her friend for her anxiety."
557,0.999886420924872,0.00011357907514314993,0.0,1.0,0.0,Am I going to not take my meds one day and go off the deep end?
558,0.9999417825867685,5.821741321412619e-05,0.227,0.773,0.0,"Will they take me off my anti-anxiety medication(klonopin), and I'll be left totally raw and unprotected from the terror that are my emotions?"
559,0.999691235166902,0.00030876483311498856,0.0,0.873,0.127,"I've been taking medication, however I spend all of my time sleeping and even when I'm asleep, I still hear voices laughing at my expense."
560,0.9983032165582149,0.0016967834417827175,0.0,0.73,0.27,I am like a hawk making sure she takes her medication and gets up in the morning.
561,0.9998145218597579,0.00018547814024129407,0.042,0.699,0.259,"After her layoff, my mom offered to pay for her health insurance but she said she was feeling great and didn't need medication."
562,0.999907302717616,9.269728239104654e-05,0.174,0.826,0.0,She stopped taking the medications and then the spiral continued.
563,0.9993900630022182,0.0006099369977698507,0.0,0.826,0.174,I want to help my aunt and I feel that she should take the medications that turned her back to her normal self.
564,0.9758686233835636,0.024131376616417302,0.203,0.797,0.0,"Do you think they've moulded society in such a way that people with a mental-illness such as Schizophrenia are oppressed and forced to take medication, to suppress it?"
565,0.9936714277488374,0.006328572251145559,0.142,0.71,0.148,"I feel like a different person without the meds, and I never truly realized that until now."
566,0.99982987940125,0.00017012059875417128,0.0,0.862,0.138,"But aside from giving him the diagnosis and prescription for meds, they haven't done much else."
567,0.9993544632673479,0.0006455367326339061,0.0,0.907,0.093,"After telling me that I might do better on different medication (negative symptoms), but then telling me it won't make a difference."
568,0.9953337088289851,0.004666291171028784,0.0,1.0,0.0,"I experienced full on psychosis for probably about a month, and then started taking meds that pulled me out of it."
