,Unnamed: 0,neg_prob,pos_prob,neg_vader,neu_vader,pos_vader,post,dict,identifier,sentiment
400,400,0.9999978897814509,2.1102185401467117e-06,0.19,0.6559999999999999,0.154,Please help. I am currently in school but I am freaking out. I feel like someone's coming to kill me or that the earth is going to swallow me. I have until 2:05 until I get out and I don't know what to do to calm myself down. I'm having bad anxiety and my medicine give me restless leg syndrome so I feel as if I will explode. EVERYONES staring and watching. Help me please. I need some tips on how to stay sane until I get out of here!,['conj'],0,neu_vader
408,408,0.9826137064363142,0.017386293563679264,0.175,0.72,0.105,"Anyone ever felt this way?

In high school I was a cheerleader... you know, friendly, social, happy. Went off to my dream college to study aerospace engineering, my truest passion (satellites!). I was always very motivated. 

It just feels like my whole personality was turned upside down in the course of a month. I started to hear voices. At first not much noticeable, but it got worse and worse. My grades declined, my hygiene went down, every relationship I have was strained. I could not function.

After about a month I attempted suicide - partially due to hallucinations. I had no idea I was sick. The first few months of treatment are a huge blur in my mind, but I was in inpatient for over 2 months. The diagnosis was like a slap in the face. Schizophrenia? Let me be honest here. I was so ignorant on this disease. When I thought of it, I thought of people in strait jackets and shit. (I know, I'm sorry, I am no longer that ignorant obviously...) but at the time it was horrifying to me because I didn't understand it. 

I understand it now and after months of treatment and medicine changes I am able to live a normal life. My SO is my caretaker and I have my bad days. I dropped out of college for the semester I had the break, but I'm going back to it. At a different university. My SO got into grad school and I decided to transfer to where he was. We now have our own home together with our little puppy and things are good. But they are different.

I am still having such a hard time accepting myself and this diagnosis. But I know I am sick. I couldn't see it at first because I had very low insight. I was very disconnected from reality.

How do you cope with accepting yourself?",['conj'],0,neu_vader
409,409,0.9918648875899456,0.008135112410042528,0.073,0.826,0.10099999999999999,"My son is currently in the diagnosis process for what I'm pretty sure will be schizophrenia (paranoid). We've had a visit with a therapist and are waiting to hear back from the psychiatrist for an official evaluation and diagnosis. He's clearly having auditory hallucinations (although he isn't convinced yet) and some significant paranoia. 

We will work through it. I'll be here for him for whatever he needs, no matter what. 

My question - for those here that have gone through this process, either as a patient or a parent - how long did you have to wait until you had a diagnosis and meds? I'm so worried that I'm losing more and more of him as each day passes. 


EDIT: thank you, everyone, for replying. His symptoms seem to be decreasing as we wait for the psychiatrist appt, and I'm hoping it's a temporary psychosis brought on by how much pot he was smoking. ",['conj'],0,neu_vader
445,445,0.9943730421258106,0.0056269578741973,0.131,0.794,0.075,"He said he was talking with another coworker and they agreed that I've been looking sad lately. But it makes sense because I just lost a friend of mine this past week that I lived with in foster care(she was my foster-sister). I'm sad about that, but I didn't think that I *looked* sad. 

Either way, I think me looking sad has more to do with my medication change from Clozapine at night to in the morning. So I'm more sedated at work than I've been previously. So that combined with my friend that's now gone and still hearing voices when working.. I guess I looked like I needed to talk or something.

It'd be nice to talk. I haven't seen my therapist in over a month now.. I haven't been talking to anyone about my symptoms or ""delusions"" and I'm falling down the rabbit hole. 

It'd be nice to talk to someone about what all is going on in my head. Intrusive thoughts. Conspiracy worries. Spy stuff. 

But it'd be too heavy to expect a coworker to carry for me.

He seems really sweet. I wonder if he'd be understanding and listen to my troubles?

Or would that be bad for work? My boss knows I'm schizophrenic, I've worked here nearly 3 years, stopped for most of this year, but got back to work because I needed the money. My boss doesn't understand what schizophrenia is, he just knows I've had to miss tons of work due to being in the hospital for it and he knows I cut myself because my arms are heavily scarred. 

I don't know what I'm going on about...

TLDR: Should I tell my friend/coworker that I'm Schizophrenic? ",['compound'],0,neu_vader
460,460,0.9990183625551284,0.0009816374448553327,0.172,0.754,0.07400000000000001,I'm feeling pretty crumby again. It's been 1 month since I was hospitalized for my schizophrenia's suicidal thoughts coupled with strong delusions. I had my latuda dose doubled while in there (I also take clozaril). 1 month later now... today I was suddenly hit by my symptoms again. I just feel so broken at a time when I should be looking for jobs and finishing up my computer science master's degree! Broken broken broken.... I feel as if I'll never break the med working --&gt; not working --&gt; increase meds cycle. I just don't know how I can live with this!!! ,['compound'],0,neu_vader
467,467,0.999153281037836,0.0008467189621523701,0.111,0.805,0.084,"Hi. I've been hanging around reddit for a while now and this is going to be my first post to this subreddit. Maybe because I've got a smaller chance of hearing the usual ""you should go see a doctor"" and maybe have someone react with experince in the field.

Around my 16ish I started changing. I guess it all started with a very vivid imagination as a kid (""there are aliens and they want to take me and watch me sleep""), no friends whatsoever and not much trust in other human beings. I think it started with me being confused and feeling like something's missing. That feeling never went away.

Fast forward to now. I'm linked to other versions of me in different worlds. We're being hunted by bleak creatures, for sport. The first one of us to go down lived in a beautiful swamp. We all experienced the death of our part. This ""us"" got bitten in half by something gigantic with sharp teeth. And a very bleak appearance. It was traumatizing to experience someone's dead who's closer than a brother. A part of me died and hasn't returned. 

I'm not entirely real and I doubt anyone is. Most of the people around me are programmed, they go back into non-existence when I lose contact with them. I feel trapped.

I hear scratching at the door, sniffing in my ear. I hear footsteps. I'm terrified of them. When I hear something at the door, I don't have the guts to throw open the door and confront the source. In theory, it's in my head and there's no source. I don't want to find out. I'll wait until the sounds are gone.

I'm plugged into my mp3 player when I'm alone. When I go to sleep, it's playing. When I wake up, it's playing. I can't hear anything else.

There's something inside of my head that's sometimes helping me, sometimes breaking me down like I'm firewood and it's the fire. I know things before possible being able to know them. It saved my life a few times. And it laughs at me when I fail. It speaks to me. Not with words. We don't think in words. We think in images, sounds, smells, memories, dreams... 
It told me to stick a screwdriver inside of my head and how delightful it would feel. I really wanted to stick the screwdriver inside of my brain. It seemed like better than chocolate. I didn't because of logic. But what will stop me when I am totally convinced I am not real? you can't kill something that's not real.

Maybe then I will wake up for real, step up from a bed and be applauded by some sort of watchers, because I passed a test or something. That's what the thing inside of my head made me see/feel/experience?

I know what's real and what's not. To some  extent. I live by logic. I'm going to a psychologist, sort of. They're requesting my data at the hospital and previous psychologists to see what conclusion-thingie_for_data the need to give me. Because I am totally sane and came to them for candy they call meds, I guess. I've got no trust in them. But hey, if I'm declared unfit for society, I an atleast get some sort of fund.

Oh, by the way, does it count when you don't really care about humans as individuals and got grand ideas how to save the human race which are being put down by other humans I speak to? I believe we're doomed to die and turn to a horrible society steered by money and no one wants to do something about it because everyone only thinks about themselves? It makes me really pissed about it, because we will be nothing 100 years from now. No one will remember us. So why not kill ourselves / make rules for procreation in order to thin out the human population so we can survive as a species? We're not real in the end, as far as we're real now.

I gotta go do stuff. I'm forgetting I need to do things and I gotta go now. Sorry for the book.",['oprd'],0,neu_vader
488,488,0.9987276062163556,0.0012723937836269573,0.036000000000000004,0.851,0.113,"I was recently diagnosed with Paranoid Schizophrenia. Since then, I have had absolutely zero ambition or motivation. Is this something other people have experienced? Is it related to the diagnosis? ....any advice?

Edit: I'm also on Risperdol. Anyone know if that's a side affect? Is there a better medication that has worked for you?",['attr'],0,neu_vader
492,492,0.9703018563171296,0.029698143682875693,0.016,0.8320000000000001,0.152,"I work at a residential treatment facility which is an alternative to hospitalization/medication. We're anti-pharmacology, trying our hardest to revolutionize the harmful psychiatric/pharmacological practices in place today. We operate on the principle that basic respect and a positive psychosocial environment can work as well as or better than neuroleptics, without the fucked up side effects. See any research by Loren Mosher, or literature by Robert Whittaker for more info.

Right now we have three residents. For most of the winter so far they have all been isolating in their rooms. It's like pulling teeth trying to get them involved in any kind of community activity. Does anyone have any insight as to how I could better connect with them and draw them out into the community? It's difficult for us to offer services or support when they are unwilling to communicate.",['relcl'],0,neu_vader
502,502,0.99900178262865,0.0009982173713588825,0.12300000000000001,0.64,0.237,"The sun grows dark and chaos comes again, but I got it beat. Sunshine all around, folks!

Clozapine is a GAME CHANGER! I'm doing OK! I started about 2 1/2 weeks ago on it and I'm PERFECT. I'm happy. NO symptoms whatsoever, just makes me super tired after taking it, but it's worth it, it's absolutely fucking worth it because the sleepiness wears off and then I'm normal. 

I don't care if I have to get my blood drawn every week while on it, it's *amazing*. 

I feel strongly that I don't even have Schizophrenia, like it was a fluke and I'm normal now. But don't fret! I know that is simply the medication makin' magic and if I go off I'll be trapped in the chaos once again. 

I don't MISS my voices like I always do, I'm aware of how awful they were and I'm *relieved* to have the peace that lives in my head. 

My headspace is my own and it's absolutely lovely. Thinkin' my own thoughts and all that freedom-type activities!



",['compound'],0,neu_vader
503,503,0.9947771020788851,0.005222897921118482,0.243,0.615,0.142,"This is a miserable life with nothing but pain and sadness. I'm trying to believe I can come out on top, though, it only ever gets worse. I'm now worried I may have this condition due to my mercury fillings. &amp; its not as if I could ever afford to have them removed. I'm on a detox with my naturapath for a few weeks.. I just want something to actually work :/ I can imagine myself growing old and living in agony. Praying to die. What good is Pharmaceutical medication if all it does is exacerbate my weakness, my fatigue etc. What? Okay.. So it makes my thoughts slower (personal experience) so WHAT. If they don't help me actually get out of BED in the morning, if they don't help me clean my HOUSE, then they are useless in my eyes. I'm sick of this shit. Everyone treating me like I'm ""special"" or treading on eggshells in my presence. Family members telling me I DON'T have schizophrenia and telling me I'm using it as an EXCUSE!!! Some excuse, huh? Yeah.. Get fuck all money from the Government, you better believe I WANT to work and live a comfortable life with money. Why would I choose this lifestyle? Afraid to go outside? No energy to take a shower? Fuck this :/ +I know you guys don't need the negativity, we all need support and positivity.. I just am so mad right now.+",['attr'],0,neu_vader
504,504,0.8594923232090788,0.1405076767909336,0.0,0.917,0.083,"I thought I'd ask something here, since I'm finding this subreddit **extremely** helpful with regards to knowing what other people experience and how they cope etc. Anyway...

The dialogues I experience are mostly distant- sort of as if they're coming from outside or from a different room (depends on the day), but sometimes, especially when I'm relaxed- usually in bed- I'll get a few words or phrases or fractions of sentences as if I was wearing earphones- as if someone was speaking *right* beside me. Most of the time it's pretty unintelligible so it's more of a novelty, but it seems such a separate aspect from the dialogues I'm used to hearing (I've been off meds for quite a while- I'm ""used"" to my normal ""tribunal"", but I don't think they're getting worse...). It does occur more frequently on some nights. My question is, has anyone else had any experience with this sort of thing? Is it just a normal thing that happens to people even if they don't have schizophrenia? It doesn't really affect me that much- I'm just curious, and Google isn't being very helpful....",['attr'],0,neu_vader
505,505,0.3247332244331119,0.675266775566874,0.177,0.746,0.077,"hello. I am feeling very alone now so here I am, shame people require socialization or I could stay hidden. I recently had a very bad reaction to haldol a medication that made me normal even a bit sharp for the first time in my life, four months of clarity tasks became easy. I then hit the wall flipped out lost my job became compulsive couldnt sit still, didnt realize it was the medication until I was on my knees two days crying to gid to make it stop, a god im not sure even exists. About the time I was ready to end the pain and madnes myself I rushed to the emergency one step ahead of taking matters into my own hands.....all this background so you can understand my question. its been almost two months and im off haldol but my mInd feels like it was damaged not physicaly not even really mentaly, ive always had mental issues but I have a feeling of emotion hurt like I lost a part of myself. a step away from death made me realize things im still struggling to put into words. has anyone else felt this kind of bizzar loss? thanx for taking the time to read this long winded post.",['attr'],0,neu_vader
524,524,0.9960840781954796,0.0039159218045176575,0.158,0.745,0.09699999999999999,"I've not posted here in a while because I've been doing pretty okay, not great not bad, about a 6-7/10 though. But I do have one big problem that I can't get over and that's pretty bad memory loss, I'd say it's gone from mild to moderate pretty fast (a few months) I'm not sure if this is related to schizophrenia, meds or some other health problem (definitely not aging because I'm not old enough for dementia). I'm currently on 150-200mg of seroquel. I get confused pretty regularly, but not soo often, I've forgotten things I've literally JUST done about 2 seconds ago (confirmed by family members), I'm forgetting what to write right now actually, I just don't know really what's going on or happening, but yet I do, it's literally like things will just not hold up in my head, I do something forget it, do something else forget it, It feels like I'm forgetting everything. Someone will tell me to do something and I'll forget they ever even told me to do that a few mins later. 

The worst part though Is I just generally feel really confused and as if I'm forgetful in the moment about everything... Can anyone tell me why this is? Is it schizophrenia, med related? Or something else?

I feel it's a lot more than mild forgetfulness, I just know I'm forgetting things really bad because other people are telling me in the moment, and confusion is really bothering me, i feel like I just can't remember most shit. 

Anyone help? ",['conj'],0,neu_vader
530,530,0.9155596846856872,0.08444031531432197,0.11599999999999999,0.8079999999999999,0.076,"Im having a particularly bad night, for a while I believed I was the only hope for a new wave of revolutionists who were going to overthrow the machine that everyone lives their whole lives on and it kills them. Like a literal machine, with claws and teeth and fire. The revolutionists are still out there calling for me to save them, but I know its not real. But it feels so real. Im 17 my name is Cole . I was diagnosed as schizophrenic a few weeks ago, for the past two years doctors refused to diagnose me and just kept me zonked on antipsychotics (seroquel) but im seeing a new doctor and he finally diagnosed me, he took me off all of my meds besides my antidepressants so he can see what im like with no meds. I told my dad, and he was mad at me and told me to go to sleep and thought I wanted attention and/or meds. Im in my room listening to Joey bada$$'s mix tape with my dogs and lizards. They're screaming for my help and im so on edge. Please someone , I just don't want to feel so alonehttp://i.imgur.com/IQj1fBM.gif",['conj'],0,neu_vader
545,545,0.9220303817369316,0.07796961826305204,0.114,0.866,0.02,"Hey there,

I am asking this on behalf of my brother. He is diagnosed with psychosis and bi-polar disorder. He is from Germany but living in Torrance, LA now.

He's had very big problems in getting Clozapine prescribed, because of the severe side-effects it can have. The only place where he was able to aquire a one week dosis was a clinic in SF on a business trip and this was also tied with him being held there for over 16 hours because ""he couldn't live on his own any more"" and even faced the threat of being locked away against his own will.

Does anyone here maybe know of a psychatrist who would still subscribe this?

The problem is that both Olanzapine and Quetiapine have heavy side-effects for him and Clozapine is the only medication he really took well up to now.",['attr'],0,neu_vader
550,550,0.9998847728036728,0.00011522719630794229,0.10400000000000001,0.8959999999999999,0.0,I feel as though I'm a psychopath I don't feel love or any emotion anymore maybe it's the meds the doctor has me on I can't seem to put a finger on it. Anybody else have this issue??,['attr'],0,neu_vader
552,552,0.9923305566797016,0.007669443320316147,0.039,0.823,0.138,"Doing some research for university, came across using psycho-education as a form of medication adherence for people taking neuroleptics or, sufferers of schizophrenia. Would be interested if anyone could give me anymore info on this from their own experiences such as; what the sessions might involve, how long they last, how many they had, did they find them effective, were your families involved etc. any responses would be appreciated as i really dont know too much about it :)",['compound'],0,neu_vader
568,568,0.9849757276164022,0.015024272383606044,0.10300000000000001,0.8079999999999999,0.08900000000000001,"Hi, r/schizophrenia! I want to start out this post saying that I have only been diagnosed with anxiety and depression (though right now I'm not really depressed, but I have had fatigue and motivation issues for a few weeks). I am not any medications daily to treat my depression or my anxiety. I'm on trazodone to sleep, Atarax/Vistaril (replaced my xanax I'd been on for years, but I hate it because it gives me vivid nightmares and makes me paranoid so I only take it when absolutely necessary which has been once in the past two months.) I take sumatriptan when needed for my migraines and I'm also on butturbur to help curb my migraines as well. I googled my hallucination symptoms and it's directed me to this board as well as a few other communities for schizophrenia. Anyways, starting a few weeks ago I noticed I was hallucinating somewhat regularly. The first time I noticed it was when I was driving home from doing laundry at my parents house. I saw a small white dog run across the street onto a residential street. I immediately pulled over to look for the dog with my brights on, I was terrified it would get hit since it was dark. I couldn't find it so I shrugged and pulled back onto the main street to go home. I saw the dog run across the street the next three times at each residential street. It was almost like it was the same 'animation' as I saw it the first time. I realized it was probably never there in the first place.      

Two weeks ago on my day off I was also hallucinating pretty much all day. I was seeing little black bugs crawling all over me and my bed and the walls. I'd immediately brush them off or go to move or smack them and they'd disappear.     

Today I've got like snow in my vision, the kind of static you would get if you turned an old TV to an unused station and you'd get that static snow on the TV. I also feel incredibly anxious for no reason and paranoid. I have to drive across town again today to do laundry and meet up with my family for dinner and I just have this dread in the pit of my stomach. I'm afraid if I go out I'm going to get in a car wreck.        

Other symptoms: general tiredness, not really wanting to do anything, noises and sound seems to be amplified (I got a cheese stick and they're all stuck together in perforated plastic and when I ripped it free from the others it made a loud noise that made me jump.) 

So I have no idea if this is a fleeting thing or if I should call my doctor. I'm actually almost afraid to call my doctor because I don't want her to laugh at me, for lack of a better term. I don't have a psychiatrist or a therapist or anything because I can't afford it. ",['attr'],0,neu_vader
584,584,0.9998283113185892,0.00017168868141008566,0.265,0.589,0.146,"Any thoughts on this wonderful pharmaceutical?  I've been taking it for 5 months.  I was literally suffering from psychosis, uncontrollable anger and delusions.  It worked immediately and I am thoroughly satisfied.  If you're suffering from psychosis I am behooved to suggest it.  5 months no side-effects, all smiles.

I had previously mentioned Buspirone, an anti-anxiety medication that didn't work for me, it amplified an overwhelming and negative urge to commit suicide.  

Suicide can be chemically induced, it's just sh*tty.  I'm not suicidal so it was quite an unpleasant experience.  I was also suffering from horrible nightmares after I started taking it as well. 


Looking for work now.  God speed.",['appos'],0,neu_vader
612,612,0.8259661331343975,0.17403386686559072,0.11699999999999999,0.723,0.16,"Before I begin, I want to say I love him very much and have had a couple of amazingly intense relationships with people with schizophrenia throughout my life. So I mean no ill will toward anyone, but i hate my brother for the monster he has become.

We are both in our 30's now and we were best friends when we wee kids. We would play games like crash up derby with hot wheels and a favorite was one where he had a stuffed animal named Etone and we would make up silly stories about him and I would make Etone talk. It was silly, but we loved it and I miss my brother very much. The man I see now looks like him, but Ive almost accepted he is gone, and there is a shell pretending to be him. Its the only way I can cope anymore. 

Until he was diagnosed at 0, he was a really good guy. You know the type that would give the shirt off his back and actually he was a bit of a pushover, but a good guy nonetheless. But then he was diagnosed with paranoid schizophrenia and the medication he was on was good for about 5 years, but then it stopped working. Everything has been bad since then.

He has been in and out of jail since then. Last time he went because he wanted to see what the inside of our other brother looked like, so he tried chasing him with a knife. Luckily for them both a cop was driving by and took him to jail. He is just getting worse and he lives with our mom. She confided in me recently she sleeps with her bedroom door locked because she is scared of him. She will be 60 next year. I want him gone, but she refuses to listen to anyone and Im scared of what he will do next. 

I dont really expect an answer, and Im not trying to discourage anyone here. But I tried, I really did but he doesnt want help and I hate him for it. My brother is gone and I hate him for leaving. 

",['conj'],0,neu_vader
