,neg_prob,pos_prob,neg_vader,neu_vader,pos_vader,sentence
0,0.865800174070461,0.13419982592954294,0.0,0.928,0.072,"There are quite a few messages in the movie, but the one I took away the most is that all the emotions that are numed with meds are very important for the evolution and expression of yourself."
1,0.9985543510827453,0.0014456489172445153,0.043,0.893,0.064,"Now I'm not saying that you should stop meds all together, but that you should always keep searching for a substance and dose which allow you to be all you can be while having manageable symptoms."
2,0.999773439035094,0.000226560964907106,0.0,0.887,0.113,I've been lucky enough to have a doctor that's willing to experiment with my meds and find a dose that allows me to be me.
3,0.9996088541831707,0.0003911458168280911,0.054,0.82,0.125,"I guess this post is trying to impart 3 wisdoms; never give up on meds just because a certain one gets you down, respect your doctor's opinion while keeping them informed on your experiences, and don't treat meds as a cure-all."
4,0.9995262188944994,0.0004737811055021433,0.0,0.796,0.204,"I feel like this life that I'm doing well in isn't the real thing, because the medication covers the real thing."
5,0.9999669964206069,3.300357940562821e-05,0.0,1.0,0.0,The meds interfere.
6,0.9995089692442296,0.000491030755769669,0.0,1.0,0.0,"I am possibly moving back with my mom in a month or so, and she is iffy about my meds."
7,0.9999277618279816,7.22381720035752e-05,0.167,0.833,0.0,Why do we get these feelings of stopping meds?
8,0.9998233081646494,0.00017669183535638262,0.0,1.0,0.0,Every time I'm in control of my medication I get this temptation.
9,0.9999468719376886,5.312806229772699e-05,0.0,0.829,0.171,"I don't plan on stopping meds, I don't think I will."
10,0.999839475627657,0.00016052437234093873,0.0,1.0,0.0,"She has taken several medications (Invega, Risperadone, and other's that I can't remember) - right now she's on risperidone."
11,0.9990779570638034,0.0009220429361878991,0.096,0.904,0.0,"The medicine keeps her from screaming all hours of the day, but the other symptoms are still present."
12,0.999731503721133,0.00026849627886032184,0.0,1.0,0.0,I wonder if she will always be this way or if we have just not found the right combination of medication.
13,0.9998301251557135,0.0001698748442982517,0.079,0.921,0.0,"My question is... do you think it's possible that she just needs a different medicine, a higher dosage, or is it just that some people are far worse than others and there's nothing that can be done about it?"
14,0.9999190582190665,8.094178092858473e-05,0.0,0.87,0.13,"Also, I have not been taking my medication so she holds this over me as well."
15,0.9882069923200248,0.01179300767998022,0.0,0.943,0.057,Here you have a class of people who a lot of them differ from the general population in that they have to take some sort of medication and the media is  putting people who want to prevent them from working and earning their living.
16,0.9996055135964447,0.000394486403566757,0.178,0.822,0.0,"My worry is that he is not on medication, but only because his mom doesn't care enough to blow her money on his treatment(hes already $20k+ in debt from medical bills, since then she hasn't helped him in any way that I know of)."
17,0.9999695049653772,3.049503461103736e-05,0.375,0.625,0.0,I started my meds today and all I felt today was tired and sad.
18,0.9923222567594165,0.007677743240591444,0.137,0.798,0.064,"They are scary and I see things and hear things and feel smell and taste things all that other people can't or claim aren't real but I think slot of hem are real, like the man and the little girl and the man trying to poison me every night so he can take me away, I don't wanna be here that's all I ever worry about I was on honor roll all of 10th grade and I'm in a bunch if activities and I'm always busy but I can't handle all of this I constantly am seeing things and my meds made everything worse I don't want to be here."
19,0.9999691039567249,3.089604328288503e-05,0.0,0.745,0.255,God I just can't keep taking these fucking medications!
20,0.9999589981249019,4.100187510900858e-05,0.223,0.777,0.0,The meds are working and I'm isolated from them.
21,0.9999652670656234,3.4732934369053394e-05,0.0,1.0,0.0,The meds are working.
22,0.995795521858627,0.004204478141385444,0.111,0.794,0.095,"When the meds that the government gives me to prevent my abilities aren't preventing the ones I have I can hear people from a whole other dimension, see their creatures, see them in dirt and ripped clothing having been fighting all their lives."
23,0.9997447839448564,0.00025521605515112776,0.0,1.0,0.0,I need to do something but the medications are getting in the way.
24,0.9995365987553356,0.0004634012446698348,0.0,0.681,0.319,I want to write about ideal worlds but I find the medications getting in the way of me thinking about ideal worlds.
25,0.9999485044563224,5.1495543692623916e-05,0.423,0.577,0.0,Should I stop the medications?
26,0.9987640083902114,0.001235991609796633,0.06,0.94,0.0,"I do not have psychotic symptoms off the meds, just what a doctor said was tangential and loose but that could be said of any social science fiction writer."
27,0.9999175886221463,8.241137786853221e-05,0.399,0.601,0.0,I do not want to be hospitalized or locked up and forced to take medications and be with unstable violent people.
28,0.9999715726141158,2.8427385902902858e-05,0.0,1.0,0.0,Are they going to lock me up again for not taking medications?
29,0.9998894969655774,0.00011050303444258733,0.083,0.784,0.132,"For example, I looked around at mood/sleep trackers and medication calendar/ reminders, maybe something that can help with anxiety."
30,0.999903765396228,9.623460376192121e-05,0.0,0.865,0.135,I also don't argue with her about meds and basically don't make drama for myself.
31,0.9991701358762756,0.0008298641237284349,0.0,0.977,0.023,"he's been living with his parents since then and was diagnosed with schizoprenia (for example, he was thinking the news or conversations were secretly about him)...
however, since he's at home again we've met every few weeks and he's on medication and a lot better, but still far from his old self...

so what i wanna know, if you have had similar experiences, was there anything you wished somebody would say or do (but without you telling them that they should do so of course)?"
32,0.9997174218916156,0.00028257810839422086,0.108,0.799,0.094,I'm considering asking the Early Intervention in Psychosis team tomorrow (whom I see weekly) about getting me meds to help my avolition and poor attention span.
33,0.940610376241991,0.059389623758006736,0.168,0.832,0.0,"I know that you might ask me to take him to a pdoc, but he refuses to acknowledge the fact that he's delusional and said that he will never visit a psychiatrist because of his persecutory fear of them (he believes they will ruin his life, pump him up with meds, etc.)."
34,0.9996723886478658,0.0003276113521489466,0.0,0.871,0.129,"On another note list your coping mechanisms for when you run out of medication, and how effective you find them to be."
35,0.9699411884560553,0.030058811543932796,0.102,0.827,0.072,"I haven’t actually spoken with her yet but based on the text message I received the Doctor simply suggested it was depression and offered a higher grade medication (she has been using Seroquel at night to help sleep since going to the hospital), which she declined."
36,0.9996001039774145,0.0003998960226042789,0.076,0.924,0.0,"Then he told me not to let the real (my boyfriends name) take the medicine because with it, his memories and personality would disappear."
37,0.9999348337769002,6.516622311656235e-05,0.0,1.0,0.0,I talked to my boyfriend today and he wants to take the medicine.
38,0.9991632662242812,0.0008367337757021149,0.13,0.742,0.129,I don't enjoy taking my meds because they reduce my creativity and I am a musician/artist that is in college.
39,0.9999864913029661,1.3508697023655972e-05,0.0,1.0,0.0,If not I guess it's back to meds but here goes nothing.
40,0.9989309711970055,0.0010690288029794057,0.092,0.734,0.174,"Next week I want to have a total reevaluation of my medication because I have been lying a lot and playing games with my healthworkers and doctors, never had a reason to be honest with them."
41,0.9811035934481087,0.018896406551901758,0.248,0.559,0.192,"There was a brief moment of perfection for a month or two, no medication, i stopped those due to the poisoning effects that they had, feeling completely tired all the time, increasing weight gain, etc."
42,0.9818154815153972,0.01818451848462086,0.139,0.82,0.041,"Or the medicines, which they collectively shove down your throat almost like a ritual in the early hours of the morning when you're hardly awake and other times when you're so tired from their drug-induce seditive that you're falling asleep) and they cut you off from the world too."
43,0.9998981117116341,0.00010188828835857375,0.0,0.765,0.235,"I'm curious to know how you would change your treatment plan, your medication, your insurance, basically anything and everything you would like to see change regarding your health care."
44,0.9636865155752524,0.036313484424742346,0.149,0.759,0.091,"I've controlled these to an extent, but they are still there, and medications (a variety) don't seem to really work, outside of a benzo on a case-by-case basis (and if it's a bad evening, even these don't help)

Not only is the above true, but I don't actively have depressive symptoms during these events (though I certainly do the next day), I experience catatonic behavior (either going completely rigid or doing a same set of physical things over and over and over), and I've definitely struggled socially and professionally (I actively avoid social encounters when things are bad)

I don't want to diagnose myself, but I also know that while doctors and shrinks are trained professionals, mental issues are very tricky, and I ultimately know what's going on inside my head."
45,0.9998290241369533,0.00017097586302853906,0.086,0.674,0.239,"I'm not searching for medication or anything; I just genuinely want to be better, and the various drugs I've tried to improve things...haven't improved them."
46,0.9999513307275745,4.86692724106725e-05,0.215,0.785,0.0,"I'm not on any meds for this, but I am for having Borderline personality disorder."
47,0.999392354006948,0.0006076459930527366,0.197,0.803,0.0,I realise some of you don't take meds and have a problem with psychiatry.
48,0.9686459167382543,0.03135408326172764,0.0,0.842,0.158,But taking one's meds is an important part of the recovery process and I know from experience and from reading other people's experience that they help a lot.
49,0.9998955710669514,0.0001044289330519855,0.113,0.887,0.0,"He's poorly medicated as the medicine makes him groggy and he doesn't take it regularly, and doesn't really believe that he is ill."
50,0.9998880713561589,0.00011192864386108083,0.0,1.0,0.0,I was diagnosed with schizophrenia 8 months ago and now that I am on the right medication and my symptoms have gone I am looking at doing some international travel.
51,0.9999856845608693,1.4315439116717659e-05,0.0,1.0,0.0,I am not on any medication and have discontinued seeing my therapist because she doesn't understand at all.
52,0.9886935334640344,0.011306466535963997,0.0,1.0,0.0,"I am on medication, I'm on 7mg of Abilify (2mg dose + 5mg dose, used to take 10mg but the side effects were too much to handle) and 1mg a day of Ativan."
53,0.9817999704740021,0.018200029526004375,0.0,0.808,0.192,"After a family trip a couple of months later, I quit using my medicine and for the next two years felt pretty much fine without it."
54,0.9978557934030896,0.0021442065969107175,0.0,0.888,0.112,"I've been on a new regimen of medication for about 4 months now, and I seem to be handling thing much better than I have these past years."
55,0.9998030026044443,0.00019699739557161222,0.231,0.638,0.131,My psychiatrist actually tried convincing me the other day that taking medication will bring peace to the voices that are suffering but that's bullshit.
56,0.9999746350604819,2.5364939522851187e-05,0.079,0.733,0.188,"The meds are blocking them, trying to make me like everyone else, pretending they don't exist, we're hurting them because we're not protecting them as we're supposed to."
57,0.9999623815175886,3.7618482397947e-05,0.229,0.71,0.061,"It seems to be managed well with medication but there are ""off days"" where behavior can border on emotionally abusive."
58,0.9999794438963884,2.0556103622999644e-05,0.0,1.0,0.0,Given medicine that she would take daily making her sleepy.
59,0.9999398741840771,6.012581590917731e-05,0.165,0.835,0.0,She's still taking medications so I'm not quite sure what's going on.
60,0.9999542841522826,4.571584771740912e-05,0.0,0.762,0.238,Are the medication supposed to be less effective with time?
61,0.9903985885456449,0.009601411454363239,0.0,0.927,0.073,"Okay, okay, so I know that I will never be cured of schizophrenia and I will most likely have a psychotic episode some time since I'm off of my medication but how long can it take for the psychotic symptoms to come back?"
62,0.9999706337597183,2.9366240296234618e-05,0.0,0.808,0.192,I've been off of my medication and I don't feel too bad at all.
63,0.9999912686350935,8.731364902826312e-06,0.0,1.0,0.0,"My psychiatrist is always fucking off, I'm seeing my psychologist though but I don't think they know too much about schizophrenia and the medicine."
64,0.9944134006503439,0.005586599349675243,0.0,0.832,0.168,"I was just wondering if anyone can describe what it is like to be on medication (as in how you feel about life, or how you see the world and what it has to offer, how you view other people and their motivations and desires, impressions on entertainment like movies and books, etc."
65,0.9999079148423133,9.208515766863541e-05,0.0,1.0,0.0,"), as opposed to not being on medication?"
66,0.9997229487061199,0.00027705129386980203,0.157,0.843,0.0,"I'm not sure if he's taken himself off of his meds again or not, and I'm not sure how frequently he's been smoking."
67,0.9998847031879433,0.0001152968120759649,0.328,0.672,0.0,They gave her medication for depression which she said she was having allergic reactions too and stopped taking it.
68,0.9999394053020505,6.059469796875913e-05,0.0,1.0,0.0,"Since we don't have health insurance, she wasn't able to get any medication immediately."
69,0.9947465706673454,0.005253429332643911,0.0,0.891,0.109,They said for her to get free medication she would have to also see a therapist and they will contact her when they have all the information for it.
70,0.9999019760511123,9.802394888308546e-05,0.423,0.577,0.0,She had no medication because of no healthcare.
71,0.9998764700817186,0.0001235299182921481,0.101,0.783,0.115,I was wondering if any of you have had an allergic reaction to the medicine and what it looked like.
72,0.9982345196772175,0.0017654803227772214,0.238,0.586,0.176,"And now the cycle begins again, where I miss 'em, think they're these powerful, meaningful voices, that I'm hurting by blocking with medication."
73,0.9999450095202186,5.49904797992045e-05,0.075,0.749,0.176,I need to hear that it would be ok if I did this because I really need help and have no one or even a doctor or any meds.
74,0.99756082368802,0.0024391763119973368,0.09,0.91,0.0,Also right now I am in the process of changing meds and the one I'm changing to isn't helping at all.
75,0.9982788975422884,0.001721102457730686,0.0,1.0,0.0,I currently take a cocktail of medications.
76,0.9998035450382337,0.00019645496176852768,0.0,1.0,0.0,"With my mother, meds were the issue."
77,0.9999712624622045,2.8737537812039545e-05,0.0,1.0,0.0,Go on meds.
78,0.9999723251205056,2.7674879493631084e-05,0.0,1.0,0.0,Go off meds.
79,0.9999562503680379,4.374963196042968e-05,0.328,0.527,0.145,Take the meds no matter what!
80,0.9998793632847399,0.00012063671524938208,0.098,0.78,0.122,"I'm just wondering how most people on meds are, do you hear voices, paranoid thoughts, and the like."
81,0.9999688787278912,3.112127211145375e-05,0.0,1.0,0.0,Also do episodes happen even while on meds and how far between do they tend to be.
82,0.9613133076957354,0.03868669230424993,0.0,1.0,0.0,I haven't taken my medication in a few days and I'm itching to get off of it due to the sedation and zombification.
83,0.99995769365994,4.2306340042777815e-05,0.181,0.819,0.0,"http://www.rollingstone.com/music/news/scott-stapp-threatened-kill-president-obama-claims-singers-wife-911-call-20141212

Apparently he suffers from schizophrenia and seems to have gone off his meds recently."
84,0.9992843463303408,0.0007156536696580137,0.207,0.676,0.117,"I don't try to manipulate people with talk of suicide, like I probably did before my demise, as it's not like someone will pull out the ""real"" medicine and advice once I talk about killing myself."
85,0.9999822832588342,1.7716741169022773e-05,0.0,0.607,0.393,"Whatever she needs, be that medication or psychotherapy, I hope she gets, and I hope it helps her."
86,0.9999850261811911,1.4973818801743127e-05,0.167,0.614,0.219,I haven't been taking my meds like I should because I forget.
87,0.9997880467639942,0.00021195323598733793,0.077,0.923,0.0,"Shortly (just a few weeks) after I was able to go off my meds, and my symptoms only start to come back if I let my b-12 levels drop."
88,0.9950847758273615,0.004915224172629016,0.104,0.896,0.0,"After a short voluntary inpatient stay, he's currently working with a psychiatrist to figure out medications and is lucid the vast majority of the time, but is struggling with ups and downs and side effects."
89,0.9984101196278851,0.001589880372131803,0.174,0.826,0.0,My biggest fear is that he will wind up homeless and suffering psychosis on the street somewhere because he will either not be able to afford his medications or a place to live.
90,0.9999789884324379,2.101156754605227e-05,0.174,0.826,0.0,"For example, somebody needs bipolar medication, they are more likely to have frivolous sex, or somebody with schizophrenia abuse substances intravenously?"
91,0.9999680714530188,3.192854698814457e-05,0.29,0.58,0.13,Because antidepressants and anti anxiety medications are just fine where I live.
92,0.9997970888929764,0.00020291110703853964,0.0,1.0,0.0,I am going to visit a psychologist here soon to confirm and begin medication.
93,0.999702814221691,0.00029718577830258004,0.073,0.927,0.0,"I just wanted to see if any of you have any suggestions, warnings, advice or whatever as far as specific medications go, or about how things will change after medication."
94,0.9997348634033866,0.00026513659662982976,0.0,0.891,0.109,would being on meds to prevent delusions a high functioning sz?
95,0.9999109843374794,8.901566250621405e-05,0.0,1.0,0.0,"Anyway, I'm on meds now and I have to take them for 2 years."
96,0.9998900533396743,0.00010994666033482231,0.167,0.833,0.0,"Most likely because of this, I am told i have severe ADHD and am on medication."
97,0.9877591946767896,0.012240805323196848,0.114,0.886,0.0,I try to avoid telling people about this because I know it's hard to believe what with so often it being the case that a person goes off of their medication and relapses.
98,0.9999907451747312,9.254825278310295e-06,0.191,0.809,0.0,"I'm calling my psychiatrist tomorrow to adjust my medications, they have been failing me recently."
99,0.9999460090305863,5.39909693950849e-05,0.0,1.0,0.0,If I don't tell him I'm assuming that he may see me take my meds or Skype with my psychiatrist.
100,0.9999573667739086,4.2633226092668496e-05,0.0,0.855,0.145,I cheeked medicine that entire week because I knew that I had to escape.
101,0.9996487772449538,0.00035122275504774253,0.0,0.755,0.245,"Hey, so I'm a nursing student interested in becoming a psych nurse &amp; for clinical we're analyzing various medication regimens for a ""medication reconciliation"" project- anyone care to share there experiences?"
102,0.9995005090010152,0.0004994909989982833,0.0,1.0,0.0,How does your current regimen compare to meds you've tried in the past?
103,0.9998899279830961,0.00011007201689221598,0.0,1.0,0.0,He doesn't take medication and recently told me he has started seeing shadow people.
104,0.9998194252394682,0.00018057476051711784,0.203,0.797,0.0,"For some 5 years now her symptomps have become worse all the time, she also doesn't want to eat medicine."
105,0.9999707042608714,2.9295739128046338e-05,0.144,0.856,0.0,She still is not accepting my diagnosis and tried to get me off meds.
106,0.9999851011151799,1.4898884814529418e-05,0.0,1.0,0.0,How is your medication working?
107,0.9999974621408466,2.5378591558945422e-06,0.215,0.785,0.0,So when i got to his office i asked to be put on different medicine because he had put me on seriquil and it gave me horrible anxiety and i had read online that you should not have anxiety on seriquil because that was bad.
108,0.9991748115487192,0.0008251884512981187,0.064,0.936,0.0,So when i told him this he told me that it wasnt the type of anxiety that I was having and that i was to stay on the medicine.
109,0.9999028364651904,9.716353481389566e-05,0.184,0.816,0.0,In response to what he said to me i got upset and told him that i had read of many websites that anxiety on that medicine was bad for you and that he had not even asked me or let me explain the type of anxiety i was having.
110,0.9997929101644472,0.00020708983555067968,0.0,0.732,0.268,They pretty much just told me to get meds and stay away from the ones that make you gain weight.
111,0.9999908859648697,9.11403513881803e-06,0.181,0.725,0.094,Edit: I want to add that my medicine does mess me up sometimes.
112,0.9999741724683361,2.58275316660526e-05,0.0,0.716,0.284,I've been completely symptom free on medication since Feb 2012.
113,0.9999708081709303,2.919182907728919e-05,0.0,1.0,0.0,I've decided to wean myself off medication and see how I do.
114,0.9995578854954936,0.00044211450452425973,0.0,1.0,0.0,"If I become symptomatic again, I will immediately start taking the medication again."
115,0.999941478282292,5.852171770558782e-05,0.0,0.52,0.48,"I had my first medication free night, so far so good."
116,0.9998322099800384,0.00016779001994719197,0.0,1.0,0.0,I used to be symptomatic again the day after not taking my medication.
117,0.9999674449717987,3.2555028197038037e-05,0.0,0.731,0.269,"And I realize it's my first day off medication, but I'm completely fine right now and this gives me high hopes!"
118,0.9979314185046398,0.0020685814953670285,0.0,1.0,0.0,The medication had caused a lot of side effects.
119,0.9999353373234717,6.466267652378035e-05,0.272,0.728,0.0,"Here I am, laying in complete darkness, not having taken my medication, with no symptoms!"
120,0.9998908753242861,0.00010912467571909105,0.0,1.0,0.0,"For those of you off medication, how are you doing?"
121,0.9999856063921914,1.4393607813761718e-05,0.0,1.0,0.0,Why are you off medication?
122,0.9998317853652071,0.00016821463479458774,0.163,0.749,0.088,But I think the fact that I can't hear them now just means they're still suffering but unable to communicate because the medication is blocking my ability to hear them.
123,0.9999816140475019,1.8385952502495173e-05,0.0,0.645,0.355,I can be ok off meds.
124,0.9998324362330281,0.00016756376696648617,0.0,1.0,0.0,Maybe it is all the meds.
125,0.9999280413528778,7.195864710631339e-05,0.211,0.789,0.0,But I've just read that the meds cause more brain damage than having schizophrenia.
126,0.9999627133893606,3.728661064161406e-05,0.0,1.0,0.0,I took my meds tonight.
127,0.999845428126467,0.00015457187351982307,0.0,0.851,0.149,That the meds are the reason I'm so normal now and doing well.
128,0.9999416686622091,5.833133777844187e-05,0.0,0.873,0.127,And it sounds like meds are the way but what if they're not?
129,0.9997817599979248,0.0002182400020692199,0.168,0.721,0.111,Meaning that the voices are real and the meds are destructing my ability to listen to them.
130,0.9999636986653915,3.630133462337766e-05,0.0,0.794,0.206,I want to go off my meds.
131,0.9999932464637283,6.7535362858059654e-06,0.199,0.801,0.0,"Tell me, have you guys heard about meds causing more brain damage than schizophrenia itself?"
132,0.9999891238209453,1.0876179058024444e-05,0.0,0.851,0.149,Do you think we can be well without medication if we try harder?
133,0.9999274059880224,7.259401196518121e-05,0.268,0.732,0.0,maybe I'm already getting sick and I just need a meds adjustment.
134,0.9999909194732195,9.080526778901747e-06,0.0,1.0,0.0,"If so, how do you cope, and what medicines or alternative methods have worked for you?"
135,0.9999847755646833,1.5224435326254853e-05,0.0,0.674,0.326,Should I wait until there are better medications?
136,0.9976680248900539,0.0023319751099499303,0.0,0.708,0.292,I know a lot of people are hopeful for CBD-based medicines.
137,0.9998437582608973,0.00015624173909805115,0.217,0.783,0.0,The second most disabling aspect is the cognitive decline from the illness and medicine that makes me feel that I can't go back to school.
138,0.999766662386786,0.00023333761320297675,0.069,0.931,0.0,I was just taken off one of my schizophrenia meds(Latuda) because it was making me sick and I don't know if that's the reason but I'm hearing voices more often and I just..
139,0.999960114500745,3.988549924444541e-05,0.0,1.0,0.0,"Talk to psychiatrist, probably get more meds."
140,0.9999156163272566,8.438367274932701e-05,0.103,0.785,0.112,He refuses to take medication or get help and is constantly fighting with his father (which seems to be his trigger).
