,neg_prob,pos_prob,neg_vader,neu_vader,pos_vader,sentence
1277,0.9997680952916944,0.00023190470829585576,0.0,1.0,0.0,"I have medication I can take that sometimes knocks me out, but I can't always talk myself into taking it."
1278,0.9998892571046549,0.00011074289532539919,0.0,1.0,0.0,"I take all my meds and meet with my psychiatrist regularly, but there is still, say, 10% of me that believes that I don't have schizophrenia."
1279,0.9994484956991266,0.000551504300889936,0.147,0.853,0.0,my symptoms are getting worse and i just started on a new medication a couple weeks ago and the abilify isn't working.
1280,0.999188817052982,0.0008111829470046902,0.0,1.0,0.0,i was wondering if anyone has any advice cause I've been living without meds for a few years and i was able to control it but now im starting to slip and i just wanted a little advice?
1281,0.9999489138507949,5.10861492225711e-05,0.0,0.937,0.063,"We can't figure out if she's been taking her medication she got from the hospital, if she's been taking her original medication, or if she even got medication from the hospital, they won't tell us."
1282,0.9999127718674055,8.722813259339674e-05,0.12,0.88,0.0,"She's resistant to wanting to go to therapy, she's constantly lying about what she's doing, what she's thinking, and whether or not she's taken her medication."
1283,0.9998856193327144,0.00011438066726603344,0.0,1.0,0.0,But the medication makes me sleepy.
1284,0.9999809535024734,1.904649751601826e-05,0.207,0.68,0.113,"Okay, so I know its incredibly stupid to come off meds without a doctors go ahead or supervision, but I accidentally came off my meds a few days ago (Seroquel) and I'm not doing so bad, the meds were working, which is good, but I wonder how long I can last before I relapse into the illness again... What if I never get ill again?"
1285,0.9999506452978676,4.935470211550672e-05,0.0,1.0,0.0,"I mean, do I need the meds?"
1286,0.9999819130445033,1.808695550316645e-05,0.219,0.781,0.0,I'm not even sure if I even need meds...
1287,0.9998692282734684,0.0001307717265258069,0.0,1.0,0.0,"Hi, regular poster here and I was wondering if it was possible to recover from schizophrenia without meds."
1288,0.9999471073448084,5.289265520229299e-05,0.0,1.0,0.0,Btw I think he still on his meds.
1289,0.9998966820591296,0.00010331794088702812,0.251,0.749,0.0,My hallucinations have also gotten somewhat worse since I've been diagnosed because I'm scared to take my new medication..
1290,0.9999552835887494,4.471641123114446e-05,0.0,1.0,0.0,Im on meds but I still get low-scale hallucinations fairly frequently.
1291,0.9999614949040736,3.8505095939230056e-05,0.0,0.792,0.208,Well shes hearing the voices daily even with medicine...
1292,0.9999790014039122,2.0998596081045913e-05,0.383,0.617,0.0,I think shes on the wrong medicine.
1293,0.9999870845511302,1.291544887736265e-05,0.0,1.0,0.0,There is other medicines then just one correct?
1294,0.9995151102238186,0.00048488977618134826,0.0,1.0,0.0,He started taking Invega injections (he won't take oral meds) a month ago.
1295,0.9938451935711282,0.006154806428857017,0.068,0.72,0.212,"I'm worried about the side effects of these medications, but I want him to get as much help as he can."
1296,0.9999522097242541,4.77902757293141e-05,0.0,1.0,0.0,I've been on medication for years.
1297,0.9949117075343659,0.005088292465617828,0.034,0.732,0.234,"I've started seroquel as my new med, I've been on it for a month and a bit, and I've been starting to get a bit better but now it feels like symptoms still breakthrough and they're doing it a lot harder now, are meds just a false hope, I was pretty much better for a week and a half (maybe 2) and it feels like everything is coming back, especially paranoia (not so much the people inside my head)."
1298,0.9997842863391596,0.00021571366085391692,0.18,0.82,0.0,I think meds are just a false hope... no point in them now.
1299,0.9995083558839605,0.0004916441160375123,0.167,0.679,0.154,I'm only on Risperidone at the moment and I hate the thought of extreme weight gain with meds.
1300,0.9999788927781585,2.1107221833246816e-05,0.31,0.588,0.102,These meds were nice and all but I hated how they made me feel.
1301,0.9985857797055239,0.001414220294487162,0.154,0.846,0.0,"I'm afraid of taking my meds again, I'm afraid of going back to the hospital, and I'm terrified of whats happening to me."
1302,0.9988756743637872,0.0011243256361971898,0.085,0.801,0.114,"**


Areas to address:

--paranoia/delusions/hallucinations - tips on how to manage and address

--avolition/lack of motivation/interest - tips on self care, reminders for gentle exercise &amp; sunshine etc, reminders to shower, eat &amp; drink water etc, other methods to tackle it

-- medication tracker

--mood/symptom tracker

--tab with connection to fitbrains/lumosity/chess/sudoku/crosswords to address cognitive difficulties 

--in built chat to connect with other users when you need help/someone to talk to asap

-- emergency help tab with connections to crisis services 

-- appointment tracker ie doctors/therapy etc 

Name is pending, although I have one idea."
1303,0.9999924390263175,7.560973692354858e-06,0.103,0.897,0.0,"I have been consistent on my medications, and i am not sure if this is something to be concerned about."
1304,0.9977796603241902,0.0022203396758026157,0.0,0.9,0.1,I take 25mg of seroquel in the morning and 225mg of seroquel at night as well as some other unrelated meds.
1305,0.9944966687520379,0.005503331247962177,0.139,0.861,0.0,But now that I'm on such a low dose of meds the voices are back.
1306,0.9999902794654504,9.72053453336691e-06,0.118,0.882,0.0,Do I just wait for my injection medicine while I have to listen to these whispers all alone?
1307,0.9998291713793775,0.0001708286206144713,0.358,0.642,0.0,"Edit: also as my username suggests, Ive turned to self medication and failed horribly."
1308,0.9991335638972043,0.0008664361027933694,0.096,0.808,0.096,I am extremely worried for him because he still seems so out of it (even with medications) I feel like I don't know what to do.
1309,0.998665975639926,0.0013340243600928126,0.0,0.908,0.092,"I started Clozapine but that made me wet the bed every other night so I immediately got off and now I'm off meds completely, just for a week now.. my doctor thought that as safe I suppose or he wouldn't have done it."
1310,0.9998901116022492,0.00010988839774025245,0.0,0.73,0.27,Maybe tomorrow is just the perfect day to start meds again.
1311,0.9999744711650133,2.5528834989691505e-05,0.0,1.0,0.0,Symptomatic without meds that make me fat and slow.
1312,0.9995687230530258,0.00043127694699330286,0.207,0.793,0.0,"I've been put on meds (no formal diagnosis of any disorder yet, though I have more in common with paranoid schizophrenia..)"
1313,0.9998301693657736,0.00016983063421325366,0.165,0.697,0.138,She's seen a psychiatrist and has tried medication before she believed they would ultimately do more harm than good.
1314,0.9999078099165107,9.219008347959624e-05,0.291,0.559,0.151,"But that's another story...

TLDR: Sister has paranoid schizophrenia, rejects medication and help."
1315,0.999958420086211,4.15799137938937e-05,0.054,0.946,0.0,"Lately I've noticed that some of my ADHD symptoms have been coming back (I was predominantly inattentive), so I've been thinking about going back to my psychiatrist and asking if I can go back on medication for that also but the only problem is that the stimulant medication was the only meds that worked for me and as you know, stimulants can cause psychosis."
1316,0.9997887112496633,0.00021128875034652858,0.116,0.776,0.108,"Has anyone ever had experience with being on ADHD (stimulant) medication and having a mental illness like schizophrenia, or even bipolar?"
1317,0.9999859291919112,1.4070808088449074e-05,0.093,0.907,0.0,"We chalked it up to immaturity and bad behavior, but he has recently been officially diagnosed and is (supposed to be) taking meds."
1318,0.9999061356722825,9.386432771755032e-05,0.138,0.786,0.076,The doctor has increased his medication and he's been taking them for the last 7 days but no effect.
1319,0.9992490076669303,0.0007509923330554212,0.106,0.807,0.087,Me and my parents feel very helpless that we can't do anything to help him out in this scenario and the medication isn't quite doing its job.
1320,0.9999653237391473,3.4676260869045866e-05,0.0,1.0,0.0,"I keep having second thoughts about medication, thinking I should quit taking them."
1321,0.9988458837458702,0.0011541162541396429,0.0,0.737,0.263,"And it's good because I can't suddenly stop taking my meds, I'll be getting a months supply in one shot so I can't hurt myself in that way."
1322,0.9999766510602467,2.3348939773272027e-05,0.0,1.0,0.0,And I need my medication.
1323,0.9998884664664187,0.00011153353359111322,0.0,1.0,0.0,"I've been hearing my mother call my name, my brother who doesn't live here talking to me; I've even had two conversations with people who weren't even there after I took my medication."
1324,0.9999840608630162,1.5939136985296876e-05,0.0,1.0,0.0,I have stated I have mental issues and need medication urgently.
1325,0.9999750357329075,2.496426708308785e-05,0.0,1.0,0.0,I have been without medication (citalopram and Abilify) for over three weeks now.
1326,0.9998993124424603,0.00010068755755640623,0.0,1.0,0.0,I went to the DHS office again this morning telling them I need medication  now.
1327,0.9999603298972053,3.967010281469544e-05,0.0,1.0,0.0,My medication has been out and dry for over three weeks.
1328,0.9998530160095165,0.00014698399048426847,0.198,0.661,0.141,"So I was bored and decided to ask people online if they were stuck on an island with a schizophrenic off their meds and a rapist and they had to trust one to get off, who would they trust."
1329,0.9963177232776813,0.003682276722314569,0.129,0.823,0.048,"First things first, there is a message by some advanced beings (I don't 100% know who they are, but I think they are advanced humans from the future) that are sending us ALL a message warning us of the tragedies that we can prevent if we just stand up as one together and fight the tyrants of today, except there is one thing, the neo mkultra group/project is intercepting that message and giving us bad thoughts so that we all get seen by psychiatrists (now I'm not saying psychiatrists know about this, but some probably do) and they give us medication so we shut up, some hospitals might even implant a thing into our brain to slow release anti psychotics and we can never come out of them, this is sad for these people (DO NOT think this happened to you, because it most likely did not, this just happens to a very few and select people)."
1330,0.9991999393781925,0.0008000606217880011,0.0,1.0,0.0,I am a student and I am studying psychotropic medications in a course I am taking right now.
1331,0.9998005471370163,0.0001994528629730123,0.168,0.832,0.0,He's been taking meds for years but I'm not seeing any improvement in his health at all.
1332,0.9999757201915381,2.4279808476527878e-05,0.261,0.633,0.106,I'm so sad and so exhausted from my medication and I'm just ready to blow my brains out.
1333,0.9996345173394934,0.0003654826605136592,0.0,1.0,0.0,M's parents don't seem to be enforcing the treatment and M confesses that she isn't taking her medication.
1334,0.9744998373069554,0.02550016269304691,0.0,1.0,0.0,"I know big pharma makes money with the drugs, so I believe they prefer someone who will have to live all his life taking these medications instead of a cure."
1335,0.9999609554514722,3.90445485419875e-05,0.193,0.807,0.0,I am diagnosed with Schizophrenia and take my medication but things are not getting better.
1336,0.9992955711816245,0.0007044288183690891,0.144,0.761,0.095,It's so bad I'm tempted to start taking brief breaks from the medication to relieve myself from the symptoms for a couple nights.
1337,0.9999959854890895,4.0145109097006325e-06,0.0,1.0,0.0,Anyone else take this medicine?
1338,0.99982549654527,0.00017450345472862873,0.209,0.791,0.0,The medication I'm taking for depression hasn't lessened the symptoms I'm about to list here.
1339,0.9988025788226661,0.0011974211773406326,0.0,1.0,0.0,It actually helped with hallucinations for a few hours each day but when the medicine wore off they started to creep back again.
1340,0.9994692171206413,0.0005307828793611005,0.177,0.741,0.082,I'm pretty fucked because without the meds I will go get into lots of trouble but to quit treatment would forego any hospitalization.
1341,0.999880967410533,0.00011903258947314756,0.314,0.686,0.0,"I had no problems doing an extensive routine while on medication,  but struggle with the basics off medication."
1342,0.9999597096747204,4.029032529200014e-05,0.278,0.722,0.0,Refusing his meds and now he is psychotic.
1343,0.9995123243138413,0.00048767568617354476,0.098,0.902,0.0,So I've been off of my medication for months now and I just wanted to know what exactly you're warning signs are for a relapse?
1344,0.9994130695306126,0.0005869304693979,0.08,0.775,0.145,One interesting fact that you learn about at the end of the movie is that he he started getting better in 1992 after suffering from years of misdiagnosis and under and over medication.
1345,0.9994798152438438,0.0005201847561690033,0.19,0.81,0.0,"But I don't want to take it any further, such as getting another official diagnoses and being forced to take meds."
1346,0.999717501316699,0.0002824986833078019,0.1,0.783,0.117,"If my mother/family knows I definitely have it, then I will be given an ultimatum, either take the meds or get lost."
1347,0.9990329353344924,0.0009670646654972881,0.255,0.651,0.094,"I don't want the meds, they're trash and do more harm than good, I already had 5mg abilify for a month +/- &amp; it just made me feel shitty."
1348,0.999978934931063,2.1065068944151077e-05,0.216,0.784,0.0,They will force meds upon me &amp; if I refuse.
1349,0.9999274396770517,7.256032295143004e-05,0.391,0.609,0.0,im scared im not sure wether or not i took my meds last night im getting panicy and am having thoughts of suicide i dont know if i should take them now out of fear ill od and die
1350,0.9998223433808064,0.00017765661918210828,0.039,0.571,0.39,"Now that I'm on medication and I feel hopeful that they will work, I want friends, I was serious friends that I can talk to, share secrets with etc."
1351,0.999515541246852,0.0004844587531649407,0.078,0.793,0.129,"I've had a psychotic episode that lasted 2 days:

* auditive hallucination (hospital sounds I've never heard before in my life)
* smelled like hospital medicine or something; when I approached people that probably had a sweet smelling perfume it would smell like lavender room spray
* made me freak out, I thought I was in a coma in reality

It stopped after 2 days."
1352,0.9998863305833422,0.00011366941663846545,0.23,0.745,0.026,"I've had an other one that lasted 1 day(4 months later):

* smelled like incense, Initially I freaked out thinking I'm in hell, but I stopped thinking that because it would've caused some terrible paranoid decisions

Then it stopped (again, without taking medicine) then I went to see the doctor again, took zyprexa for 6 months till this day and I'm still taking it."
1353,0.9999488784574362,5.11215425695587e-05,0.0,1.0,0.0,I am also now on medication.
1354,0.9999652382736213,3.476172638082436e-05,0.15,0.751,0.099,"Most people think that dating bipolar people who are not on medication is an extremely bad idea, and I agree with this."
1355,0.9985781821393529,0.0014218178606327664,0.201,0.732,0.067,"I do not think I would date an unmedicated woman either, but I also know that a lot of the medications have quite severe side effects that could make the bipolar person emotionally unresponsive and dull, which is still better than being off meds but much worse than a neurotypical person."
1356,0.9999848083951439,1.5191604858832448e-05,0.0,0.894,0.106,I just want to know how medication has gone for you guys here?
1357,0.9997644257974594,0.00023557420255778343,0.0,1.0,0.0,How many times did you have to swap meds until you found the right one?
1358,0.9996031741031965,0.00039682589679922566,0.0,1.0,0.0,How does it compare to being off the meds?
1359,0.9865051156905825,0.013494884309407673,0.0,1.0,0.0,And I know that a common medication for the disease does sort of the opposite of a DRI.
1360,0.9999796863707994,2.0313629218935402e-05,0.227,0.773,0.0,He will not take any other medicine prescribed because he thinks it will give him cancer.
1361,0.9999448179208278,5.518207918323916e-05,0.0,0.649,0.351,He's convinced that marijuana is the only medicine that will help him.
1362,0.999814188828299,0.00018581117168624058,0.0,0.923,0.077,"We tried to at least get him to take that long release medicine shot, but he has to consent and refuses to do it each time hes been hospitalized."
1363,0.9952371255189025,0.0047628744810975475,0.0,0.884,0.116,"Though he seems more stable in there, he quits taking his meds the day he gets out of the hospital."
1364,0.9975731921843328,0.0024268078156504808,0.0,0.887,0.113,"We've been able to get him to take his meds for about 3 whole weeks almost 2.5 years ago, and were lucky now to have him take them 2 days in a row when he actually agrees to get prescribed them."
1365,0.9982480254088336,0.0017519745911705894,0.0,1.0,0.0,"He refuses all medication except marijuana and occasionally a 'benzo', except every time he gets marijuana, he believes its been tampered with."
1366,0.9995686669627661,0.00043133303722431656,0.258,0.664,0.078,"(I think this is bc he doesn't get a desired result, so someone had to have messed with it) All other medications he's convinced will kill him quickly."
1367,0.9999555869615802,4.441303840230294e-05,0.159,0.841,0.0,He thinks has anxiety and refuses all treatment and medications.
1368,0.9999434634768739,5.653652311525259e-05,0.0,1.0,0.0,"They've tried multiple medications on her, and nothing seems to work."
1369,0.998557711369995,0.0014422886300071859,0.072,0.928,0.0,"I'm just so done, it is so hard to remember to take my medicine, I have a pill sorter things that has a lot of colors on it."
1370,0.9999903670582996,9.632941698805677e-06,0.0,1.0,0.0,How do you remind yourself to take your medicine?
1371,0.999940776831744,5.9223168264432564e-05,0.203,0.735,0.061,"Anyway, after that, I never talked about these sypmtomes again and talked about anxiety, depression and things like that, I got medication and actually, even though I wasn´t treated for it, my schizophrenic sympotomes became much weaker."
1372,0.9999741970789723,2.5802921040598107e-05,0.149,0.799,0.052,"I can´t take my meds, because I can´t afford them and because my finances are so bad that I want to donate blood, which I can´t while being on meds..."
1373,0.9819197150050557,0.018080284994962528,0.0,0.798,0.202,"These are some studies that I found to help me find out: [Here](http://www.schizophrenia.com/szresearch/archives/001061.html) is a study that suggests nicotine helps with our ability to process information, cognitive function, and reduce the side affects of medication."
1374,0.9999004867364696,9.951326352708124e-05,0.0,1.0,0.0,He needs to stay at his father's house and take his medication.
1375,0.9903251936465954,0.009674806353393092,0.115,0.885,0.0,"Both my therapist and my physc are aware of this, they've been aware since I had to go to a partial program in October because I was seriously thinking of killing myself (wherein they changed my meds to a relatively high dose of Effexor and something I cant remember the name of for sleep."
1376,0.8932888204893418,0.10671117951064142,0.17,0.83,0.0,"He had NO symptoms during the day (now that his medications are straightened out) but smoking causes him to be more delusional (as in the tv and music is speaking specifically to him) and hear some of the voices again, so I'm not sure it's a great trade off."
1377,0.9997754945817552,0.00022450541824926325,0.0,1.0,0.0,He was under various medications (small doses) for the past two years.
1378,0.9997998628431557,0.00020013715686358234,0.0,0.71,0.29,We realize he needs to be under medication all his life but is there hope that he can take care of himself?
1379,0.9998035582509602,0.000196441749040958,0.0,1.0,0.0,Anyone have a similar experience with meds?
1380,0.999981272898176,1.8727101809821907e-05,0.368,0.632,0.0,I stopped taking medicine for my anxiety and depression (Cymbalta and Vistaril) because Cymbalta gave me the shits and made me feel drunk while Vistaril made me sleepy.
1381,0.999936608735053,6.339126495857571e-05,0.2,0.8,0.0,"I called a hotline and they sent emergency response people who basically said I can't get any help or be evaluated without parent consent and they don't want me to since they think medicine will make me ""slow""."
1382,0.999986741583425,1.3258416562316466e-05,0.0,0.891,0.109,I'm patiently waiting to gradually have my meds reduced and am hoping to one day be completely off meds and not have any symptoms.
1383,0.9998835525793838,0.000116447420605647,0.0,1.0,0.0,He has told me that he is schizophrenic and takes his meds every morning and every night.
1384,0.9936753417951963,0.006324658204798376,0.331,0.669,0.0,"Since then, she has put on a considerable amount of weight, became very depressed and started taking medication to battle her problems."
1385,0.9999738903922103,2.6109607770863615e-05,0.0,1.0,0.0,"When she would take her medication, mainly Zyprexa(sp?)"
1386,0.997193086935384,0.002806913064599711,0.0,0.829,0.171,"she would be just fine and return to normal, engaging in conversations, cleaning the house and taking care of things, however, lately her medication hasn't been working and she just wanders around the house, looking for something to do."
1387,0.9991966296742878,0.0008033703256938004,0.099,0.733,0.168,I have a friend in his early 20's who suddenly stopped taking his medication without informing his doctors.
1388,0.999948812288818,5.1187711177470866e-05,0.0,0.882,0.118,What can I do to convince him to go back on his medications and stay on them?
1389,0.9991663763880942,0.0008336236119186811,0.109,0.891,0.0,I talked to my psychiatrist today about it and he said it could be a side effect from the medication I'm on or my illness.
1390,0.9787753322866661,0.02122466771334528,0.057,0.89,0.054,"It seems like a lot of what I read shows that professionals don't know the difference on many issues whether it's a side effect of the medication or the illness, but shouldn't they know."
1391,0.9998017003751898,0.0001982996247958387,0.411,0.428,0.161,"I feel so lonely, really lonely, I never felt it this bad before the meds well, I actually liked being lonely before."
1392,0.9999876438705304,1.2356129487584961e-05,0.55,0.45,0.0,"I think the meds are making me agitated and restless and ugh, just, worse?"
1393,0.9999090137816108,9.098621837394077e-05,0.0,0.89,0.11,"For those of you who have taken meds or are on them now, how well do they work?"
1394,0.9972976805706719,0.002702319429312106,0.054,0.844,0.102,"My symptoms have been worse lately, but I'm also starting a new job in September so I don't know if now's a good time to try out a new medication, especially if it requires a blood test once a week."
1395,0.9998145218597579,0.00018547814024129407,0.042,0.699,0.259,"After her layoff, my mom offered to pay for her health insurance but she said she was feeling great and didn't need medication."
1396,0.999907302717616,9.269728239104654e-05,0.174,0.826,0.0,She stopped taking the medications and then the spiral continued.
1397,0.9993900630022182,0.0006099369977698507,0.0,0.826,0.174,I want to help my aunt and I feel that she should take the medications that turned her back to her normal self.
1398,0.9999904922723108,9.50772770591759e-06,0.258,0.682,0.06,"But even then I don't want anyone to know it besides a few people
I'm not sure what I want
I want to not pretend but if I weren't what would be the point I mean hell
But at the same time people don't understand me like they think I'm fine or I'll get better but I'm barely able to hide how much I want to shout and scream and break things and kick and punch and shit and it's not changing and if it were to start to or I'd have to take medicine or something I'd go crazy I can't live like that"
1399,0.9999528830791612,4.711692085078734e-05,0.184,0.816,0.0,She is refusing all her medications and and is starting to slip medically.
1400,0.999883127644282,0.0001168723557285066,0.0,0.811,0.189,My wife has POA for health issues so hopefully we can force her to take meds.
1401,0.9999800864395909,1.9913560414014583e-05,0.0,0.849,0.151,Can she live on her own successfully with medication or will we have to be watching over her constantly?
1402,0.9998544033963833,0.00014559660362019095,0.182,0.818,0.0,"I'm not any medication at the moment, much too scared to be on anti-psychotics."
1403,0.9999228485509566,7.715144905526881e-05,0.0,1.0,0.0,Do you think it has something to do with medication?
1404,0.99939079132952,0.0006092086704777919,0.159,0.841,0.0,"I am not sure how well the medications are working, I hear voices inside and outside, however, I hear the inside voices much less frequently."
1405,0.991092102862415,0.0089078971375656,0.0,1.0,0.0,"This is aided by the fact that I do not own a firearm, and I am not given large doses of medication."
1406,0.9999550124166837,4.498758330211007e-05,0.0,1.0,0.0,"I even here my neighbors talking about my current doctor, the medications I take, and my former doctors."
1407,0.996472109262079,0.0035278907379149693,0.189,0.811,0.0,"I just take the medication, sometimes I think the other things are a waste of time."
1408,0.9998365446191061,0.00016345538089424162,0.0,1.0,0.0,"I am on medications now so my symptoms have decreased some, but not a lot."
1409,0.9969754446424863,0.0030245553575296547,0.0,1.0,0.0,"flash forward a couple years, 2 other medications, and a new doctor and I'm back on it but at a higher dose and this time in shot form once a month."
