,neg_prob,pos_prob,neg_vader,neu_vader,pos_vader,sentence
861,0.9999247008089461,7.529919106348529e-05,0.232,0.628,0.14,"What good is Pharmaceutical medication if all it does is exacerbate my weakness, my fatigue etc."
862,0.9438216832821853,0.05617831671781255,0.0,0.953,0.047,"Most of the time it's pretty unintelligible so it's more of a novelty, but it seems such a separate aspect from the dialogues I'm used to hearing (I've been off meds for quite a while- I'm ""used"" to my normal ""tribunal"", but I don't think they're getting worse...)."
863,0.9141874666000072,0.08581253339999763,0.107,0.735,0.158,"I recently had a very bad reaction to haldol a medication that made me normal even a bit sharp for the first time in my life, four months of clarity tasks became easy."
864,0.9962592574639098,0.003740742536074879,0.205,0.75,0.045,"I then hit the wall flipped out lost my job became compulsive couldnt sit still, didnt realize it was the medication until I was on my knees two days crying to gid to make it stop, a god im not sure even exists."
865,0.9999816397331962,1.836026680321117e-05,0.0,1.0,0.0,Take meds?
866,0.9988392284054263,0.0011607715945606972,0.224,0.776,0.0,"So Basically, Here I am on reddit, knowing I have a problem, can't take medications (which doctors and what not LOVE to tell me to just do - their rather simple minded, non understanding people), and scared every single second."
867,0.9997745131150678,0.00022548688494908575,0.413,0.587,0.0,"My medications are poisoned I absolutely can't take them, and If i try and kill myself before they kill me i'll end up in one of those damn cheesy hospitals (seriously, I hate those things)."
868,0.9999676794653575,3.232053463515227e-05,0.0,1.0,0.0,I was put on medication and started seeing psychiatrists.
869,0.9996799777124422,0.0003200222875512784,0.0,0.691,0.309,"I am finally on medication that helps for the most part, and my therapist and doctor is great."
870,0.9999624002911538,3.759970884637877e-05,0.0,1.0,0.0,Any tips on dealing with delusions or getting her to go back on meds?
871,0.9984964917701575,0.0015035082298578003,0.11,0.714,0.176,A friend of mine has paranoid schizophrenia and takes medication at morning and in the evening.
872,0.9994761557670889,0.0005238442329233561,0.0,1.0,0.0,"Last night, he took his evening medication as scheduled and he noticed that he forgot to take his morning medication."
873,0.9999365228969876,6.347710300845894e-05,0.0,1.0,0.0,He INSISTED that he take his morning medication right then and there so he took his morning meds right after his evening ones yesterday evening.
874,0.9996405490339406,0.000359450966045368,0.0,1.0,0.0,I don't know what the name was of the medication he was taking.
875,0.9999451234127334,5.4876587263951784e-05,0.0,1.0,0.0,I'm focusing on medications and their side effects.
876,0.9953893857067183,0.0046106142932990255,0.035,0.86,0.105,"What medications have you taken, what were the side effects, did they work, do you felt like they changed your personality/body in ways that was unrelated to the schizophrenia 

(IE, my brothers normally very active, but on his meds he's EXTREMELY sleepy, and now has become a huge movie guy because he just doesn't have the energy for anything else."
877,0.9279871958649233,0.07201280413507635,0.046,0.825,0.128,"when before this medication and a majority of his life he has always felt movies were a waste of time 'read a book, create it for yourself, work your noggin, and experience magic, each page is a new adventure, glu"" is the thing I remember him saying the most, my friends and family call me glu because I have celiac)"
878,0.9999792425894012,2.0757410583917974e-05,0.0,0.868,0.132,I asked my psychiatrist if I can be put on ADHD medications and he gave me the good to go on adderall.
879,0.9999914292956171,8.570704389332042e-06,0.0,1.0,0.0,Anyone else on ADHD medications here?
880,0.9973732774995835,0.0026267225004064387,0.0,0.886,0.114,I've been diagnosed with psychosis/schizophrenia and my medication has been changed a substantial amount of times.
881,0.9982059846211855,0.0017940153788081191,0.158,0.842,0.0,"Changing medication, however, is a bit tough to deal with."
882,0.9999704713102832,2.952868972232467e-05,0.159,0.841,0.0,"This waiting period, since I'd be close to off my meds or completely off at this time is very stressful."
883,0.9999089170291287,9.10829708689074e-05,0.143,0.79,0.068,I once had to admit myself to ER because it got very bad - although doing this made the transition from my meds even longer.
884,0.9980717690543012,0.0019282309457104541,0.0,1.0,0.0,I'm currently off one of my meds and I'm changing to a different one once I see a psychiatrist which is happening next week.
885,0.999785243780881,0.0002147562191237869,0.25,0.625,0.125,"The only medication I'm on is for seizures, although I have some benzos on hand for when I have a panic attack."
886,0.9999105394540942,8.946054592208925e-05,0.172,0.775,0.053,"I expected that he'd prescribe me some prozac or paxil or something and I'd be on my way, but he evidently thinks that I'm suffering from psychosis and recommended anti-psych meds, but I'm skeptical of this."
887,0.9999613615841678,3.8638415846821345e-05,0.0,0.647,0.353,My pdoc seems super confident that I need anti-psych meds and that I will decompensate without them.
888,0.9999950771876297,4.92281238144152e-06,0.232,0.768,0.0,I've decided I don't want to go on meds (why would I if I don't trust his diagnosis?).
889,0.999971757315286,2.8242684706985905e-05,0.0,1.0,0.0,"**TL;DR**

My pdoc thinks I'm psychotic and need anti-psych meds."
890,0.9998943907819079,0.00010560921810337114,0.163,0.741,0.096,My meds hardly work anymore and I just want it all to stop.
891,0.9839718556754421,0.01602814432456728,0.137,0.863,0.0,It's been a long time problem of mine and I used to take some anti-anxiety meds that had a light sedative in them before bed but ended up changing meds many years ago and the sleep problems came back.
892,0.9998920941602323,0.00010790583974769112,0.108,0.892,0.0,Last night I was in the ER because I was having chest pain(turned out to be bad heartburn) and they told me not to take my meds since I was throwing up anyways.
893,0.999965525575147,3.4474424854433185e-05,0.0,1.0,0.0,"It'd have to be caused by drugs/meds or something, I think."
894,0.9998634238476327,0.000136576152366456,0.0,0.881,0.119,"Like the meds make the sounds.. transparent, but the people are still there, floating."
895,0.9999728742338035,2.7125766203825903e-05,0.194,0.806,0.0,Soon i found out that she had been diagnosed with anxiety and had been given medication that she claimed made her feel worse.
896,0.9999676227190867,3.2377280932381726e-05,0.355,0.645,0.0,Pain medications do not work at all.
897,0.9999416724310357,5.832756896922228e-05,0.06,0.83,0.11,I can tell because they are happy to discharge me on Friday without giving me any medication or indication of what is going on or why this has happened to me.
898,0.9997790378418829,0.00022096215811293987,0.343,0.657,0.0,My medication makes me feel restricted even at such a low dose.
899,0.9992655992404521,0.0007344007595471619,0.0,0.864,0.136,"He's seeking treatment, taking medications, and trying to make his life as stable as possible."
900,0.9999693000399179,3.0699960071881863e-05,0.0,1.0,0.0,I am now symptom-free clear-headed but still on medication (Abilify).
901,0.9999191317099,8.086829008765904e-05,0.198,0.706,0.096,"But I do have one big problem that I can't get over and that's pretty bad memory loss, I'd say it's gone from mild to moderate pretty fast (a few months) I'm not sure if this is related to schizophrenia, meds or some other health problem (definitely not aging because I'm not old enough for dementia)."
902,0.9999345097290683,6.549027094669622e-05,0.231,0.769,0.0,I don't trust the medicine because people say I don't need it.
903,0.9868147929350445,0.013185207064950502,0.108,0.763,0.129,"it said something to the effect of schizophrenia being like the word cancer in medicine, its not just a diagnosis but also a sentence."
904,0.9998873201065293,0.00011267989345096795,0.0,1.0,0.0,You can have all the meds and psychologists your life can hold.
905,0.986249818958279,0.013750181041739952,0.072,0.839,0.089,I suffer daily with the voices...I am on medication it does help with the other issues but the voices are always their...My father gave me an adderoll he is also schitzophrentic he said they do wonders for him.....I took it and it made me feel amazing the voices shut up and my frame of mind was great....I asked my doctor if she would give them to me I told her how they helped so much she said NO!!
906,0.9999838226391432,1.6177360837888508e-05,0.14,0.662,0.199,I stopped taking meds by myself because my doctor was on holiday.
907,0.9989717391864047,0.0010282608135749312,0.0,1.0,0.0,"I talked to my mom, she is a mental health nurse, and she said that it's totally up to me if I take the medication or not."
908,0.9999774024087895,2.2597591222423507e-05,0.391,0.609,0.0,But the medication made me feel so bad.
909,0.9998696230826659,0.00013037691734750186,0.0,0.8,0.2,I want to be able to take care of my body and with my medication I couldn't even get out of bed.
910,0.9796684807903765,0.020331519209611588,0.073,0.874,0.054,"I was diagnosed as schizophrenic a few weeks ago, for the past two years doctors refused to diagnose me and just kept me zonked on antipsychotics (seroquel) but im seeing a new doctor and he finally diagnosed me, he took me off all of my meds besides my antidepressants so he can see what im like with no meds."
911,0.9998749807075612,0.00012501929244945395,0.132,0.868,0.0,"I told my dad, and he was mad at me and told me to go to sleep and thought I wanted attention and/or meds."
912,0.9998581553346255,0.00014184466536866215,0.061,0.687,0.252,I want so much to be off medication but that will never be and I'm growing to accept it but it's still hard.
913,0.999899157293744,0.00010084270624963188,0.277,0.723,0.0,hopping back on the meds now :\
914,0.9998437714842011,0.00015622851581182504,0.0,1.0,0.0,Did meds make a difference?
915,0.9998788274161843,0.00012117258381080185,0.0,1.0,0.0,"I was supposed to go in Friday for another injection of my medication(Abilify), but I rescheduled for Monday, and I rescheduled again today for Wednesday.. so that's going to be 5 days without medication.. and I was already symptomatic."
916,0.9994172406576519,0.0005827593423650734,0.207,0.793,0.0,So I decided to punish myself for that and just try to survive a month without meds.
917,0.9996067363871187,0.0003932636128946429,0.312,0.688,0.0,"""Sorry, I was a dumbass and lost my meds and for that I've caused you financial loss?"""
918,0.9999910128039803,8.987196008047873e-06,0.23,0.77,0.0,Does anyone else get incredibly restless on their meds?
919,0.9999786105119358,2.1389488059055703e-05,0.095,0.905,0.0,"So anyway, about 6 years ago when I saw my latest psychiatrist he told me that after five years I could stop taking my meds."
920,0.9996055647263404,0.00039443527364916133,0.128,0.872,0.0,"I thought that when I would stop taking my meds, I wouldn't tell the canadia immigration officers about it."
921,0.9970695061914344,0.0029304938085848906,0.076,0.84,0.084,"Well what ended up happening is that 5 years later (at the start of this year), I had a psychotic episode because I had stopped my meds."
922,0.9999671556794527,3.284432056686639e-05,0.0,1.0,0.0,Now I am back on meds.
923,0.9938296469420579,0.006170353057927726,0.0,0.802,0.198,"To the best of my knowledge he was taking his medication steady for at least a month, maybe two."
924,0.9998480106049463,0.00015198939506986796,0.161,0.839,0.0,I think the medication helped with the auditory hallucinations but he was beyond paranoid still.
925,0.9988671315438077,0.0011328684561779287,0.071,0.866,0.063,"Several occasions he stops taking his medication and he will sit there for hours smoking cigarettes left and right constantly putting his hand through his hair and is still just as paranoid as when he was on medication, just  isn't so visibly to me effected by it."
926,0.9998828808404333,0.00011711915956485145,0.083,0.917,0.0,It is to the point now where I beg him to take his medication and he yells at me saying the medication isn't going to help him.
927,0.9943911306781593,0.005608869321831115,0.127,0.794,0.079,"I try to explain to him that medication can take a very long time to get adjusted in the system, maybe even a year(not sure if true, but for my bipolar medications I've been told this before so I'm just trying to help)

He is really bad at communicating what he is experiencing one because its so unbelievable and second he claims sometimes if he explains exactly whats happening to him he will die."
928,0.9966323466269784,0.0033676533730146374,0.0,0.854,0.146,"I think the most they did medication wise for him in the last few months was up the dosage by a little bit and say ""he needs to be on it longer""

Now how the heck can I help?"
929,0.9999043599929262,9.564000707232475e-05,0.127,0.873,0.0,"I have been off my meds for awhile now because I didnt like what they did to me, and I feel like I can just tell myself that the things I hear and see arent real."
930,0.9989731747320918,0.0010268252679142124,0.0,0.628,0.372,I try my hardest to keep up with things but I feel like some sort of medication could help me do a lot better
931,0.9913278815122155,0.008672118487773167,0.0,1.0,0.0,"I went the past few days without meds at home as I forgot to bring them with me, then last night I looked at the moon and thought ""I must be a werewolf."""
932,0.9999276997869927,7.230021301701116e-05,0.0,0.622,0.378,Am back on meds tonight so hopefully this won't get out of hand.
933,0.9999393516354288,6.064836458577597e-05,0.0,1.0,0.0,"How did you handle it (aside from going back on meds, which will probably happen eventually)?"
934,0.9967318154221799,0.003268184577811691,0.375,0.564,0.061,"A large part of my illness is delusions however; my medications are poisoned, snipers are trying to kill me, the government has a plot to kill me... stuff like that."
935,0.9999490949676063,5.090503237842566e-05,0.0,1.0,0.0,I am currently afraid to take medications so I rely heavily on coping skills to get me through day to day activities.
936,0.9946624595869483,0.0053375404130549245,0.0,0.912,0.088,Obviously the best way to deal with all that is listed below is to remain on medication and talk to a doctor but sometimes you need to mix both.
937,0.9991809322276696,0.0008190677723128366,0.054,0.557,0.39,"If you can get a great support system under you belt, great therapist, trust medication, and have a routine and a team to help you then this will help develop your own personal coping skills for any problem."
938,0.9999738545853332,2.614541465483167e-05,0.0,1.0,0.0,"Have people ""escaped"" symptoms without meds?"
939,0.9999861662366407,1.3833763362096864e-05,0.0,1.0,0.0,I spend $15/medicine.
940,0.9997547921381942,0.0002452078618153273,0.093,0.825,0.082,The problem is that both Olanzapine and Quetiapine have heavy side-effects for him and Clozapine is the only medication he really took well up to now.
941,0.9999692657435117,3.0734256488268356e-05,0.0,1.0,0.0,I'm on meds but still I don't feel anything.
942,0.9998518952215524,0.00014810477844408228,0.0,1.0,0.0,She says her meds have subsided the voices and rarely hears them now for the past 5 months.
943,0.9999811798834464,1.88201165545038e-05,0.0,1.0,0.0,Do you take medication?
944,0.999982105179949,1.7894820057483635e-05,0.137,0.863,0.0,I was wondering if anyone is or was on that medication and if you had any problems with it.
945,0.9992911294002577,0.0007088705997267181,0.111,0.889,0.0,I feel as though I'm a psychopath I don't feel love or any emotion anymore maybe it's the meds the doctor has me on I can't seem to put a finger on it.
946,0.9992219779546097,0.0007780220453996008,0.168,0.774,0.058,"On top of the stress, I kept forgetting to take my medicine (Geodone,) because my alarm would go off while I was working, so this day I took it early."
947,0.9997919148244929,0.00020808517551033117,0.141,0.859,0.0,"I quit the next day after coming home, freaking out, then taking stress-relief medicine that I hadn't taken in months."
948,0.9917054877771234,0.008294512222881885,0.139,0.861,0.0,"Doing some research for university, came across using psycho-education as a form of medication adherence for people taking neuroleptics or, sufferers of schizophrenia."
949,0.9989843083091384,0.001015691690867731,0.0,1.0,0.0,"I was wondering, for those of you who have been diagnosed, how much do you have to spend on medication, say on a monthly basis?"
950,0.9993242424440909,0.0006757575559232123,0.0,0.95,0.05,My psychiatrist has not been practicing very long and all the work she has done for the VA has been mainly focused on PTSD so she has reffered me to her boss who is in charge of the VA mental health department so we can get me started on medication.
951,0.9999393448175242,6.065518248524429e-05,0.0,1.0,0.0,What kind of questions and concerns do I need to talk with my new psychiatrist about since I'll be starting meds?
952,0.9999398629871455,6.013701283617713e-05,0.0,1.0,0.0,This will be my first time on medication so I am very new to this.
953,0.950639550128666,0.049360449871337794,0.104,0.732,0.164,"He didn't want to talk much about the last 6 months since its too painful for him, and said he's on pretty strong meds at the moment so most of the time he's a zombie."
954,0.9997799096376033,0.000220090362405808,0.0,1.0,0.0,So until recently my psychiatrist only seemed to prescribe medication as a treatment.
955,0.9991167710979162,0.0008832289020893391,0.184,0.816,0.0,"Recently, he informed my parents that medication won't help much in my case, and that I need training, work, and living independently, and that he will work on providing all these via mental illness help programs."
956,0.9999471192280295,5.288077198922249e-05,0.167,0.833,0.0,I was not prescribed any medication and I am stuck sucking it up.
957,0.9999522864611237,4.771353888899897e-05,0.146,0.728,0.126,i didn't even want to take medication bc I felt like my dad or family would judge me and that there would be so much shame in it and I didn't want to be like my mom.
958,0.9999374352105852,6.256478940458936e-05,0.409,0.591,0.0,"I ended up abandoning my medicine so I could ""wake up"" and I discovered a disgust for my overweight body."
959,0.9999909829597952,9.017040199974153e-06,0.0,1.0,0.0,Has anyone else had weight issues due to medicine?
960,0.9986048991193366,0.0013951008806589542,0.0,0.888,0.112,"I started this medication not too long ago now because my psych thought it would be good since I was having ""symptoms"" of a pre psychotic break."
961,0.9999336827790777,6.631722091687039e-05,0.0,1.0,0.0,I guess I can't come off of meds.
962,0.9976214257388345,0.00237857426116889,0.0,0.748,0.252,"The meds help with the psychosis, but there's so many aspects of my life they don't help with."
963,0.9999032701280612,9.672987193466885e-05,0.0,1.0,0.0,"In her case she heard loud voices in her head, usually around the evening and was on heavy medication."
964,0.998178725474187,0.0018212745258115786,0.17,0.83,0.0,"On those moments I stop taking the medication and start to become extremely paranoid, that's when it comes to me that it is actually real."
965,0.9999759198098062,2.4080190185319546e-05,0.0,1.0,0.0,The mainline medication is Abilify 10mg daily now.
966,0.9999372850958737,6.271490414187837e-05,0.0,0.737,0.263,Mental disease medication is tailored like most others.
967,0.9997092673021266,0.00029073269785909075,0.222,0.778,0.0,"What type of medication is usually prescribed, and does it have negative side effects?"
968,0.9998679491793684,0.00013205082061333223,0.0,0.775,0.225,"If my friend does not take his ADHD medication, it's very obvious."
969,0.9944817662380557,0.005518233761925624,0.13,0.87,0.0,"Hi, I've been on a few meds over the years and I've always struggled with the side effects."
970,0.992431845071613,0.007568154928388555,0.076,0.883,0.04,"Now I'm sure some are going to tell me to just take my meds, I know, but my question is has anyone else struggled with not wanting the side effect of the meds or wanting to live a med-free life?"
971,0.9999715263148968,2.8473685097225607e-05,0.0,0.685,0.315,And is medication the only solution?
972,0.9997968438943095,0.000203156105693978,0.054,0.946,0.0,"For the past 2 montgs I stopped taking my meds, because there were too many side effects, and my insurance woupdnt let me see the psychiatrist more than once every 2 months so we couldnt tweak it."
973,0.9999649577739065,3.504222609027609e-05,0.316,0.526,0.158,I am not any medications daily to treat my depression or my anxiety.
974,0.9999393636904138,6.063630957008007e-05,0.0,0.906,0.094,Was okay for the past 2 months on new meds but something is out there again.
975,0.9990706356824736,0.0009293643175082783,0.0,1.0,0.0,"A lot of you seem to know a lot about psychiatric medications, have you ever heard this?"
976,0.9975873876331708,0.002412612366824107,0.15,0.85,0.0,"I've had a schizophrenia episode starting at ~13, that grew along with family problems I had at the time, and took medicine (mostly Risperdal) until almost 16 and hallucinations stopped."
977,0.9999092042344567,9.079576553568815e-05,0.0,1.0,0.0,I'm not on medication at the moment.
978,0.9999633976621415,3.660233787381061e-05,0.256,0.744,0.0,"I don't take medication, which I should, but medication scares me too."
979,0.998972357050117,0.0010276429498687987,0.343,0.657,0.0,"I'm terrified of taking medication because I don't want it to ""change me."""
980,0.9999212689115192,7.873108846762171e-05,0.0,0.921,0.079,I keep telling myself that if I develop psychosis that I'll be put into a hospital and get a few weeks off work and take some medicine to chill me out and that it won't be that bad.
981,0.999803520813753,0.00019647918625346176,0.095,0.905,0.0,"I have been diagnosed with paranoid schizophrenia a short while ago, before I was on medicine I used to smoke weed every so often."
982,0.9999014746883713,9.852531161091922e-05,0.0,0.757,0.243,"The medicine really helps, all of my hallucinations feels like they are really far away from me and it doesn't scare me when i don't do what they say."
983,0.999990223433843,9.77656614817393e-06,0.0,1.0,0.0,"Anyway, my question is: what could happen if I smoke while on my medicine, should I skip my meds for a day if I smoke, or should I stay away from weed altogether?"
984,0.9999653751004803,3.4624899536481936e-05,0.169,0.831,0.0,I don't want to be on meds anymore.
985,0.9998085547358572,0.00019144526415484106,0.256,0.744,0.0,"I get paranoid in public, I hate the medication, have tried Risperdal, Abilify, (which made me very very sleepy) and seroquel, which just sedated me to no other."
986,0.9999800103337471,1.9989666236026547e-05,0.0,0.633,0.367,Even if they are completely stable and basically symptom free on medication.
987,0.9962940251814645,0.00370597481852909,0.165,0.623,0.212,"My Doctor suggested that the decline in working memory might come from depression but with the antidepressant medication I feel less depressed than a year ago, actually I feel pretty good."
988,0.999929626535411,7.037346460290481e-05,0.0,1.0,0.0,"2) If I do get to the point where I develop schizophrenia and have to take antipsychotic medication, is there any way for me to continue my studies as an engineer, and to then go on working in the industry?"
989,0.9946147100388515,0.005385289961165132,0.213,0.787,0.0,"I'm on meds, but recently had a bout of psychosis due to an interruption."
990,0.9987793605184828,0.0012206394815271816,0.186,0.621,0.193,"His brother obviously needs medication and help, and my friend and his mom should not have to live in such a hostile, dangerous environment."
991,0.9995374498916385,0.0004625501083584638,0.171,0.829,0.0,He told me he does not have much interest in talking to a professional and does not want to take medicine.
992,0.9998478485261644,0.0001521514738393935,0.145,0.855,0.0,The medication turned me into an emotionless zombie and I refused to take it anymore.
993,0.9997907640850138,0.00020923591498354352,0.0,1.0,0.0,I have been off meds since I was 18 and for the most part I have been highly functional.
994,0.9999169073494384,8.309265057723809e-05,0.0,1.0,0.0,I just discovered that almost every doctor in the states(and abroad without adoubt) is paid off by pharmaceutical companies to prescribe their medicine.
995,0.9976386839497061,0.0023613160502849373,0.144,0.856,0.0,dont trust psychiatrists who seem to stick with the same meds in the prescence of new/changed symptoms.
996,0.9997009055185283,0.000299094481463309,0.279,0.646,0.075,"I had previously mentioned Buspirone, an anti-anxiety medication that didn't work for me, it amplified an overwhelming and negative urge to commit suicide."
997,0.9999142495412147,8.575045878393009e-05,0.142,0.712,0.146,"Now that I take medication, I have no symptoms of either schizophrenia nor bipolar disorder."
998,0.9996700512233584,0.0003299487766513021,0.217,0.783,0.0,She hated her injections and as soon as they let her start taking her own medication in pill form she immediately stopped taking it.
999,0.9997088449907683,0.00029115500922857637,0.0,1.0,0.0,Around Christmas her parents started to notice something was up with her and of course i can't FORCE someone to take medication.
1000,0.9987176097928636,0.001282390207122187,0.0,0.884,0.116,While she was in the hospital they started her on a new medication and she seemed to feel a lot better on this new drug.
1001,0.9984166182580728,0.0015833817419103567,0.128,0.872,0.0,When she was released she only took the medication for a couple days and stopped.
