,Unnamed: 0,neg_prob,pos_prob,neg_vader,neu_vader,pos_vader,post,dict,identifier,sentiment
839,839,7.273488255956997e-05,0.9999272651174272,0.162,0.725,0.114,"I'm sure this'll evolve into a giant wall of text as its 2:30 in the morning and I'm on my computer to keep my attention away from the scary shit I pretend exists. So early apology. 

I'm undiagnosed something, I don't have the money for a doctor or medication, and I'm really too full of myself to degrade my own image to ask for advice from people that know me.
It's pathetic, I know. And I should go ask people, I know. But I won't. 

I don't know why I'm doing this and I'm honestly scared shitless that somehow I'm actually lying and someone is going to find out and report me and they'll lock me away. I really, really hope this doesn't bite me in the ass. Maybe I'm just sick of being in a constant state of panic and paranoia.

I'm doing this not for gratification or some weird recognition but for honest to goodness on advice on how to handle my problem. And to vent.
I've been through my hero-complex, my victim complex, and now I'm finally able to see myself for just how bad I'm getting. Everything I put in this post is half to get it out of my book and half to give you any information I can to help me out.

I guess I should start with a backstory before I get to anything else.

So it all started back in July 2008. I was 17 and a junior in high school. I was a pretty popular guy. You could call me a class clown, because I didn't take anything too seriously and I was pretty much friends with everyone. I was raised to be a good dude. Then, on July 1st, 2008 my best friend committed suicide. His mom had died of cancer several years before, his dad was a deadbeat, and his older brother who took care of him was really abusive. My mom died in 2005 and we were both into music so we clicked really quick and we were pretty much inseparable from the moment we met on. I was really close to the dude, and it just hit me with a massive pile of guilt about how I didn't see it and I wasn't there and a whole slew of other terrible things. Which brought on the repressed depression from my mom's death on august 15th, 2005. It didn't help that school officials came after me to get all of his friends and notify them of what happened. 

I had a girlfriend at the time and it was really just a relationship of physical attraction, so I came to her for some kind of support and she just tried to do what horny teenage girls with no life skills tried to do, and so we had this teary argument and broke up.

So I'm sitting on top of a pile of guilt and depression and I just broke up with a really sweet girl and my junior summer was going really, really badly. 

I don't have much in the way of family, which I'll address later on, but for about a month I was pretty much alone, and extremely depressed and mad at myself for the shit I let happen to people that mattered.

Not in your slick black hair, emo-band-shirt cry to a diary type depressed, but as a young man reflecting on serious preventable mistakes type depressed. 

Then starting on August 17th, 2008 lasting until August 21st, 2008 I had the most awkward thing happen to me. It started out as a sort of all-female choir group that would at random times during the day very quietly sing to no apparent rhythm for between 20 minutes to several hours.

On August 19th, 2008, I had an agonizing migraine. I mean crippling to the point where I could not stand, the slightest amount of light made me want to vomit and I was physically incapable of any kind effort to do anything. This migraine started at approximately 6:00 PM and lasted until I fell asleep at some time after 10:00. 

After I had this migraine, as well as the strange noise issue, I started a journal because I was legitimately worried I was either going to die, or my mental health would be dramatically impacted.

During the month of august, and I didn't write this down in the journal, I began talking with the girl I'd begin dating, starting December 2, 2008.

September 2008 saw no real painful symptoms, but I did start having incredibly vivid dreams, some of them were pleasant, and some of them were grotesquely violent.

I've written down a few that I felt were profound or deserved note.

Dream 1: I'm an older man in what felt like a warehouse for making leather supplies for either Nazi Germany, or for a resistance during Nazi era France. There's a commotion and my coworkers and I flee to hide, but I don't make it out, I hide beneath a table as several men search for my coworkers and I. 

During the part of the dream I felt the most overwhelming sense of abhorrent horror I woke up physically crying. The dream ended as they dragged me out and shot me with a pistol of an unknown calibre through the neck. I physically felt penetration and awoke moments later in sweat and cried when I realized it was a dream. I am a man and rarely ever cry, especially over dreams.

Dream 2: I am myself with my brother and tens of other people that I do not know. We are all standing at night, starless sky, in a massive field of green grass, on a small decline. At first I scan the area and see some type of encampment, I am drawn to it. My brother is scared but I reassure him that we are doing the right thing. We arrive, I don't remember witnessing our actual travel to the area. It appears to be a government complex. They line up civilians and have us perform strange tasks, like putting our hands in a bucket of water with a low electrical current, or standing on a launch pad that sends us up 15-20 feet in the air. I remember the slight pain of the electrical current, but absolutely no pain from the launch pad. I actually remember excitement as I lifted into the air.

After completing the tasks they assigned me, I remember looking for my brother, who was nowhere to be found. Then I was looking at an incredibly fast aircraft dock in a larger blimp like aircraft in the sky, both of which had a green coloring, as I watched these aircraft I felt this feeling of complete and utter serenity. It was the most at peace I have ever felt and sometimes when I'm incredibly deep in a terrifying episode I will recall the dream and be far more at peace.

Dream 3: I'm myself, though a young child, early elementary school years. There's a man down the staircase in my old elementary school building and he is in some unknown way bad. He appears as what I could best describe as a diluted Beetlejuice from the Keaton movie. Similar clothes, but a much old face and body type. I am the only one able to stand up to him, and I have some secret device in my pocket that will allow me to thwart him. I am unusually brave as I stare down the man, and he attempts to strike me up with a deal. I do not know what the deal was, nor if he holds true. I woke up feeling confident but had this terrible fear of the dark for the remainder of that night. I turned on all the lights in the house but couldn't shake the odd fear.

There's a total of 6 dreams that I wrote down, but those three seem to high-light the themes present in all dreams.

October 2008 saw the return of the choir and a difficulty focusing on things. 

November 2008 saw a similar pattern.

My current girlfriend, (And likely lifemate) began dating December 2, 2008. I did not tell her of any of the mental symptoms at this point. I figured they were just byproducts of depression. The month felt far more stressful than usual.

January 2009 was an awful month. I began hearing muffled voices constantly, but they seemed to come from within I'd say 5 feet of myself, leading to sleepless nights and extreme paranoia. I told my dad about the voices and he told me that he was diagnosed with schizophrenia when he was 26, but that my mom had been diagnosed as Bipolar when she was 17. 

It turns out my mother started drinking at 17 due to bad home life and her bipolar disorder. She died on August 15th, at 8:37 PM due to a heart condition associated with alcoholism.

Genuinely terrified of the future and really bummed out, I carried on.

The Rest of 2009 has a lot of footnotes but to save time I will condense it as best as possible.
Actually, I think I'm writing to descriptive now to be productive. I'm going to condense the next few years up to 2013 as best as I can.

- Girlfriend and I hit off swimmingly, but a new issue developed in early March; crowds became a huge problem. When I was in a crowd of people, the voices would get louder and faces would become malformed and terrifying. I dropped out of high school my senior year. It seriously made me sad.

- Early June I began seeing people in the dark, for about a split second or two. They didn't move or speak at all, they were occasionally in peripheral vision, and when I'd glance at them they'd disappear, or I'd look right at them but they'd distort out of my view.

- Late November I tell my girlfriend about schizophrenia, she tells me we'll work through it. I considered breaking up with her out of self pity. Decided against it.

2010 saw crowds become terrifying. I starting thinking that I could read minds when I was in a crowd, and that everyone in a crowd wanted to, in some way or another, read my mind. I also became convinced that my vivid dreams were actually visions of actual ghosts.

In late 2010 I began seeing people and things for extended periods of time. Occasionally they'll move to face me. Usually just average people, but I have seen, in the dark some kind of scaly thing with strange eyes. Regular talks with my Girlfriend's superstitious mom leads me to believe I can see the dead and demons. 

In early 2011 I develop a hallucination named Josef Skeller, who goes by Mr. Skeller. Going along with the early mentioned belief, I begin doing weird things at the advice of Mr. Skeller. Girlfriend is kind of convinced by coincidences and her mom that I can talk to the dead.

You can probably see the downhill pattern forming by now. 

By the end of 2011, I begin seeing horribly deformed / mutilated hallucinations, start hearing voices in full effect, and begin having night terror that leave me paralyzed upon waking up for several minutes. Pleasant dreams become less and less prevalent. Talk to dad about beliefs, he tells me I can't speak to the dead and that I need to man up and remind myself that I have a disease any time I feel a god complex.

I tried to argue but he brought up a really valid argument ""Go talk to your mom if you don't like what I'm saying.""

I was butthurt but he was completely right.

By 2012, I'm trying desperately to overcome night terrors, can usually talk myself out of a stupor. Sat down my girlfriend and told her that when I'm going off the deep end she needs to completely control the situation or it'll get worse, et cetera. She does a pretty good job being the boss when I go crazy. 

2012 is a good year to highlight because I feel like I made a LOT of progress. I stopped listening to my Skeller hallucination, which was a lot harder than it sounds and I've been able to be in a group of friends if I'm fairly intoxicated, which, while not the best thing ever, is a huge step up from not being able to walk down the street without being scared for my life.
I also stopped believe I could talk to the dead / fight demons / read minds. Although I do get these episodes where it gets awful for everyone involved. 

By the end of 2012, I was on a high note.

But then 2013 kicks in and I start working at a new place and I just get overwhelmingly afraid that my coworkers, who I get along great with, are trying to get me fired, or get with my girlfriend or whatever.
And on a lower note than that, I'm starting to realize that my girlfriend is losing patience with me.

I've also started having episodes where I feel like I'm not a part of my life, I'm just casually looking in through the eyes of me. Like someone else has the reins and I'm just along for the ride. 

And I'm slowly losing patience too. I'm starting to see people as pure annoying. A lady took too long to checkout? I hope she dies.
Toddler is asking too many questions? I hope he grows up alone.

Those kinds of thoughts, and I fully mean them, in my head. I have to catch myself and really go ""Hey man, what are you becoming?!""

I'm still writing my journal, and I think maybe I need to keep writing it for good, if only to reflect on my more crazy moments.
Some of my friends said that people would be really interested reading it, even if it's a LOT of gibberish.
I guess now would be a good time to start asking questions.

1.) Has anyone dealt with these episodes where you're in second person? Where it feels like someone else is controlling you? How do you get your life back?

2.) How on earth do can I stop the anathema of groups? Just the thought of something I used to love now makes my stomach drop and it's starting to affect my social life. None of my friends outside of a handful of very close people know that I have some type of mental illness, and I don't want to drive them away.  Is there any way to just suck it up and deal with large groups? I miss society..

3.) Is there anything I can do to stop the faces in the darkness? Closing my eyes sometimes works, but sometimes I'll open them and have a torn-up mutilated face you know, 2 inches from mine. Doesn't really help the sleep schedule.

4.) Is there anything I can do to reduce the severity of night terrors? I wake up feeling sore from them nowadays and I just want a good night sleep.

5.) Am I the only person to have an imaginary friend like Skeller? That's the aspect that confuses me the most as most people don't suffer that type of hallucination. He's recurring and consistent, and has a made up story out of my imagination. Insistent, and has a snide personality unlike my own.

6.) Does it get worse? I'm 22, and I've been dealing with a gradually worse and worse affliction since I was 17 years old. My biggest fear right now, besides the crazy fears, is that it's going to continue to get worse until I just completely lose the guy I was at one point. That'd be the worst thing that could happen. If there was nothing left.",['conj'],0,neu_vader
841,841,0.3944554460691981,0.605544553930796,0.158,0.7809999999999999,0.062,"Since I was in middle school (I'm in college now) my sister started having really strong panic attacks. She didn't show any signs of it beforehand, it was like it was activated when she finished high school. But basically in these panic attacks she believes that people are out to get her, shooting her with beams in her heart, trying to rape her etc. Sometimes she would have these freak outs everyday and they can last a really long time.

I can't say my parents haven't done anything, they have tried many pills to stop the attacks but the current pills pretty much make her ""empty,"" more specifically, you could say they only mute her without actually doing anything to ""help"" or ""fix"" her. She may live with this for the rest of her life but as a family we don't know what to do about it. She's 26 still living at home, basically after high school just stayed and progressively became more insane.

TL;DR: sister has schizo for as long as I can remember, family can't take it anymore but won't do anything about it. If anyone has experienced therapy, hospitilization, medications, that have helped you please give me advice because I hate visiting home now and as cold as it may seem it feels as though she died when she started having episodes because as a person she is broken. 

On another note, I have an undiagnosed brother who hasn't spoken for about the same time as my sister lost it. Before he stopped functioning, he became obsessed with aliens and alternative healing (magnets, amulets, etc.) which seemed fine but one day he wouldn't stop laughing and that progressed to not talking and then living at home leeching off my parents at 25.

My parents don't know what to do, I don't know what to. I know this may not be the absolute best place to post this but idk. Lastly, I'm truly sorry if I offended anyone with how I view my siblings but when you live with people in such a condition for so long, it just feels like they die as people and become a huge burden and a problem. When I was young experiencing all of this for the first time, I just grew an absolute hatred of her because of the attacks, the screaming especially. I just wanted a normal family and life but I don't know what to do, my other sister is ""normal"" in the same sense I am but she moved away and stays away because of these problems, though she is 28 so It's normal and my other two siblings should have graduated college already and living on their own. I wrote all of this as she was screaming to my mom about all of it so yeah. It's so difficult for me to talk about this I'm not even going to reread this. 

actual TL;DR: anyone who is living well while having schizo in them or in family, how do you do it? because it's something that a lot of people can't do...",['conj'],0,neu_vader
859,859,0.9867901512666968,0.01320984873329223,0.0,0.892,0.10800000000000001,"My SO's therapist is really trying to push him to talk to a psychiatrist about the Abilify IM shot. Both of us are really off-put by the idea of a number of reasons (newness, it seems like the new pharma-rep push, the concentration of medication in the bloodstream over the month, how he'll be able to sleep if the medication isn't being taken nightly, if it'll make him a zombie like the seroquel did, etc), and the information I've been reading from clinical trials hasn't really done anything to convince me otherwise.

I was wondering if anyone here is/was on this and if they could share their experience or answers some questions about their own experience for me.

Thanks in advance...",['nsubjpass'],0,neu_vader
862,862,0.9993193035007628,0.0006806964992451504,0.27,0.73,0.0,"[this article](http://www.nytimes.com/2014/09/14/opinion/sunday/nicholas-kristof-the-way-to-beat-poverty.html) made me wonder about the healthcare system here and how disadvantaged groups can learn and become more aware of the various factors that contribute to post-traumatic stress disorder, anxiety, depression, and schizophrenia.


Have any of you ever had trouble affording treatment or medication for this or other issues?",['conj'],0,neu_vader
864,864,0.9905067994645164,0.009493200535480882,0.121,0.743,0.136,"My friends and I have this friend who we believe to be schizophrenic. He claims he is sure he doesn't have it, but he hasn't been tested, his dad has severe schizophrenia to where he has to be in a mental institution and his grandmother on his dads side also had it. At first we all thought he was a little cooky but hes very nice and we all enjoy being around him so hes become one of the main people in our friend group. Recently, however things have been happening that are worrisome to me and the rest of my friends. 



My friends and I have known each other for years, and because of that we have some shared stories. Recently whenever we bring them up or just have a one on one conversation about something that happened to just two of us or a few of us but not this other friend he gets very emotional, sometimes to tears and will make up a story about something that happened between him and his other long lost friend who's name he doesn't remember. Its a new friend each time. We can be joking around and he will make a joke along with us, if it doesn't get the reaction he expects he will start clinching his jaw and mouthing things like ""no, no, stupid"" while shaking his head. This has never really bothered us because we know hes a little different and everything but we still all like him. However, in the past week some really out of the ordinary things have happened. 


We went out to eat at a Chinese takeout place after we got some ice cream. Everyone was eating their food except him, no one really noticed and I was talking to my friend next to me about something that had happened earlier that day. My friend noticed he hadn't eaten anything so he says ""Hey ____ are you not hungry or anything? You haven't even opened your food."" Just a genuine and honest question, but he turns to my friend with his head down at the table and gritting his teeth, clearly angry says ""Do you think I'm fucking oblivious? I'm not an idiot."" Everyone at the table looked over to see what was wrong because that was nothing to be mad about. In an instant he completely changes his demeanor, puts on a smile and says ""oh I'm just not hungry!"" We get back to our place and he came over for a few hours to hang out. We asked what had happened since we were in the privacy of our own home, he said ""I'm done lying to you guys."" We've never thought he was lying to us or doing wrong by us except for his stories. Before we had gone to get ice cream I had been reading the picture of Manny Pacquiao with the quotes about how he submitted to all of Mayweathers demands for the boxing match and his friend asked him why, Manny replies ""That's what we do in our country, give them everything they want before an execution."" He said we we asked to go get ice cream shortly after he was scared the whole time thinking that we were taking him somewhere to beat him up or kill him because I had told everyone about the picture. We've known him for almost 6 months now so he has no reason to think that. But things are getting progressively weirder, he will leave our apartment and stand just around the corner trying to listen to us then speed off when he hears the door open, or wait below my friends open window to see what he can hear. I'm just really hoping for some advice in how to deal with this, we all like him but we are genuinely scared for what he might do because he thinks we are going to kill him or something. 


Sorry for the novel but there's been a lot going on. TL;DR, possibly schizophrenic friend thinks we are going to hurt him and is acting in ways that scare us because of it. Thanks in advance for any replies

EDIT: The reason his dad is so bad is because he never got any help or medication, we are just afraid that something is boiling inside of him that he cant help but will get worse if he doesn't get any professional help. We are afraid to bring it up out of fear of making him mad again because hes pretty unpredictable when he gets angry. The last story he told us about his dad was how he had an episode when he was drunk and started shooting his gun in the house while his step-mom hid in the bathroom, we know his dad hasn't remarried and he said this happened just a few weeks ago, well after his mom and dad divorced many years ago. ",['conj'],0,neu_vader
